    1   0.000000           :: → ff02::1:ff94:36a1 ICMPv6 86 Neighbor Solicitation for fe80::fcf2:eaff:fe94:36a1
    2  38.879581     10.0.0.2 → 10.0.0.1     TCP 74 35722 → 42763 [SYN, ACK] Seq=0 Ack=1 Win=37792 Len=0 MSS=9460 SACK_PERM TSval=1886573260 TSecr=1758595171 WS=512
    3  38.885329     10.0.0.2 → 10.0.0.1     TCP 74 59433 → 36467 [SYN, ACK] Seq=0 Ack=1 Win=37792 Len=0 MSS=9460 SACK_PERM TSval=1886573266 TSecr=1758595179 WS=512
    4  38.885544     10.0.0.2 → 10.0.0.1     TCP 66 35722 → 42763 [ACK] Seq=1 Ack=38 Win=37888 Len=0 TSval=1886573266 TSecr=1758595179
    5  38.889265     10.0.0.2 → 10.0.0.1     TCP 67 59433 → 36467 [PSH, ACK] Seq=1 Ack=38 Win=37888 Len=1 TSval=1886573270 TSecr=1758595183
    6  38.913939     10.0.0.2 → 10.0.0.1     TCP 74 6776 → 55655 [SYN, ACK] Seq=0 Ack=1 Win=37792 Len=0 MSS=9460 SACK_PERM TSval=1886573293 TSecr=1758595202 WS=512
    7  38.918929     10.0.0.2 → 10.0.0.1     TCP 67 40783 → 58271 [PSH, ACK] Seq=1 Ack=1 Win=74 Len=1 TSval=1886573298 TSecr=1758595208
    8  38.919451     10.0.0.2 → 10.0.0.1     TCP 74 42968 → 49189 [SYN, ACK] Seq=0 Ack=1 Win=37792 Len=0 MSS=9460 SACK_PERM TSval=1886573298 TSecr=1758595206 WS=512
    9  38.921477     10.0.0.2 → 10.0.0.1     TCP 67 25904 → 51099 [PSH, ACK] Seq=1 Ack=1 Win=74 Len=1 TSval=1886573299 TSecr=1758595208
   10  38.923054     10.0.0.2 → 10.0.0.1     TCP 66 6776 → 55655 [ACK] Seq=1 Ack=38 Win=37888 Len=0 TSval=1886573304 TSecr=1758595212
   11  38.923857     10.0.0.2 → 10.0.0.1     TCP 67 6776 → 55655 [PSH, ACK] Seq=1 Ack=38 Win=37888 Len=1 TSval=1886573304 TSecr=1758595212
   12  38.928724     10.0.0.2 → 10.0.0.1     TCP 67 46356 → 47085 [PSH, ACK] Seq=1 Ack=1 Win=74 Len=1 TSval=1886573309 TSecr=1758595217
   13  38.933202     10.0.0.2 → 10.0.0.1     TCP 66 [TCP Previous segment not captured] 35722 → 42763 [ACK] Seq=2 Ack=42 Win=37888 Len=0 TSval=1886573314 TSecr=1758595186
   14  38.935582     10.0.0.2 → 10.0.0.1     TCP 66 35722 → 42763 [ACK] Seq=2 Ack=159 Win=37888 Len=0 TSval=1886573316 TSecr=1758595230
   15  38.935840     10.0.0.2 → 10.0.0.1     TCP 67 35722 → 42763 [PSH, ACK] Seq=2 Ack=159 Win=37888 Len=1 TSval=1886573316 TSecr=1758595230
   16  38.936646     10.0.0.2 → 10.0.0.1     TCP 66 59433 → 36467 [ACK] Seq=2 Ack=42 Win=37888 Len=0 TSval=1886573318 TSecr=1758595186
   17  38.945208     10.0.0.2 → 10.0.0.1     TCP 66 59433 → 36467 [ACK] Seq=2 Ack=159 Win=37888 Len=0 TSval=1886573320 TSecr=1758595234
   18  38.992885     10.0.0.2 → 10.0.0.1     TCP 66 47452 → 39475 [ACK] Seq=1 Ack=1 Win=74 Len=0 TSval=1886573358 TSecr=1758595212
   19  39.001519     10.0.0.2 → 10.0.0.1     TCP 66 6776 → 55655 [ACK] Seq=2 Ack=42 Win=37888 Len=0 TSval=1886573358 TSecr=1758595223
   20  39.002469     10.0.0.2 → 10.0.0.1     TCP 66 25904 → 51099 [ACK] Seq=2 Ack=5 Win=74 Len=0 TSval=1886573358 TSecr=1758595223
   21  39.002847     10.0.0.2 → 10.0.0.1     TCP 66 46356 → 47085 [ACK] Seq=2 Ack=5 Win=74 Len=0 TSval=1886573358 TSecr=1758595228
   22  39.018470     10.0.0.2 → 10.0.0.1     TCP 66 47452 → 39475 [ACK] Seq=1 Ack=118 Win=74 Len=0 TSval=1886573399 TSecr=1758595309
   23  39.028910     10.0.0.2 → 10.0.0.1     TCP 67 6776 → 55655 [PSH, ACK] Seq=2 Ack=159 Win=37888 Len=1 TSval=1886573409 TSecr=1758595312
   24  39.031934     10.0.0.2 → 10.0.0.1     TCP 66 25904 → 51099 [ACK] Seq=2 Ack=122 Win=74 Len=0 TSval=1886573413 TSecr=1758595312
   25  39.034076     10.0.0.2 → 10.0.0.1     TCP 66 46356 → 47085 [ACK] Seq=2 Ack=122 Win=74 Len=0 TSval=1886573415 TSecr=1758595313
   26  39.034450     10.0.0.2 → 10.0.0.1     TCP 67 46356 → 47085 [PSH, ACK] Seq=2 Ack=122 Win=74 Len=1 TSval=1886573415 TSecr=1758595313
   27  39.043332     10.0.0.2 → 10.0.0.1     TCP 66 40783 → 58271 [ACK] Seq=2 Ack=122 Win=74 Len=0 TSval=1886573422 TSecr=1758595314
   28  39.066106     10.0.0.2 → 10.0.0.1     TCP 67 [TCP Previous segment not captured] 42968 → 49189 [PSH, ACK] Seq=2 Ack=159 Win=37888 Len=1 TSval=1886573438 TSecr=1758595317
   29  39.083160     10.0.0.2 → 10.0.0.1     TCP 66 35722 → 19551 [ACK] Seq=1 Ack=1 Win=73 Len=0 TSval=1886573464 TSecr=1758595317
   30  39.086837     10.0.0.2 → 10.0.0.1     TCP 74 47452 → 53241 [SYN, ACK] Seq=0 Ack=1 Win=37792 Len=0 MSS=9460 SACK_PERM TSval=1886573468 TSecr=1758595379 WS=512
   31  39.088949     10.0.0.2 → 10.0.0.1     TCP 74 6776 → 55246 [SYN, ACK] Seq=0 Ack=1 Win=37792 Len=0 MSS=9460 SACK_PERM TSval=1886573470 TSecr=1758595380 WS=512
   32  39.090195     10.0.0.2 → 10.0.0.1     TCP 66 59433 → 48193 [ACK] Seq=1 Ack=1 Win=73 Len=0 TSval=1886573471 TSecr=1758595380
   33  39.091266     10.0.0.2 → 10.0.0.1     TCP 74 25904 → 58169 [SYN, ACK] Seq=0 Ack=1 Win=37792 Len=0 MSS=9460 SACK_PERM TSval=1886573472 TSecr=1758595381 WS=512
   34  39.093671     10.0.0.2 → 10.0.0.1     TCP 74 46356 → 54368 [SYN, ACK] Seq=0 Ack=1 Win=37792 Len=0 MSS=9460 SACK_PERM TSval=1886573473 TSecr=1758595381 WS=512
   35  39.101411     10.0.0.2 → 10.0.0.1     TCP 74 40783 → 32720 [SYN, ACK] Seq=0 Ack=1 Win=37792 Len=0 MSS=9460 SACK_PERM TSval=1886573482 TSecr=1758595382 WS=512
   36  39.109788     10.0.0.2 → 10.0.0.1     TCP 66 35722 → 19551 [ACK] Seq=1 Ack=5001 Win=67 Len=0 TSval=1886573491 TSecr=1758595385
   37  39.138641     10.0.0.2 → 10.0.0.1     TCP 66 47452 → 53241 [ACK] Seq=1 Ack=38 Win=37888 Len=0 TSval=1886573520 TSecr=1758595399
   38  39.210939     10.0.0.2 → 10.0.0.1     TCP 66 40783 → 32720 [ACK] Seq=1 Ack=38 Win=37888 Len=0 TSval=1886573592 TSecr=1758595417
   39  39.219916     10.0.0.2 → 10.0.0.1     TCP 68 [TCP Previous segment not captured] 25904 → 51099 [PSH, ACK] Seq=3 Ack=122 Win=74 Len=2 TSval=1886573601 TSecr=1758595421
   40  39.235305     10.0.0.2 → 10.0.0.1     TCP 66 35722 → 19551 [ACK] Seq=1 Ack=8001 Win=67 Len=0 TSval=1886573616 TSecr=1758595436
   41  39.247848     10.0.0.2 → 10.0.0.1     TCP 66 35722 → 19551 [ACK] Seq=1 Ack=16001 Win=67 Len=0 TSval=1886573629 TSecr=1758595534
   42  39.259508     10.0.0.2 → 10.0.0.1     TCP 66 47452 → 53241 [ACK] Seq=1 Ack=1038 Win=37376 Len=0 TSval=1886573640 TSecr=1758595534
   43  39.262158     10.0.0.2 → 10.0.0.1     TCP 66 6776 → 55246 [ACK] Seq=1 Ack=1038 Win=37376 Len=0 TSval=1886573643 TSecr=1758595543
   44  39.263422     10.0.0.2 → 10.0.0.1     TCP 66 59433 → 48193 [ACK] Seq=1 Ack=12001 Win=67 Len=0 TSval=1886573645 TSecr=1758595544
   45  39.265631     10.0.0.2 → 10.0.0.1     TCP 66 35722 → 19551 [ACK] Seq=1 Ack=17001 Win=67 Len=0 TSval=1886573647 TSecr=1758595549
   46  39.267691     10.0.0.2 → 10.0.0.1     TCP 66 47452 → 53241 [ACK] Seq=1 Ack=2038 Win=36864 Len=0 TSval=1886573649 TSecr=1758595556
   47  39.269807     10.0.0.2 → 10.0.0.1     TCP 66 6776 → 55246 [ACK] Seq=1 Ack=2038 Win=36864 Len=0 TSval=1886573651 TSecr=1758595559
   48  39.273545     10.0.0.2 → 10.0.0.1     TCP 66 25904 → 58169 [ACK] Seq=1 Ack=1038 Win=37376 Len=0 TSval=1886573655 TSecr=1758595534
   49  39.280592     10.0.0.2 → 10.0.0.1     TCP 66 25904 → 58169 [ACK] Seq=1 Ack=4038 Win=35328 Len=0 TSval=1886573661 TSecr=1758595574
   50  39.286470     10.0.0.2 → 10.0.0.1     TCP 66 42968 → 55943 [ACK] Seq=1 Ack=1 Win=72 Len=0 TSval=1886573667 TSecr=1758595558
   51  39.299985     10.0.0.2 → 10.0.0.1     TCP 66 59433 → 48193 [ACK] Seq=1 Ack=16001 Win=67 Len=0 TSval=1886573681 TSecr=1758595594
   52  39.306072     10.0.0.2 → 10.0.0.1     TCP 66 6776 → 55246 [ACK] Seq=1 Ack=5038 Win=34816 Len=0 TSval=1886573687 TSecr=1758595601
   53  39.315190     10.0.0.2 → 10.0.0.1     TCP 66 6776 → 55246 [ACK] Seq=1 Ack=6038 Win=34304 Len=0 TSval=1886573696 TSecr=1758595611
   54  39.332253     10.0.0.2 → 10.0.0.1     TCP 66 42968 → 55943 [ACK] Seq=1 Ack=2001 Win=69 Len=0 TSval=1886573713 TSecr=1758595583
   55  39.344804     10.0.0.2 → 10.0.0.1     TCP 66 35722 → 19551 [ACK] Seq=1 Ack=20001 Win=67 Len=0 TSval=1886573726 TSecr=1758595592
   56  39.346464     10.0.0.2 → 10.0.0.1     TCP 66 35722 → 19551 [ACK] Seq=1 Ack=24001 Win=67 Len=0 TSval=1886573728 TSecr=1758595642
   57  39.352944     10.0.0.2 → 10.0.0.1     TCP 66 47452 → 53241 [ACK] Seq=1 Ack=6038 Win=34304 Len=0 TSval=1886573734 TSecr=1758595601
   58  39.357290     10.0.0.2 → 10.0.0.1     TCP 66 40783 → 32720 [ACK] Seq=1 Ack=6038 Win=34304 Len=0 TSval=1886573738 TSecr=1758595606
   59  39.358810     10.0.0.2 → 10.0.0.1     TCP 66 35722 → 19551 [ACK] Seq=1 Ack=25001 Win=67 Len=0 TSval=1886573739 TSecr=1758595651
   60  39.359715     10.0.0.2 → 10.0.0.1     TCP 66 47452 → 53241 [ACK] Seq=1 Ack=10038 Win=34304 Len=0 TSval=1886573741 TSecr=1758595654
   61  39.374182     10.0.0.2 → 10.0.0.1     TCP 66 42968 → 55943 [ACK] Seq=1 Ack=5001 Win=67 Len=0 TSval=1886573755 TSecr=1758595629
   62  39.375643     10.0.0.2 → 10.0.0.1     TCP 66 42968 → 55943 [ACK] Seq=1 Ack=9001 Win=67 Len=0 TSval=1886573757 TSecr=1758595671
   63  39.415077     10.0.0.2 → 10.0.0.1     TCP 66 59433 → 48193 [ACK] Seq=1 Ack=21001 Win=67 Len=0 TSval=1886573796 TSecr=1758595663
   64  39.435746     10.0.0.2 → 10.0.0.1     TCP 66 6776 → 55246 [ACK] Seq=1 Ack=10038 Win=34304 Len=0 TSval=1886573817 TSecr=1758595667
   65  39.451623     10.0.0.2 → 10.0.0.1     TCP 66 47452 → 53241 [ACK] Seq=1 Ack=11038 Win=34304 Len=0 TSval=1886573832 TSecr=1758595668
   66  39.456465     10.0.0.2 → 10.0.0.1     TCP 66 46356 → 54368 [ACK] Seq=1 Ack=12038 Win=34304 Len=0 TSval=1886573838 TSecr=1758595684
   67  39.467535     10.0.0.2 → 10.0.0.1     TCP 66 46356 → 54368 [ACK] Seq=1 Ack=18038 Win=34304 Len=0 TSval=1886573849 TSecr=1758595763
   68  39.472843     10.0.0.2 → 10.0.0.1     TCP 66 25904 → 58169 [ACK] Seq=1 Ack=12038 Win=34304 Len=0 TSval=1886573854 TSecr=1758595687
   69  39.474392     10.0.0.2 → 10.0.0.1     TCP 66 25904 → 58169 [ACK] Seq=1 Ack=18038 Win=34304 Len=0 TSval=1886573855 TSecr=1758595770
   70  39.499778     10.0.0.2 → 10.0.0.1     TCP 66 40783 → 32720 [ACK] Seq=1 Ack=20038 Win=34304 Len=0 TSval=1886573881 TSecr=1758595788
   71  39.506531     10.0.0.2 → 10.0.0.1     TCP 66 59433 → 48193 [ACK] Seq=1 Ack=25001 Win=67 Len=0 TSval=1886573886 TSecr=1758595714
   72  39.509573     10.0.0.2 → 10.0.0.1     TCP 66 35722 → 19551 [ACK] Seq=1 Ack=30001 Win=67 Len=0 TSval=1886573891 TSecr=1758595729
   73  39.520022     10.0.0.2 → 10.0.0.1     TCP 66 35722 → 19551 [ACK] Seq=1 Ack=37001 Win=67 Len=0 TSval=1886573901 TSecr=1758595811
   74  39.532159     10.0.0.2 → 10.0.0.1     TCP 66 47452 → 53241 [ACK] Seq=1 Ack=22038 Win=34304 Len=0 TSval=1886573913 TSecr=1758595827
   75  39.554339     10.0.0.2 → 10.0.0.1     TCP 66 42968 → 55943 [ACK] Seq=1 Ack=14001 Win=67 Len=0 TSval=1886573935 TSecr=1758595750
   76  39.574393     10.0.0.2 → 10.0.0.1     TCP 66 42968 → 55943 [ACK] Seq=1 Ack=23001 Win=67 Len=0 TSval=1886573955 TSecr=1758595858
   77  39.577162     10.0.0.2 → 10.0.0.1     TCP 66 46356 → 54368 [ACK] Seq=1 Ack=20038 Win=34304 Len=0 TSval=1886573956 TSecr=1758595790
   78  39.581777     10.0.0.2 → 10.0.0.1     TCP 66 40783 → 32720 [ACK] Seq=1 Ack=21038 Win=34304 Len=0 TSval=1886573961 TSecr=1758595801
   79  39.586177     10.0.0.2 → 10.0.0.1     TCP 66 46356 → 54368 [ACK] Seq=1 Ack=26038 Win=34304 Len=0 TSval=1886573967 TSecr=1758595874
   80  39.598171     10.0.0.2 → 10.0.0.1     TCP 66 25904 → 58169 [ACK] Seq=1 Ack=26038 Win=34304 Len=0 TSval=1886573979 TSecr=1758595875
   81  39.607694     10.0.0.2 → 10.0.0.1     TCP 66 6776 → 55246 [ACK] Seq=1 Ack=21038 Win=34304 Len=0 TSval=1886573989 TSecr=1758595823
   82  39.622458     10.0.0.2 → 10.0.0.1     TCP 66 46356 → 54368 [ACK] Seq=1 Ack=27038 Win=34304 Len=0 TSval=1886574004 TSecr=1758595883
   83  39.629210     10.0.0.2 → 10.0.0.1     TCP 66 6776 → 55246 [ACK] Seq=1 Ack=28038 Win=34304 Len=0 TSval=1886574010 TSecr=1758595905
   84  39.637239     10.0.0.2 → 10.0.0.1     TCP 66 42968 → 55943 [ACK] Seq=1 Ack=24001 Win=67 Len=0 TSval=1886574017 TSecr=1758595871
   85  39.642920     10.0.0.2 → 10.0.0.1     TCP 66 46356 → 54368 [ACK] Seq=1 Ack=29038 Win=34304 Len=0 TSval=1886574024 TSecr=1758595919
   86  39.647010     10.0.0.2 → 10.0.0.1     TCP 66 35722 → 19551 [ACK] Seq=1 Ack=45001 Win=67 Len=0 TSval=1886574028 TSecr=1758595925
   87  39.649385     10.0.0.2 → 10.0.0.1     TCP 66 59433 → 48193 [ACK] Seq=1 Ack=39001 Win=67 Len=0 TSval=1886574030 TSecr=1758595907
   88  39.657133     10.0.0.2 → 10.0.0.1     TCP 66 25904 → 58169 [ACK] Seq=1 Ack=30038 Win=34304 Len=0 TSval=1886574038 TSecr=1758595921
   89  39.665583     10.0.0.2 → 10.0.0.1     TCP 66 59433 → 48193 [ACK] Seq=1 Ack=42001 Win=67 Len=0 TSval=1886574046 TSecr=1758595946
   90  39.665916     10.0.0.2 → 10.0.0.1     TCP 66 6776 → 55246 [ACK] Seq=1 Ack=29038 Win=34304 Len=0 TSval=1886574047 TSecr=1758595926
   91  39.669707     10.0.0.2 → 10.0.0.1     TCP 66 42968 → 55943 [ACK] Seq=1 Ack=28001 Win=67 Len=0 TSval=1886574051 TSecr=1758595934
   92  39.675691     10.0.0.2 → 10.0.0.1     TCP 66 42968 → 55943 [ACK] Seq=1 Ack=31001 Win=67 Len=0 TSval=1886574057 TSecr=1758595967
   93  39.681795     10.0.0.2 → 10.0.0.1     TCP 66 47452 → 53241 [ACK] Seq=1 Ack=33038 Win=34304 Len=0 TSval=1886574063 TSecr=1758595968
   94  39.686168     10.0.0.2 → 10.0.0.1     TCP 66 40783 → 32720 [ACK] Seq=1 Ack=31038 Win=34304 Len=0 TSval=1886574067 TSecr=1758595937
   95  39.708276     10.0.0.2 → 10.0.0.1     TCP 66 25904 → 58169 [ACK] Seq=1 Ack=36038 Win=34304 Len=0 TSval=1886574089 TSecr=1758596004
   96  39.714809     10.0.0.2 → 10.0.0.1     TCP 66 35722 → 19551 [ACK] Seq=1 Ack=48001 Win=67 Len=0 TSval=1886574096 TSecr=1758595960
   97  39.716324     10.0.0.2 → 10.0.0.1     TCP 66 35722 → 19551 [ACK] Seq=1 Ack=52001 Win=67 Len=0 TSval=1886574097 TSecr=1758596012
   98  39.728432     10.0.0.2 → 10.0.0.1     TCP 66 47452 → 53241 [ACK] Seq=1 Ack=34038 Win=34304 Len=0 TSval=1886574110 TSecr=1758595979
   99  39.729904     10.0.0.2 → 10.0.0.1     TCP 66 59433 → 48193 [ACK] Seq=1 Ack=48001 Win=67 Len=0 TSval=1886574111 TSecr=1758596022
  100  39.733878     10.0.0.2 → 10.0.0.1     TCP 66 6776 → 55246 [ACK] Seq=1 Ack=37038 Win=34304 Len=0 TSval=1886574115 TSecr=1758596024
  101  39.745063     10.0.0.2 → 10.0.0.1     TCP 66 47452 → 53241 [ACK] Seq=1 Ack=37038 Win=34304 Len=0 TSval=1886574126 TSecr=1758596025
  102  39.748131     10.0.0.2 → 10.0.0.1     TCP 66 46356 → 54368 [ACK] Seq=1 Ack=35038 Win=34304 Len=0 TSval=1886574129 TSecr=1758595995
  103  39.752273     10.0.0.2 → 10.0.0.1     TCP 66 42968 → 55943 [ACK] Seq=1 Ack=36001 Win=67 Len=0 TSval=1886574133 TSecr=1758596042
  104  39.758335     10.0.0.2 → 10.0.0.1     TCP 66 47452 → 53241 [ACK] Seq=1 Ack=39038 Win=34304 Len=0 TSval=1886574139 TSecr=1758596042
  105  39.770666     10.0.0.2 → 10.0.0.1     TCP 66 42968 → 55943 [ACK] Seq=1 Ack=37001 Win=67 Len=0 TSval=1886574152 TSecr=1758596049
  106  39.772847     10.0.0.2 → 10.0.0.1     TCP 66 46356 → 54368 [ACK] Seq=1 Ack=40038 Win=34304 Len=0 TSval=1886574154 TSecr=1758596059
  107  39.783118     10.0.0.2 → 10.0.0.1     TCP 66 25904 → 58169 [ACK] Seq=1 Ack=41038 Win=34304 Len=0 TSval=1886574164 TSecr=1758596072
  108  39.787094     10.0.0.2 → 10.0.0.1     TCP 66 6776 → 55246 [ACK] Seq=1 Ack=41038 Win=34304 Len=0 TSval=1886574168 TSecr=1758596082
  109  39.792574     10.0.0.2 → 10.0.0.1     TCP 66 59433 → 48193 [ACK] Seq=1 Ack=49001 Win=67 Len=0 TSval=1886574174 TSecr=1758596034
  110  39.793896     10.0.0.2 → 10.0.0.1     TCP 66 40783 → 32720 [ACK] Seq=1 Ack=40038 Win=34304 Len=0 TSval=1886574175 TSecr=1758596066
  111  39.810493     10.0.0.2 → 10.0.0.1     TCP 66 47452 → 53241 [ACK] Seq=1 Ack=42038 Win=34304 Len=0 TSval=1886574192 TSecr=1758596086
  112  39.811940     10.0.0.2 → 10.0.0.1     TCP 66 47452 → 53241 [ACK] Seq=1 Ack=43038 Win=34304 Len=0 TSval=1886574193 TSecr=1758596107
  113  39.829006     10.0.0.2 → 10.0.0.1     TCP 66 42968 → 55943 [ACK] Seq=1 Ack=38001 Win=67 Len=0 TSval=1886574210 TSecr=1758596067
  114  39.829429     10.0.0.2 → 10.0.0.1     TCP 66 35722 → 19551 [ACK] Seq=1 Ack=54001 Win=67 Len=0 TSval=1886574210 TSecr=1758596037
  115  39.852585     10.0.0.2 → 10.0.0.1     TCP 66 59433 → 48193 [ACK] Seq=1 Ack=55001 Win=67 Len=0 TSval=1886574233 TSecr=1758596116
  116  39.852940     10.0.0.2 → 10.0.0.1     TCP 66 25904 → 58169 [ACK] Seq=1 Ack=42038 Win=34304 Len=0 TSval=1886574234 TSecr=1758596081
  117  39.871544     10.0.0.2 → 10.0.0.1     TCP 66 42968 → 55943 [ACK] Seq=1 Ack=43001 Win=67 Len=0 TSval=1886574251 TSecr=1758596126
  118  39.876169     10.0.0.2 → 10.0.0.1     TCP 66 46356 → 54368 [ACK] Seq=1 Ack=47038 Win=34304 Len=0 TSval=1886574253 TSecr=1758596159
  119  39.876647     10.0.0.2 → 10.0.0.1     TCP 66 40783 → 32720 [ACK] Seq=1 Ack=42038 Win=34304 Len=0 TSval=1886574258 TSecr=1758596091
  120  39.882466     10.0.0.2 → 10.0.0.1     TCP 66 35722 → 19551 [ACK] Seq=1 Ack=60001 Win=67 Len=0 TSval=1886574261 TSecr=1758596127
  121  39.885172     10.0.0.2 → 10.0.0.1     TCP 66 6776 → 55246 [ACK] Seq=1 Ack=43038 Win=34304 Len=0 TSval=1886574266 TSecr=1758596104
  122  39.886793     10.0.0.2 → 10.0.0.1     TCP 66 35722 → 19551 [ACK] Seq=1 Ack=64001 Win=67 Len=0 TSval=1886574268 TSecr=1758596180
  123  39.888498     10.0.0.2 → 10.0.0.1     TCP 66 47452 → 53241 [ACK] Seq=1 Ack=44038 Win=34304 Len=0 TSval=1886574270 TSecr=1758596109
  124  39.891474     10.0.0.2 → 10.0.0.1     TCP 66 6776 → 55246 [ACK] Seq=1 Ack=48038 Win=34304 Len=0 TSval=1886574272 TSecr=1758596182
  125  39.905871     10.0.0.2 → 10.0.0.1     TCP 66 25904 → 58169 [ACK] Seq=1 Ack=47038 Win=34304 Len=0 TSval=1886574286 TSecr=1758596151
  126  39.947390     10.0.0.2 → 10.0.0.1     TCP 66 59433 → 48193 [ACK] Seq=1 Ack=57001 Win=67 Len=0 TSval=1886574322 TSecr=1758596150
  127  39.953229     10.0.0.2 → 10.0.0.1     TCP 66 42968 → 55943 [ACK] Seq=1 Ack=46001 Win=67 Len=0 TSval=1886574325 TSecr=1758596169
  128  39.957180     10.0.0.2 → 10.0.0.1     TCP 66 46356 → 54368 [ACK] Seq=1 Ack=48038 Win=34304 Len=0 TSval=1886574328 TSecr=1758596173
  129  39.977379     10.0.0.2 → 10.0.0.1     TCP 66 47452 → 53241 [ACK] Seq=1 Ack=49038 Win=34304 Len=0 TSval=1886574358 TSecr=1758596185
  130  40.021643     10.0.0.2 → 10.0.0.1     TCP 66 25904 → 58169 [ACK] Seq=1 Ack=59038 Win=34304 Len=0 TSval=1886574402 TSecr=1758596308
  131  40.023222     10.0.0.2 → 10.0.0.1     TCP 66 59433 → 48193 [ACK] Seq=1 Ack=70001 Win=67 Len=0 TSval=1886574404 TSecr=1758596315
  132  40.037614     10.0.0.2 → 10.0.0.1     TCP 66 59433 → 48193 [ACK] Seq=1 Ack=71001 Win=67 Len=0 TSval=1886574419 TSecr=1758596327
  133  40.079771     10.0.0.2 → 10.0.0.1     TCP 66 46356 → 54368 [ACK] Seq=1 Ack=55038 Win=34304 Len=0 TSval=1886574459 TSecr=1758596265
  134  40.089354     10.0.0.2 → 10.0.0.1     TCP 66 42968 → 55943 [ACK] Seq=1 Ack=62001 Win=67 Len=0 TSval=1886574470 TSecr=1758596376
  135  40.118163     10.0.0.2 → 10.0.0.1     TCP 66 35722 → 19551 [ACK] Seq=1 Ack=72001 Win=67 Len=0 TSval=1886574496 TSecr=1758596278
  136  40.151570     10.0.0.2 → 10.0.0.1     TCP 66 25904 → 58169 [ACK] Seq=1 Ack=64038 Win=34304 Len=0 TSval=1886574533 TSecr=1758596382
  137  40.153274     10.0.0.2 → 10.0.0.1     TCP 66 35722 → 19551 [ACK] Seq=1 Ack=82001 Win=67 Len=0 TSval=1886574534 TSecr=1758596411
  138  40.174873     10.0.0.2 → 10.0.0.1     TCP 66 47452 → 53241 [ACK] Seq=1 Ack=66038 Win=34304 Len=0 TSval=1886574555 TSecr=1758596411
  139  40.177073     10.0.0.2 → 10.0.0.1     TCP 66 46356 → 54368 [ACK] Seq=1 Ack=67038 Win=34304 Len=0 TSval=1886574556 TSecr=1758596424
  140  40.179361     10.0.0.2 → 10.0.0.1     TCP 66 40783 → 32720 [ACK] Seq=1 Ack=69038 Win=34304 Len=0 TSval=1886574559 TSecr=1758596445
  141  40.190442     10.0.0.2 → 10.0.0.1     TCP 66 46356 → 54368 [ACK] Seq=1 Ack=71038 Win=34304 Len=0 TSval=1886574571 TSecr=1758596475
  142  40.212635     10.0.0.2 → 10.0.0.1     TCP 66 35722 → 19551 [ACK] Seq=1 Ack=84001 Win=67 Len=0 TSval=1886574594 TSecr=1758596451
  143  40.216526     10.0.0.2 → 10.0.0.1     TCP 66 42968 → 55943 [ACK] Seq=1 Ack=63001 Win=67 Len=0 TSval=1886574598 TSecr=1758596390
  144  40.233361     10.0.0.2 → 10.0.0.1     TCP 66 6776 → 55246 [ACK] Seq=1 Ack=74038 Win=34304 Len=0 TSval=1886574614 TSecr=1758596520
  145  40.245924     10.0.0.2 → 10.0.0.1     TCP 66 42968 → 55943 [ACK] Seq=1 Ack=73001 Win=67 Len=0 TSval=1886574627 TSecr=1758596523
  146  40.247386     10.0.0.2 → 10.0.0.1     TCP 66 47452 → 53241 [ACK] Seq=1 Ack=75038 Win=34304 Len=0 TSval=1886574628 TSecr=1758596531
  147  40.253543     10.0.0.2 → 10.0.0.1     TCP 66 59433 → 48193 [ACK] Seq=1 Ack=82001 Win=67 Len=0 TSval=1886574635 TSecr=1758596483
  148  40.282274     10.0.0.2 → 10.0.0.1     TCP 66 35722 → 19551 [ACK] Seq=1 Ack=89001 Win=67 Len=0 TSval=1886574663 TSecr=1758596510
  149  40.302901     10.0.0.2 → 10.0.0.1     TCP 66 6776 → 55246 [ACK] Seq=1 Ack=75038 Win=34304 Len=0 TSval=1886574684 TSecr=1758596531
  150  40.306945     10.0.0.2 → 10.0.0.1     TCP 66 6776 → 55246 [ACK] Seq=1 Ack=80038 Win=34304 Len=0 TSval=1886574688 TSecr=1758596600
  151  40.307465     10.0.0.2 → 10.0.0.1     TCP 66 47452 → 53241 [ACK] Seq=1 Ack=76038 Win=34304 Len=0 TSval=1886574688 TSecr=1758596545
  152  40.311026     10.0.0.2 → 10.0.0.1     TCP 66 59433 → 48193 [ACK] Seq=1 Ack=87001 Win=67 Len=0 TSval=1886574692 TSecr=1758596550
  153  40.321324     10.0.0.2 → 10.0.0.1     TCP 66 40783 → 32720 [ACK] Seq=1 Ack=73038 Win=34304 Len=0 TSval=1886574702 TSecr=1758596495
  154  40.339007     10.0.0.2 → 10.0.0.1     TCP 66 46356 → 54368 [ACK] Seq=1 Ack=82038 Win=34304 Len=0 TSval=1886574720 TSecr=1758596626
  155  40.390954     10.0.0.2 → 10.0.0.1     TCP 66 47452 → 53241 [ACK] Seq=1 Ack=82038 Win=34304 Len=0 TSval=1886574766 TSecr=1758596614
  156  40.396828     10.0.0.2 → 10.0.0.1     TCP 66 35722 → 19551 [ACK] Seq=1 Ack=98001 Win=67 Len=0 TSval=1886574767 TSecr=1758596630
  157  40.398290     10.0.0.2 → 10.0.0.1     TCP 66 47452 → 53241 [ACK] Seq=1 Ack=87038 Win=34304 Len=0 TSval=1886574779 TSecr=1758596688
  158  40.404886     10.0.0.2 → 10.0.0.1     TCP 66 40783 → 32720 [ACK] Seq=1 Ack=87038 Win=34304 Len=0 TSval=1886574785 TSecr=1758596693
  159  40.406784     10.0.0.2 → 10.0.0.1     TCP 66 59433 → 48193 [ACK] Seq=1 Ack=93001 Win=67 Len=0 TSval=1886574787 TSecr=1758596620
  160  40.415331     10.0.0.2 → 10.0.0.1     TCP 66 42968 → 55943 [ACK] Seq=1 Ack=81001 Win=67 Len=0 TSval=1886574792 TSecr=1758596632
  161  40.423218     10.0.0.2 → 10.0.0.1     TCP 66 35722 → 19551 [ACK] Seq=1 Ack=103001 Win=67 Len=0 TSval=1886574797 TSecr=1758596694
  162  40.428873     10.0.0.2 → 10.0.0.1     TCP 66 6776 → 55246 [ACK] Seq=1 Ack=86038 Win=34304 Len=0 TSval=1886574806 TSecr=1758596686
  163  40.448279     10.0.0.2 → 10.0.0.1     TCP 66 59433 → 48193 [ACK] Seq=1 Ack=99001 Win=67 Len=0 TSval=1886574828 TSecr=1758596704
  164  40.458707     10.0.0.2 → 10.0.0.1     TCP 66 46356 → 54368 [ACK] Seq=1 Ack=90038 Win=34304 Len=0 TSval=1886574840 TSecr=1758596723
  165  40.474621     10.0.0.2 → 10.0.0.1     TCP 66 25904 → 58169 [ACK] Seq=1 Ack=90038 Win=34304 Len=0 TSval=1886574856 TSecr=1758596727
  166  40.483084     10.0.0.2 → 10.0.0.1     TCP 66 47452 → 53241 [ACK] Seq=1 Ack=91038 Win=34304 Len=0 TSval=1886574864 TSecr=1758596743
  167  40.496198     10.0.0.2 → 10.0.0.1     TCP 66 46356 → 54368 [ACK] Seq=1 Ack=92038 Win=34304 Len=0 TSval=1886574876 TSecr=1758596756
  168  40.519787     10.0.0.2 → 10.0.0.1     TCP 66 25904 → 58169 [ACK] Seq=1 Ack=93038 Win=34304 Len=0 TSval=1886574901 TSecr=1758596771
  169  40.536819     10.0.0.2 → 10.0.0.1     TCP 66 42968 → 55943 [ACK] Seq=1 Ack=92001 Win=67 Len=0 TSval=1886574916 TSecr=1758596777
  170  40.561152     10.0.0.2 → 10.0.0.1     TCP 66 6776 → 55246 [ACK] Seq=1 Ack=92038 Win=34304 Len=0 TSval=1886574942 TSecr=1758596770
  171  40.568691     10.0.0.2 → 10.0.0.1     TCP 66 35722 → 19551 [ACK] Seq=1 Ack=110001 Win=67 Len=0 TSval=1886574950 TSecr=1758596792
  172  40.576890     10.0.0.2 → 10.0.0.1     TCP 66 46356 → 54368 [ACK] Seq=1 Ack=95038 Win=34304 Len=0 TSval=1886574958 TSecr=1758596793
  173  40.578487     10.0.0.2 → 10.0.0.1     TCP 66 46356 → 54368 [ACK] Seq=1 Ack=101038 Win=34304 Len=0 TSval=1886574960 TSecr=1758596874
  174  40.600746     10.0.0.2 → 10.0.0.1     TCP 66 25904 → 58169 [ACK] Seq=1 Ack=102038 Win=34304 Len=0 TSval=1886574980 TSecr=1758596890
  175  40.609733     10.0.0.2 → 10.0.0.1     TCP 66 47452 → 53241 [ACK] Seq=1 Ack=98038 Win=34304 Len=0 TSval=1886574991 TSecr=1758596837
  176  40.611273     10.0.0.2 → 10.0.0.1     TCP 66 47452 → 53241 [ACK] Seq=1 Ack=103038 Win=34304 Len=0 TSval=1886574992 TSecr=1758596907
  177  40.621857     10.0.0.2 → 10.0.0.1     TCP 66 59433 → 48193 [ACK] Seq=1 Ack=105001 Win=67 Len=0 TSval=1886575002 TSecr=1758596790
  178  40.626532     10.0.0.2 → 10.0.0.1     TCP 66 6776 → 55246 [ACK] Seq=1 Ack=99038 Win=34304 Len=0 TSval=1886575007 TSecr=1758596858
  179  40.654468     10.0.0.2 → 10.0.0.1     TCP 66 35722 → 19551 [ACK] Seq=1 Ack=116001 Win=67 Len=0 TSval=1886575035 TSecr=1758596866
  180  40.655934     10.0.0.2 → 10.0.0.1     TCP 66 59433 → 48193 [ACK] Seq=1 Ack=116001 Win=67 Len=0 TSval=1886575037 TSecr=1758596927
  181  40.663156     10.0.0.2 → 10.0.0.1     TCP 66 6776 → 55246 [ACK] Seq=1 Ack=105038 Win=34304 Len=0 TSval=1886575044 TSecr=1758596942
  182  40.665213     10.0.0.2 → 10.0.0.1     TCP 66 40783 → 32720 [ACK] Seq=1 Ack=106038 Win=34304 Len=0 TSval=1886575046 TSecr=1758596955
  183  40.683168     10.0.0.2 → 10.0.0.1     TCP 66 25904 → 58169 [ACK] Seq=1 Ack=103038 Win=34304 Len=0 TSval=1886575064 TSecr=1758596898
  184  40.684731     10.0.0.2 → 10.0.0.1     TCP 66 47452 → 53241 [ACK] Seq=1 Ack=105038 Win=34304 Len=0 TSval=1886575066 TSecr=1758596921
  185  40.687101     10.0.0.2 → 10.0.0.1     TCP 78 [TCP Dup ACK 182#1] 40783 → 32720 [ACK] Seq=1 Ack=106038 Win=34304 Len=0 TSval=1886575068 TSecr=1758596955 SLE=94038 SRE=103486
  186  40.769437     10.0.0.2 → 10.0.0.1     TCP 66 35722 → 19551 [ACK] Seq=1 Ack=131001 Win=67 Len=0 TSval=1886575151 TSecr=1758597065
  187  40.791784     10.0.0.2 → 10.0.0.1     TCP 66 59433 → 48193 [ACK] Seq=1 Ack=117001 Win=67 Len=0 TSval=1886575173 TSecr=1758596953
  188  40.793355     10.0.0.2 → 10.0.0.1     TCP 78 [TCP Dup ACK 187#1] 59433 → 48193 [ACK] Seq=1 Ack=117001 Win=67 Len=0 TSval=1886575174 TSecr=1758596953 SLE=126449 SRE=128001
  189  40.795852     10.0.0.2 → 10.0.0.1     TCP 66 6776 → 55246 [ACK] Seq=1 Ack=107038 Win=34304 Len=0 TSval=1886575177 TSecr=1758596960
  190  40.797416     10.0.0.2 → 10.0.0.1     TCP 78 [TCP Dup ACK 189#1] 6776 → 55246 [ACK] Seq=1 Ack=107038 Win=34304 Len=0 TSval=1886575179 TSecr=1758596960 SLE=116486 SRE=117038
  191  40.798902     10.0.0.2 → 10.0.0.1     TCP 78 [TCP Dup ACK 182#2] 40783 → 32720 [ACK] Seq=1 Ack=106038 Win=34304 Len=0 TSval=1886575180 TSecr=1758596955 SLE=108038 SRE=117486
  192  40.812622     10.0.0.2 → 10.0.0.1     TCP 66 46356 → 54368 [ACK] Seq=1 Ack=108038 Win=34304 Len=0 TSval=1886575194 TSecr=1758596976
  193  40.825728     10.0.0.2 → 10.0.0.1     TCP 66 6776 → 55246 [ACK] Seq=1 Ack=117038 Win=34304 Len=0 TSval=1886575206 TSecr=1758597094
  194  40.836772     10.0.0.2 → 10.0.0.1     TCP 66 25904 → 58169 [ACK] Seq=1 Ack=109038 Win=34304 Len=0 TSval=1886575218 TSecr=1758596980
  195  40.858812     10.0.0.2 → 10.0.0.1     TCP 78 40783 → 32720 [ACK] Seq=1 Ack=117486 Win=34304 Len=0 TSval=1886575240 TSecr=1758596962 SLE=106038 SRE=108038
  196  40.861520     10.0.0.2 → 10.0.0.1     TCP 66 47452 → 53241 [ACK] Seq=1 Ack=109038 Win=34304 Len=0 TSval=1886575242 TSecr=1758596982
  197  40.862993     10.0.0.2 → 10.0.0.1     TCP 66 40783 → 32720 [ACK] Seq=1 Ack=118038 Win=34304 Len=0 TSval=1886575244 TSecr=1758597101
  198  40.918625     10.0.0.2 → 10.0.0.1     TCP 66 6776 → 55246 [ACK] Seq=1 Ack=125038 Win=34304 Len=0 TSval=1886575300 TSecr=1758597200
  199  40.951865     10.0.0.2 → 10.0.0.1     TCP 78 59433 → 48193 [ACK] Seq=1 Ack=136001 Win=67 Len=0 TSval=1886575333 TSecr=1758597206 SLE=117001 SRE=126449
  200  40.966053     10.0.0.2 → 10.0.0.1     TCP 66 6776 → 55246 [ACK] Seq=1 Ack=126038 Win=34304 Len=0 TSval=1886575347 TSecr=1758597215
  201  40.972123     10.0.0.2 → 10.0.0.1     TCP 78 35722 → 19551 [ACK] Seq=1 Ack=141449 Win=67 Len=0 TSval=1886575353 TSecr=1758597077 SLE=131001 SRE=132001
  202  41.028578     10.0.0.2 → 10.0.0.1     TCP 66 25904 → 58169 [ACK] Seq=1 Ack=129038 Win=34304 Len=0 TSval=1886575409 TSecr=1758597134
  203  41.052043     10.0.0.2 → 10.0.0.1     TCP 78 40783 → 32720 [ACK] Seq=1 Ack=122038 Win=34304 Len=0 TSval=1886575433 TSecr=1758597160 SLE=126038 SRE=135486
  204  41.079200     10.0.0.2 → 10.0.0.1     TCP 66 40783 → 32720 [ACK] Seq=1 Ack=138038 Win=34304 Len=0 TSval=1886575460 TSecr=1758597368
  205  41.086952     10.0.0.2 → 10.0.0.1     TCP 66 46356 → 54368 [ACK] Seq=1 Ack=125038 Win=34304 Len=0 TSval=1886575468 TSecr=1758597199
  206  41.092526     10.0.0.2 → 10.0.0.1     TCP 66 42968 → 55943 [ACK] Seq=1 Ack=130449 Win=67 Len=0 TSval=1886575474 TSecr=1758597331
  207  41.097667     10.0.0.2 → 10.0.0.1     TCP 78 [TCP Dup ACK 201#1] 35722 → 19551 [ACK] Seq=1 Ack=141449 Win=67 Len=0 TSval=1886575479 TSecr=1758597077 SLE=144001 SRE=153449
  208  41.116726     10.0.0.2 → 10.0.0.1     TCP 66 47452 → 53241 [ACK] Seq=1 Ack=138038 Win=33280 Len=0 TSval=1886575498 TSecr=1758597381
  209  41.154857     10.0.0.2 → 10.0.0.1     TCP 78 [TCP Dup ACK 205#1] 46356 → 54368 [ACK] Seq=1 Ack=125038 Win=34304 Len=0 TSval=1886575536 TSecr=1758597199 SLE=134486 SRE=139038
  210  41.169558     10.0.0.2 → 10.0.0.1     TCP 66 35722 → 19551 [ACK] Seq=1 Ack=153449 Win=65 Len=0 TSval=1886575551 TSecr=1758597247
  211  41.188443     10.0.0.2 → 10.0.0.1     TCP 66 46356 → 54368 [ACK] Seq=1 Ack=139038 Win=34304 Len=0 TSval=1886575569 TSecr=1758597452
  212  41.211179     10.0.0.2 → 10.0.0.1     TCP 78 [TCP Dup ACK 208#1] 47452 → 53241 [ACK] Seq=1 Ack=138038 Win=34304 Len=0 TSval=1886575592 TSecr=1758597381 SLE=122038 SRE=131486
  213  41.226618     10.0.0.2 → 10.0.0.1     TCP 78 [TCP Dup ACK 206#1] 42968 → 55943 [ACK] Seq=1 Ack=130449 Win=67 Len=0 TSval=1886575607 TSecr=1758597331 SLE=133001 SRE=142449
  214  41.249264     10.0.0.2 → 10.0.0.1     TCP 78 [TCP Dup ACK 211#1] 46356 → 54368 [ACK] Seq=1 Ack=139038 Win=34304 Len=0 TSval=1886575630 TSecr=1758597452 SLE=125038 SRE=134486
  215  41.267064     10.0.0.2 → 10.0.0.1     TCP 66 46356 → 54368 [ACK] Seq=1 Ack=147038 Win=34304 Len=0 TSval=1886575648 TSecr=1758597485
  216  41.287396     10.0.0.2 → 10.0.0.1     TCP 66 25904 → 58169 [ACK] Seq=1 Ack=144486 Win=31232 Len=0 TSval=1886575668 TSecr=1758597325
  217  41.322180     10.0.0.2 → 10.0.0.1     TCP 66 40783 → 32720 [ACK] Seq=1 Ack=148486 Win=34304 Len=0 TSval=1886575703 TSecr=1758597376
  218  41.338697     10.0.0.2 → 10.0.0.1     TCP 78 6776 → 55246 [ACK] Seq=1 Ack=138486 Win=34304 Len=0 TSval=1886575719 TSecr=1758597263 SLE=126038 SRE=129038
  219  41.348685     10.0.0.2 → 10.0.0.1     TCP 66 35722 → 19551 [ACK] Seq=1 Ack=167001 Win=67 Len=0 TSval=1886575730 TSecr=1758597549
  220  41.351121     10.0.0.2 → 10.0.0.1     TCP 66 6776 → 55246 [ACK] Seq=1 Ack=145038 Win=34304 Len=0 TSval=1886575732 TSecr=1758597477
  221  41.362232     10.0.0.2 → 10.0.0.1     TCP 66 40783 → 32720 [ACK] Seq=1 Ack=155038 Win=34304 Len=0 TSval=1886575742 TSecr=1758597597
  222  41.376727     10.0.0.2 → 10.0.0.1     TCP 66 47452 → 53241 [ACK] Seq=1 Ack=150486 Win=34304 Len=0 TSval=1886575758 TSecr=1758597534
  223  41.377808     10.0.0.2 → 10.0.0.1     TCP 78 42968 → 55943 [ACK] Seq=1 Ack=142449 Win=67 Len=0 TSval=1886575759 TSecr=1758597331 SLE=130449 SRE=133001
  224  41.393496     10.0.0.2 → 10.0.0.1     TCP 78 [TCP Dup ACK 221#1] 40783 → 32720 [ACK] Seq=1 Ack=155038 Win=34304 Len=0 TSval=1886575774 TSecr=1758597597 SLE=138038 SRE=139038
  225  41.395609     10.0.0.2 → 10.0.0.1     TCP 78 [TCP Dup ACK 223#1] 42968 → 55943 [ACK] Seq=1 Ack=142449 Win=67 Len=0 TSval=1886575776 TSecr=1758597331 SLE=151897 SRE=154001
  226  41.399908     10.0.0.2 → 10.0.0.1     TCP 66 47452 → 53241 [ACK] Seq=1 Ack=157038 Win=34304 Len=0 TSval=1886575781 TSecr=1758597623
  227  41.412395     10.0.0.2 → 10.0.0.1     TCP 66 59433 → 48193 [ACK] Seq=1 Ack=164001 Win=67 Len=0 TSval=1886575793 TSecr=1758597580
  228  41.413956     10.0.0.2 → 10.0.0.1     TCP 66 25904 → 58169 [ACK] Seq=1 Ack=154038 Win=34304 Len=0 TSval=1886575795 TSecr=1758597665
  229  41.433839     10.0.0.2 → 10.0.0.1     TCP 78 [TCP Dup ACK 228#1] 25904 → 58169 [ACK] Seq=1 Ack=154038 Win=34304 Len=0 TSval=1886575814 TSecr=1758597665 SLE=163486 SRE=164038
  230  41.436319     10.0.0.2 → 10.0.0.1     TCP 86 [TCP Dup ACK 228#2] 25904 → 58169 [ACK] Seq=1 Ack=154038 Win=34304 Len=0 TSval=1886575817 TSecr=1758597665 SLE=144486 SRE=153934 SLE=163486 SRE=164038
  231  41.480303     10.0.0.2 → 10.0.0.1     TCP 78 [TCP Dup ACK 219#1] 35722 → 19551 [ACK] Seq=1 Ack=167001 Win=67 Len=0 TSval=1886575861 TSecr=1758597549 SLE=174001 SRE=183449
  232  41.498098     10.0.0.2 → 10.0.0.1     TCP 66 35722 → 19551 [ACK] Seq=1 Ack=183449 Win=61 Len=0 TSval=1886575879 TSecr=1758597777
  233  41.713822     10.0.0.2 → 10.0.0.1     TCP 78 [TCP Dup ACK 221#2] 40783 → 32720 [ACK] Seq=1 Ack=155038 Win=34304 Len=0 TSval=1886575893 TSecr=1758597597 SLE=160038 SRE=169486
  234  41.714694     10.0.0.2 → 10.0.0.1     TCP 78 [TCP Dup ACK 232#1] 35722 → 19551 [ACK] Seq=1 Ack=183449 Win=67 Len=0 TSval=1886575893 TSecr=1758597777 SLE=167001 SRE=174001
  235  41.726801     10.0.0.2 → 10.0.0.1     TCP 78 [TCP Dup ACK 226#1] 47452 → 53241 [ACK] Seq=1 Ack=157038 Win=34304 Len=0 TSval=1886576108 TSecr=1758597623 SLE=163038 SRE=172486
  236  41.734842     10.0.0.2 → 10.0.0.1     TCP 66 46356 → 54368 [ACK] Seq=1 Ack=162038 Win=34304 Len=0 TSval=1886576116 TSecr=1758597685
  237  41.784478     10.0.0.2 → 10.0.0.1     TCP 78 [TCP Dup ACK 227#1] 59433 → 48193 [ACK] Seq=1 Ack=164001 Win=67 Len=0 TSval=1886576165 TSecr=1758597580 SLE=174001 SRE=192897
  238  41.809309     10.0.0.2 → 10.0.0.1     TCP 66 47452 → 53241 [ACK] Seq=1 Ack=181934 Win=23040 Len=0 TSval=1886576190 TSecr=1758597697
  239  41.833569     10.0.0.2 → 10.0.0.1     TCP 86 59433 → 48193 [ACK] Seq=1 Ack=173449 Win=53 Len=0 TSval=1886576215 TSecr=1758598043 SLE=164001 SRE=173449 SLE=174001 SRE=192897
  240  41.841420     10.0.0.2 → 10.0.0.1     TCP 78 40783 → 32720 [ACK] Seq=1 Ack=169486 Win=34304 Len=0 TSval=1886576222 TSecr=1758597659 SLE=180486 SRE=189934
  241  41.860173     10.0.0.2 → 10.0.0.1     TCP 66 59433 → 48193 [ACK] Seq=1 Ack=192897 Win=52 Len=0 TSval=1886576241 TSecr=1758598081
  242  41.873983     10.0.0.2 → 10.0.0.1     TCP 66 25904 → 58169 [ACK] Seq=1 Ack=164038 Win=34304 Len=0 TSval=1886576255 TSecr=1758597711
  243  41.887936     10.0.0.2 → 10.0.0.1     TCP 66 47452 → 53241 [ACK] Seq=1 Ack=193038 Win=34304 Len=0 TSval=1886576267 TSecr=1758598106
  244  41.932469     10.0.0.2 → 10.0.0.1     TCP 66 59433 → 48193 [ACK] Seq=1 Ack=208001 Win=67 Len=0 TSval=1886576308 TSecr=1758598157
  245  41.939522     10.0.0.2 → 10.0.0.1     TCP 66 35722 → 19551 [ACK] Seq=1 Ack=203897 Win=57 Len=0 TSval=1886576319 TSecr=1758598158
  246  41.988043     10.0.0.2 → 10.0.0.1     TCP 86 42968 → 55943 [ACK] Seq=1 Ack=166001 Win=67 Len=0 TSval=1886576369 TSecr=1758597797 SLE=154001 SRE=163449 SLE=184001 SRE=193449
  247  42.005229     10.0.0.2 → 10.0.0.1     TCP 66 47452 → 53241 [ACK] Seq=1 Ack=199038 Win=34304 Len=0 TSval=1886576386 TSecr=1758598185
  248  42.080716     10.0.0.2 → 10.0.0.1     TCP 66 46356 → 54368 [ACK] Seq=1 Ack=171486 Win=34304 Len=0 TSval=1886576462 TSecr=1758597816
  249  42.109011     10.0.0.2 → 10.0.0.1     TCP 78 35722 → 19551 [ACK] Seq=1 Ack=213001 Win=67 Len=0 TSval=1886576490 TSecr=1758598158 SLE=185001 SRE=194449
  250  42.129155     10.0.0.2 → 10.0.0.1     TCP 78 42968 → 55943 [ACK] Seq=1 Ack=193449 Win=67 Len=0 TSval=1886576510 TSecr=1758598333 SLE=212345 SRE=214001
  251  42.193937     10.0.0.2 → 10.0.0.1     TCP 66 46356 → 54368 [ACK] Seq=1 Ack=186038 Win=34304 Len=0 TSval=1886576573 TSecr=1758597936
  252  42.201441     10.0.0.2 → 10.0.0.1     TCP 78 [TCP Dup ACK 251#1] 46356 → 54368 [ACK] Seq=1 Ack=186038 Win=34304 Len=0 TSval=1886576579 TSecr=1758597936 SLE=204934 SRE=214382
  253  42.213854     10.0.0.2 → 10.0.0.1     TCP 66 6776 → 55246 [ACK] Seq=1 Ack=203934 Win=23040 Len=0 TSval=1886576594 TSecr=1758598005
  254  42.251409     10.0.0.2 → 10.0.0.1     TCP 66 47452 → 53241 [ACK] Seq=1 Ack=217486 Win=72192 Len=0 TSval=1886576632 TSecr=1758598512
  255  42.273357     10.0.0.2 → 10.0.0.1     TCP 78 [TCP Dup ACK 254#1] 47452 → 53241 [ACK] Seq=1 Ack=217486 Win=91136 Len=0 TSval=1886576652 TSecr=1758598512 SLE=226934 SRE=227038
  256  42.283416     10.0.0.2 → 10.0.0.1     TCP 78 40783 → 32720 [ACK] Seq=1 Ack=189934 Win=34304 Len=0 TSval=1886576664 TSecr=1758598007 SLE=155038 SRE=160038
  257  42.382312     10.0.0.2 → 10.0.0.1     TCP 86 [TCP Dup ACK 254#2] 47452 → 53241 [ACK] Seq=1 Ack=217486 Win=91136 Len=0 TSval=1886576760 TSecr=1758598512 SLE=157038 SRE=163038 SLE=226934 SRE=227038
  258  42.438604     10.0.0.2 → 10.0.0.1     TCP 78 40783 → 32720 [ACK] Seq=1 Ack=208830 Win=34304 Len=0 TSval=1886576819 TSecr=1758598580 SLE=169486 SRE=171038
  259  42.447201     10.0.0.2 → 10.0.0.1     TCP 86 25904 → 58169 [ACK] Seq=1 Ack=198038 Win=34304 Len=0 TSval=1886576826 TSecr=1758598291 SLE=164038 SRE=173486 SLE=212038 SRE=221486
  260  42.448669     10.0.0.2 → 10.0.0.1     TCP 78 [TCP Dup ACK 258#1] 40783 → 32720 [ACK] Seq=1 Ack=208830 Win=34304 Len=0 TSval=1886576829 TSecr=1758598580 SLE=224238 SRE=227726
  261  42.453315     10.0.0.2 → 10.0.0.1     TCP 78 [TCP Dup ACK 258#2] 40783 → 32720 [ACK] Seq=1 Ack=208830 Win=34304 Len=0 TSval=1886576833 TSecr=1758598580 SLE=224238 SRE=237174
  262  42.520749     10.0.0.2 → 10.0.0.1     TCP 86 [TCP Dup ACK 250#1] 42968 → 55943 [ACK] Seq=1 Ack=193449 Win=67 Len=0 TSval=1886576902 TSecr=1758598333 SLE=166001 SRE=175449 SLE=212345 SRE=214001
  263  42.577813     10.0.0.2 → 10.0.0.1     TCP 66 42968 → 55943 [ACK] Seq=1 Ack=214001 Win=57 Len=0 TSval=1886576959 TSecr=1758598873
  264  42.578699     10.0.0.2 → 10.0.0.1     TCP 78 35722 → 19551 [ACK] Seq=1 Ack=220001 Win=61 Len=0 TSval=1886576960 TSecr=1758598261 SLE=229449 SRE=238897
  265  42.593746     10.0.0.2 → 10.0.0.1     TCP 78 [TCP Dup ACK 263#1] 42968 → 55943 [ACK] Seq=1 Ack=214001 Win=67 Len=0 TSval=1886576975 TSecr=1758598873 SLE=223449 SRE=232897
  266  42.606913     10.0.0.2 → 10.0.0.1     TCP 86 [TCP Dup ACK 254#3] 47452 → 53241 [ACK] Seq=1 Ack=217486 Win=91136 Len=0 TSval=1886576988 TSecr=1758598512 SLE=199038 SRE=208038 SLE=226934 SRE=227038
  267  42.633946     10.0.0.2 → 10.0.0.1     TCP 78 [TCP Dup ACK 263#2] 42968 → 55943 [ACK] Seq=1 Ack=214001 Win=67 Len=0 TSval=1886577014 TSecr=1758598873 SLE=223449 SRE=243185
  268  42.643761     10.0.0.2 → 10.0.0.1     TCP 86 46356 → 54368 [ACK] Seq=1 Ack=195486 Win=34304 Len=0 TSval=1886577025 TSecr=1758598503 SLE=162038 SRE=171486 SLE=204934 SRE=214382
  269  42.648669     10.0.0.2 → 10.0.0.1     TCP 78 [TCP Dup ACK 268#1] 46356 → 54368 [ACK] Seq=1 Ack=195486 Win=34304 Len=0 TSval=1886577030 TSecr=1758598503 SLE=204934 SRE=220342
  270  42.657356     10.0.0.2 → 10.0.0.1     TCP 66 46356 → 54368 [ACK] Seq=1 Ack=220342 Win=29184 Len=0 TSval=1886577038 TSecr=1758598946
  271  42.681256     10.0.0.2 → 10.0.0.1     TCP 78 25904 → 58169 [ACK] Seq=1 Ack=207486 Win=29184 Len=0 TSval=1886577062 TSecr=1758598354 SLE=212038 SRE=221486
  272  42.767165     10.0.0.2 → 10.0.0.1     TCP 66 46356 → 54368 [ACK] Seq=1 Ack=248686 Win=53248 Len=0 TSval=1886577096 TSecr=1758598954
  273  42.771378     10.0.0.2 → 10.0.0.1     TCP 78 [TCP Dup ACK 253#1] 6776 → 55246 [ACK] Seq=1 Ack=203934 Win=34304 Len=0 TSval=1886577149 TSecr=1758598005 SLE=222830 SRE=223038
  274  42.775995     10.0.0.2 → 10.0.0.1     TCP 66 25904 → 58169 [ACK] Seq=1 Ack=221486 Win=31232 Len=0 TSval=1886577151 TSecr=1758598354
  275  42.782264     10.0.0.2 → 10.0.0.1     TCP 78 [TCP Dup ACK 272#1] 46356 → 54368 [ACK] Seq=1 Ack=248686 Win=72192 Len=0 TSval=1886577154 TSecr=1758598954 SLE=249526 SRE=258974
  276  42.784871     10.0.0.2 → 10.0.0.1     TCP 78 59433 → 48193 [ACK] Seq=1 Ack=213001 Win=141 Len=0 TSval=1886577158 TSecr=1758598910 SLE=231897 SRE=241001
