    1   0.000000     10.0.0.1 → 10.0.0.2     TCP 66 36467 → 59433 [ACK] Seq=1 Ack=1 Win=74 Len=0 TSval=1758595183 TSecr=1886573266
    2   0.003959     10.0.0.1 → 10.0.0.2     TCP 70 42763 → 35722 [PSH, ACK] Seq=1 Ack=1 Win=74 Len=4 TSval=1758595186 TSecr=1886573267
    3   0.005316     10.0.0.1 → 10.0.0.2     TCP 70 [TCP Previous segment not captured] 36467 → 59433 [PSH, ACK] Seq=38 Ack=2 Win=74 Len=4 TSval=1758595186 TSecr=1886573270
    4   0.012432     10.0.0.1 → 10.0.0.2     TCP 74 39475 → 47452 [SYN] Seq=0 Win=37840 Len=0 MSS=9460 SACK_PERM TSval=1758595195 TSecr=0 WS=512
    5   0.021283     10.0.0.1 → 10.0.0.2     TCP 74 55655 → 6776 [SYN] Seq=0 Win=37840 Len=0 MSS=9460 SACK_PERM TSval=1758595202 TSecr=0 WS=512
    6   0.024204     10.0.0.1 → 10.0.0.2     TCP 66 51099 → 25904 [ACK] Seq=1 Ack=1 Win=74 Len=0 TSval=1758595207 TSecr=1886573285
    7   0.024937     10.0.0.1 → 10.0.0.2     TCP 103 58271 → 40783 [PSH, ACK] Seq=1 Ack=1 Win=74 Len=37 TSval=1758595208 TSecr=1886573285
    8   0.028715     10.0.0.1 → 10.0.0.2     TCP 66 55655 → 6776 [ACK] Seq=1 Ack=1 Win=37888 Len=0 TSval=1758595211 TSecr=1886573293
    9   0.029697     10.0.0.1 → 10.0.0.2     TCP 66 [TCP Previous segment not captured] 39475 → 47452 [ACK] Seq=38 Ack=1 Win=37888 Len=0 TSval=1758595212 TSecr=1886573293
   10   0.030292     10.0.0.1 → 10.0.0.2     TCP 70 39475 → 47452 [PSH, ACK] Seq=38 Ack=1 Win=37888 Len=4 TSval=1758595212 TSecr=1886573293
   11   0.037509     10.0.0.1 → 10.0.0.2     TCP 70 58271 → 40783 [PSH, ACK] Seq=38 Ack=2 Win=74 Len=4 TSval=1758595217 TSecr=1886573298
   12   0.037883     10.0.0.1 → 10.0.0.2     TCP 66 49189 → 42968 [ACK] Seq=1 Ack=1 Win=74 Len=0 TSval=1758595217 TSecr=1886573298
   13   0.038433     10.0.0.1 → 10.0.0.2     TCP 103 49189 → 42968 [PSH, ACK] Seq=1 Ack=1 Win=74 Len=37 TSval=1758595217 TSecr=1886573298
   14   0.038975     10.0.0.1 → 10.0.0.2     TCP 103 47085 → 46356 [PSH, ACK] Seq=1 Ack=1 Win=74 Len=37 TSval=1758595217 TSecr=1886573296
   15   0.043020     10.0.0.1 → 10.0.0.2     TCP 66 [TCP Previous segment not captured] 55655 → 6776 [ACK] Seq=38 Ack=2 Win=37888 Len=0 TSval=1758595223 TSecr=1886573304
   16   0.045045     10.0.0.1 → 10.0.0.2     TCP 70 49189 → 42968 [PSH, ACK] Seq=38 Ack=2 Win=74 Len=4 TSval=1758595227 TSecr=1886573308
   17   0.046588     10.0.0.1 → 10.0.0.2     TCP 70 47085 → 46356 [PSH, ACK] Seq=38 Ack=2 Win=74 Len=4 TSval=1758595228 TSecr=1886573309
   18   0.123300     10.0.0.1 → 10.0.0.2     TCP 103 48193 → 59433 [PSH, ACK] Seq=1 Ack=1 Win=74 Len=37 TSval=1758595249 TSecr=1886573330
   19   0.125080     10.0.0.1 → 10.0.0.2     TCP 66 [TCP Previous segment not captured] 42763 → 35722 [ACK] Seq=122 Ack=2 Win=74 Len=0 TSval=1758595277 TSecr=1886573316
   20   0.129916     10.0.0.1 → 10.0.0.2     TCP 183 39475 → 47452 [PSH, ACK] Seq=42 Ack=1 Win=37888 Len=117 TSval=1758595309 TSecr=1886573358
   21   0.134342     10.0.0.1 → 10.0.0.2     TCP 183 [TCP Previous segment not captured] 55655 → 6776 [PSH, ACK] Seq=42 Ack=2 Win=37888 Len=117 TSval=1758595312 TSecr=1886573358
   22   0.143340     10.0.0.1 → 10.0.0.2     TCP 183 [TCP Previous segment not captured] 51099 → 25904 [PSH, ACK] Seq=42 Ack=2 Win=74 Len=117 TSval=1758595312 TSecr=1886573358
   23   0.146036     10.0.0.1 → 10.0.0.2     TCP 183 47085 → 46356 [PSH, ACK] Seq=42 Ack=2 Win=74 Len=117 TSval=1758595313 TSecr=1886573358
   24   0.150978     10.0.0.1 → 10.0.0.2     TCP 183 58271 → 40783 [PSH, ACK] Seq=42 Ack=2 Win=74 Len=117 TSval=1758595314 TSecr=1886573358
   25   0.167603     10.0.0.1 → 10.0.0.2     TCP 183 49189 → 42968 [PSH, ACK] Seq=42 Ack=2 Win=74 Len=117 TSval=1758595317 TSecr=1886573358
   26   0.180154     10.0.0.1 → 10.0.0.2     TCP 66 42763 → 35722 [ACK] Seq=122 Ack=4 Win=74 Len=0 TSval=1758595317 TSecr=1886573394
   27   0.202435     10.0.0.1 → 10.0.0.2     TCP 1066 48193 → 59433 [PSH, ACK] Seq=38 Ack=1 Win=74 Len=1000 TSval=1758595380 TSecr=1886573395
   28   0.213511     10.0.0.1 → 10.0.0.2     TCP 74 32720 → 40783 [SYN] Seq=0 Win=37840 Len=0 MSS=9460 SACK_PERM TSval=1758595382 TSecr=0 WS=512
   29   0.215988     10.0.0.1 → 10.0.0.2     TCP 5066 19551 → 35722 [PSH, ACK] Seq=1 Ack=1 Win=74 Len=5000 TSval=1758595385 TSecr=1886573464
   30   0.233742     10.0.0.1 → 10.0.0.2     TCP 66 53241 → 47452 [ACK] Seq=1 Ack=1 Win=74 Len=0 TSval=1758595399 TSecr=1886573468
   31   0.250617     10.0.0.1 → 10.0.0.2     TCP 103 53241 → 47452 [PSH, ACK] Seq=1 Ack=1 Win=74 Len=37 TSval=1758595399 TSecr=1886573468
   32   0.271376     10.0.0.1 → 10.0.0.2     TCP 66 58169 → 25904 [ACK] Seq=1 Ack=1 Win=74 Len=0 TSval=1758595410 TSecr=1886573472
   33   0.318315     10.0.0.1 → 10.0.0.2     TCP 103 54368 → 46356 [PSH, ACK] Seq=1 Ack=1 Win=74 Len=37 TSval=1758595410 TSecr=1886573473
   34   0.319493     10.0.0.1 → 10.0.0.2     TCP 66 32720 → 40783 [ACK] Seq=1 Ack=1 Win=37888 Len=0 TSval=1758595417 TSecr=1886573482
   35   0.329603     10.0.0.1 → 10.0.0.2     TCP 66 55943 → 42968 [ACK] Seq=1 Ack=1 Win=74 Len=0 TSval=1758595417 TSecr=1886573483
   36   0.330207     10.0.0.1 → 10.0.0.2     TCP 103 55943 → 42968 [PSH, ACK] Seq=1 Ack=1 Win=74 Len=37 TSval=1758595417 TSecr=1886573483
   37   0.332057     10.0.0.1 → 10.0.0.2     TCP 66 51099 → 25904 [ACK] Seq=159 Ack=3 Win=74 Len=0 TSval=1758595421 TSecr=1886573413
   38   0.333035     10.0.0.1 → 10.0.0.2     TCP 66 55655 → 6776 [ACK] Seq=159 Ack=3 Win=37888 Len=0 TSval=1758595421 TSecr=1886573409
   39   0.334189     10.0.0.1 → 10.0.0.2     TCP 66 39475 → 47452 [ACK] Seq=159 Ack=2 Win=37888 Len=0 TSval=1758595421 TSecr=1886573399
   40   0.341302     10.0.0.1 → 10.0.0.2     TCP 66 49189 → 42968 [ACK] Seq=159 Ack=3 Win=74 Len=0 TSval=1758595425 TSecr=1886573438
   41   0.345299     10.0.0.1 → 10.0.0.2     TCP 66 58271 → 40783 [ACK] Seq=159 Ack=3 Win=74 Len=0 TSval=1758595425 TSecr=1886573423
   42   0.346365     10.0.0.1 → 10.0.0.2     TCP 66 47085 → 46356 [ACK] Seq=159 Ack=3 Win=74 Len=0 TSval=1758595425 TSecr=1886573415
   43   0.347564     10.0.0.1 → 10.0.0.2     TCP 3066 19551 → 35722 [PSH, ACK] Seq=5001 Ack=1 Win=74 Len=3000 TSval=1758595436 TSecr=1886573491
   44   0.350307     10.0.0.1 → 10.0.0.2     TCP 9066 [TCP Previous segment not captured] 48193 → 59433 [PSH, ACK] Seq=3038 Ack=1 Win=74 Len=9000 TSval=1758595532 TSecr=1886573539
   45   0.358244     10.0.0.1 → 10.0.0.2     TCP 66 55655 → 6776 [ACK] Seq=159 Ack=5 Win=37888 Len=0 TSval=1758595533 TSecr=1886573602
   46   0.358591     10.0.0.1 → 10.0.0.2     TCP 66 39475 → 47452 [ACK] Seq=159 Ack=4 Win=37888 Len=0 TSval=1758595533 TSecr=1886573603
   47   0.358910     10.0.0.1 → 10.0.0.2     TCP 66 49189 → 42968 [ACK] Seq=159 Ack=5 Win=74 Len=0 TSval=1758595533 TSecr=1886573610
   48   0.359236     10.0.0.1 → 10.0.0.2     TCP 66 58271 → 40783 [ACK] Seq=159 Ack=5 Win=74 Len=0 TSval=1758595533 TSecr=1886573614
   49   0.359577     10.0.0.1 → 10.0.0.2     TCP 66 47085 → 46356 [ACK] Seq=159 Ack=5 Win=74 Len=0 TSval=1758595533 TSecr=1886573615
   50   0.361676     10.0.0.1 → 10.0.0.2     TCP 1066 53241 → 47452 [PSH, ACK] Seq=38 Ack=1 Win=74 Len=1000 TSval=1758595534 TSecr=1886573520
   51   0.362995     10.0.0.1 → 10.0.0.2     TCP 1066 55943 → 42968 [PSH, ACK] Seq=38 Ack=1 Win=74 Len=1000 TSval=1758595536 TSecr=1886573599
   52   0.363771     10.0.0.1 → 10.0.0.2     TCP 1066 55246 → 6776 [PSH, ACK] Seq=1 Ack=1 Win=74 Len=1000 TSval=1758595543 TSecr=1886573523
   53   0.364129     10.0.0.1 → 10.0.0.2     TCP 1066 48193 → 59433 [PSH, ACK] Seq=12038 Ack=1 Win=74 Len=1000 TSval=1758595544 TSecr=1886573619
   54   0.365630     10.0.0.1 → 10.0.0.2     TCP 1066 [TCP Previous segment not captured] 19551 → 35722 [PSH, ACK] Seq=16001 Ack=1 Win=74 Len=1000 TSval=1758595549 TSecr=1886573629
   55   0.373273     10.0.0.1 → 10.0.0.2     TCP 1066 53241 → 47452 [PSH, ACK] Seq=1038 Ack=1 Win=74 Len=1000 TSval=1758595556 TSecr=1886573640
   56   0.375885     10.0.0.1 → 10.0.0.2     TCP 1066 55246 → 6776 [PSH, ACK] Seq=1001 Ack=1 Win=74 Len=1000 TSval=1758595559 TSecr=1886573643
   57   0.387285     10.0.0.1 → 10.0.0.2     TCP 2066 [TCP Previous segment not captured] 58169 → 25904 [PSH, ACK] Seq=1038 Ack=1 Win=74 Len=2000 TSval=1758595570 TSecr=1886573655
   58   0.391219     10.0.0.1 → 10.0.0.2     TCP 1066 58169 → 25904 [PSH, ACK] Seq=3038 Ack=1 Win=74 Len=1000 TSval=1758595574 TSecr=1886573656
   59   0.404350     10.0.0.1 → 10.0.0.2     TCP 2066 [TCP Previous segment not captured] 48193 → 59433 [PSH, ACK] Seq=14038 Ack=1 Win=74 Len=2000 TSval=1758595587 TSecr=1886573672
   60   0.411315     10.0.0.1 → 10.0.0.2     TCP 1066 48193 → 59433 [PSH, ACK] Seq=16038 Ack=1 Win=74 Len=1000 TSval=1758595594 TSecr=1886573673
   61   0.414877     10.0.0.1 → 10.0.0.2     TCP 2066 [TCP Previous segment not captured] 53241 → 47452 [PSH, ACK] Seq=3038 Ack=1 Win=74 Len=2000 TSval=1758595598 TSecr=1886573681
   62   0.417698     10.0.0.1 → 10.0.0.2     TCP 2066 [TCP Previous segment not captured] 55246 → 6776 [PSH, ACK] Seq=3001 Ack=1 Win=74 Len=2000 TSval=1758595601 TSecr=1886573685
   63   0.427468     10.0.0.1 → 10.0.0.2     TCP 1066 55246 → 6776 [PSH, ACK] Seq=5001 Ack=1 Win=74 Len=1000 TSval=1758595611 TSecr=1886573687
   64   0.433722     10.0.0.1 → 10.0.0.2     TCP 3066 [TCP Previous segment not captured] 54368 → 46356 [PSH, ACK] Seq=4038 Ack=1 Win=74 Len=3000 TSval=1758595617 TSecr=1886573701
   65   0.458586     10.0.0.1 → 10.0.0.2     TCP 4066 [TCP Previous segment not captured] 19551 → 35722 [PSH, ACK] Seq=20001 Ack=1 Win=74 Len=4000 TSval=1758595642 TSecr=1886573726
   66   0.466715     10.0.0.1 → 10.0.0.2     TCP 3066 [TCP Previous segment not captured] 53241 → 47452 [PSH, ACK] Seq=6038 Ack=1 Win=74 Len=3000 TSval=1758595650 TSecr=1886573734
   67   0.468188     10.0.0.1 → 10.0.0.2     TCP 1066 19551 → 35722 [PSH, ACK] Seq=24001 Ack=1 Win=74 Len=1000 TSval=1758595651 TSecr=1886573728
   68   0.471353     10.0.0.1 → 10.0.0.2     TCP 1066 53241 → 47452 [PSH, ACK] Seq=9038 Ack=1 Win=74 Len=1000 TSval=1758595654 TSecr=1886573736
   69   0.487903     10.0.0.1 → 10.0.0.2     TCP 4066 [TCP Previous segment not captured] 55943 → 42968 [PSH, ACK] Seq=7038 Ack=1 Win=74 Len=4000 TSval=1758595671 TSecr=1886573755
   70   0.528777     10.0.0.1 → 10.0.0.2     TCP 3066 [TCP Previous segment not captured] 48193 → 59433 [PSH, ACK] Seq=22038 Ack=1 Win=74 Len=3000 TSval=1758595712 TSecr=1886573796
   71   0.549513     10.0.0.1 → 10.0.0.2     TCP 5066 [TCP Previous segment not captured] 55246 → 6776 [PSH, ACK] Seq=10001 Ack=1 Win=74 Len=5000 TSval=1758595733 TSecr=1886573817
   72   0.570214     10.0.0.1 → 10.0.0.2     TCP 5066 [TCP Previous segment not captured] 54368 → 46356 [PSH, ACK] Seq=12038 Ack=1 Win=74 Len=5000 TSval=1758595753 TSecr=1886573838
   73   0.579677     10.0.0.1 → 10.0.0.2     TCP 1066 54368 → 46356 [PSH, ACK] Seq=17038 Ack=1 Win=74 Len=1000 TSval=1758595763 TSecr=1886573839
   74   0.586635     10.0.0.1 → 10.0.0.2     TCP 6066 [TCP Previous segment not captured] 58169 → 25904 [PSH, ACK] Seq=12038 Ack=1 Win=74 Len=6000 TSval=1758595770 TSecr=1886573854
   75   0.591164     10.0.0.1 → 10.0.0.2     TCP 1066 58169 → 25904 [PSH, ACK] Seq=18038 Ack=1 Win=74 Len=1000 TSval=1758595774 TSecr=1886573855
   76   0.592631     10.0.0.1 → 10.0.0.2     TCP 1066 54368 → 46356 [PSH, ACK] Seq=18038 Ack=1 Win=74 Len=1000 TSval=1758595776 TSecr=1886573849
   77   0.602734     10.0.0.1 → 10.0.0.2     TCP 6066 [TCP Previous segment not captured] 32720 → 40783 [PSH, ACK] Seq=13038 Ack=1 Win=37888 Len=6000 TSval=1758595786 TSecr=1886573870
   78   0.605935     10.0.0.1 → 10.0.0.2     TCP 1066 32720 → 40783 [PSH, ACK] Seq=19038 Ack=1 Win=37888 Len=1000 TSval=1758595788 TSecr=1886573872
   79   0.623354     10.0.0.1 → 10.0.0.2     TCP 6066 [TCP Previous segment not captured] 19551 → 35722 [PSH, ACK] Seq=30001 Ack=1 Win=74 Len=6000 TSval=1758595806 TSecr=1886573891
   80   0.628157     10.0.0.1 → 10.0.0.2     TCP 1066 19551 → 35722 [PSH, ACK] Seq=36001 Ack=1 Win=74 Len=1000 TSval=1758595811 TSecr=1886573892
   81   0.642334     10.0.0.1 → 10.0.0.2     TCP 1066 19551 → 35722 [PSH, ACK] Seq=37001 Ack=1 Win=74 Len=1000 TSval=1758595824 TSecr=1886573901
   82   0.644408     10.0.0.1 → 10.0.0.2     TCP 5066 [TCP Previous segment not captured] 53241 → 47452 [PSH, ACK] Seq=17038 Ack=1 Win=74 Len=5000 TSval=1758595827 TSecr=1886573911
   83   0.645892     10.0.0.1 → 10.0.0.2     TCP 1066 53241 → 47452 [PSH, ACK] Seq=22038 Ack=1 Win=74 Len=1000 TSval=1758595829 TSecr=1886573913
   84   0.654178     10.0.0.1 → 10.0.0.2     TCP 1066 19551 → 35722 [PSH, ACK] Seq=38001 Ack=1 Win=74 Len=1000 TSval=1758595837 TSecr=1886573912
   85   0.658459     10.0.0.1 → 10.0.0.2     TCP 1066 53241 → 47452 [PSH, ACK] Seq=23038 Ack=1 Win=74 Len=1000 TSval=1758595841 TSecr=1886573920
   86   0.668130     10.0.0.1 → 10.0.0.2     TCP 1066 19551 → 35722 [PSH, ACK] Seq=39001 Ack=1 Win=74 Len=1000 TSval=1758595851 TSecr=1886573923
   87   0.668499     10.0.0.1 → 10.0.0.2     TCP 8066 [TCP Previous segment not captured] 55943 → 42968 [PSH, ACK] Seq=16038 Ack=1 Win=74 Len=8000 TSval=1758595851 TSecr=1886573935
   88   0.672031     10.0.0.1 → 10.0.0.2     TCP 1066 53241 → 47452 [PSH, ACK] Seq=24038 Ack=1 Win=74 Len=1000 TSval=1758595854 TSecr=1886573927
   89   0.674611     10.0.0.1 → 10.0.0.2     TCP 1066 55943 → 42968 [PSH, ACK] Seq=24038 Ack=1 Win=74 Len=1000 TSval=1758595858 TSecr=1886573941
   90   0.684548     10.0.0.1 → 10.0.0.2     TCP 5066 [TCP Previous segment not captured] 58169 → 25904 [PSH, ACK] Seq=20038 Ack=1 Win=74 Len=5000 TSval=1758595867 TSecr=1886573952
   91   0.691402     10.0.0.1 → 10.0.0.2     TCP 6066 [TCP Previous segment not captured] 54368 → 46356 [PSH, ACK] Seq=20038 Ack=1 Win=74 Len=6000 TSval=1758595874 TSecr=1886573956
   92   0.691908     10.0.0.1 → 10.0.0.2     TCP 1066 58169 → 25904 [PSH, ACK] Seq=25038 Ack=1 Win=74 Len=1000 TSval=1758595875 TSecr=1886573958
   93   0.695634     10.0.0.1 → 10.0.0.2     TCP 5066 [TCP Previous segment not captured] 32720 → 40783 [PSH, ACK] Seq=21038 Ack=1 Win=37888 Len=5000 TSval=1758595879 TSecr=1886573961
   94   0.697756     10.0.0.1 → 10.0.0.2     TCP 6066 [TCP Previous segment not captured] 48193 → 59433 [PSH, ACK] Seq=32038 Ack=1 Win=74 Len=6000 TSval=1758595881 TSecr=1886573965
   95   0.699922     10.0.0.1 → 10.0.0.2     TCP 1066 54368 → 46356 [PSH, ACK] Seq=26038 Ack=1 Win=74 Len=1000 TSval=1758595883 TSecr=1886573967
   96   0.711969     10.0.0.1 → 10.0.0.2     TCP 2066 58169 → 25904 [PSH, ACK] Seq=26038 Ack=1 Win=74 Len=2000 TSval=1758595895 TSecr=1886573979
   97   0.721475     10.0.0.1 → 10.0.0.2     TCP 7066 [TCP Previous segment not captured] 55246 → 6776 [PSH, ACK] Seq=21001 Ack=1 Win=74 Len=7000 TSval=1758595905 TSecr=1886573989
   98   0.736203     10.0.0.1 → 10.0.0.2     TCP 2066 54368 → 46356 [PSH, ACK] Seq=27038 Ack=1 Win=74 Len=2000 TSval=1758595919 TSecr=1886574004
   99   0.741672     10.0.0.1 → 10.0.0.2     TCP 4066 [TCP Previous segment not captured] 19551 → 35722 [PSH, ACK] Seq=41001 Ack=1 Win=74 Len=4000 TSval=1758595925 TSecr=1886574009
  100   0.745799     10.0.0.1 → 10.0.0.2     TCP 4066 [TCP Previous segment not captured] 53241 → 47452 [PSH, ACK] Seq=26038 Ack=1 Win=74 Len=4000 TSval=1758595929 TSecr=1886574013
  101   0.760732     10.0.0.1 → 10.0.0.2     TCP 1066 19551 → 35722 [PSH, ACK] Seq=45001 Ack=1 Win=74 Len=1000 TSval=1758595944 TSecr=1886574028
  102   0.763150     10.0.0.1 → 10.0.0.2     TCP 3066 [TCP Previous segment not captured] 48193 → 59433 [PSH, ACK] Seq=40038 Ack=1 Win=74 Len=3000 TSval=1758595946 TSecr=1886574030
  103   0.768884     10.0.0.1 → 10.0.0.2     TCP 2066 53241 → 47452 [PSH, ACK] Seq=30038 Ack=1 Win=74 Len=2000 TSval=1758595952 TSecr=1886574036
  104   0.783484     10.0.0.1 → 10.0.0.2     TCP 3066 [TCP Previous segment not captured] 55943 → 42968 [PSH, ACK] Seq=30038 Ack=1 Win=74 Len=3000 TSval=1758595967 TSecr=1886574051
  105   0.785325     10.0.0.1 → 10.0.0.2     TCP 1066 53241 → 47452 [PSH, ACK] Seq=32038 Ack=1 Win=74 Len=1000 TSval=1758595968 TSecr=1886574053
  106   0.792650     10.0.0.1 → 10.0.0.2     TCP 1066 55943 → 42968 [PSH, ACK] Seq=33038 Ack=1 Win=74 Len=1000 TSval=1758595976 TSecr=1886574057
  107   0.795521     10.0.0.1 → 10.0.0.2     TCP 1066 53241 → 47452 [PSH, ACK] Seq=33038 Ack=1 Win=74 Len=1000 TSval=1758595979 TSecr=1886574063
  108   0.799918     10.0.0.1 → 10.0.0.2     TCP 3066 [TCP Previous segment not captured] 32720 → 40783 [PSH, ACK] Seq=31038 Ack=1 Win=37888 Len=3000 TSval=1758595983 TSecr=1886574067
  109   0.820455     10.0.0.1 → 10.0.0.2     TCP 4066 [TCP Previous segment not captured] 58169 → 25904 [PSH, ACK] Seq=32038 Ack=1 Win=74 Len=4000 TSval=1758596004 TSecr=1886574088
  110   0.828583     10.0.0.1 → 10.0.0.2     TCP 4066 [TCP Previous segment not captured] 19551 → 35722 [PSH, ACK] Seq=48001 Ack=1 Win=74 Len=4000 TSval=1758596012 TSecr=1886574096
  111   0.836826     10.0.0.1 → 10.0.0.2     TCP 4066 [TCP Previous segment not captured] 48193 → 59433 [PSH, ACK] Seq=44038 Ack=1 Win=74 Len=4000 TSval=1758596020 TSecr=1886574104
  112   0.839062     10.0.0.1 → 10.0.0.2     TCP 1066 48193 → 59433 [PSH, ACK] Seq=48038 Ack=1 Win=74 Len=1000 TSval=1758596022 TSecr=1886574106
  113   0.841460     10.0.0.1 → 10.0.0.2     TCP 1066 19551 → 35722 [PSH, ACK] Seq=52001 Ack=1 Win=74 Len=1000 TSval=1758596024 TSecr=1886574097
  114   0.841850     10.0.0.1 → 10.0.0.2     TCP 5066 [TCP Previous segment not captured] 55246 → 6776 [PSH, ACK] Seq=32001 Ack=1 Win=74 Len=5000 TSval=1758596024 TSecr=1886574108
  115   0.842613     10.0.0.1 → 10.0.0.2     TCP 3066 53241 → 47452 [PSH, ACK] Seq=34038 Ack=1 Win=74 Len=3000 TSval=1758596025 TSecr=1886574110
  116   0.851131     10.0.0.1 → 10.0.0.2     TCP 1066 48193 → 59433 [PSH, ACK] Seq=49038 Ack=1 Win=74 Len=1000 TSval=1758596034 TSecr=1886574111
  117   0.858762     10.0.0.1 → 10.0.0.2     TCP 3066 [TCP Previous segment not captured] 55943 → 42968 [PSH, ACK] Seq=35038 Ack=1 Win=74 Len=3000 TSval=1758596042 TSecr=1886574125
  118   0.859261     10.0.0.1 → 10.0.0.2     TCP 2066 53241 → 47452 [PSH, ACK] Seq=37038 Ack=1 Win=74 Len=2000 TSval=1758596042 TSecr=1886574126
  119   0.861894     10.0.0.1 → 10.0.0.2     TCP 4066 [TCP Previous segment not captured] 54368 → 46356 [PSH, ACK] Seq=35038 Ack=1 Win=74 Len=4000 TSval=1758596045 TSecr=1886574129
  120   0.866011     10.0.0.1 → 10.0.0.2     TCP 1066 55943 → 42968 [PSH, ACK] Seq=38038 Ack=1 Win=74 Len=1000 TSval=1758596049 TSecr=1886574133
  121   0.876347     10.0.0.1 → 10.0.0.2     TCP 1066 54368 → 46356 [PSH, ACK] Seq=39038 Ack=1 Win=74 Len=1000 TSval=1758596059 TSecr=1886574144
  122   0.878158     10.0.0.1 → 10.0.0.2     TCP 3066 [TCP Previous segment not captured] 58169 → 25904 [PSH, ACK] Seq=37038 Ack=1 Win=74 Len=3000 TSval=1758596061 TSecr=1886574145
  123   0.884452     10.0.0.1 → 10.0.0.2     TCP 1066 55943 → 42968 [PSH, ACK] Seq=39038 Ack=1 Win=74 Len=1000 TSval=1758596067 TSecr=1886574152
  124   0.888724     10.0.0.1 → 10.0.0.2     TCP 1066 58169 → 25904 [PSH, ACK] Seq=40038 Ack=1 Win=74 Len=1000 TSval=1758596072 TSecr=1886574156
  125   0.899330     10.0.0.1 → 10.0.0.2     TCP 3066 [TCP Previous segment not captured] 55246 → 6776 [PSH, ACK] Seq=38001 Ack=1 Win=74 Len=3000 TSval=1758596082 TSecr=1886574166
  126   0.907517     10.0.0.1 → 10.0.0.2     TCP 1066 55246 → 6776 [PSH, ACK] Seq=41001 Ack=1 Win=74 Len=1000 TSval=1758596091 TSecr=1886574168
  127   0.924215     10.0.0.1 → 10.0.0.2     TCP 1066 [TCP Previous segment not captured] 53241 → 47452 [PSH, ACK] Seq=42038 Ack=1 Win=74 Len=1000 TSval=1758596107 TSecr=1886574192
  128   0.966753     10.0.0.1 → 10.0.0.2     TCP 2066 [TCP Previous segment not captured] 48193 → 59433 [PSH, ACK] Seq=56038 Ack=1 Win=74 Len=2000 TSval=1758596150 TSecr=1886574233
  129   0.980399     10.0.0.1 → 10.0.0.2     TCP 6066 [TCP Previous segment not captured] 54368 → 46356 [PSH, ACK] Seq=41038 Ack=1 Win=74 Len=6000 TSval=1758596159 TSecr=1886574234
  130   0.998462     10.0.0.1 → 10.0.0.2     TCP 4066 [TCP Previous segment not captured] 19551 → 35722 [PSH, ACK] Seq=60001 Ack=1 Win=74 Len=4000 TSval=1758596180 TSecr=1886574261
  131   0.999772     10.0.0.1 → 10.0.0.2     TCP 5066 [TCP Previous segment not captured] 55246 → 6776 [PSH, ACK] Seq=43001 Ack=1 Win=74 Len=5000 TSval=1758596182 TSecr=1886574266
  132   1.068858     10.0.0.1 → 10.0.0.2     TCP 6066 [TCP Previous segment not captured] 55943 → 42968 [PSH, ACK] Seq=48038 Ack=1 Win=74 Len=6000 TSval=1758596250 TSecr=1886574325
  133   1.073020     10.0.0.1 → 10.0.0.2     TCP 6066 [TCP Previous segment not captured] 54368 → 46356 [PSH, ACK] Seq=48038 Ack=1 Win=74 Len=6000 TSval=1758596255 TSecr=1886574328
  134   1.086027     10.0.0.1 → 10.0.0.2     TCP 6066 [TCP Previous segment not captured] 19551 → 35722 [PSH, ACK] Seq=65001 Ack=1 Win=74 Len=6000 TSval=1758596269 TSecr=1886574353
  135   1.121841     10.0.0.1 → 10.0.0.2     TCP 7066 [TCP Previous segment not captured] 58169 → 25904 [PSH, ACK] Seq=51038 Ack=1 Win=74 Len=7000 TSval=1758596304 TSecr=1886574387
  136   1.125140     10.0.0.1 → 10.0.0.2     TCP 1066 58169 → 25904 [PSH, ACK] Seq=58038 Ack=1 Win=74 Len=1000 TSval=1758596308 TSecr=1886574391
  137   1.131725     10.0.0.1 → 10.0.0.2     TCP 6066 [TCP Previous segment not captured] 48193 → 59433 [PSH, ACK] Seq=65038 Ack=1 Win=74 Len=6000 TSval=1758596315 TSecr=1886574399
  138   1.138176     10.0.0.1 → 10.0.0.2     TCP 1066 58169 → 25904 [PSH, ACK] Seq=59038 Ack=1 Win=74 Len=1000 TSval=1758596321 TSecr=1886574402
  139   1.145267     10.0.0.1 → 10.0.0.2     TCP 1066 48193 → 59433 [PSH, ACK] Seq=71038 Ack=1 Win=74 Len=1000 TSval=1758596327 TSecr=1886574404
  140   1.157186     10.0.0.1 → 10.0.0.2     TCP 1066 48193 → 59433 [PSH, ACK] Seq=72038 Ack=1 Win=74 Len=1000 TSval=1758596340 TSecr=1886574419
  141   1.159447     10.0.0.1 → 10.0.0.2     TCP 6066 [TCP Previous segment not captured] 32720 → 40783 [PSH, ACK] Seq=55038 Ack=1 Win=37888 Len=6000 TSval=1758596342 TSecr=1886574427
  142   1.187954     10.0.0.1 → 10.0.0.2     TCP 8066 [TCP Previous segment not captured] 55943 → 42968 [PSH, ACK] Seq=55038 Ack=1 Win=74 Len=8000 TSval=1758596371 TSecr=1886574455
  143   1.196469     10.0.0.1 → 10.0.0.2     TCP 1066 55943 → 42968 [PSH, ACK] Seq=63038 Ack=1 Win=74 Len=1000 TSval=1758596376 TSecr=1886574457
  144   1.197664     10.0.0.1 → 10.0.0.2     TCP 9066 [TCP Previous segment not captured] 54368 → 46356 [PSH, ACK] Seq=55038 Ack=1 Win=74 Len=9000 TSval=1758596381 TSecr=1886574459
  145   1.200685     10.0.0.1 → 10.0.0.2     TCP 8066 [TCP Previous segment not captured] 53241 → 47452 [PSH, ACK] Seq=56038 Ack=1 Win=74 Len=8000 TSval=1758596384 TSecr=1886574467
  146   1.207054     10.0.0.1 → 10.0.0.2     TCP 1066 54368 → 46356 [PSH, ACK] Seq=64038 Ack=1 Win=74 Len=1000 TSval=1758596390 TSecr=1886574473
  147   1.210367     10.0.0.1 → 10.0.0.2     TCP 3066 48193 → 59433 [PSH, ACK] Seq=73038 Ack=1 Win=74 Len=3000 TSval=1758596393 TSecr=1886574478
  148   1.228374     10.0.0.1 → 10.0.0.2     TCP 9514 [TCP Previous segment not captured] 19551 → 35722 [ACK] Seq=72001 Ack=1 Win=74 Len=9448 TSval=1758596411 TSecr=1886574360
  149   1.233365     10.0.0.1 → 10.0.0.2     TCP 618 19551 → 35722 [PSH, ACK] Seq=81449 Ack=1 Win=74 Len=552 TSval=1758596415 TSecr=1886574496
  150   1.235041     10.0.0.1 → 10.0.0.2     TCP 9066 [TCP Previous segment not captured] 55246 → 6776 [PSH, ACK] Seq=57001 Ack=1 Win=74 Len=9000 TSval=1758596416 TSecr=1886574498
  151   1.242296     10.0.0.1 → 10.0.0.2     TCP 2066 54368 → 46356 [PSH, ACK] Seq=65038 Ack=1 Win=74 Len=2000 TSval=1758596424 TSecr=1886574507
  152   1.262298     10.0.0.1 → 10.0.0.2     TCP 7066 [TCP Previous segment not captured] 32720 → 40783 [PSH, ACK] Seq=62038 Ack=1 Win=37888 Len=7000 TSval=1758596445 TSecr=1886574528
  153   1.295704     10.0.0.1 → 10.0.0.2     TCP 4066 54368 → 46356 [PSH, ACK] Seq=67038 Ack=1 Win=74 Len=4000 TSval=1758596475 TSecr=1886574556
  154   1.297716     10.0.0.1 → 10.0.0.2     TCP 2066 32720 → 40783 [PSH, ACK] Seq=69038 Ack=1 Win=37888 Len=2000 TSval=1758596479 TSecr=1886574559
  155   1.304318     10.0.0.1 → 10.0.0.2     TCP 1066 54368 → 46356 [PSH, ACK] Seq=71038 Ack=1 Win=74 Len=1000 TSval=1758596487 TSecr=1886574571
  156   1.306097     10.0.0.1 → 10.0.0.2     TCP 3066 [TCP Previous segment not captured] 58169 → 25904 [PSH, ACK] Seq=69038 Ack=1 Win=74 Len=3000 TSval=1758596489 TSecr=1886574573
  157   1.318364     10.0.0.1 → 10.0.0.2     TCP 1066 58169 → 25904 [PSH, ACK] Seq=72038 Ack=1 Win=74 Len=1000 TSval=1758596501 TSecr=1886574586
  158   1.325738     10.0.0.1 → 10.0.0.2     TCP 1066 58169 → 25904 [PSH, ACK] Seq=73038 Ack=1 Win=74 Len=1000 TSval=1758596508 TSecr=1886574592
  159   1.330299     10.0.0.1 → 10.0.0.2     TCP 9066 [TCP Previous segment not captured] 55943 → 42968 [PSH, ACK] Seq=65038 Ack=1 Win=74 Len=9000 TSval=1758596513 TSecr=1886574598
  160   1.337449     10.0.0.1 → 10.0.0.2     TCP 5066 [TCP Previous segment not captured] 55246 → 6776 [PSH, ACK] Seq=69001 Ack=1 Win=74 Len=5000 TSval=1758596520 TSecr=1886574604
  161   1.339671     10.0.0.1 → 10.0.0.2     TCP 1066 55943 → 42968 [PSH, ACK] Seq=74038 Ack=1 Win=74 Len=1000 TSval=1758596523 TSecr=1886574599
  162   1.349271     10.0.0.1 → 10.0.0.2     TCP 4066 [TCP Previous segment not captured] 53241 → 47452 [PSH, ACK] Seq=71038 Ack=1 Win=74 Len=4000 TSval=1758596531 TSecr=1886574615
  163   1.360971     10.0.0.1 → 10.0.0.2     TCP 1066 55943 → 42968 [PSH, ACK] Seq=75038 Ack=1 Win=74 Len=1000 TSval=1758596544 TSecr=1886574627
  164   1.374313     10.0.0.1 → 10.0.0.2     TCP 3066 58169 → 25904 [PSH, ACK] Seq=74038 Ack=1 Win=74 Len=3000 TSval=1758596557 TSecr=1886574642
  165   1.378142     10.0.0.1 → 10.0.0.2     TCP 1066 58169 → 25904 [PSH, ACK] Seq=77038 Ack=1 Win=74 Len=1000 TSval=1758596561 TSecr=1886574643
  166   1.396096     10.0.0.1 → 10.0.0.2     TCP 5066 [TCP Previous segment not captured] 19551 → 35722 [PSH, ACK] Seq=89001 Ack=1 Win=74 Len=5000 TSval=1758596579 TSecr=1886574663
  167   1.417620     10.0.0.1 → 10.0.0.2     TCP 5066 [TCP Previous segment not captured] 55246 → 6776 [PSH, ACK] Seq=75001 Ack=1 Win=74 Len=5000 TSval=1758596600 TSecr=1886574684
  168   1.421631     10.0.0.1 → 10.0.0.2     TCP 5066 [TCP Previous segment not captured] 53241 → 47452 [PSH, ACK] Seq=76038 Ack=1 Win=74 Len=5000 TSval=1758596604 TSecr=1886574688
  169   1.424931     10.0.0.1 → 10.0.0.2     TCP 5066 [TCP Previous segment not captured] 48193 → 59433 [PSH, ACK] Seq=88038 Ack=1 Win=74 Len=5000 TSval=1758596608 TSecr=1886574692
  170   1.438297     10.0.0.1 → 10.0.0.2     TCP 3066 19551 → 35722 [PSH, ACK] Seq=94001 Ack=1 Win=74 Len=3000 TSval=1758596621 TSecr=1886574706
  171   1.442867     10.0.0.1 → 10.0.0.2     TCP 9066 [TCP Previous segment not captured] 54368 → 46356 [PSH, ACK] Seq=73038 Ack=1 Win=74 Len=9000 TSval=1758596626 TSecr=1886574710
  172   1.446657     10.0.0.1 → 10.0.0.2     TCP 1066 19551 → 35722 [PSH, ACK] Seq=97001 Ack=1 Win=74 Len=1000 TSval=1758596630 TSecr=1886574714
  173   1.507522     10.0.0.1 → 10.0.0.2     TCP 5066 [TCP Previous segment not captured] 53241 → 47452 [PSH, ACK] Seq=82038 Ack=1 Win=74 Len=5000 TSval=1758596688 TSecr=1886574766
  174   1.510182     10.0.0.1 → 10.0.0.2     TCP 5066 [TCP Previous segment not captured] 32720 → 40783 [PSH, ACK] Seq=82038 Ack=1 Win=37888 Len=5000 TSval=1758596693 TSecr=1886574766
  175   1.511691     10.0.0.1 → 10.0.0.2     TCP 5066 19551 → 35722 [PSH, ACK] Seq=98001 Ack=1 Win=74 Len=5000 TSval=1758596694 TSecr=1886574767
  176   1.513042     10.0.0.1 → 10.0.0.2     TCP 9066 [TCP Previous segment not captured] 58169 → 25904 [PSH, ACK] Seq=79038 Ack=1 Win=74 Len=9000 TSval=1758596695 TSecr=1886574778
  177   1.514056     10.0.0.1 → 10.0.0.2     TCP 1066 53241 → 47452 [PSH, ACK] Seq=87038 Ack=1 Win=74 Len=1000 TSval=1758596696 TSecr=1886574779
  178   1.520545     10.0.0.1 → 10.0.0.2     TCP 1066 32720 → 40783 [PSH, ACK] Seq=87038 Ack=1 Win=37888 Len=1000 TSval=1758596702 TSecr=1886574785
  179   1.521949     10.0.0.1 → 10.0.0.2     TCP 6066 [TCP Previous segment not captured] 48193 → 59433 [PSH, ACK] Seq=94038 Ack=1 Win=74 Len=6000 TSval=1758596704 TSecr=1886574787
  180   1.542651     10.0.0.1 → 10.0.0.2     TCP 7066 [TCP Previous segment not captured] 54368 → 46356 [PSH, ACK] Seq=83038 Ack=1 Win=74 Len=7000 TSval=1758596723 TSecr=1886574799
  181   1.543831     10.0.0.1 → 10.0.0.2     TCP 3066 [TCP Previous segment not captured] 55246 → 6776 [PSH, ACK] Seq=86001 Ack=1 Win=74 Len=3000 TSval=1758596727 TSecr=1886574806
  182   1.559020     10.0.0.1 → 10.0.0.2     TCP 2066 [TCP Previous segment not captured] 55943 → 42968 [PSH, ACK] Seq=89038 Ack=1 Win=74 Len=2000 TSval=1758596742 TSecr=1886574824
  183   1.561255     10.0.0.1 → 10.0.0.2     TCP 3066 32720 → 40783 [PSH, ACK] Seq=88038 Ack=1 Win=37888 Len=3000 TSval=1758596744 TSecr=1886574827
  184   1.562039     10.0.0.1 → 10.0.0.2     TCP 3066 48193 → 59433 [PSH, ACK] Seq=100038 Ack=1 Win=74 Len=3000 TSval=1758596745 TSecr=1886574828
  185   1.572521     10.0.0.1 → 10.0.0.2     TCP 2066 54368 → 46356 [PSH, ACK] Seq=90038 Ack=1 Win=74 Len=2000 TSval=1758596756 TSecr=1886574840
  186   1.596898     10.0.0.1 → 10.0.0.2     TCP 3066 [TCP Previous segment not captured] 53241 → 47452 [PSH, ACK] Seq=91038 Ack=1 Win=74 Len=3000 TSval=1758596780 TSecr=1886574864
  187   1.633627     10.0.0.1 → 10.0.0.2     TCP 4066 [TCP Previous segment not captured] 58169 → 25904 [PSH, ACK] Seq=93038 Ack=1 Win=74 Len=4000 TSval=1758596817 TSecr=1886574901
  188   1.690678     10.0.0.1 → 10.0.0.2     TCP 6066 [TCP Previous segment not captured] 54368 → 46356 [PSH, ACK] Seq=95038 Ack=1 Win=74 Len=6000 TSval=1758596874 TSecr=1886574958
  189   1.707260     10.0.0.1 → 10.0.0.2     TCP 4066 [TCP Previous segment not captured] 58169 → 25904 [PSH, ACK] Seq=98038 Ack=1 Win=74 Len=4000 TSval=1758596890 TSecr=1886574971
  190   1.713388     10.0.0.1 → 10.0.0.2     TCP 5066 [TCP Previous segment not captured] 55943 → 42968 [PSH, ACK] Seq=98038 Ack=1 Win=74 Len=5000 TSval=1758596896 TSecr=1886574977
  191   1.723503     10.0.0.1 → 10.0.0.2     TCP 5066 [TCP Previous segment not captured] 53241 → 47452 [PSH, ACK] Seq=98038 Ack=1 Win=74 Len=5000 TSval=1758596907 TSecr=1886574991
  192   1.725110     10.0.0.1 → 10.0.0.2     TCP 1066 53241 → 47452 [PSH, ACK] Seq=103038 Ack=1 Win=74 Len=1000 TSval=1758596908 TSecr=1886574992
  193   1.735672     10.0.0.1 → 10.0.0.2     TCP 618 [TCP Previous segment not captured] 48193 → 59433 [PSH, ACK] Seq=115486 Ack=1 Win=74 Len=552 TSval=1758596919 TSecr=1886575002
  194   1.737937     10.0.0.1 → 10.0.0.2     TCP 9514 [TCP Out-Of-Order] 48193 → 59433 [ACK] Seq=106038 Ack=1 Win=74 Len=9448 TSval=1758596921 TSecr=1886575005
  195   1.738360     10.0.0.1 → 10.0.0.2     TCP 1066 53241 → 47452 [PSH, ACK] Seq=104038 Ack=1 Win=74 Len=1000 TSval=1758596921 TSecr=1886575004
  196   1.740244     10.0.0.1 → 10.0.0.2     TCP 5066 [TCP Previous segment not captured] 55246 → 6776 [PSH, ACK] Seq=99001 Ack=1 Win=74 Len=5000 TSval=1758596923 TSecr=1886575007
  197   1.744199     10.0.0.1 → 10.0.0.2     TCP 1066 48193 → 59433 [PSH, ACK] Seq=116038 Ack=1 Win=74 Len=1000 TSval=1758596927 TSecr=1886575007
  198   1.754464     10.0.0.1 → 10.0.0.2     TCP 2618 [TCP Previous segment not captured] 32720 → 40783 [PSH, ACK] Seq=103486 Ack=1 Win=37888 Len=2552 TSval=1758596937 TSecr=1886575022
  199   1.759473     10.0.0.1 → 10.0.0.2     TCP 1066 55246 → 6776 [PSH, ACK] Seq=104001 Ack=1 Win=74 Len=1000 TSval=1758596942 TSecr=1886575027
  200   1.771910     10.0.0.1 → 10.0.0.2     TCP 9514 [TCP Out-Of-Order] 32720 → 40783 [ACK] Seq=94038 Ack=1 Win=37888 Len=9448 TSval=1758596955 TSecr=1886575039
  201   1.881508     10.0.0.1 → 10.0.0.2     TCP 9066 [TCP Previous segment not captured] 19551 → 35722 [PSH, ACK] Seq=122001 Ack=1 Win=74 Len=9000 TSval=1758597065 TSecr=1886575149
  202   1.905589     10.0.0.1 → 10.0.0.2     TCP 1618 [TCP Previous segment not captured] 48193 → 59433 [PSH, ACK] Seq=127486 Ack=1 Win=74 Len=1552 TSval=1758597089 TSecr=1886575173
  203   1.909660     10.0.0.1 → 10.0.0.2     TCP 618 [TCP Previous segment not captured] 55246 → 6776 [PSH, ACK] Seq=116449 Ack=1 Win=74 Len=552 TSval=1758597093 TSecr=1886575177
  204   1.911192     10.0.0.1 → 10.0.0.2     TCP 9514 [TCP Previous segment not captured] 32720 → 40783 [ACK] Seq=108038 Ack=1 Win=37888 Len=9448 TSval=1758597094 TSecr=1886575068
  205   1.911721     10.0.0.1 → 10.0.0.2     TCP 9514 [TCP Out-Of-Order] 55246 → 6776 [ACK] Seq=107001 Ack=1 Win=74 Len=9448 TSval=1758597094 TSecr=1886575179
  206   1.912778     10.0.0.1 → 10.0.0.2     TCP 9514 [TCP Previous segment not captured] 54368 → 46356 [ACK] Seq=108038 Ack=1 Win=74 Len=9448 TSval=1758597096 TSecr=1886575060
  207   1.913362     10.0.0.1 → 10.0.0.2     TCP 2066 [TCP Out-Of-Order] 32720 → 40783 [PSH, ACK] Seq=106038 Ack=1 Win=37888 Len=2000 TSval=1758597096 TSecr=1886575180
  208   1.917999     10.0.0.1 → 10.0.0.2     TCP 618 32720 → 40783 [PSH, ACK] Seq=117486 Ack=1 Win=37888 Len=552 TSval=1758597101 TSecr=1886575185
  209   1.925385     10.0.0.1 → 10.0.0.2     TCP 9514 [TCP Previous segment not captured] 53241 → 47452 [ACK] Seq=109038 Ack=1 Win=74 Len=9448 TSval=1758597108 TSecr=1886575066
  210   1.925811     10.0.0.1 → 10.0.0.2     TCP 9514 [TCP Previous segment not captured] 58169 → 25904 [ACK] Seq=109038 Ack=1 Win=74 Len=9448 TSval=1758597108 TSecr=1886575064
  211   1.926903     10.0.0.1 → 10.0.0.2     TCP 618 54368 → 46356 [PSH, ACK] Seq=117486 Ack=1 Win=74 Len=552 TSval=1758597109 TSecr=1886575194
  212   1.939770     10.0.0.1 → 10.0.0.2     TCP 2066 55246 → 6776 [PSH, ACK] Seq=117001 Ack=1 Win=74 Len=2000 TSval=1758597123 TSecr=1886575206
  213   1.976885     10.0.0.1 → 10.0.0.2     TCP 4066 32720 → 40783 [PSH, ACK] Seq=118038 Ack=1 Win=37888 Len=4000 TSval=1758597160 TSecr=1886575244
  214   1.991464     10.0.0.1 → 10.0.0.2     TCP 1618 [TCP Previous segment not captured] 55943 → 42968 [PSH, ACK] Seq=121486 Ack=1 Win=74 Len=1552 TSval=1758597175 TSecr=1886575258
  215   2.017305     10.0.0.1 → 10.0.0.2     TCP 6066 55246 → 6776 [PSH, ACK] Seq=119001 Ack=1 Win=74 Len=6000 TSval=1758597200 TSecr=1886575285
  216   2.023170     10.0.0.1 → 10.0.0.2     TCP 8066 48193 → 59433 [PSH, ACK] Seq=129038 Ack=1 Win=74 Len=8000 TSval=1758597206 TSecr=1886575291
  217   2.028163     10.0.0.1 → 10.0.0.2     TCP 9514 [TCP Previous segment not captured] 19551 → 35722 [ACK] Seq=132001 Ack=1 Win=74 Len=9448 TSval=1758597211 TSecr=1886575151
  218   2.032355     10.0.0.1 → 10.0.0.2     TCP 1066 55246 → 6776 [PSH, ACK] Seq=125001 Ack=1 Win=74 Len=1000 TSval=1758597215 TSecr=1886575300
  219   2.044521     10.0.0.1 → 10.0.0.2     TCP 2066 48193 → 59433 [PSH, ACK] Seq=137038 Ack=1 Win=74 Len=2000 TSval=1758597228 TSecr=1886575312
  220   2.063268     10.0.0.1 → 10.0.0.2     TCP 1066 [TCP Retransmission] 19551 → 35722 [PSH, ACK] Seq=131001 Ack=1 Win=74 Len=1000 TSval=1758597246 TSecr=1886575328
  221   2.065599     10.0.0.1 → 10.0.0.2     TCP 9066 [TCP Previous segment not captured] 58169 → 25904 [PSH, ACK] Seq=120038 Ack=1 Win=74 Len=9000 TSval=1758597249 TSecr=1886575218
  222   2.148198     10.0.0.1 → 10.0.0.2     TCP 9514 55943 → 42968 [ACK] Seq=123038 Ack=1 Win=74 Len=9448 TSval=1758597331 TSecr=1886575416
  223   2.151168     10.0.0.1 → 10.0.0.2     TCP 9514 [TCP Previous segment not captured] 32720 → 40783 [ACK] Seq=126038 Ack=1 Win=37888 Len=9448 TSval=1758597334 TSecr=1886575288
  224   2.165753     10.0.0.1 → 10.0.0.2     TCP 4066 [TCP Out-Of-Order] 32720 → 40783 [PSH, ACK] Seq=122038 Ack=1 Win=37888 Len=4000 TSval=1758597349 TSecr=1886575433
  225   2.184805     10.0.0.1 → 10.0.0.2     TCP 2618 32720 → 40783 [PSH, ACK] Seq=135486 Ack=1 Win=37888 Len=2552 TSval=1758597368 TSecr=1886575452
  226   2.186133     10.0.0.1 → 10.0.0.2     TCP 6618 [TCP Previous segment not captured] 53241 → 47452 [PSH, ACK] Seq=131486 Ack=1 Win=74 Len=6552 TSval=1758597369 TSecr=1886575453
  227   2.188138     10.0.0.1 → 10.0.0.2     TCP 9514 [TCP Previous segment not captured] 19551 → 35722 [ACK] Seq=144001 Ack=1 Win=74 Len=9448 TSval=1758597371 TSecr=1886575353
  228   2.198200     10.0.0.1 → 10.0.0.2     TCP 9514 [TCP Retransmission] 53241 → 47452 [ACK] Seq=122038 Ack=1 Win=74 Len=9448 TSval=1758597381 TSecr=1886575465
  229   2.200702     10.0.0.1 → 10.0.0.2     TCP 9514 [TCP Previous segment not captured] 55246 → 6776 [ACK] Seq=129001 Ack=1 Win=74 Len=9448 TSval=1758597384 TSecr=1886575371
  230   2.201046     10.0.0.1 → 10.0.0.2     TCP 4618 [TCP Previous segment not captured] 54368 → 46356 [PSH, ACK] Seq=134486 Ack=1 Win=74 Len=4552 TSval=1758597384 TSecr=1886575468
  231   2.211408     10.0.0.1 → 10.0.0.2     TCP 9514 [TCP Previous segment not captured] 48193 → 59433 [ACK] Seq=142038 Ack=1 Win=74 Len=9448 TSval=1758597394 TSecr=1886575349
  232   2.211753     10.0.0.1 → 10.0.0.2     TCP 2618 [TCP Retransmission] 19551 → 35722 [PSH, ACK] Seq=141449 Ack=1 Win=74 Len=2552 TSval=1758597394 TSecr=1886575479
  233   2.268668     10.0.0.1 → 10.0.0.2     TCP 9514 [TCP Retransmission] 54368 → 46356 [ACK] Seq=125038 Ack=1 Win=74 Len=9448 TSval=1758597452 TSecr=1886575536
  234   2.271170     10.0.0.1 → 10.0.0.2     TCP 9514 [TCP Previous segment not captured] 58169 → 25904 [ACK] Seq=135038 Ack=1 Win=74 Len=9448 TSval=1758597454 TSecr=1886575409
  235   2.272730     10.0.0.1 → 10.0.0.2     TCP 9514 [TCP Previous segment not captured] 55943 → 42968 [ACK] Seq=135038 Ack=1 Win=74 Len=9448 TSval=1758597456 TSecr=1886575513
  236   2.277911     10.0.0.1 → 10.0.0.2     TCP 3066 [TCP Retransmission] 48193 → 59433 [PSH, ACK] Seq=139038 Ack=1 Win=74 Len=3000 TSval=1758597461 TSecr=1886575545
  237   2.283423     10.0.0.1 → 10.0.0.2     TCP 7618 19551 → 35722 [PSH, ACK] Seq=153449 Ack=1 Win=74 Len=7552 TSval=1758597466 TSecr=1886575551
  238   2.302281     10.0.0.1 → 10.0.0.2     TCP 8066 54368 → 46356 [PSH, ACK] Seq=139038 Ack=1 Win=74 Len=8000 TSval=1758597485 TSecr=1886575569
  239   2.306321     10.0.0.1 → 10.0.0.2     TCP 7618 48193 → 59433 [PSH, ACK] Seq=151486 Ack=1 Win=74 Len=7552 TSval=1758597489 TSecr=1886575573
  240   2.321338     10.0.0.1 → 10.0.0.2     TCP 6066 [TCP Retransmission] 58169 → 25904 [PSH, ACK] Seq=129038 Ack=1 Win=74 Len=6000 TSval=1758597504 TSecr=1886575588
  241   2.325224     10.0.0.1 → 10.0.0.2     TCP 9514 [TCP Previous segment not captured] 32720 → 40783 [ACK] Seq=139038 Ack=1 Win=37888 Len=9448 TSval=1758597508 TSecr=1886575496
  242   2.351239     10.0.0.1 → 10.0.0.2     TCP 9514 [TCP Previous segment not captured] 53241 → 47452 [ACK] Seq=141038 Ack=1 Win=74 Len=9448 TSval=1758597534 TSecr=1886575592
  243   2.365668     10.0.0.1 → 10.0.0.2     TCP 6066 19551 → 35722 [PSH, ACK] Seq=161001 Ack=1 Win=74 Len=6000 TSval=1758597549 TSecr=1886575633
  244   2.401843     10.0.0.1 → 10.0.0.2     TCP 170 [TCP Previous segment not captured] 58169 → 25904 [PSH, ACK] Seq=153934 Ack=1 Win=74 Len=104 TSval=1758597584 TSecr=1886575668
  245   2.413740     10.0.0.1 → 10.0.0.2     TCP 6618 32720 → 40783 [PSH, ACK] Seq=148486 Ack=1 Win=37888 Len=6552 TSval=1758597597 TSecr=1886575496
  246   2.414729     10.0.0.1 → 10.0.0.2     TCP 9514 [TCP Previous segment not captured] 55246 → 6776 [ACK] Seq=145001 Ack=1 Win=74 Len=9448 TSval=1758597598 TSecr=1886575561
  247   2.424859     10.0.0.1 → 10.0.0.2     TCP 1066 [TCP Out-Of-Order] 32720 → 40783 [PSH, ACK] Seq=138038 Ack=1 Win=37888 Len=1000 TSval=1758597608 TSecr=1886575691
  248   2.427211     10.0.0.1 → 10.0.0.2     TCP 2170 [TCP Previous segment not captured] 55943 → 42968 [PSH, ACK] Seq=153934 Ack=1 Win=74 Len=2104 TSval=1758597610 TSecr=1886575693
  249   2.440351     10.0.0.1 → 10.0.0.2     TCP 6618 53241 → 47452 [PSH, ACK] Seq=150486 Ack=1 Win=74 Len=6552 TSval=1758597623 TSecr=1886575707
  250   2.481614     10.0.0.1 → 10.0.0.2     TCP 9514 [TCP Retransmission] 58169 → 25904 [ACK] Seq=144486 Ack=1 Win=74 Len=9448 TSval=1758597665 TSecr=1886575742
