    1   0.000000     10.0.0.2 → 10.0.0.1     TCP 74 35722 → 42763 [SYN, ACK] Seq=0 Ack=1 Win=37792 Len=0 MSS=9460 SACK_PERM TSval=1886573260 TSecr=1758595171 WS=512
    2   0.004782     10.0.0.2 → 10.0.0.1     TCP 74 59433 → 36467 [SYN, ACK] Seq=0 Ack=1 Win=37792 Len=0 MSS=9460 SACK_PERM TSval=1886573266 TSecr=1758595179 WS=512
    3   0.004955     10.0.0.2 → 10.0.0.1     TCP 66 35722 → 42763 [ACK] Seq=1 Ack=38 Win=37888 Len=0 TSval=1886573266 TSecr=1758595179
    4   0.008134     10.0.0.2 → 10.0.0.1     TCP 67 35722 → 42763 [PSH, ACK] Seq=1 Ack=38 Win=37888 Len=1 TSval=1886573267 TSecr=1758595179
    5   0.008314     10.0.0.2 → 10.0.0.1     TCP 66 59433 → 36467 [ACK] Seq=1 Ack=38 Win=37888 Len=0 TSval=1886573270 TSecr=1758595183
    6   0.008454     10.0.0.2 → 10.0.0.1     TCP 67 59433 → 36467 [PSH, ACK] Seq=1 Ack=38 Win=37888 Len=1 TSval=1886573270 TSecr=1758595183
    7   0.020954     10.0.0.2 → 10.0.0.1     TCP 74 47452 → 39475 [SYN, ACK] Seq=0 Ack=1 Win=37792 Len=0 MSS=9460 SACK_PERM TSval=1886573281 TSecr=1758595195 WS=512
    8   0.029264     10.0.0.2 → 10.0.0.1     TCP 74 25904 → 51099 [SYN, ACK] Seq=0 Ack=1 Win=37792 Len=0 MSS=9460 SACK_PERM TSval=1886573285 TSecr=1758595198 WS=512
    9   0.029297     10.0.0.2 → 10.0.0.1     TCP 74 40783 → 58271 [SYN, ACK] Seq=0 Ack=1 Win=37792 Len=0 MSS=9460 SACK_PERM TSval=1886573285 TSecr=1758595198 WS=512
   10   0.033464     10.0.0.2 → 10.0.0.1     TCP 74 6776 → 55655 [SYN, ACK] Seq=0 Ack=1 Win=37792 Len=0 MSS=9460 SACK_PERM TSval=1886573293 TSecr=1758595202 WS=512
   11   0.033649     10.0.0.2 → 10.0.0.1     TCP 66 47452 → 39475 [ACK] Seq=1 Ack=38 Win=37888 Len=0 TSval=1886573293 TSecr=1758595203
   12   0.033803     10.0.0.2 → 10.0.0.1     TCP 67 47452 → 39475 [PSH, ACK] Seq=1 Ack=38 Win=37888 Len=1 TSval=1886573293 TSecr=1758595203
   13   0.038521     10.0.0.2 → 10.0.0.1     TCP 74 46356 → 47085 [SYN, ACK] Seq=0 Ack=1 Win=37792 Len=0 MSS=9460 SACK_PERM TSval=1886573296 TSecr=1758595206 WS=512
   14   0.038840     10.0.0.2 → 10.0.0.1     TCP 66 40783 → 58271 [ACK] Seq=1 Ack=38 Win=37888 Len=0 TSval=1886573298 TSecr=1758595208
   15   0.038981     10.0.0.2 → 10.0.0.1     TCP 67 40783 → 58271 [PSH, ACK] Seq=1 Ack=38 Win=37888 Len=1 TSval=1886573298 TSecr=1758595208
   16   0.039164     10.0.0.2 → 10.0.0.1     TCP 74 42968 → 49189 [SYN, ACK] Seq=0 Ack=1 Win=37792 Len=0 MSS=9460 SACK_PERM TSval=1886573298 TSecr=1758595206 WS=512
   17   0.041725     10.0.0.2 → 10.0.0.1     TCP 66 [TCP Dup ACK 14#1] 40783 → 58271 [ACK] Seq=2 Ack=38 Win=37888 Len=0 TSval=1886573298 TSecr=1758595208
   18   0.044863     10.0.0.2 → 10.0.0.1     TCP 66 25904 → 51099 [ACK] Seq=1 Ack=38 Win=37888 Len=0 TSval=1886573298 TSecr=1758595208
   19   0.045008     10.0.0.2 → 10.0.0.1     TCP 67 25904 → 51099 [PSH, ACK] Seq=1 Ack=38 Win=37888 Len=1 TSval=1886573299 TSecr=1758595208
   20   0.045171     10.0.0.2 → 10.0.0.1     TCP 66 6776 → 55655 [ACK] Seq=1 Ack=38 Win=37888 Len=0 TSval=1886573304 TSecr=1758595212
   21   0.045307     10.0.0.2 → 10.0.0.1     TCP 67 6776 → 55655 [PSH, ACK] Seq=1 Ack=38 Win=37888 Len=1 TSval=1886573304 TSecr=1758595212
   22   0.049228     10.0.0.2 → 10.0.0.1     TCP 66 42968 → 49189 [ACK] Seq=1 Ack=38 Win=37888 Len=0 TSval=1886573308 TSecr=1758595217
   23   0.049375     10.0.0.2 → 10.0.0.1     TCP 67 42968 → 49189 [PSH, ACK] Seq=1 Ack=38 Win=37888 Len=1 TSval=1886573308 TSecr=1758595217
   24   0.049721     10.0.0.2 → 10.0.0.1     TCP 66 46356 → 47085 [ACK] Seq=1 Ack=38 Win=37888 Len=0 TSval=1886573309 TSecr=1758595217
   25   0.049863     10.0.0.2 → 10.0.0.1     TCP 67 46356 → 47085 [PSH, ACK] Seq=1 Ack=38 Win=37888 Len=1 TSval=1886573309 TSecr=1758595217
   26   0.052516     10.0.0.2 → 10.0.0.1     TCP 66 35722 → 42763 [ACK] Seq=2 Ack=42 Win=37888 Len=0 TSval=1886573314 TSecr=1758595186
   27   0.054496     10.0.0.2 → 10.0.0.1     TCP 66 35722 → 42763 [ACK] Seq=2 Ack=159 Win=37888 Len=0 TSval=1886573316 TSecr=1758595230
   28   0.054759     10.0.0.2 → 10.0.0.1     TCP 67 35722 → 42763 [PSH, ACK] Seq=2 Ack=159 Win=37888 Len=1 TSval=1886573316 TSecr=1758595230
   29   0.055680     10.0.0.2 → 10.0.0.1     TCP 66 59433 → 36467 [ACK] Seq=2 Ack=42 Win=37888 Len=0 TSval=1886573318 TSecr=1758595186
   30   0.057104     10.0.0.2 → 10.0.0.1     TCP 74 35722 → 19551 [SYN, ACK] Seq=0 Ack=1 Win=37792 Len=0 MSS=9460 SACK_PERM TSval=1886573319 TSecr=1758595233 WS=512
   31   0.065159     10.0.0.2 → 10.0.0.1     TCP 66 59433 → 36467 [ACK] Seq=2 Ack=159 Win=37888 Len=0 TSval=1886573320 TSecr=1758595234
   32   0.065318     10.0.0.2 → 10.0.0.1     TCP 67 59433 → 36467 [PSH, ACK] Seq=2 Ack=159 Win=37888 Len=1 TSval=1886573320 TSecr=1758595234
   33   0.066481     10.0.0.2 → 10.0.0.1     TCP 66 35722 → 19551 [ACK] Seq=1 Ack=38 Win=37888 Len=0 TSval=1886573328 TSecr=1758595235
   34   0.070763     10.0.0.2 → 10.0.0.1     TCP 74 59433 → 48193 [SYN, ACK] Seq=0 Ack=1 Win=37792 Len=0 MSS=9460 SACK_PERM TSval=1886573330 TSecr=1758595243 WS=512
   35   0.131454     10.0.0.2 → 10.0.0.1     TCP 66 47452 → 39475 [ACK] Seq=2 Ack=42 Win=37888 Len=0 TSval=1886573358 TSecr=1758595212
   36   0.134092     10.0.0.2 → 10.0.0.1     TCP 66 6776 → 55655 [ACK] Seq=2 Ack=42 Win=37888 Len=0 TSval=1886573358 TSecr=1758595223
   37   0.134290     10.0.0.2 → 10.0.0.1     TCP 66 25904 → 51099 [ACK] Seq=2 Ack=42 Win=37888 Len=0 TSval=1886573358 TSecr=1758595223
   38   0.134687     10.0.0.2 → 10.0.0.1     TCP 66 46356 → 47085 [ACK] Seq=2 Ack=42 Win=37888 Len=0 TSval=1886573358 TSecr=1758595228
   39   0.135611     10.0.0.2 → 10.0.0.1     TCP 66 40783 → 58271 [ACK] Seq=2 Ack=42 Win=37888 Len=0 TSval=1886573358 TSecr=1758595217
   40   0.138719     10.0.0.2 → 10.0.0.1     TCP 66 42968 → 49189 [ACK] Seq=2 Ack=42 Win=37888 Len=0 TSval=1886573358 TSecr=1758595227
   41   0.138940     10.0.0.2 → 10.0.0.1     TCP 66 59433 → 48193 [ACK] Seq=1 Ack=38 Win=37888 Len=0 TSval=1886573393 TSecr=1758595249
   42   0.139139     10.0.0.2 → 10.0.0.1     TCP 68 35722 → 42763 [PSH, ACK] Seq=3 Ack=159 Win=37888 Len=2 TSval=1886573394 TSecr=1758595277
   43   0.171361     10.0.0.2 → 10.0.0.1     TCP 66 47452 → 39475 [ACK] Seq=2 Ack=159 Win=37888 Len=0 TSval=1886573399 TSecr=1758595309
   44   0.172240     10.0.0.2 → 10.0.0.1     TCP 66 [TCP Dup ACK 41#1] 59433 → 48193 [ACK] Seq=1 Ack=38 Win=37888 Len=0 TSval=1886573395 TSecr=1758595249
   45   0.200584     10.0.0.2 → 10.0.0.1     TCP 67 47452 → 39475 [PSH, ACK] Seq=2 Ack=159 Win=37888 Len=1 TSval=1886573399 TSecr=1758595309
   46   0.201574     10.0.0.2 → 10.0.0.1     TCP 68 59433 → 36467 [PSH, ACK] Seq=3 Ack=159 Win=37888 Len=2 TSval=1886573399 TSecr=1758595285
   47   0.201812     10.0.0.2 → 10.0.0.1     TCP 67 6776 → 55655 [PSH, ACK] Seq=2 Ack=159 Win=37888 Len=1 TSval=1886573409 TSecr=1758595312
   48   0.202074     10.0.0.2 → 10.0.0.1     TCP 66 [TCP Keep-Alive] 6776 → 55655 [ACK] Seq=2 Ack=159 Win=37888 Len=0 TSval=1886573409 TSecr=1758595312
   49   0.202343     10.0.0.2 → 10.0.0.1     TCP 66 25904 → 51099 [ACK] Seq=2 Ack=159 Win=37888 Len=0 TSval=1886573413 TSecr=1758595312
   50   0.202561     10.0.0.2 → 10.0.0.1     TCP 67 25904 → 51099 [PSH, ACK] Seq=2 Ack=159 Win=37888 Len=1 TSval=1886573413 TSecr=1758595312
   51   0.202972     10.0.0.2 → 10.0.0.1     TCP 66 46356 → 47085 [ACK] Seq=2 Ack=159 Win=37888 Len=0 TSval=1886573415 TSecr=1758595313
   52   0.203134     10.0.0.2 → 10.0.0.1     TCP 67 46356 → 47085 [PSH, ACK] Seq=2 Ack=159 Win=37888 Len=1 TSval=1886573415 TSecr=1758595313
   53   0.203545     10.0.0.2 → 10.0.0.1     TCP 66 40783 → 58271 [ACK] Seq=2 Ack=159 Win=37888 Len=0 TSval=1886573422 TSecr=1758595314
   54   0.203696     10.0.0.2 → 10.0.0.1     TCP 67 40783 → 58271 [PSH, ACK] Seq=2 Ack=159 Win=37888 Len=1 TSval=1886573423 TSecr=1758595314
   55   0.203894     10.0.0.2 → 10.0.0.1     TCP 67 42968 → 49189 [PSH, ACK] Seq=2 Ack=159 Win=37888 Len=1 TSval=1886573438 TSecr=1758595317
   56   0.204104     10.0.0.2 → 10.0.0.1     TCP 66 [TCP Keep-Alive] 42968 → 49189 [ACK] Seq=2 Ack=159 Win=37888 Len=0 TSval=1886573437 TSecr=1758595317
   57   0.207501     10.0.0.2 → 10.0.0.1     TCP 66 35722 → 19551 [ACK] Seq=1 Ack=1038 Win=37376 Len=0 TSval=1886573464 TSecr=1758595317
   58   0.221046     10.0.0.2 → 10.0.0.1     TCP 74 47452 → 53241 [SYN, ACK] Seq=0 Ack=1 Win=37792 Len=0 MSS=9460 SACK_PERM TSval=1886573468 TSecr=1758595379 WS=512
   59   0.221659     10.0.0.2 → 10.0.0.1     TCP 74 6776 → 55246 [SYN, ACK] Seq=0 Ack=1 Win=37792 Len=0 MSS=9460 SACK_PERM TSval=1886573470 TSecr=1758595380 WS=512
   60   0.231132     10.0.0.2 → 10.0.0.1     TCP 66 59433 → 48193 [ACK] Seq=1 Ack=1038 Win=37376 Len=0 TSval=1886573471 TSecr=1758595380
   61   0.231670     10.0.0.2 → 10.0.0.1     TCP 74 25904 → 58169 [SYN, ACK] Seq=0 Ack=1 Win=37792 Len=0 MSS=9460 SACK_PERM TSval=1886573472 TSecr=1758595381 WS=512
   62   0.231902     10.0.0.2 → 10.0.0.1     TCP 74 46356 → 54368 [SYN, ACK] Seq=0 Ack=1 Win=37792 Len=0 MSS=9460 SACK_PERM TSval=1886573473 TSecr=1758595381 WS=512
   63   0.238872     10.0.0.2 → 10.0.0.1     TCP 74 40783 → 32720 [SYN, ACK] Seq=0 Ack=1 Win=37792 Len=0 MSS=9460 SACK_PERM TSval=1886573482 TSecr=1758595382 WS=512
   64   0.239404     10.0.0.2 → 10.0.0.1     TCP 74 42968 → 55943 [SYN, ACK] Seq=0 Ack=1 Win=37792 Len=0 MSS=9460 SACK_PERM TSval=1886573483 TSecr=1758595382 WS=512
   65   0.258437     10.0.0.2 → 10.0.0.1     TCP 66 35722 → 19551 [ACK] Seq=1 Ack=6038 Win=34304 Len=0 TSval=1886573491 TSecr=1758595385
   66   0.352078     10.0.0.2 → 10.0.0.1     TCP 66 47452 → 53241 [ACK] Seq=1 Ack=38 Win=37888 Len=0 TSval=1886573520 TSecr=1758595399
   67   0.353216     10.0.0.2 → 10.0.0.1     TCP 66 6776 → 55246 [ACK] Seq=1 Ack=38 Win=37888 Len=0 TSval=1886573523 TSecr=1758595400
   68   0.353922     10.0.0.2 → 10.0.0.1     TCP 66 59433 → 48193 [ACK] Seq=1 Ack=3038 Win=35840 Len=0 TSval=1886573539 TSecr=1758595409
   69   0.354126     10.0.0.2 → 10.0.0.1     TCP 66 25904 → 58169 [ACK] Seq=1 Ack=38 Win=37888 Len=0 TSval=1886573575 TSecr=1758595410
   70   0.354271     10.0.0.2 → 10.0.0.1     TCP 66 46356 → 54368 [ACK] Seq=1 Ack=38 Win=37888 Len=0 TSval=1886573587 TSecr=1758595410
   71   0.354415     10.0.0.2 → 10.0.0.1     TCP 66 40783 → 32720 [ACK] Seq=1 Ack=38 Win=37888 Len=0 TSval=1886573592 TSecr=1758595417
   72   0.354558     10.0.0.2 → 10.0.0.1     TCP 66 42968 → 55943 [ACK] Seq=1 Ack=38 Win=37888 Len=0 TSval=1886573599 TSecr=1758595417
   73   0.354709     10.0.0.2 → 10.0.0.1     TCP 68 25904 → 51099 [PSH, ACK] Seq=3 Ack=159 Win=37888 Len=2 TSval=1886573601 TSecr=1758595421
   74   0.354864     10.0.0.2 → 10.0.0.1     TCP 68 6776 → 55655 [PSH, ACK] Seq=3 Ack=159 Win=37888 Len=2 TSval=1886573602 TSecr=1758595421
   75   0.355018     10.0.0.2 → 10.0.0.1     TCP 68 47452 → 39475 [PSH, ACK] Seq=3 Ack=159 Win=37888 Len=2 TSval=1886573603 TSecr=1758595421
   76   0.355183     10.0.0.2 → 10.0.0.1     TCP 68 42968 → 49189 [PSH, ACK] Seq=3 Ack=159 Win=37888 Len=2 TSval=1886573610 TSecr=1758595425
   77   0.355335     10.0.0.2 → 10.0.0.1     TCP 68 40783 → 58271 [PSH, ACK] Seq=3 Ack=159 Win=37888 Len=2 TSval=1886573614 TSecr=1758595425
   78   0.355486     10.0.0.2 → 10.0.0.1     TCP 68 46356 → 47085 [PSH, ACK] Seq=3 Ack=159 Win=37888 Len=2 TSval=1886573615 TSecr=1758595425
   79   0.355957     10.0.0.2 → 10.0.0.1     TCP 66 35722 → 19551 [ACK] Seq=1 Ack=9038 Win=34304 Len=0 TSval=1886573616 TSecr=1758595436
   80   0.366326     10.0.0.2 → 10.0.0.1     TCP 66 59433 → 48193 [ACK] Seq=1 Ack=12038 Win=34304 Len=0 TSval=1886573619 TSecr=1758595532
   81   0.370735     10.0.0.2 → 10.0.0.1     TCP 66 35722 → 19551 [ACK] Seq=1 Ack=17038 Win=34304 Len=0 TSval=1886573629 TSecr=1758595534
   82   0.378425     10.0.0.2 → 10.0.0.1     TCP 66 47452 → 53241 [ACK] Seq=1 Ack=1038 Win=37376 Len=0 TSval=1886573640 TSecr=1758595534
   83   0.379794     10.0.0.2 → 10.0.0.1     TCP 66 42968 → 55943 [ACK] Seq=1 Ack=1038 Win=37376 Len=0 TSval=1886573641 TSecr=1758595536
   84   0.381038     10.0.0.2 → 10.0.0.1     TCP 66 6776 → 55246 [ACK] Seq=1 Ack=1038 Win=37376 Len=0 TSval=1886573643 TSecr=1758595543
   85   0.382293     10.0.0.2 → 10.0.0.1     TCP 66 59433 → 48193 [ACK] Seq=1 Ack=13038 Win=34304 Len=0 TSval=1886573645 TSecr=1758595544
   86   0.384541     10.0.0.2 → 10.0.0.1     TCP 66 35722 → 19551 [ACK] Seq=1 Ack=18038 Win=34304 Len=0 TSval=1886573647 TSecr=1758595549
   87   0.386568     10.0.0.2 → 10.0.0.1     TCP 66 47452 → 53241 [ACK] Seq=1 Ack=2038 Win=36864 Len=0 TSval=1886573649 TSecr=1758595556
   88   0.388699     10.0.0.2 → 10.0.0.1     TCP 66 6776 → 55246 [ACK] Seq=1 Ack=2038 Win=36864 Len=0 TSval=1886573651 TSecr=1758595559
   89   0.392430     10.0.0.2 → 10.0.0.1     TCP 66 25904 → 58169 [ACK] Seq=1 Ack=1038 Win=37376 Len=0 TSval=1886573655 TSecr=1758595534
   90   0.394201     10.0.0.2 → 10.0.0.1     TCP 66 25904 → 58169 [ACK] Seq=1 Ack=3038 Win=35840 Len=0 TSval=1886573656 TSecr=1758595570
   91   0.397639     10.0.0.2 → 10.0.0.1     TCP 66 40783 → 32720 [ACK] Seq=1 Ack=1038 Win=37376 Len=0 TSval=1886573659 TSecr=1758595534
   92   0.399473     10.0.0.2 → 10.0.0.1     TCP 66 25904 → 58169 [ACK] Seq=1 Ack=4038 Win=35328 Len=0 TSval=1886573661 TSecr=1758595574
   93   0.400947     10.0.0.2 → 10.0.0.1     TCP 66 46356 → 54368 [ACK] Seq=1 Ack=1038 Win=37376 Len=0 TSval=1886573663 TSecr=1758595536
   94   0.405349     10.0.0.2 → 10.0.0.1     TCP 66 42968 → 55943 [ACK] Seq=1 Ack=2038 Win=36864 Len=0 TSval=1886573667 TSecr=1758595558
   95   0.409494     10.0.0.2 → 10.0.0.1     TCP 66 59433 → 48193 [ACK] Seq=1 Ack=14038 Win=34304 Len=0 TSval=1886573672 TSecr=1758595560
   96   0.411964     10.0.0.2 → 10.0.0.1     TCP 66 59433 → 48193 [ACK] Seq=1 Ack=16038 Win=34304 Len=0 TSval=1886573673 TSecr=1758595587
   97   0.413793     10.0.0.2 → 10.0.0.1     TCP 66 35722 → 19551 [ACK] Seq=1 Ack=19038 Win=34304 Len=0 TSval=1886573676 TSecr=1758595562
   98   0.419027     10.0.0.2 → 10.0.0.1     TCP 66 59433 → 48193 [ACK] Seq=1 Ack=17038 Win=34304 Len=0 TSval=1886573681 TSecr=1758595594
   99   0.420029     10.0.0.2 → 10.0.0.1     TCP 66 47452 → 53241 [ACK] Seq=1 Ack=3038 Win=36352 Len=0 TSval=1886573681 TSecr=1758595564
  100   0.422489     10.0.0.2 → 10.0.0.1     TCP 66 47452 → 53241 [ACK] Seq=1 Ack=5038 Win=34816 Len=0 TSval=1886573684 TSecr=1758595598
  101   0.422864     10.0.0.2 → 10.0.0.1     TCP 66 6776 → 55246 [ACK] Seq=1 Ack=3038 Win=36352 Len=0 TSval=1886573685 TSecr=1758595571
  102   0.425991     10.0.0.2 → 10.0.0.1     TCP 66 6776 → 55246 [ACK] Seq=1 Ack=5038 Win=34816 Len=0 TSval=1886573687 TSecr=1758595601
  103   0.427756     10.0.0.2 → 10.0.0.1     TCP 66 40783 → 32720 [ACK] Seq=1 Ack=4038 Win=34816 Len=0 TSval=1886573690 TSecr=1758595576
  104   0.434060     10.0.0.2 → 10.0.0.1     TCP 66 6776 → 55246 [ACK] Seq=1 Ack=6038 Win=34304 Len=0 TSval=1886573696 TSecr=1758595611
  105   0.438866     10.0.0.2 → 10.0.0.1     TCP 66 46356 → 54368 [ACK] Seq=1 Ack=4038 Win=34816 Len=0 TSval=1886573701 TSecr=1758595579
  106   0.440438     10.0.0.2 → 10.0.0.1     TCP 66 46356 → 54368 [ACK] Seq=1 Ack=7038 Win=34304 Len=0 TSval=1886573703 TSecr=1758595617
  107   0.451159     10.0.0.2 → 10.0.0.1     TCP 66 42968 → 55943 [ACK] Seq=1 Ack=4038 Win=35328 Len=0 TSval=1886573713 TSecr=1758595583
  108   0.459608     10.0.0.2 → 10.0.0.1     TCP 66 25904 → 58169 [ACK] Seq=1 Ack=5038 Win=34816 Len=0 TSval=1886573722 TSecr=1758595588
  109   0.463699     10.0.0.2 → 10.0.0.1     TCP 66 35722 → 19551 [ACK] Seq=1 Ack=21038 Win=34304 Len=0 TSval=1886573726 TSecr=1758595592
  110   0.465349     10.0.0.2 → 10.0.0.1     TCP 66 35722 → 19551 [ACK] Seq=1 Ack=25038 Win=34304 Len=0 TSval=1886573728 TSecr=1758595642
  111   0.471868     10.0.0.2 → 10.0.0.1     TCP 66 47452 → 53241 [ACK] Seq=1 Ack=6038 Win=34304 Len=0 TSval=1886573734 TSecr=1758595601
  112   0.473355     10.0.0.2 → 10.0.0.1     TCP 66 47452 → 53241 [ACK] Seq=1 Ack=9038 Win=34304 Len=0 TSval=1886573736 TSecr=1758595650
  113   0.476175     10.0.0.2 → 10.0.0.1     TCP 66 40783 → 32720 [ACK] Seq=1 Ack=6038 Win=34304 Len=0 TSval=1886573738 TSecr=1758595606
  114   0.477694     10.0.0.2 → 10.0.0.1     TCP 66 35722 → 19551 [ACK] Seq=1 Ack=26038 Win=34304 Len=0 TSval=1886573739 TSecr=1758595651
  115   0.478578     10.0.0.2 → 10.0.0.1     TCP 66 47452 → 53241 [ACK] Seq=1 Ack=10038 Win=34304 Len=0 TSval=1886573741 TSecr=1758595654
  116   0.484663     10.0.0.2 → 10.0.0.1     TCP 66 59433 → 48193 [ACK] Seq=1 Ack=18038 Win=34304 Len=0 TSval=1886573747 TSecr=1758595607
  117   0.488809     10.0.0.2 → 10.0.0.1     TCP 66 6776 → 55246 [ACK] Seq=1 Ack=7038 Win=34304 Len=0 TSval=1886573751 TSecr=1758595624
  118   0.493063     10.0.0.2 → 10.0.0.1     TCP 66 42968 → 55943 [ACK] Seq=1 Ack=7038 Win=34304 Len=0 TSval=1886573755 TSecr=1758595629
  119   0.494512     10.0.0.2 → 10.0.0.1     TCP 66 42968 → 55943 [ACK] Seq=1 Ack=11038 Win=34304 Len=0 TSval=1886573757 TSecr=1758595671
  120   0.505654     10.0.0.2 → 10.0.0.1     TCP 66 46356 → 54368 [ACK] Seq=1 Ack=8038 Win=34304 Len=0 TSval=1886573767 TSecr=1758595630
  121   0.509496     10.0.0.2 → 10.0.0.1     TCP 66 25904 → 58169 [ACK] Seq=1 Ack=8038 Win=34304 Len=0 TSval=1886573772 TSecr=1758595638
  122   0.521640     10.0.0.2 → 10.0.0.1     TCP 66 40783 → 32720 [ACK] Seq=1 Ack=9038 Win=34304 Len=0 TSval=1886573784 TSecr=1758595654
  123   0.533948     10.0.0.2 → 10.0.0.1     TCP 66 59433 → 48193 [ACK] Seq=1 Ack=22038 Win=34304 Len=0 TSval=1886573796 TSecr=1758595663
  124   0.536500     10.0.0.2 → 10.0.0.1     TCP 66 59433 → 48193 [ACK] Seq=1 Ack=25038 Win=34304 Len=0 TSval=1886573798 TSecr=1758595712
  125   0.550640     10.0.0.2 → 10.0.0.1     TCP 66 35722 → 19551 [ACK] Seq=1 Ack=27038 Win=34304 Len=0 TSval=1886573813 TSecr=1758595664
  126   0.554649     10.0.0.2 → 10.0.0.1     TCP 66 6776 → 55246 [ACK] Seq=1 Ack=10038 Win=34304 Len=0 TSval=1886573817 TSecr=1758595667
  127   0.556194     10.0.0.2 → 10.0.0.1     TCP 66 6776 → 55246 [ACK] Seq=1 Ack=15038 Win=34304 Len=0 TSval=1886573818 TSecr=1758595733
  128   0.570551     10.0.0.2 → 10.0.0.1     TCP 66 47452 → 53241 [ACK] Seq=1 Ack=11038 Win=34304 Len=0 TSval=1886573832 TSecr=1758595668
  129   0.571762     10.0.0.2 → 10.0.0.1     TCP 66 42968 → 55943 [ACK] Seq=1 Ack=12038 Win=34304 Len=0 TSval=1886573833 TSecr=1758595683
  130   0.575345     10.0.0.2 → 10.0.0.1     TCP 66 46356 → 54368 [ACK] Seq=1 Ack=12038 Win=34304 Len=0 TSval=1886573838 TSecr=1758595684
  131   0.576790     10.0.0.2 → 10.0.0.1     TCP 66 46356 → 54368 [ACK] Seq=1 Ack=17038 Win=34304 Len=0 TSval=1886573839 TSecr=1758595753
  132   0.586436     10.0.0.2 → 10.0.0.1     TCP 66 46356 → 54368 [ACK] Seq=1 Ack=18038 Win=34304 Len=0 TSval=1886573849 TSecr=1758595763
  133   0.591757     10.0.0.2 → 10.0.0.1     TCP 66 25904 → 58169 [ACK] Seq=1 Ack=12038 Win=34304 Len=0 TSval=1886573854 TSecr=1758595687
  134   0.593272     10.0.0.2 → 10.0.0.1     TCP 66 25904 → 58169 [ACK] Seq=1 Ack=18038 Win=34304 Len=0 TSval=1886573855 TSecr=1758595770
  135   0.602273     10.0.0.2 → 10.0.0.1     TCP 66 25904 → 58169 [ACK] Seq=1 Ack=19038 Win=34304 Len=0 TSval=1886573864 TSecr=1758595774
  136   0.604333     10.0.0.2 → 10.0.0.1     TCP 66 46356 → 54368 [ACK] Seq=1 Ack=19038 Win=34304 Len=0 TSval=1886573867 TSecr=1758595776
  137   0.607888     10.0.0.2 → 10.0.0.1     TCP 66 40783 → 32720 [ACK] Seq=1 Ack=13038 Win=34304 Len=0 TSval=1886573870 TSecr=1758595700
  138   0.609361     10.0.0.2 → 10.0.0.1     TCP 66 40783 → 32720 [ACK] Seq=1 Ack=19038 Win=34304 Len=0 TSval=1886573872 TSecr=1758595786
  139   0.618677     10.0.0.2 → 10.0.0.1     TCP 66 40783 → 32720 [ACK] Seq=1 Ack=20038 Win=34304 Len=0 TSval=1886573881 TSecr=1758595788
  140   0.625543     10.0.0.2 → 10.0.0.1     TCP 66 59433 → 48193 [ACK] Seq=1 Ack=26038 Win=34304 Len=0 TSval=1886573886 TSecr=1758595714
  141   0.628486     10.0.0.2 → 10.0.0.1     TCP 66 35722 → 19551 [ACK] Seq=1 Ack=31038 Win=34304 Len=0 TSval=1886573891 TSecr=1758595729
  142   0.630002     10.0.0.2 → 10.0.0.1     TCP 66 35722 → 19551 [ACK] Seq=1 Ack=37038 Win=34304 Len=0 TSval=1886573892 TSecr=1758595806
  143   0.638905     10.0.0.2 → 10.0.0.1     TCP 66 35722 → 19551 [ACK] Seq=1 Ack=38038 Win=34304 Len=0 TSval=1886573901 TSecr=1758595811
  144   0.644746     10.0.0.2 → 10.0.0.1     TCP 66 6776 → 55246 [ACK] Seq=1 Ack=16038 Win=34304 Len=0 TSval=1886573907 TSecr=1758595744
  145   0.649386     10.0.0.2 → 10.0.0.1     TCP 66 47452 → 53241 [ACK] Seq=1 Ack=17038 Win=34304 Len=0 TSval=1886573911 TSecr=1758595748
  146   0.650146     10.0.0.2 → 10.0.0.1     TCP 66 35722 → 19551 [ACK] Seq=1 Ack=39038 Win=34304 Len=0 TSval=1886573912 TSecr=1758595824
  147   0.651050     10.0.0.2 → 10.0.0.1     TCP 66 47452 → 53241 [ACK] Seq=1 Ack=22038 Win=34304 Len=0 TSval=1886573913 TSecr=1758595827
  148   0.658430     10.0.0.2 → 10.0.0.1     TCP 66 47452 → 53241 [ACK] Seq=1 Ack=23038 Win=34304 Len=0 TSval=1886573920 TSecr=1758595829
  149   0.660850     10.0.0.2 → 10.0.0.1     TCP 66 35722 → 19551 [ACK] Seq=1 Ack=40038 Win=34304 Len=0 TSval=1886573923 TSecr=1758595837
  150   0.666028     10.0.0.2 → 10.0.0.1     TCP 66 47452 → 53241 [ACK] Seq=1 Ack=24038 Win=34304 Len=0 TSval=1886573927 TSecr=1758595841
  151   0.673260     10.0.0.2 → 10.0.0.1     TCP 66 42968 → 55943 [ACK] Seq=1 Ack=16038 Win=34304 Len=0 TSval=1886573935 TSecr=1758595750
  152   0.679102     10.0.0.2 → 10.0.0.1     TCP 66 35722 → 19551 [ACK] Seq=1 Ack=41038 Win=34304 Len=0 TSval=1886573940 TSecr=1758595851
  153   0.679727     10.0.0.2 → 10.0.0.1     TCP 66 42968 → 55943 [ACK] Seq=1 Ack=24038 Win=34304 Len=0 TSval=1886573941 TSecr=1758595851
  154   0.689544     10.0.0.2 → 10.0.0.1     TCP 66 25904 → 58169 [ACK] Seq=1 Ack=20038 Win=34304 Len=0 TSval=1886573952 TSecr=1758595788
  155   0.691388     10.0.0.2 → 10.0.0.1     TCP 66 47452 → 53241 [ACK] Seq=1 Ack=25038 Win=34304 Len=0 TSval=1886573953 TSecr=1758595854
  156   0.693362     10.0.0.2 → 10.0.0.1     TCP 66 42968 → 55943 [ACK] Seq=1 Ack=25038 Win=34304 Len=0 TSval=1886573955 TSecr=1758595858
  157   0.696120     10.0.0.2 → 10.0.0.1     TCP 66 46356 → 54368 [ACK] Seq=1 Ack=20038 Win=34304 Len=0 TSval=1886573956 TSecr=1758595790
  158   0.697057     10.0.0.2 → 10.0.0.1     TCP 66 25904 → 58169 [ACK] Seq=1 Ack=25038 Win=34304 Len=0 TSval=1886573958 TSecr=1758595867
  159   0.700694     10.0.0.2 → 10.0.0.1     TCP 66 40783 → 32720 [ACK] Seq=1 Ack=21038 Win=34304 Len=0 TSval=1886573961 TSecr=1758595801
  160   0.702841     10.0.0.2 → 10.0.0.1     TCP 66 59433 → 48193 [ACK] Seq=1 Ack=32038 Win=34304 Len=0 TSval=1886573965 TSecr=1758595803
  161   0.705070     10.0.0.2 → 10.0.0.1     TCP 66 46356 → 54368 [ACK] Seq=1 Ack=26038 Win=34304 Len=0 TSval=1886573967 TSecr=1758595874
  162   0.717083     10.0.0.2 → 10.0.0.1     TCP 66 25904 → 58169 [ACK] Seq=1 Ack=26038 Win=34304 Len=0 TSval=1886573979 TSecr=1758595875
  163   0.719138     10.0.0.2 → 10.0.0.1     TCP 66 40783 → 32720 [ACK] Seq=1 Ack=26038 Win=34304 Len=0 TSval=1886573981 TSecr=1758595879
  164   0.726601     10.0.0.2 → 10.0.0.1     TCP 66 6776 → 55246 [ACK] Seq=1 Ack=21038 Win=34304 Len=0 TSval=1886573989 TSecr=1758595823
  165   0.729280     10.0.0.2 → 10.0.0.1     TCP 66 59433 → 48193 [ACK] Seq=1 Ack=38038 Win=34304 Len=0 TSval=1886573991 TSecr=1758595881
  166   0.741347     10.0.0.2 → 10.0.0.1     TCP 66 46356 → 54368 [ACK] Seq=1 Ack=27038 Win=34304 Len=0 TSval=1886574004 TSecr=1758595883
  167   0.743520     10.0.0.2 → 10.0.0.1     TCP 66 25904 → 58169 [ACK] Seq=1 Ack=28038 Win=34304 Len=0 TSval=1886574006 TSecr=1758595895
  168   0.746827     10.0.0.2 → 10.0.0.1     TCP 66 35722 → 19551 [ACK] Seq=1 Ack=42038 Win=34304 Len=0 TSval=1886574009 TSecr=1758595864
  169   0.748081     10.0.0.2 → 10.0.0.1     TCP 66 6776 → 55246 [ACK] Seq=1 Ack=28038 Win=34304 Len=0 TSval=1886574010 TSecr=1758595905
  170   0.750969     10.0.0.2 → 10.0.0.1     TCP 66 47452 → 53241 [ACK] Seq=1 Ack=26038 Win=34304 Len=0 TSval=1886574013 TSecr=1758595869
  171   0.756131     10.0.0.2 → 10.0.0.1     TCP 66 42968 → 55943 [ACK] Seq=1 Ack=26038 Win=34304 Len=0 TSval=1886574017 TSecr=1758595871
  172   0.759547     10.0.0.2 → 10.0.0.1     TCP 66 40783 → 32720 [ACK] Seq=1 Ack=28038 Win=34304 Len=0 TSval=1886574022 TSecr=1758595897
  173   0.761852     10.0.0.2 → 10.0.0.1     TCP 66 46356 → 54368 [ACK] Seq=1 Ack=29038 Win=34304 Len=0 TSval=1886574024 TSecr=1758595919
  174   0.765898     10.0.0.2 → 10.0.0.1     TCP 66 35722 → 19551 [ACK] Seq=1 Ack=46038 Win=34304 Len=0 TSval=1886574028 TSecr=1758595925
  175   0.768291     10.0.0.2 → 10.0.0.1     TCP 66 59433 → 48193 [ACK] Seq=1 Ack=40038 Win=34304 Len=0 TSval=1886574030 TSecr=1758595907
  176   0.774043     10.0.0.2 → 10.0.0.1     TCP 66 47452 → 53241 [ACK] Seq=1 Ack=30038 Win=34304 Len=0 TSval=1886574036 TSecr=1758595929
  177   0.776068     10.0.0.2 → 10.0.0.1     TCP 66 25904 → 58169 [ACK] Seq=1 Ack=30038 Win=34304 Len=0 TSval=1886574038 TSecr=1758595921
  178   0.782276     10.0.0.2 → 10.0.0.1     TCP 66 35722 → 19551 [ACK] Seq=1 Ack=47038 Win=34304 Len=0 TSval=1886574044 TSecr=1758595944
  179   0.784568     10.0.0.2 → 10.0.0.1     TCP 66 59433 → 48193 [ACK] Seq=1 Ack=43038 Win=34304 Len=0 TSval=1886574046 TSecr=1758595946
  180   0.785102     10.0.0.2 → 10.0.0.1     TCP 66 6776 → 55246 [ACK] Seq=1 Ack=29038 Win=34304 Len=0 TSval=1886574047 TSecr=1758595926
  181   0.788597     10.0.0.2 → 10.0.0.1     TCP 66 42968 → 55943 [ACK] Seq=1 Ack=30038 Win=34304 Len=0 TSval=1886574051 TSecr=1758595934
  182   0.790449     10.0.0.2 → 10.0.0.1     TCP 66 47452 → 53241 [ACK] Seq=1 Ack=32038 Win=34304 Len=0 TSval=1886574053 TSecr=1758595952
  183   0.794602     10.0.0.2 → 10.0.0.1     TCP 66 42968 → 55943 [ACK] Seq=1 Ack=33038 Win=34304 Len=0 TSval=1886574057 TSecr=1758595967
  184   0.800682     10.0.0.2 → 10.0.0.1     TCP 66 47452 → 53241 [ACK] Seq=1 Ack=33038 Win=34304 Len=0 TSval=1886574063 TSecr=1758595968
  185   0.802806     10.0.0.2 → 10.0.0.1     TCP 66 42968 → 55943 [ACK] Seq=1 Ack=34038 Win=34304 Len=0 TSval=1886574065 TSecr=1758595976
  186   0.805067     10.0.0.2 → 10.0.0.1     TCP 66 40783 → 32720 [ACK] Seq=1 Ack=31038 Win=34304 Len=0 TSval=1886574067 TSecr=1758595937
  187   0.807749     10.0.0.2 → 10.0.0.1     TCP 66 40783 → 32720 [ACK] Seq=1 Ack=34038 Win=34304 Len=0 TSval=1886574069 TSecr=1758595983
  188   0.817312     10.0.0.2 → 10.0.0.1     TCP 66 46356 → 54368 [ACK] Seq=1 Ack=31038 Win=34304 Len=0 TSval=1886574079 TSecr=1758595940
  189   0.825579     10.0.0.2 → 10.0.0.1     TCP 66 25904 → 58169 [ACK] Seq=1 Ack=32038 Win=34304 Len=0 TSval=1886574088 TSecr=1758595954
  190   0.827252     10.0.0.2 → 10.0.0.1     TCP 66 25904 → 58169 [ACK] Seq=1 Ack=36038 Win=34304 Len=0 TSval=1886574089 TSecr=1758596004
  191   0.833721     10.0.0.2 → 10.0.0.1     TCP 66 35722 → 19551 [ACK] Seq=1 Ack=49038 Win=34304 Len=0 TSval=1886574096 TSecr=1758595960
  192   0.835205     10.0.0.2 → 10.0.0.1     TCP 66 35722 → 19551 [ACK] Seq=1 Ack=53038 Win=34304 Len=0 TSval=1886574097 TSecr=1758596012
  193   0.841983     10.0.0.2 → 10.0.0.1     TCP 66 59433 → 48193 [ACK] Seq=1 Ack=44038 Win=34304 Len=0 TSval=1886574104 TSecr=1758595962
  194   0.844182     10.0.0.2 → 10.0.0.1     TCP 66 59433 → 48193 [ACK] Seq=1 Ack=48038 Win=34304 Len=0 TSval=1886574106 TSecr=1758596020
  195   0.846284     10.0.0.2 → 10.0.0.1     TCP 66 6776 → 55246 [ACK] Seq=1 Ack=32038 Win=34304 Len=0 TSval=1886574108 TSecr=1758595963
  196   0.847567     10.0.0.2 → 10.0.0.1     TCP 66 47452 → 53241 [ACK] Seq=1 Ack=34038 Win=34304 Len=0 TSval=1886574110 TSecr=1758595979
  197   0.848802     10.0.0.2 → 10.0.0.1     TCP 66 59433 → 48193 [ACK] Seq=1 Ack=49038 Win=34304 Len=0 TSval=1886574111 TSecr=1758596022
  198   0.850678     10.0.0.2 → 10.0.0.1     TCP 66 35722 → 19551 [ACK] Seq=1 Ack=54038 Win=34304 Len=0 TSval=1886574113 TSecr=1758596024
  199   0.852768     10.0.0.2 → 10.0.0.1     TCP 66 6776 → 55246 [ACK] Seq=1 Ack=37038 Win=34304 Len=0 TSval=1886574115 TSecr=1758596024
  200   0.858688     10.0.0.2 → 10.0.0.1     TCP 66 40783 → 32720 [ACK] Seq=1 Ack=35038 Win=34304 Len=0 TSval=1886574121 TSecr=1758595988
  201   0.863738     10.0.0.2 → 10.0.0.1     TCP 66 42968 → 55943 [ACK] Seq=1 Ack=35038 Win=34304 Len=0 TSval=1886574125 TSecr=1758595990
  202   0.864413     10.0.0.2 → 10.0.0.1     TCP 66 47452 → 53241 [ACK] Seq=1 Ack=37038 Win=34304 Len=0 TSval=1886574126 TSecr=1758596025
  203   0.867034     10.0.0.2 → 10.0.0.1     TCP 66 46356 → 54368 [ACK] Seq=1 Ack=35038 Win=34304 Len=0 TSval=1886574129 TSecr=1758595995
  204   0.871167     10.0.0.2 → 10.0.0.1     TCP 66 42968 → 55943 [ACK] Seq=1 Ack=38038 Win=34304 Len=0 TSval=1886574133 TSecr=1758596042
  205   0.877223     10.0.0.2 → 10.0.0.1     TCP 66 47452 → 53241 [ACK] Seq=1 Ack=39038 Win=34304 Len=0 TSval=1886574139 TSecr=1758596042
  206   0.881474     10.0.0.2 → 10.0.0.1     TCP 66 46356 → 54368 [ACK] Seq=1 Ack=39038 Win=34304 Len=0 TSval=1886574144 TSecr=1758596045
  207   0.883306     10.0.0.2 → 10.0.0.1     TCP 66 25904 → 58169 [ACK] Seq=1 Ack=37038 Win=34304 Len=0 TSval=1886574145 TSecr=1758596014
  208   0.887585     10.0.0.2 → 10.0.0.1     TCP 66 40783 → 32720 [ACK] Seq=1 Ack=38038 Win=34304 Len=0 TSval=1886574150 TSecr=1758596037
  209   0.889570     10.0.0.2 → 10.0.0.1     TCP 66 42968 → 55943 [ACK] Seq=1 Ack=39038 Win=34304 Len=0 TSval=1886574152 TSecr=1758596049
  210   0.891753     10.0.0.2 → 10.0.0.1     TCP 66 46356 → 54368 [ACK] Seq=1 Ack=40038 Win=34304 Len=0 TSval=1886574154 TSecr=1758596059
  211   0.893851     10.0.0.2 → 10.0.0.1     TCP 66 25904 → 58169 [ACK] Seq=1 Ack=40038 Win=34304 Len=0 TSval=1886574156 TSecr=1758596061
  212   0.902049     10.0.0.2 → 10.0.0.1     TCP 66 25904 → 58169 [ACK] Seq=1 Ack=41038 Win=34304 Len=0 TSval=1886574164 TSecr=1758596072
  213   0.904476     10.0.0.2 → 10.0.0.1     TCP 66 6776 → 55246 [ACK] Seq=1 Ack=38038 Win=34304 Len=0 TSval=1886574166 TSecr=1758596038
  214   0.905971     10.0.0.2 → 10.0.0.1     TCP 66 6776 → 55246 [ACK] Seq=1 Ack=41038 Win=34304 Len=0 TSval=1886574168 TSecr=1758596082
  215   0.908417     10.0.0.2 → 10.0.0.1     TCP 66 47452 → 53241 [ACK] Seq=1 Ack=40038 Win=34304 Len=0 TSval=1886574171 TSecr=1758596055
  216   0.911464     10.0.0.2 → 10.0.0.1     TCP 66 59433 → 48193 [ACK] Seq=1 Ack=50038 Win=34304 Len=0 TSval=1886574174 TSecr=1758596034
  217   0.913209     10.0.0.2 → 10.0.0.1     TCP 66 40783 → 32720 [ACK] Seq=1 Ack=40038 Win=34304 Len=0 TSval=1886574175 TSecr=1758596066
  218   0.914435     10.0.0.2 → 10.0.0.1     TCP 66 6776 → 55246 [ACK] Seq=1 Ack=42038 Win=34304 Len=0 TSval=1886574177 TSecr=1758596091
  219   0.929384     10.0.0.2 → 10.0.0.1     TCP 66 47452 → 53241 [ACK] Seq=1 Ack=42038 Win=34304 Len=0 TSval=1886574192 TSecr=1758596086
  220   0.930847     10.0.0.2 → 10.0.0.1     TCP 66 47452 → 53241 [ACK] Seq=1 Ack=43038 Win=34304 Len=0 TSval=1886574193 TSecr=1758596107
  221   0.937694     10.0.0.2 → 10.0.0.1     TCP 66 59433 → 48193 [ACK] Seq=1 Ack=54038 Win=34304 Len=0 TSval=1886574200 TSecr=1758596089
  222   0.948083     10.0.0.2 → 10.0.0.1     TCP 66 42968 → 55943 [ACK] Seq=1 Ack=40038 Win=34304 Len=0 TSval=1886574210 TSecr=1758596067
  223   0.948749     10.0.0.2 → 10.0.0.1     TCP 66 35722 → 19551 [ACK] Seq=1 Ack=55038 Win=34304 Len=0 TSval=1886574210 TSecr=1758596037
  224   0.971594     10.0.0.2 → 10.0.0.1     TCP 66 59433 → 48193 [ACK] Seq=1 Ack=56038 Win=34304 Len=0 TSval=1886574233 TSecr=1758596116
  225   0.972971     10.0.0.2 → 10.0.0.1     TCP 66 25904 → 58169 [ACK] Seq=1 Ack=42038 Win=34304 Len=0 TSval=1886574234 TSecr=1758596081
  226   0.980913     10.0.0.2 → 10.0.0.1     TCP 66 46356 → 54368 [ACK] Seq=1 Ack=41038 Win=34304 Len=0 TSval=1886574234 TSecr=1758596070
  227   0.991479     10.0.0.2 → 10.0.0.1     TCP 66 42968 → 55943 [ACK] Seq=1 Ack=45038 Win=34304 Len=0 TSval=1886574251 TSecr=1758596126
  228   0.995262     10.0.0.2 → 10.0.0.1     TCP 66 46356 → 54368 [ACK] Seq=1 Ack=47038 Win=34304 Len=0 TSval=1886574253 TSecr=1758596159
  229   0.995934     10.0.0.2 → 10.0.0.1     TCP 66 40783 → 32720 [ACK] Seq=1 Ack=42038 Win=34304 Len=0 TSval=1886574258 TSecr=1758596091
  230   1.001589     10.0.0.2 → 10.0.0.1     TCP 66 35722 → 19551 [ACK] Seq=1 Ack=61038 Win=34304 Len=0 TSval=1886574261 TSecr=1758596127
  231   1.004127     10.0.0.2 → 10.0.0.1     TCP 66 6776 → 55246 [ACK] Seq=1 Ack=43038 Win=34304 Len=0 TSval=1886574266 TSecr=1758596104
  232   1.005740     10.0.0.2 → 10.0.0.1     TCP 66 35722 → 19551 [ACK] Seq=1 Ack=65038 Win=34304 Len=0 TSval=1886574268 TSecr=1758596180
  233   1.007400     10.0.0.2 → 10.0.0.1     TCP 66 47452 → 53241 [ACK] Seq=1 Ack=44038 Win=34304 Len=0 TSval=1886574270 TSecr=1758596109
  234   1.010382     10.0.0.2 → 10.0.0.1     TCP 66 6776 → 55246 [ACK] Seq=1 Ack=48038 Win=34304 Len=0 TSval=1886574272 TSecr=1758596182
  235   1.024923     10.0.0.2 → 10.0.0.1     TCP 66 25904 → 58169 [ACK] Seq=1 Ack=47038 Win=34304 Len=0 TSval=1886574286 TSecr=1758596151
  236   1.067035     10.0.0.2 → 10.0.0.1     TCP 66 59433 → 48193 [ACK] Seq=1 Ack=58038 Win=34304 Len=0 TSval=1886574322 TSecr=1758596150
  237   1.072520     10.0.0.2 → 10.0.0.1     TCP 66 42968 → 55943 [ACK] Seq=1 Ack=48038 Win=34304 Len=0 TSval=1886574325 TSecr=1758596169
  238   1.076943     10.0.0.2 → 10.0.0.1     TCP 66 46356 → 54368 [ACK] Seq=1 Ack=48038 Win=34304 Len=0 TSval=1886574328 TSecr=1758596173
  239   1.082103     10.0.0.2 → 10.0.0.1     TCP 66 40783 → 32720 [ACK] Seq=1 Ack=48038 Win=34304 Len=0 TSval=1886574340 TSecr=1758596174
  240   1.084185     10.0.0.2 → 10.0.0.1     TCP 66 42968 → 55943 [ACK] Seq=1 Ack=54038 Win=34304 Len=0 TSval=1886574340 TSecr=1758596250
  241   1.086806     10.0.0.2 → 10.0.0.1     TCP 66 46356 → 54368 [ACK] Seq=1 Ack=54038 Win=34304 Len=0 TSval=1886574348 TSecr=1758596255
  242   1.091113     10.0.0.2 → 10.0.0.1     TCP 66 35722 → 19551 [ACK] Seq=1 Ack=66038 Win=34304 Len=0 TSval=1886574353 TSecr=1758596184
  243   1.096714     10.0.0.2 → 10.0.0.1     TCP 66 47452 → 53241 [ACK] Seq=1 Ack=49038 Win=34304 Len=0 TSval=1886574358 TSecr=1758596185
  244   1.098168     10.0.0.2 → 10.0.0.1     TCP 66 35722 → 19551 [ACK] Seq=1 Ack=72038 Win=34304 Len=0 TSval=1886574360 TSecr=1758596269
  245   1.121877     10.0.0.2 → 10.0.0.1     TCP 66 6776 → 55246 [ACK] Seq=1 Ack=49038 Win=34304 Len=0 TSval=1886574379 TSecr=1758596188
  246   1.126393     10.0.0.2 → 10.0.0.1     TCP 66 25904 → 58169 [ACK] Seq=1 Ack=51038 Win=34304 Len=0 TSval=1886574387 TSecr=1758596203
  247   1.129357     10.0.0.2 → 10.0.0.1     TCP 66 25904 → 58169 [ACK] Seq=1 Ack=58038 Win=34304 Len=0 TSval=1886574391 TSecr=1758596304
  248   1.136739     10.0.0.2 → 10.0.0.1     TCP 66 59433 → 48193 [ACK] Seq=1 Ack=65038 Win=34304 Len=0 TSval=1886574399 TSecr=1758596245
  249   1.140583     10.0.0.2 → 10.0.0.1     TCP 66 25904 → 58169 [ACK] Seq=1 Ack=59038 Win=34304 Len=0 TSval=1886574402 TSecr=1758596308
  250   1.142143     10.0.0.2 → 10.0.0.1     TCP 66 59433 → 48193 [ACK] Seq=1 Ack=71038 Win=34304 Len=0 TSval=1886574404 TSecr=1758596315
  251   1.156540     10.0.0.2 → 10.0.0.1     TCP 66 59433 → 48193 [ACK] Seq=1 Ack=72038 Win=34304 Len=0 TSval=1886574419 TSecr=1758596327
  252   1.164501     10.0.0.2 → 10.0.0.1     TCP 66 40783 → 32720 [ACK] Seq=1 Ack=55038 Win=34304 Len=0 TSval=1886574427 TSecr=1758596260
  253   1.166452     10.0.0.2 → 10.0.0.1     TCP 66 40783 → 32720 [ACK] Seq=1 Ack=61038 Win=34304 Len=0 TSval=1886574428 TSecr=1758596342
  254   1.192987     10.0.0.2 → 10.0.0.1     TCP 66 42968 → 55943 [ACK] Seq=1 Ack=55038 Win=34304 Len=0 TSval=1886574455 TSecr=1758596262
  255   1.195210     10.0.0.2 → 10.0.0.1     TCP 66 42968 → 55943 [ACK] Seq=1 Ack=63038 Win=34304 Len=0 TSval=1886574457 TSecr=1758596371
  256   1.202569     10.0.0.2 → 10.0.0.1     TCP 66 46356 → 54368 [ACK] Seq=1 Ack=55038 Win=34304 Len=0 TSval=1886574459 TSecr=1758596265
  257   1.204317     10.0.0.2 → 10.0.0.1     TCP 66 25904 → 58169 [ACK] Seq=1 Ack=60038 Win=34304 Len=0 TSval=1886574462 TSecr=1758596321
  258   1.205647     10.0.0.2 → 10.0.0.1     TCP 66 47452 → 53241 [ACK] Seq=1 Ack=56038 Win=34304 Len=0 TSval=1886574467 TSecr=1758596275
  259   1.210133     10.0.0.2 → 10.0.0.1     TCP 66 42968 → 55943 [ACK] Seq=1 Ack=64038 Win=34304 Len=0 TSval=1886574470 TSecr=1758596376
  260   1.211189     10.0.0.2 → 10.0.0.1     TCP 66 46356 → 54368 [ACK] Seq=1 Ack=64038 Win=34304 Len=0 TSval=1886574473 TSecr=1758596381
  261   1.215442     10.0.0.2 → 10.0.0.1     TCP 66 59433 → 48193 [ACK] Seq=1 Ack=73038 Win=34304 Len=0 TSval=1886574478 TSecr=1758596340
  262   1.233371     10.0.0.2 → 10.0.0.1     TCP 66 47452 → 53241 [ACK] Seq=1 Ack=64038 Win=34304 Len=0 TSval=1886574491 TSecr=1758596384
  263   1.237454     10.0.0.2 → 10.0.0.1     TCP 66 35722 → 19551 [ACK] Seq=1 Ack=73038 Win=34304 Len=0 TSval=1886574496 TSecr=1758596278
  264   1.238287     10.0.0.2 → 10.0.0.1     TCP 66 6776 → 55246 [ACK] Seq=1 Ack=57038 Win=34304 Len=0 TSval=1886574498 TSecr=1758596300
  265   1.246136     10.0.0.2 → 10.0.0.1     TCP 66 46356 → 54368 [ACK] Seq=1 Ack=65038 Win=34304 Len=0 TSval=1886574507 TSecr=1758596390
  266   1.248188     10.0.0.2 → 10.0.0.1     TCP 66 59433 → 48193 [ACK] Seq=1 Ack=76038 Win=34304 Len=0 TSval=1886574509 TSecr=1758596393
  267   1.267333     10.0.0.2 → 10.0.0.1     TCP 66 40783 → 32720 [ACK] Seq=1 Ack=62038 Win=34304 Len=0 TSval=1886574528 TSecr=1758596348
  268   1.270552     10.0.0.2 → 10.0.0.1     TCP 66 25904 → 58169 [ACK] Seq=1 Ack=64038 Win=34304 Len=0 TSval=1886574533 TSecr=1758596382
  269   1.272729     10.0.0.2 → 10.0.0.1     TCP 66 35722 → 19551 [ACK] Seq=1 Ack=83038 Win=34304 Len=0 TSval=1886574534 TSecr=1758596411
  270   1.274109     10.0.0.2 → 10.0.0.1     TCP 66 6776 → 55246 [ACK] Seq=1 Ack=66038 Win=34304 Len=0 TSval=1886574536 TSecr=1758596416
  271   1.295098     10.0.0.2 → 10.0.0.1     TCP 66 47452 → 53241 [ACK] Seq=1 Ack=66038 Win=34304 Len=0 TSval=1886574555 TSecr=1758596411
  272   1.296721     10.0.0.2 → 10.0.0.1     TCP 66 46356 → 54368 [ACK] Seq=1 Ack=67038 Win=34304 Len=0 TSval=1886574556 TSecr=1758596424
  273   1.301401     10.0.0.2 → 10.0.0.1     TCP 66 40783 → 32720 [ACK] Seq=1 Ack=69038 Win=34304 Len=0 TSval=1886574559 TSecr=1758596445
  274   1.304813     10.0.0.2 → 10.0.0.1     TCP 66 59433 → 48193 [ACK] Seq=1 Ack=79038 Win=34304 Len=0 TSval=1886574562 TSecr=1758596426
  275   1.309354     10.0.0.2 → 10.0.0.1     TCP 66 46356 → 54368 [ACK] Seq=1 Ack=71038 Win=34304 Len=0 TSval=1886574571 TSecr=1758596475
  276   1.311240     10.0.0.2 → 10.0.0.1     TCP 66 25904 → 58169 [ACK] Seq=1 Ack=69038 Win=34304 Len=0 TSval=1886574573 TSecr=1758596448
  277   1.317565     10.0.0.2 → 10.0.0.1     TCP 66 40783 → 32720 [ACK] Seq=1 Ack=71038 Win=34304 Len=0 TSval=1886574580 TSecr=1758596479
  278   1.321427     10.0.0.2 → 10.0.0.1     TCP 66 46356 → 54368 [ACK] Seq=1 Ack=72038 Win=34304 Len=0 TSval=1886574584 TSecr=1758596487
  279   1.323498     10.0.0.2 → 10.0.0.1     TCP 66 25904 → 58169 [ACK] Seq=1 Ack=72038 Win=34304 Len=0 TSval=1886574586 TSecr=1758596489
  280   1.329697     10.0.0.2 → 10.0.0.1     TCP 66 25904 → 58169 [ACK] Seq=1 Ack=73038 Win=34304 Len=0 TSval=1886574592 TSecr=1758596501
  281   1.331782     10.0.0.2 → 10.0.0.1     TCP 66 35722 → 19551 [ACK] Seq=1 Ack=85038 Win=34304 Len=0 TSval=1886574594 TSecr=1758596451
  282   1.335428     10.0.0.2 → 10.0.0.1     TCP 66 42968 → 55943 [ACK] Seq=1 Ack=65038 Win=34304 Len=0 TSval=1886574598 TSecr=1758596390
  283   1.337010     10.0.0.2 → 10.0.0.1     TCP 66 42968 → 55943 [ACK] Seq=1 Ack=74038 Win=34304 Len=0 TSval=1886574599 TSecr=1758596513
  284   1.342097     10.0.0.2 → 10.0.0.1     TCP 66 6776 → 55246 [ACK] Seq=1 Ack=69038 Win=34304 Len=0 TSval=1886574604 TSecr=1758596452
  285   1.352355     10.0.0.2 → 10.0.0.1     TCP 66 6776 → 55246 [ACK] Seq=1 Ack=74038 Win=34304 Len=0 TSval=1886574614 TSecr=1758596520
  286   1.352969     10.0.0.2 → 10.0.0.1     TCP 66 47452 → 53241 [ACK] Seq=1 Ack=71038 Win=34304 Len=0 TSval=1886574615 TSecr=1758596473
