    1   0.000000           :: → ff02::1:ff00:1 ICMPv6 86 Neighbor Solicitation for fe80::201:aff:fe00:1
    2  38.790580     10.0.0.1 → 10.0.0.2     TCP 74 42763 → 35722 [SYN] Seq=0 Win=37840 Len=0 MSS=9460 SACK_PERM TSval=1758595171 TSecr=0 WS=512
    3  38.797286     10.0.0.1 → 10.0.0.2     TCP 66 42763 → 35722 [ACK] Seq=1 Ack=1 Win=37888 Len=0 TSval=1758595178 TSecr=1886573260
    4  38.797888     10.0.0.1 → 10.0.0.2     TCP 74 36467 → 59433 [SYN] Seq=0 Win=37840 Len=0 MSS=9460 SACK_PERM TSval=1758595179 TSecr=0 WS=512
    5  38.797919     10.0.0.1 → 10.0.0.2     TCP 103 42763 → 35722 [PSH, ACK] Seq=1 Ack=1 Win=37888 Len=37 TSval=1758595179 TSecr=1886573260
    6  38.802047     10.0.0.1 → 10.0.0.2     TCP 66 36467 → 59433 [ACK] Seq=1 Ack=1 Win=37888 Len=0 TSval=1758595183 TSecr=1886573266
    7  38.802093     10.0.0.1 → 10.0.0.2     TCP 103 36467 → 59433 [PSH, ACK] Seq=1 Ack=1 Win=37888 Len=37 TSval=1758595183 TSecr=1886573266
    8  38.805394     10.0.0.1 → 10.0.0.2     TCP 66 42763 → 35722 [ACK] Seq=38 Ack=2 Win=37888 Len=0 TSval=1758595186 TSecr=1886573267
    9  38.805421     10.0.0.1 → 10.0.0.2     TCP 70 42763 → 35722 [PSH, ACK] Seq=38 Ack=2 Win=37888 Len=4 TSval=1758595186 TSecr=1886573267
   10  38.805712     10.0.0.1 → 10.0.0.2     TCP 66 36467 → 59433 [ACK] Seq=38 Ack=2 Win=37888 Len=0 TSval=1758595186 TSecr=1886573270
   11  38.805736     10.0.0.1 → 10.0.0.2     TCP 70 36467 → 59433 [PSH, ACK] Seq=38 Ack=2 Win=37888 Len=4 TSval=1758595186 TSecr=1886573270
   12  38.814197     10.0.0.1 → 10.0.0.2     TCP 74 39475 → 47452 [SYN] Seq=0 Win=37840 Len=0 MSS=9460 SACK_PERM TSval=1758595195 TSecr=0 WS=512
   13  38.817041     10.0.0.1 → 10.0.0.2     TCP 74 51099 → 25904 [SYN] Seq=0 Win=37840 Len=0 MSS=9460 SACK_PERM TSval=1758595198 TSecr=0 WS=512
   14  38.817682     10.0.0.1 → 10.0.0.2     TCP 74 58271 → 40783 [SYN] Seq=0 Win=37840 Len=0 MSS=9460 SACK_PERM TSval=1758595198 TSecr=0 WS=512
   15  38.818218     10.0.0.1 → 10.0.0.2     TCP 66 39475 → 47452 [ACK] Seq=1 Ack=1 Win=37888 Len=0 TSval=1758595199 TSecr=1886573281
   16  38.821465     10.0.0.1 → 10.0.0.2     TCP 74 55655 → 6776 [SYN] Seq=0 Win=37840 Len=0 MSS=9460 SACK_PERM TSval=1758595202 TSecr=0 WS=512
   17  38.822775     10.0.0.1 → 10.0.0.2     TCP 103 39475 → 47452 [PSH, ACK] Seq=1 Ack=1 Win=37888 Len=37 TSval=1758595203 TSecr=1886573281
   18  38.824965     10.0.0.1 → 10.0.0.2     TCP 74 47085 → 46356 [SYN] Seq=0 Win=37840 Len=0 MSS=9460 SACK_PERM TSval=1758595206 TSecr=0 WS=512
   19  38.825266     10.0.0.1 → 10.0.0.2     TCP 74 49189 → 42968 [SYN] Seq=0 Win=37840 Len=0 MSS=9460 SACK_PERM TSval=1758595206 TSecr=0 WS=512
   20  38.826533     10.0.0.1 → 10.0.0.2     TCP 66 51099 → 25904 [ACK] Seq=1 Ack=1 Win=37888 Len=0 TSval=1758595207 TSecr=1886573285
   21  38.826559     10.0.0.1 → 10.0.0.2     TCP 66 58271 → 40783 [ACK] Seq=1 Ack=1 Win=37888 Len=0 TSval=1758595207 TSecr=1886573285
   22  38.827127     10.0.0.1 → 10.0.0.2     TCP 103 58271 → 40783 [PSH, ACK] Seq=1 Ack=1 Win=37888 Len=37 TSval=1758595208 TSecr=1886573285
   23  38.827154     10.0.0.1 → 10.0.0.2     TCP 103 51099 → 25904 [PSH, ACK] Seq=1 Ack=1 Win=37888 Len=37 TSval=1758595208 TSecr=1886573285
   24  38.830729     10.0.0.1 → 10.0.0.2     TCP 66 55655 → 6776 [ACK] Seq=1 Ack=1 Win=37888 Len=0 TSval=1758595211 TSecr=1886573293
   25  38.831062     10.0.0.1 → 10.0.0.2     TCP 66 39475 → 47452 [ACK] Seq=38 Ack=2 Win=37888 Len=0 TSval=1758595212 TSecr=1886573293
   26  38.831088     10.0.0.1 → 10.0.0.2     TCP 70 39475 → 47452 [PSH, ACK] Seq=38 Ack=2 Win=37888 Len=4 TSval=1758595212 TSecr=1886573293
   27  38.831397     10.0.0.1 → 10.0.0.2     TCP 103 55655 → 6776 [PSH, ACK] Seq=1 Ack=1 Win=37888 Len=37 TSval=1758595212 TSecr=1886573293
   28  38.835785     10.0.0.1 → 10.0.0.2     TCP 66 47085 → 46356 [ACK] Seq=1 Ack=1 Win=37888 Len=0 TSval=1758595216 TSecr=1886573296
   29  38.836240     10.0.0.1 → 10.0.0.2     TCP 66 58271 → 40783 [ACK] Seq=38 Ack=2 Win=37888 Len=0 TSval=1758595217 TSecr=1886573298
   30  38.836264     10.0.0.1 → 10.0.0.2     TCP 70 58271 → 40783 [PSH, ACK] Seq=38 Ack=2 Win=37888 Len=4 TSval=1758595217 TSecr=1886573298
   31  38.836426     10.0.0.1 → 10.0.0.2     TCP 66 49189 → 42968 [ACK] Seq=1 Ack=1 Win=37888 Len=0 TSval=1758595217 TSecr=1886573298
   32  38.836448     10.0.0.1 → 10.0.0.2     TCP 103 49189 → 42968 [PSH, ACK] Seq=1 Ack=1 Win=37888 Len=37 TSval=1758595217 TSecr=1886573298
   33  38.836475     10.0.0.1 → 10.0.0.2     TCP 103 47085 → 46356 [PSH, ACK] Seq=1 Ack=1 Win=37888 Len=37 TSval=1758595217 TSecr=1886573296
   34  38.842266     10.0.0.1 → 10.0.0.2     TCP 66 51099 → 25904 [ACK] Seq=38 Ack=2 Win=37888 Len=0 TSval=1758595223 TSecr=1886573299
   35  38.842286     10.0.0.1 → 10.0.0.2     TCP 70 51099 → 25904 [PSH, ACK] Seq=38 Ack=2 Win=37888 Len=4 TSval=1758595223 TSecr=1886573299
   36  38.842565     10.0.0.1 → 10.0.0.2     TCP 66 55655 → 6776 [ACK] Seq=38 Ack=2 Win=37888 Len=0 TSval=1758595223 TSecr=1886573304
   37  38.842583     10.0.0.1 → 10.0.0.2     TCP 70 55655 → 6776 [PSH, ACK] Seq=38 Ack=2 Win=37888 Len=4 TSval=1758595223 TSecr=1886573304
   38  38.846633     10.0.0.1 → 10.0.0.2     TCP 66 49189 → 42968 [ACK] Seq=38 Ack=2 Win=37888 Len=0 TSval=1758595227 TSecr=1886573308
   39  38.846648     10.0.0.1 → 10.0.0.2     TCP 70 49189 → 42968 [PSH, ACK] Seq=38 Ack=2 Win=37888 Len=4 TSval=1758595227 TSecr=1886573308
   40  38.847121     10.0.0.1 → 10.0.0.2     TCP 66 47085 → 46356 [ACK] Seq=38 Ack=2 Win=37888 Len=0 TSval=1758595228 TSecr=1886573309
   41  38.847134     10.0.0.1 → 10.0.0.2     TCP 70 47085 → 46356 [PSH, ACK] Seq=38 Ack=2 Win=37888 Len=4 TSval=1758595228 TSecr=1886573309
   42  38.849781     10.0.0.1 → 10.0.0.2     TCP 183 42763 → 35722 [PSH, ACK] Seq=42 Ack=2 Win=37888 Len=117 TSval=1758595230 TSecr=1886573314
   43  38.852064     10.0.0.1 → 10.0.0.2     TCP 74 19551 → 35722 [SYN] Seq=0 Win=37840 Len=0 MSS=9460 SACK_PERM TSval=1758595233 TSecr=0 WS=512
   44  38.852941     10.0.0.1 → 10.0.0.2     TCP 183 36467 → 59433 [PSH, ACK] Seq=42 Ack=2 Win=37888 Len=117 TSval=1758595234 TSecr=1886573318
   45  38.854367     10.0.0.1 → 10.0.0.2     TCP 66 19551 → 35722 [ACK] Seq=1 Ack=1 Win=37888 Len=0 TSval=1758595235 TSecr=1886573319
   46  38.854372     10.0.0.1 → 10.0.0.2     TCP 103 19551 → 35722 [PSH, ACK] Seq=1 Ack=1 Win=37888 Len=37 TSval=1758595235 TSecr=1886573319
   47  38.862633     10.0.0.1 → 10.0.0.2     TCP 74 48193 → 59433 [SYN] Seq=0 Win=37840 Len=0 MSS=9460 SACK_PERM TSval=1758595243 TSecr=0 WS=512
   48  38.868025     10.0.0.1 → 10.0.0.2     TCP 66 48193 → 59433 [ACK] Seq=1 Ack=1 Win=37888 Len=0 TSval=1758595249 TSecr=1886573330
   49  38.868030     10.0.0.1 → 10.0.0.2     TCP 103 48193 → 59433 [PSH, ACK] Seq=1 Ack=1 Win=37888 Len=37 TSval=1758595249 TSecr=1886573330
   50  38.895936     10.0.0.1 → 10.0.0.2     TCP 66 42763 → 35722 [ACK] Seq=159 Ack=3 Win=37888 Len=0 TSval=1758595277 TSecr=1886573316
   51  38.904264     10.0.0.1 → 10.0.0.2     TCP 66 36467 → 59433 [ACK] Seq=159 Ack=3 Win=37888 Len=0 TSval=1758595285 TSecr=1886573320
   52  38.928730     10.0.0.1 → 10.0.0.2     TCP 183 39475 → 47452 [PSH, ACK] Seq=42 Ack=2 Win=37888 Len=117 TSval=1758595309 TSecr=1886573358
   53  38.931359     10.0.0.1 → 10.0.0.2     TCP 183 55655 → 6776 [PSH, ACK] Seq=42 Ack=2 Win=37888 Len=117 TSval=1758595312 TSecr=1886573358
   54  38.931680     10.0.0.1 → 10.0.0.2     TCP 183 51099 → 25904 [PSH, ACK] Seq=42 Ack=2 Win=37888 Len=117 TSval=1758595312 TSecr=1886573358
   55  38.931950     10.0.0.1 → 10.0.0.2     TCP 183 47085 → 46356 [PSH, ACK] Seq=42 Ack=2 Win=37888 Len=117 TSval=1758595313 TSecr=1886573358
   56  38.932874     10.0.0.1 → 10.0.0.2     TCP 183 58271 → 40783 [PSH, ACK] Seq=42 Ack=2 Win=37888 Len=117 TSval=1758595314 TSecr=1886573358
   57  38.935982     10.0.0.1 → 10.0.0.2     TCP 183 49189 → 42968 [PSH, ACK] Seq=42 Ack=2 Win=37888 Len=117 TSval=1758595317 TSecr=1886573358
   58  38.936400     10.0.0.1 → 10.0.0.2     TCP 66 42763 → 35722 [ACK] Seq=159 Ack=5 Win=37888 Len=0 TSval=1758595317 TSecr=1886573394
   59  38.936419     10.0.0.1 → 10.0.0.2     TCP 1066 19551 → 35722 [PSH, ACK] Seq=38 Ack=1 Win=37888 Len=1000 TSval=1758595317 TSecr=1886573328
   60  38.997935     10.0.0.1 → 10.0.0.2     TCP 74 53241 → 47452 [SYN] Seq=0 Win=37840 Len=0 MSS=9460 SACK_PERM TSval=1758595379 TSecr=0 WS=512
   61  38.998841     10.0.0.1 → 10.0.0.2     TCP 66 36467 → 59433 [ACK] Seq=159 Ack=5 Win=37888 Len=0 TSval=1758595380 TSecr=1886573399
   62  38.999138     10.0.0.1 → 10.0.0.2     TCP 74 55246 → 6776 [SYN] Seq=0 Win=37840 Len=0 MSS=9460 SACK_PERM TSval=1758595380 TSecr=0 WS=512
   63  38.999487     10.0.0.1 → 10.0.0.2     TCP 1066 48193 → 59433 [PSH, ACK] Seq=38 Ack=1 Win=37888 Len=1000 TSval=1758595380 TSecr=1886573395
   64  38.999881     10.0.0.1 → 10.0.0.2     TCP 74 58169 → 25904 [SYN] Seq=0 Win=37840 Len=0 MSS=9460 SACK_PERM TSval=1758595381 TSecr=0 WS=512
   65  39.000437     10.0.0.1 → 10.0.0.2     TCP 74 54368 → 46356 [SYN] Seq=0 Win=37840 Len=0 MSS=9460 SACK_PERM TSval=1758595381 TSecr=0 WS=512
   66  39.001016     10.0.0.1 → 10.0.0.2     TCP 74 32720 → 40783 [SYN] Seq=0 Win=37840 Len=0 MSS=9460 SACK_PERM TSval=1758595382 TSecr=0 WS=512
   67  39.001192     10.0.0.1 → 10.0.0.2     TCP 74 55943 → 42968 [SYN] Seq=0 Win=37840 Len=0 MSS=9460 SACK_PERM TSval=1758595382 TSecr=0 WS=512
   68  39.004766     10.0.0.1 → 10.0.0.2     TCP 5066 19551 → 35722 [PSH, ACK] Seq=1038 Ack=1 Win=37888 Len=5000 TSval=1758595385 TSecr=1886573464
   69  39.018323     10.0.0.1 → 10.0.0.2     TCP 66 53241 → 47452 [ACK] Seq=1 Ack=1 Win=37888 Len=0 TSval=1758595399 TSecr=1886573468
   70  39.018336     10.0.0.1 → 10.0.0.2     TCP 103 53241 → 47452 [PSH, ACK] Seq=1 Ack=1 Win=37888 Len=37 TSval=1758595399 TSecr=1886573468
   71  39.018923     10.0.0.1 → 10.0.0.2     TCP 66 55246 → 6776 [ACK] Seq=1 Ack=1 Win=37888 Len=0 TSval=1758595400 TSecr=1886573470
   72  39.018932     10.0.0.1 → 10.0.0.2     TCP 103 55246 → 6776 [PSH, ACK] Seq=1 Ack=1 Win=37888 Len=37 TSval=1758595400 TSecr=1886573470
   73  39.028408     10.0.0.1 → 10.0.0.2     TCP 2066 48193 → 59433 [PSH, ACK] Seq=1038 Ack=1 Win=37888 Len=2000 TSval=1758595409 TSecr=1886573471
   74  39.028942     10.0.0.1 → 10.0.0.2     TCP 66 58169 → 25904 [ACK] Seq=1 Ack=1 Win=37888 Len=0 TSval=1758595410 TSecr=1886573472
   75  39.028958     10.0.0.1 → 10.0.0.2     TCP 103 58169 → 25904 [PSH, ACK] Seq=1 Ack=1 Win=37888 Len=37 TSval=1758595410 TSecr=1886573472
   76  39.029165     10.0.0.1 → 10.0.0.2     TCP 66 54368 → 46356 [ACK] Seq=1 Ack=1 Win=37888 Len=0 TSval=1758595410 TSecr=1886573473
   77  39.029173     10.0.0.1 → 10.0.0.2     TCP 103 54368 → 46356 [PSH, ACK] Seq=1 Ack=1 Win=37888 Len=37 TSval=1758595410 TSecr=1886573473
   78  39.036137     10.0.0.1 → 10.0.0.2     TCP 66 32720 → 40783 [ACK] Seq=1 Ack=1 Win=37888 Len=0 TSval=1758595417 TSecr=1886573482
   79  39.036150     10.0.0.1 → 10.0.0.2     TCP 103 32720 → 40783 [PSH, ACK] Seq=1 Ack=1 Win=37888 Len=37 TSval=1758595417 TSecr=1886573482
   80  39.036670     10.0.0.1 → 10.0.0.2     TCP 66 55943 → 42968 [ACK] Seq=1 Ack=1 Win=37888 Len=0 TSval=1758595417 TSecr=1886573483
   81  39.036678     10.0.0.1 → 10.0.0.2     TCP 103 55943 → 42968 [PSH, ACK] Seq=1 Ack=1 Win=37888 Len=37 TSval=1758595417 TSecr=1886573483
   82  39.039847     10.0.0.1 → 10.0.0.2     TCP 66 51099 → 25904 [ACK] Seq=159 Ack=3 Win=37888 Len=0 TSval=1758595421 TSecr=1886573413
   83  39.039848     10.0.0.1 → 10.0.0.2     TCP 66 55655 → 6776 [ACK] Seq=159 Ack=3 Win=37888 Len=0 TSval=1758595421 TSecr=1886573409
   84  39.039850     10.0.0.1 → 10.0.0.2     TCP 66 39475 → 47452 [ACK] Seq=159 Ack=3 Win=37888 Len=0 TSval=1758595421 TSecr=1886573399
   85  39.043845     10.0.0.1 → 10.0.0.2     TCP 66 49189 → 42968 [ACK] Seq=159 Ack=3 Win=37888 Len=0 TSval=1758595425 TSecr=1886573438
   86  39.043847     10.0.0.1 → 10.0.0.2     TCP 66 58271 → 40783 [ACK] Seq=159 Ack=3 Win=37888 Len=0 TSval=1758595425 TSecr=1886573423
   87  39.043847     10.0.0.1 → 10.0.0.2     TCP 66 47085 → 46356 [ACK] Seq=159 Ack=3 Win=37888 Len=0 TSval=1758595425 TSecr=1886573415
   88  39.055702     10.0.0.1 → 10.0.0.2     TCP 3066 19551 → 35722 [PSH, ACK] Seq=6038 Ack=1 Win=37888 Len=3000 TSval=1758595436 TSecr=1886573491
   89  39.151190     10.0.0.1 → 10.0.0.2     TCP 9066 48193 → 59433 [PSH, ACK] Seq=3038 Ack=1 Win=37888 Len=9000 TSval=1758595532 TSecr=1886573539
   90  39.151968     10.0.0.1 → 10.0.0.2     TCP 66 51099 → 25904 [ACK] Seq=159 Ack=5 Win=37888 Len=0 TSval=1758595533 TSecr=1886573601
   91  39.152123     10.0.0.1 → 10.0.0.2     TCP 66 55655 → 6776 [ACK] Seq=159 Ack=5 Win=37888 Len=0 TSval=1758595533 TSecr=1886573602
   92  39.152281     10.0.0.1 → 10.0.0.2     TCP 66 39475 → 47452 [ACK] Seq=159 Ack=5 Win=37888 Len=0 TSval=1758595533 TSecr=1886573603
   93  39.152441     10.0.0.1 → 10.0.0.2     TCP 66 49189 → 42968 [ACK] Seq=159 Ack=5 Win=37888 Len=0 TSval=1758595533 TSecr=1886573610
   94  39.152593     10.0.0.1 → 10.0.0.2     TCP 66 58271 → 40783 [ACK] Seq=159 Ack=5 Win=37888 Len=0 TSval=1758595533 TSecr=1886573614
   95  39.152745     10.0.0.1 → 10.0.0.2     TCP 66 47085 → 46356 [ACK] Seq=159 Ack=5 Win=37888 Len=0 TSval=1758595533 TSecr=1886573615
   96  39.153217     10.0.0.1 → 10.0.0.2     TCP 8066 19551 → 35722 [PSH, ACK] Seq=9038 Ack=1 Win=37888 Len=8000 TSval=1758595534 TSecr=1886573616
   97  39.153402     10.0.0.1 → 10.0.0.2     TCP 1066 53241 → 47452 [PSH, ACK] Seq=38 Ack=1 Win=37888 Len=1000 TSval=1758595534 TSecr=1886573520
   98  39.153412     10.0.0.1 → 10.0.0.2     TCP 1066 58169 → 25904 [PSH, ACK] Seq=38 Ack=1 Win=37888 Len=1000 TSval=1758595534 TSecr=1886573575
   99  39.153498     10.0.0.1 → 10.0.0.2     TCP 1066 32720 → 40783 [PSH, ACK] Seq=38 Ack=1 Win=37888 Len=1000 TSval=1758595534 TSecr=1886573592
  100  39.154982     10.0.0.1 → 10.0.0.2     TCP 1066 55943 → 42968 [PSH, ACK] Seq=38 Ack=1 Win=37888 Len=1000 TSval=1758595536 TSecr=1886573599
  101  39.154999     10.0.0.1 → 10.0.0.2     TCP 1066 54368 → 46356 [PSH, ACK] Seq=38 Ack=1 Win=37888 Len=1000 TSval=1758595536 TSecr=1886573587
  102  39.162823     10.0.0.1 → 10.0.0.2     TCP 1066 55246 → 6776 [PSH, ACK] Seq=38 Ack=1 Win=37888 Len=1000 TSval=1758595543 TSecr=1886573523
  103  39.163588     10.0.0.1 → 10.0.0.2     TCP 1066 48193 → 59433 [PSH, ACK] Seq=12038 Ack=1 Win=37888 Len=1000 TSval=1758595544 TSecr=1886573619
  104  39.168010     10.0.0.1 → 10.0.0.2     TCP 1066 19551 → 35722 [PSH, ACK] Seq=17038 Ack=1 Win=37888 Len=1000 TSval=1758595549 TSecr=1886573629
  105  39.175688     10.0.0.1 → 10.0.0.2     TCP 1066 53241 → 47452 [PSH, ACK] Seq=1038 Ack=1 Win=37888 Len=1000 TSval=1758595556 TSecr=1886573640
  106  39.177056     10.0.0.1 → 10.0.0.2     TCP 1066 55943 → 42968 [PSH, ACK] Seq=1038 Ack=1 Win=37888 Len=1000 TSval=1758595558 TSecr=1886573641
  107  39.178298     10.0.0.1 → 10.0.0.2     TCP 1066 55246 → 6776 [PSH, ACK] Seq=1038 Ack=1 Win=37888 Len=1000 TSval=1758595559 TSecr=1886573643
  108  39.179553     10.0.0.1 → 10.0.0.2     TCP 1066 48193 → 59433 [PSH, ACK] Seq=13038 Ack=1 Win=37888 Len=1000 TSval=1758595560 TSecr=1886573645
  109  39.181802     10.0.0.1 → 10.0.0.2     TCP 1066 19551 → 35722 [PSH, ACK] Seq=18038 Ack=1 Win=37888 Len=1000 TSval=1758595562 TSecr=1886573647
  110  39.183828     10.0.0.1 → 10.0.0.2     TCP 1066 53241 → 47452 [PSH, ACK] Seq=2038 Ack=1 Win=37888 Len=1000 TSval=1758595564 TSecr=1886573649
  111  39.189692     10.0.0.1 → 10.0.0.2     TCP 2066 58169 → 25904 [PSH, ACK] Seq=1038 Ack=1 Win=37888 Len=2000 TSval=1758595570 TSecr=1886573655
  112  39.190049     10.0.0.1 → 10.0.0.2     TCP 1066 55246 → 6776 [PSH, ACK] Seq=2038 Ack=1 Win=37888 Len=1000 TSval=1758595571 TSecr=1886573651
  113  39.193461     10.0.0.1 → 10.0.0.2     TCP 1066 58169 → 25904 [PSH, ACK] Seq=3038 Ack=1 Win=37888 Len=1000 TSval=1758595574 TSecr=1886573656
  114  39.194906     10.0.0.1 → 10.0.0.2     TCP 3066 32720 → 40783 [PSH, ACK] Seq=1038 Ack=1 Win=37888 Len=3000 TSval=1758595576 TSecr=1886573659
  115  39.198208     10.0.0.1 → 10.0.0.2     TCP 3066 54368 → 46356 [PSH, ACK] Seq=1038 Ack=1 Win=37888 Len=3000 TSval=1758595579 TSecr=1886573663
  116  39.202611     10.0.0.1 → 10.0.0.2     TCP 2066 55943 → 42968 [PSH, ACK] Seq=2038 Ack=1 Win=37888 Len=2000 TSval=1758595583 TSecr=1886573667
  117  39.206756     10.0.0.1 → 10.0.0.2     TCP 2066 48193 → 59433 [PSH, ACK] Seq=14038 Ack=1 Win=37888 Len=2000 TSval=1758595587 TSecr=1886573672
  118  39.207463     10.0.0.1 → 10.0.0.2     TCP 1066 58169 → 25904 [PSH, ACK] Seq=4038 Ack=1 Win=37888 Len=1000 TSval=1758595588 TSecr=1886573661
  119  39.211054     10.0.0.1 → 10.0.0.2     TCP 2066 19551 → 35722 [PSH, ACK] Seq=19038 Ack=1 Win=37888 Len=2000 TSval=1758595592 TSecr=1886573676
  120  39.213543     10.0.0.1 → 10.0.0.2     TCP 1066 48193 → 59433 [PSH, ACK] Seq=16038 Ack=1 Win=37888 Len=1000 TSval=1758595594 TSecr=1886573673
  121  39.217291     10.0.0.1 → 10.0.0.2     TCP 2066 53241 → 47452 [PSH, ACK] Seq=3038 Ack=1 Win=37888 Len=2000 TSval=1758595598 TSecr=1886573681
  122  39.220125     10.0.0.1 → 10.0.0.2     TCP 2066 55246 → 6776 [PSH, ACK] Seq=3038 Ack=1 Win=37888 Len=2000 TSval=1758595601 TSecr=1886573685
  123  39.220462     10.0.0.1 → 10.0.0.2     TCP 1066 53241 → 47452 [PSH, ACK] Seq=5038 Ack=1 Win=37888 Len=1000 TSval=1758595601 TSecr=1886573684
  124  39.225018     10.0.0.1 → 10.0.0.2     TCP 2066 32720 → 40783 [PSH, ACK] Seq=4038 Ack=1 Win=37888 Len=2000 TSval=1758595606 TSecr=1886573690
  125  39.226541     10.0.0.1 → 10.0.0.2     TCP 1066 48193 → 59433 [PSH, ACK] Seq=17038 Ack=1 Win=37888 Len=1000 TSval=1758595607 TSecr=1886573681
  126  39.229879     10.0.0.1 → 10.0.0.2     TCP 1066 55246 → 6776 [PSH, ACK] Seq=5038 Ack=1 Win=37888 Len=1000 TSval=1758595611 TSecr=1886573687
  127  39.236128     10.0.0.1 → 10.0.0.2     TCP 3066 54368 → 46356 [PSH, ACK] Seq=4038 Ack=1 Win=37888 Len=3000 TSval=1758595617 TSecr=1886573701
  128  39.242881     10.0.0.1 → 10.0.0.2     TCP 1066 55246 → 6776 [PSH, ACK] Seq=6038 Ack=1 Win=37888 Len=1000 TSval=1758595624 TSecr=1886573696
  129  39.248423     10.0.0.1 → 10.0.0.2     TCP 3066 55943 → 42968 [PSH, ACK] Seq=4038 Ack=1 Win=37888 Len=3000 TSval=1758595629 TSecr=1886573713
  130  39.249039     10.0.0.1 → 10.0.0.2     TCP 1066 54368 → 46356 [PSH, ACK] Seq=7038 Ack=1 Win=37888 Len=1000 TSval=1758595630 TSecr=1886573703
  131  39.256906     10.0.0.1 → 10.0.0.2     TCP 3066 58169 → 25904 [PSH, ACK] Seq=5038 Ack=1 Win=37888 Len=3000 TSval=1758595638 TSecr=1886573722
  132  39.260962     10.0.0.1 → 10.0.0.2     TCP 4066 19551 → 35722 [PSH, ACK] Seq=21038 Ack=1 Win=37888 Len=4000 TSval=1758595642 TSecr=1886573726
  133  39.269130     10.0.0.1 → 10.0.0.2     TCP 3066 53241 → 47452 [PSH, ACK] Seq=6038 Ack=1 Win=37888 Len=3000 TSval=1758595650 TSecr=1886573734
  134  39.270467     10.0.0.1 → 10.0.0.2     TCP 1066 19551 → 35722 [PSH, ACK] Seq=25038 Ack=1 Win=37888 Len=1000 TSval=1758595651 TSecr=1886573728
  135  39.273437     10.0.0.1 → 10.0.0.2     TCP 3066 32720 → 40783 [PSH, ACK] Seq=6038 Ack=1 Win=37888 Len=3000 TSval=1758595654 TSecr=1886573738
  136  39.273456     10.0.0.1 → 10.0.0.2     TCP 1066 53241 → 47452 [PSH, ACK] Seq=9038 Ack=1 Win=37888 Len=1000 TSval=1758595654 TSecr=1886573736
  137  39.281925     10.0.0.1 → 10.0.0.2     TCP 4066 48193 → 59433 [PSH, ACK] Seq=18038 Ack=1 Win=37888 Len=4000 TSval=1758595663 TSecr=1886573747
  138  39.283464     10.0.0.1 → 10.0.0.2     TCP 1066 19551 → 35722 [PSH, ACK] Seq=26038 Ack=1 Win=37888 Len=1000 TSval=1758595664 TSecr=1886573739
  139  39.286071     10.0.0.1 → 10.0.0.2     TCP 3066 55246 → 6776 [PSH, ACK] Seq=7038 Ack=1 Win=37888 Len=3000 TSval=1758595667 TSecr=1886573751
  140  39.287458     10.0.0.1 → 10.0.0.2     TCP 1066 53241 → 47452 [PSH, ACK] Seq=10038 Ack=1 Win=37888 Len=1000 TSval=1758595668 TSecr=1886573741
  141  39.290325     10.0.0.1 → 10.0.0.2     TCP 4066 55943 → 42968 [PSH, ACK] Seq=7038 Ack=1 Win=37888 Len=4000 TSval=1758595671 TSecr=1886573755
  142  39.302056     10.0.0.1 → 10.0.0.2     TCP 1066 55943 → 42968 [PSH, ACK] Seq=11038 Ack=1 Win=37888 Len=1000 TSval=1758595683 TSecr=1886573757
  143  39.302916     10.0.0.1 → 10.0.0.2     TCP 4066 54368 → 46356 [PSH, ACK] Seq=8038 Ack=1 Win=37888 Len=4000 TSval=1758595684 TSecr=1886573767
  144  39.306757     10.0.0.1 → 10.0.0.2     TCP 4066 58169 → 25904 [PSH, ACK] Seq=8038 Ack=1 Win=37888 Len=4000 TSval=1758595687 TSecr=1886573772
  145  39.318902     10.0.0.1 → 10.0.0.2     TCP 4066 32720 → 40783 [PSH, ACK] Seq=9038 Ack=1 Win=37888 Len=4000 TSval=1758595700 TSecr=1886573784
  146  39.331208     10.0.0.1 → 10.0.0.2     TCP 3066 48193 → 59433 [PSH, ACK] Seq=22038 Ack=1 Win=37888 Len=3000 TSval=1758595712 TSecr=1886573796
  147  39.333768     10.0.0.1 → 10.0.0.2     TCP 1066 48193 → 59433 [PSH, ACK] Seq=25038 Ack=1 Win=37888 Len=1000 TSval=1758595714 TSecr=1886573798
  148  39.347911     10.0.0.1 → 10.0.0.2     TCP 4066 19551 → 35722 [PSH, ACK] Seq=27038 Ack=1 Win=37888 Len=4000 TSval=1758595729 TSecr=1886573813
  149  39.351915     10.0.0.1 → 10.0.0.2     TCP 5066 55246 → 6776 [PSH, ACK] Seq=10038 Ack=1 Win=37888 Len=5000 TSval=1758595733 TSecr=1886573817
  150  39.362965     10.0.0.1 → 10.0.0.2     TCP 1066 55246 → 6776 [PSH, ACK] Seq=15038 Ack=1 Win=37888 Len=1000 TSval=1758595744 TSecr=1886573818
  151  39.367821     10.0.0.1 → 10.0.0.2     TCP 6066 53241 → 47452 [PSH, ACK] Seq=11038 Ack=1 Win=37888 Len=6000 TSval=1758595748 TSecr=1886573832
  152  39.369031     10.0.0.1 → 10.0.0.2     TCP 4066 55943 → 42968 [PSH, ACK] Seq=12038 Ack=1 Win=37888 Len=4000 TSval=1758595750 TSecr=1886573833
  153  39.372608     10.0.0.1 → 10.0.0.2     TCP 5066 54368 → 46356 [PSH, ACK] Seq=12038 Ack=1 Win=37888 Len=5000 TSval=1758595753 TSecr=1886573838
  154  39.382045     10.0.0.1 → 10.0.0.2     TCP 1066 54368 → 46356 [PSH, ACK] Seq=17038 Ack=1 Win=37888 Len=1000 TSval=1758595763 TSecr=1886573839
  155  39.389025     10.0.0.1 → 10.0.0.2     TCP 6066 58169 → 25904 [PSH, ACK] Seq=12038 Ack=1 Win=37888 Len=6000 TSval=1758595770 TSecr=1886573854
  156  39.393558     10.0.0.1 → 10.0.0.2     TCP 1066 58169 → 25904 [PSH, ACK] Seq=18038 Ack=1 Win=37888 Len=1000 TSval=1758595774 TSecr=1886573855
  157  39.395040     10.0.0.1 → 10.0.0.2     TCP 1066 54368 → 46356 [PSH, ACK] Seq=18038 Ack=1 Win=37888 Len=1000 TSval=1758595776 TSecr=1886573849
  158  39.405151     10.0.0.1 → 10.0.0.2     TCP 6066 32720 → 40783 [PSH, ACK] Seq=13038 Ack=1 Win=37888 Len=6000 TSval=1758595786 TSecr=1886573870
  159  39.407564     10.0.0.1 → 10.0.0.2     TCP 1066 58169 → 25904 [PSH, ACK] Seq=19038 Ack=1 Win=37888 Len=1000 TSval=1758595788 TSecr=1886573864
  160  39.407580     10.0.0.1 → 10.0.0.2     TCP 1066 32720 → 40783 [PSH, ACK] Seq=19038 Ack=1 Win=37888 Len=1000 TSval=1758595788 TSecr=1886573872
  161  39.408957     10.0.0.1 → 10.0.0.2     TCP 1066 54368 → 46356 [PSH, ACK] Seq=19038 Ack=1 Win=37888 Len=1000 TSval=1758595790 TSecr=1886573867
  162  39.420543     10.0.0.1 → 10.0.0.2     TCP 1066 32720 → 40783 [PSH, ACK] Seq=20038 Ack=1 Win=37888 Len=1000 TSval=1758595801 TSecr=1886573881
  163  39.422808     10.0.0.1 → 10.0.0.2     TCP 6066 48193 → 59433 [PSH, ACK] Seq=26038 Ack=1 Win=37888 Len=6000 TSval=1758595803 TSecr=1886573886
  164  39.425751     10.0.0.1 → 10.0.0.2     TCP 6066 19551 → 35722 [PSH, ACK] Seq=31038 Ack=1 Win=37888 Len=6000 TSval=1758595806 TSecr=1886573891
  165  39.430562     10.0.0.1 → 10.0.0.2     TCP 1066 19551 → 35722 [PSH, ACK] Seq=37038 Ack=1 Win=37888 Len=1000 TSval=1758595811 TSecr=1886573892
  166  39.442018     10.0.0.1 → 10.0.0.2     TCP 5066 55246 → 6776 [PSH, ACK] Seq=16038 Ack=1 Win=37888 Len=5000 TSval=1758595823 TSecr=1886573907
  167  39.443748     10.0.0.1 → 10.0.0.2     TCP 1066 19551 → 35722 [PSH, ACK] Seq=38038 Ack=1 Win=37888 Len=1000 TSval=1758595824 TSecr=1886573901
  168  39.446650     10.0.0.1 → 10.0.0.2     TCP 5066 53241 → 47452 [PSH, ACK] Seq=17038 Ack=1 Win=37888 Len=5000 TSval=1758595827 TSecr=1886573911
  169  39.448311     10.0.0.1 → 10.0.0.2     TCP 1066 53241 → 47452 [PSH, ACK] Seq=22038 Ack=1 Win=37888 Len=1000 TSval=1758595829 TSecr=1886573913
  170  39.456509     10.0.0.1 → 10.0.0.2     TCP 1066 19551 → 35722 [PSH, ACK] Seq=39038 Ack=1 Win=37888 Len=1000 TSval=1758595837 TSecr=1886573912
  171  39.460744     10.0.0.1 → 10.0.0.2     TCP 1066 53241 → 47452 [PSH, ACK] Seq=23038 Ack=1 Win=37888 Len=1000 TSval=1758595841 TSecr=1886573920
  172  39.470464     10.0.0.1 → 10.0.0.2     TCP 1066 19551 → 35722 [PSH, ACK] Seq=40038 Ack=1 Win=37888 Len=1000 TSval=1758595851 TSecr=1886573923
  173  39.470524     10.0.0.1 → 10.0.0.2     TCP 8066 55943 → 42968 [PSH, ACK] Seq=16038 Ack=1 Win=37888 Len=8000 TSval=1758595851 TSecr=1886573935
  174  39.473491     10.0.0.1 → 10.0.0.2     TCP 1066 53241 → 47452 [PSH, ACK] Seq=24038 Ack=1 Win=37888 Len=1000 TSval=1758595854 TSecr=1886573927
  175  39.476988     10.0.0.1 → 10.0.0.2     TCP 1066 55943 → 42968 [PSH, ACK] Seq=24038 Ack=1 Win=37888 Len=1000 TSval=1758595858 TSecr=1886573941
  176  39.483595     10.0.0.1 → 10.0.0.2     TCP 1066 19551 → 35722 [PSH, ACK] Seq=41038 Ack=1 Win=37888 Len=1000 TSval=1758595864 TSecr=1886573940
  177  39.486809     10.0.0.1 → 10.0.0.2     TCP 5066 58169 → 25904 [PSH, ACK] Seq=20038 Ack=1 Win=37888 Len=5000 TSval=1758595867 TSecr=1886573952
  178  39.488652     10.0.0.1 → 10.0.0.2     TCP 1066 53241 → 47452 [PSH, ACK] Seq=25038 Ack=1 Win=37888 Len=1000 TSval=1758595869 TSecr=1886573953
  179  39.490624     10.0.0.1 → 10.0.0.2     TCP 1066 55943 → 42968 [PSH, ACK] Seq=25038 Ack=1 Win=37888 Len=1000 TSval=1758595871 TSecr=1886573955
  180  39.493382     10.0.0.1 → 10.0.0.2     TCP 6066 54368 → 46356 [PSH, ACK] Seq=20038 Ack=1 Win=37888 Len=6000 TSval=1758595874 TSecr=1886573956
  181  39.494325     10.0.0.1 → 10.0.0.2     TCP 1066 58169 → 25904 [PSH, ACK] Seq=25038 Ack=1 Win=37888 Len=1000 TSval=1758595875 TSecr=1886573958
  182  39.497959     10.0.0.1 → 10.0.0.2     TCP 5066 32720 → 40783 [PSH, ACK] Seq=21038 Ack=1 Win=37888 Len=5000 TSval=1758595879 TSecr=1886573961
  183  39.500105     10.0.0.1 → 10.0.0.2     TCP 6066 48193 → 59433 [PSH, ACK] Seq=32038 Ack=1 Win=37888 Len=6000 TSval=1758595881 TSecr=1886573965
  184  39.502333     10.0.0.1 → 10.0.0.2     TCP 1066 54368 → 46356 [PSH, ACK] Seq=26038 Ack=1 Win=37888 Len=1000 TSval=1758595883 TSecr=1886573967
  185  39.514347     10.0.0.1 → 10.0.0.2     TCP 2066 58169 → 25904 [PSH, ACK] Seq=26038 Ack=1 Win=37888 Len=2000 TSval=1758595895 TSecr=1886573979
  186  39.516399     10.0.0.1 → 10.0.0.2     TCP 2066 32720 → 40783 [PSH, ACK] Seq=26038 Ack=1 Win=37888 Len=2000 TSval=1758595897 TSecr=1886573981
  187  39.523864     10.0.0.1 → 10.0.0.2     TCP 7066 55246 → 6776 [PSH, ACK] Seq=21038 Ack=1 Win=37888 Len=7000 TSval=1758595905 TSecr=1886573989
  188  39.526542     10.0.0.1 → 10.0.0.2     TCP 2066 48193 → 59433 [PSH, ACK] Seq=38038 Ack=1 Win=37888 Len=2000 TSval=1758595907 TSecr=1886573991
  189  39.538609     10.0.0.1 → 10.0.0.2     TCP 2066 54368 → 46356 [PSH, ACK] Seq=27038 Ack=1 Win=37888 Len=2000 TSval=1758595919 TSecr=1886574004
  190  39.540781     10.0.0.1 → 10.0.0.2     TCP 2066 58169 → 25904 [PSH, ACK] Seq=28038 Ack=1 Win=37888 Len=2000 TSval=1758595921 TSecr=1886574006
  191  39.544089     10.0.0.1 → 10.0.0.2     TCP 4066 19551 → 35722 [PSH, ACK] Seq=42038 Ack=1 Win=37888 Len=4000 TSval=1758595925 TSecr=1886574009
  192  39.545340     10.0.0.1 → 10.0.0.2     TCP 1066 55246 → 6776 [PSH, ACK] Seq=28038 Ack=1 Win=37888 Len=1000 TSval=1758595926 TSecr=1886574010
  193  39.548230     10.0.0.1 → 10.0.0.2     TCP 4066 53241 → 47452 [PSH, ACK] Seq=26038 Ack=1 Win=37888 Len=4000 TSval=1758595929 TSecr=1886574013
  194  39.553401     10.0.0.1 → 10.0.0.2     TCP 4066 55943 → 42968 [PSH, ACK] Seq=26038 Ack=1 Win=37888 Len=4000 TSval=1758595934 TSecr=1886574017
  195  39.556809     10.0.0.1 → 10.0.0.2     TCP 3066 32720 → 40783 [PSH, ACK] Seq=28038 Ack=1 Win=37888 Len=3000 TSval=1758595937 TSecr=1886574022
  196  39.559113     10.0.0.1 → 10.0.0.2     TCP 2066 54368 → 46356 [PSH, ACK] Seq=29038 Ack=1 Win=37888 Len=2000 TSval=1758595940 TSecr=1886574024
  197  39.563161     10.0.0.1 → 10.0.0.2     TCP 1066 19551 → 35722 [PSH, ACK] Seq=46038 Ack=1 Win=37888 Len=1000 TSval=1758595944 TSecr=1886574028
  198  39.565553     10.0.0.1 → 10.0.0.2     TCP 3066 48193 → 59433 [PSH, ACK] Seq=40038 Ack=1 Win=37888 Len=3000 TSval=1758595946 TSecr=1886574030
  199  39.571306     10.0.0.1 → 10.0.0.2     TCP 2066 53241 → 47452 [PSH, ACK] Seq=30038 Ack=1 Win=37888 Len=2000 TSval=1758595952 TSecr=1886574036
  200  39.573337     10.0.0.1 → 10.0.0.2     TCP 2066 58169 → 25904 [PSH, ACK] Seq=30038 Ack=1 Win=37888 Len=2000 TSval=1758595954 TSecr=1886574038
  201  39.579538     10.0.0.1 → 10.0.0.2     TCP 2066 19551 → 35722 [PSH, ACK] Seq=47038 Ack=1 Win=37888 Len=2000 TSval=1758595960 TSecr=1886574044
  202  39.581830     10.0.0.1 → 10.0.0.2     TCP 1066 48193 → 59433 [PSH, ACK] Seq=43038 Ack=1 Win=37888 Len=1000 TSval=1758595962 TSecr=1886574046
  203  39.582362     10.0.0.1 → 10.0.0.2     TCP 3066 55246 → 6776 [PSH, ACK] Seq=29038 Ack=1 Win=37888 Len=3000 TSval=1758595963 TSecr=1886574047
  204  39.585859     10.0.0.1 → 10.0.0.2     TCP 3066 55943 → 42968 [PSH, ACK] Seq=30038 Ack=1 Win=37888 Len=3000 TSval=1758595967 TSecr=1886574051
  205  39.587709     10.0.0.1 → 10.0.0.2     TCP 1066 53241 → 47452 [PSH, ACK] Seq=32038 Ack=1 Win=37888 Len=1000 TSval=1758595968 TSecr=1886574053
  206  39.595050     10.0.0.1 → 10.0.0.2     TCP 1066 55943 → 42968 [PSH, ACK] Seq=33038 Ack=1 Win=37888 Len=1000 TSval=1758595976 TSecr=1886574057
  207  39.597942     10.0.0.1 → 10.0.0.2     TCP 1066 53241 → 47452 [PSH, ACK] Seq=33038 Ack=1 Win=37888 Len=1000 TSval=1758595979 TSecr=1886574063
  208  39.602329     10.0.0.1 → 10.0.0.2     TCP 3066 32720 → 40783 [PSH, ACK] Seq=31038 Ack=1 Win=37888 Len=3000 TSval=1758595983 TSecr=1886574067
  209  39.607563     10.0.0.1 → 10.0.0.2     TCP 1066 32720 → 40783 [PSH, ACK] Seq=34038 Ack=1 Win=37888 Len=1000 TSval=1758595988 TSecr=1886574069
  210  39.609059     10.0.0.1 → 10.0.0.2     TCP 1066 55943 → 42968 [PSH, ACK] Seq=34038 Ack=1 Win=37888 Len=1000 TSval=1758595990 TSecr=1886574065
  211  39.614576     10.0.0.1 → 10.0.0.2     TCP 4066 54368 → 46356 [PSH, ACK] Seq=31038 Ack=1 Win=37888 Len=4000 TSval=1758595995 TSecr=1886574079
  212  39.622842     10.0.0.1 → 10.0.0.2     TCP 4066 58169 → 25904 [PSH, ACK] Seq=32038 Ack=1 Win=37888 Len=4000 TSval=1758596004 TSecr=1886574088
  213  39.630983     10.0.0.1 → 10.0.0.2     TCP 4066 19551 → 35722 [PSH, ACK] Seq=49038 Ack=1 Win=37888 Len=4000 TSval=1758596012 TSecr=1886574096
  214  39.633520     10.0.0.1 → 10.0.0.2     TCP 1066 58169 → 25904 [PSH, ACK] Seq=36038 Ack=1 Win=37888 Len=1000 TSval=1758596014 TSecr=1886574089
  215  39.639245     10.0.0.1 → 10.0.0.2     TCP 4066 48193 → 59433 [PSH, ACK] Seq=44038 Ack=1 Win=37888 Len=4000 TSval=1758596020 TSecr=1886574104
  216  39.641443     10.0.0.1 → 10.0.0.2     TCP 1066 48193 → 59433 [PSH, ACK] Seq=48038 Ack=1 Win=37888 Len=1000 TSval=1758596022 TSecr=1886574106
  217  39.643462     10.0.0.1 → 10.0.0.2     TCP 1066 19551 → 35722 [PSH, ACK] Seq=53038 Ack=1 Win=37888 Len=1000 TSval=1758596024 TSecr=1886574097
  218  39.643544     10.0.0.1 → 10.0.0.2     TCP 5066 55246 → 6776 [PSH, ACK] Seq=32038 Ack=1 Win=37888 Len=5000 TSval=1758596024 TSecr=1886574108
  219  39.644828     10.0.0.1 → 10.0.0.2     TCP 3066 53241 → 47452 [PSH, ACK] Seq=34038 Ack=1 Win=37888 Len=3000 TSval=1758596025 TSecr=1886574110
  220  39.653521     10.0.0.1 → 10.0.0.2     TCP 1066 48193 → 59433 [PSH, ACK] Seq=49038 Ack=1 Win=37888 Len=1000 TSval=1758596034 TSecr=1886574111
  221  39.655951     10.0.0.1 → 10.0.0.2     TCP 3066 32720 → 40783 [PSH, ACK] Seq=35038 Ack=1 Win=37888 Len=3000 TSval=1758596037 TSecr=1886574121
  222  39.656504     10.0.0.1 → 10.0.0.2     TCP 1066 19551 → 35722 [PSH, ACK] Seq=54038 Ack=1 Win=37888 Len=1000 TSval=1758596037 TSecr=1886574113
  223  39.656885     10.0.0.1 → 10.0.0.2     TCP 1066 55246 → 6776 [PSH, ACK] Seq=37038 Ack=1 Win=37888 Len=1000 TSval=1758596038 TSecr=1886574115
  224  39.661002     10.0.0.1 → 10.0.0.2     TCP 3066 55943 → 42968 [PSH, ACK] Seq=35038 Ack=1 Win=37888 Len=3000 TSval=1758596042 TSecr=1886574125
  225  39.661674     10.0.0.1 → 10.0.0.2     TCP 2066 53241 → 47452 [PSH, ACK] Seq=37038 Ack=1 Win=37888 Len=2000 TSval=1758596042 TSecr=1886574126
  226  39.664297     10.0.0.1 → 10.0.0.2     TCP 4066 54368 → 46356 [PSH, ACK] Seq=35038 Ack=1 Win=37888 Len=4000 TSval=1758596045 TSecr=1886574129
  227  39.668429     10.0.0.1 → 10.0.0.2     TCP 1066 55943 → 42968 [PSH, ACK] Seq=38038 Ack=1 Win=37888 Len=1000 TSval=1758596049 TSecr=1886574133
  228  39.674484     10.0.0.1 → 10.0.0.2     TCP 1066 53241 → 47452 [PSH, ACK] Seq=39038 Ack=1 Win=37888 Len=1000 TSval=1758596055 TSecr=1886574139
  229  39.678736     10.0.0.1 → 10.0.0.2     TCP 1066 54368 → 46356 [PSH, ACK] Seq=39038 Ack=1 Win=37888 Len=1000 TSval=1758596059 TSecr=1886574144
  230  39.680567     10.0.0.1 → 10.0.0.2     TCP 3066 58169 → 25904 [PSH, ACK] Seq=37038 Ack=1 Win=37888 Len=3000 TSval=1758596061 TSecr=1886574145
  231  39.684846     10.0.0.1 → 10.0.0.2     TCP 2066 32720 → 40783 [PSH, ACK] Seq=38038 Ack=1 Win=37888 Len=2000 TSval=1758596066 TSecr=1886574150
  232  39.686830     10.0.0.1 → 10.0.0.2     TCP 1066 55943 → 42968 [PSH, ACK] Seq=39038 Ack=1 Win=37888 Len=1000 TSval=1758596067 TSecr=1886574152
  233  39.689048     10.0.0.1 → 10.0.0.2     TCP 1066 54368 → 46356 [PSH, ACK] Seq=40038 Ack=1 Win=37888 Len=1000 TSval=1758596070 TSecr=1886574154
  234  39.691111     10.0.0.1 → 10.0.0.2     TCP 1066 58169 → 25904 [PSH, ACK] Seq=40038 Ack=1 Win=37888 Len=1000 TSval=1758596072 TSecr=1886574156
  235  39.700470     10.0.0.1 → 10.0.0.2     TCP 1066 58169 → 25904 [PSH, ACK] Seq=41038 Ack=1 Win=37888 Len=1000 TSval=1758596081 TSecr=1886574164
  236  39.701737     10.0.0.1 → 10.0.0.2     TCP 3066 55246 → 6776 [PSH, ACK] Seq=38038 Ack=1 Win=37888 Len=3000 TSval=1758596082 TSecr=1886574166
  237  39.705677     10.0.0.1 → 10.0.0.2     TCP 2066 53241 → 47452 [PSH, ACK] Seq=40038 Ack=1 Win=37888 Len=2000 TSval=1758596086 TSecr=1886574171
  238  39.708725     10.0.0.1 → 10.0.0.2     TCP 4066 48193 → 59433 [PSH, ACK] Seq=50038 Ack=1 Win=37888 Len=4000 TSval=1758596089 TSecr=1886574174
  239  39.709880     10.0.0.1 → 10.0.0.2     TCP 1066 55246 → 6776 [PSH, ACK] Seq=41038 Ack=1 Win=37888 Len=1000 TSval=1758596091 TSecr=1886574168
  240  39.710470     10.0.0.1 → 10.0.0.2     TCP 2066 32720 → 40783 [PSH, ACK] Seq=40038 Ack=1 Win=37888 Len=2000 TSval=1758596091 TSecr=1886574175
  241  39.722921     10.0.0.1 → 10.0.0.2     TCP 1066 55246 → 6776 [PSH, ACK] Seq=42038 Ack=1 Win=37888 Len=1000 TSval=1758596104 TSecr=1886574177
  242  39.726643     10.0.0.1 → 10.0.0.2     TCP 1066 53241 → 47452 [PSH, ACK] Seq=42038 Ack=1 Win=37888 Len=1000 TSval=1758596107 TSecr=1886574192
  243  39.728107     10.0.0.1 → 10.0.0.2     TCP 1066 53241 → 47452 [PSH, ACK] Seq=43038 Ack=1 Win=37888 Len=1000 TSval=1758596109 TSecr=1886574193
  244  39.734954     10.0.0.1 → 10.0.0.2     TCP 2066 48193 → 59433 [PSH, ACK] Seq=54038 Ack=1 Win=37888 Len=2000 TSval=1758596116 TSecr=1886574200
  245  39.745346     10.0.0.1 → 10.0.0.2     TCP 5066 55943 → 42968 [PSH, ACK] Seq=40038 Ack=1 Win=37888 Len=5000 TSval=1758596126 TSecr=1886574210
  246  39.746010     10.0.0.1 → 10.0.0.2     TCP 6066 19551 → 35722 [PSH, ACK] Seq=55038 Ack=1 Win=37888 Len=6000 TSval=1758596127 TSecr=1886574210
  247  39.768866     10.0.0.1 → 10.0.0.2     TCP 2066 48193 → 59433 [PSH, ACK] Seq=56038 Ack=1 Win=37888 Len=2000 TSval=1758596150 TSecr=1886574233
  248  39.770237     10.0.0.1 → 10.0.0.2     TCP 5066 58169 → 25904 [PSH, ACK] Seq=42038 Ack=1 Win=37888 Len=5000 TSval=1758596151 TSecr=1886574234
  249  39.778226     10.0.0.1 → 10.0.0.2     TCP 6066 54368 → 46356 [PSH, ACK] Seq=41038 Ack=1 Win=37888 Len=6000 TSval=1758596159 TSecr=1886574234
  250  39.788756     10.0.0.1 → 10.0.0.2     TCP 3066 55943 → 42968 [PSH, ACK] Seq=45038 Ack=1 Win=37888 Len=3000 TSval=1758596169 TSecr=1886574251
  251  39.792531     10.0.0.1 → 10.0.0.2     TCP 1066 54368 → 46356 [PSH, ACK] Seq=47038 Ack=1 Win=37888 Len=1000 TSval=1758596173 TSecr=1886574253
  252  39.793199     10.0.0.1 → 10.0.0.2     TCP 6066 32720 → 40783 [PSH, ACK] Seq=42038 Ack=1 Win=37888 Len=6000 TSval=1758596174 TSecr=1886574258
  253  39.798858     10.0.0.1 → 10.0.0.2     TCP 4066 19551 → 35722 [PSH, ACK] Seq=61038 Ack=1 Win=37888 Len=4000 TSval=1758596180 TSecr=1886574261
  254  39.801392     10.0.0.1 → 10.0.0.2     TCP 5066 55246 → 6776 [PSH, ACK] Seq=43038 Ack=1 Win=37888 Len=5000 TSval=1758596182 TSecr=1886574266
  255  39.803471     10.0.0.1 → 10.0.0.2     TCP 1066 19551 → 35722 [PSH, ACK] Seq=65038 Ack=1 Win=37888 Len=1000 TSval=1758596184 TSecr=1886574268
  256  39.804665     10.0.0.1 → 10.0.0.2     TCP 5066 53241 → 47452 [PSH, ACK] Seq=44038 Ack=1 Win=37888 Len=5000 TSval=1758596185 TSecr=1886574270
  257  39.807683     10.0.0.1 → 10.0.0.2     TCP 1066 55246 → 6776 [PSH, ACK] Seq=48038 Ack=1 Win=37888 Len=1000 TSval=1758596188 TSecr=1886574272
  258  39.822205     10.0.0.1 → 10.0.0.2     TCP 4066 58169 → 25904 [PSH, ACK] Seq=47038 Ack=1 Win=37888 Len=4000 TSval=1758596203 TSecr=1886574286
  259  39.864327     10.0.0.1 → 10.0.0.2     TCP 7066 48193 → 59433 [PSH, ACK] Seq=58038 Ack=1 Win=37888 Len=7000 TSval=1758596245 TSecr=1886574322
  260  39.869843     10.0.0.1 → 10.0.0.2     TCP 6066 55943 → 42968 [PSH, ACK] Seq=48038 Ack=1 Win=37888 Len=6000 TSval=1758596250 TSecr=1886574325
  261  39.874212     10.0.0.1 → 10.0.0.2     TCP 6066 54368 → 46356 [PSH, ACK] Seq=48038 Ack=1 Win=37888 Len=6000 TSval=1758596255 TSecr=1886574328
  262  39.879381     10.0.0.1 → 10.0.0.2     TCP 7066 32720 → 40783 [PSH, ACK] Seq=48038 Ack=1 Win=37888 Len=7000 TSval=1758596260 TSecr=1886574340
  263  39.881452     10.0.0.1 → 10.0.0.2     TCP 1066 55943 → 42968 [PSH, ACK] Seq=54038 Ack=1 Win=37888 Len=1000 TSval=1758596262 TSecr=1886574340
  264  39.884072     10.0.0.1 → 10.0.0.2     TCP 1066 54368 → 46356 [PSH, ACK] Seq=54038 Ack=1 Win=37888 Len=1000 TSval=1758596265 TSecr=1886574348
  265  39.888383     10.0.0.1 → 10.0.0.2     TCP 6066 19551 → 35722 [PSH, ACK] Seq=66038 Ack=1 Win=37888 Len=6000 TSval=1758596269 TSecr=1886574353
  266  39.893982     10.0.0.1 → 10.0.0.2     TCP 7066 53241 → 47452 [PSH, ACK] Seq=49038 Ack=1 Win=37888 Len=7000 TSval=1758596275 TSecr=1886574358
  267  39.896951     10.0.0.1 → 10.0.0.2     TCP 1066 19551 → 35722 [PSH, ACK] Seq=72038 Ack=1 Win=37888 Len=1000 TSval=1758596278 TSecr=1886574360
  268  39.919165     10.0.0.1 → 10.0.0.2     TCP 8066 55246 → 6776 [PSH, ACK] Seq=49038 Ack=1 Win=37888 Len=8000 TSval=1758596300 TSecr=1886574379
  269  39.923664     10.0.0.1 → 10.0.0.2     TCP 7066 58169 → 25904 [PSH, ACK] Seq=51038 Ack=1 Win=37888 Len=7000 TSval=1758596304 TSecr=1886574387
  270  39.927493     10.0.0.1 → 10.0.0.2     TCP 1066 58169 → 25904 [PSH, ACK] Seq=58038 Ack=1 Win=37888 Len=1000 TSval=1758596308 TSecr=1886574391
  271  39.934010     10.0.0.1 → 10.0.0.2     TCP 6066 48193 → 59433 [PSH, ACK] Seq=65038 Ack=1 Win=37888 Len=6000 TSval=1758596315 TSecr=1886574399
  272  39.940517     10.0.0.1 → 10.0.0.2     TCP 1066 58169 → 25904 [PSH, ACK] Seq=59038 Ack=1 Win=37888 Len=1000 TSval=1758596321 TSecr=1886574402
  273  39.946580     10.0.0.1 → 10.0.0.2     TCP 1066 48193 → 59433 [PSH, ACK] Seq=71038 Ack=1 Win=37888 Len=1000 TSval=1758596327 TSecr=1886574404
  274  39.959551     10.0.0.1 → 10.0.0.2     TCP 1066 48193 → 59433 [PSH, ACK] Seq=72038 Ack=1 Win=37888 Len=1000 TSval=1758596340 TSecr=1886574419
  275  39.961765     10.0.0.1 → 10.0.0.2     TCP 6066 32720 → 40783 [PSH, ACK] Seq=55038 Ack=1 Win=37888 Len=6000 TSval=1758596342 TSecr=1886574427
  276  39.967523     10.0.0.1 → 10.0.0.2     TCP 1066 32720 → 40783 [PSH, ACK] Seq=61038 Ack=1 Win=37888 Len=1000 TSval=1758596348 TSecr=1886574428
