    1   0.000000           :: → ff02::16     ICMPv6 90 Multicast Listener Report Message v2
    2  -0.000003           :: → ff02::16     ICMPv6 90 Multicast Listener Report Message v2
    3  38.742789     10.0.0.2 → 10.0.0.1     TCP 67 35722 → 42763 [PSH, ACK] Seq=1 Ack=1 Win=74 Len=1 TSval=1886573267 TSecr=1758595179
    4  38.744872     10.0.0.2 → 10.0.0.1     TCP 66 59433 → 36467 [ACK] Seq=1 Ack=1 Win=74 Len=0 TSval=1886573270 TSecr=1758595183
    5  38.757296     10.0.0.2 → 10.0.0.1     TCP 74 47452 → 39475 [SYN, ACK] Seq=0 Ack=1 Win=37792 Len=0 MSS=9460 SACK_PERM TSval=1886573281 TSecr=1758595195 WS=512
    6  38.762746     10.0.0.2 → 10.0.0.1     TCP 74 25904 → 51099 [SYN, ACK] Seq=0 Ack=1 Win=37792 Len=0 MSS=9460 SACK_PERM TSval=1886573285 TSecr=1758595198 WS=512
    7  38.762813     10.0.0.2 → 10.0.0.1     TCP 74 40783 → 58271 [SYN, ACK] Seq=0 Ack=1 Win=37792 Len=0 MSS=9460 SACK_PERM TSval=1886573285 TSecr=1758595198 WS=512
    8  38.770251     10.0.0.2 → 10.0.0.1     TCP 66 47452 → 39475 [ACK] Seq=1 Ack=38 Win=37888 Len=0 TSval=1886573293 TSecr=1758595203
    9  38.770614     10.0.0.2 → 10.0.0.1     TCP 67 47452 → 39475 [PSH, ACK] Seq=1 Ack=38 Win=37888 Len=1 TSval=1886573293 TSecr=1758595203
   10  38.774101     10.0.0.2 → 10.0.0.1     TCP 74 46356 → 47085 [SYN, ACK] Seq=0 Ack=1 Win=37792 Len=0 MSS=9460 SACK_PERM TSval=1886573296 TSecr=1758595206 WS=512
   11  38.774613     10.0.0.2 → 10.0.0.1     TCP 66 40783 → 58271 [ACK] Seq=1 Ack=38 Win=37888 Len=0 TSval=1886573298 TSecr=1758595208
   12  38.775975     10.0.0.2 → 10.0.0.1     TCP 66 [TCP Previous segment not captured] 40783 → 58271 [ACK] Seq=2 Ack=38 Win=37888 Len=0 TSval=1886573298 TSecr=1758595208
   13  38.777172     10.0.0.2 → 10.0.0.1     TCP 66 25904 → 51099 [ACK] Seq=1 Ack=38 Win=37888 Len=0 TSval=1886573298 TSecr=1758595208
   14  38.783751     10.0.0.2 → 10.0.0.1     TCP 66 42968 → 49189 [ACK] Seq=1 Ack=1 Win=74 Len=0 TSval=1886573308 TSecr=1758595217
   15  38.784093     10.0.0.2 → 10.0.0.1     TCP 67 42968 → 49189 [PSH, ACK] Seq=1 Ack=1 Win=74 Len=1 TSval=1886573308 TSecr=1758595217
   16  38.784427     10.0.0.2 → 10.0.0.1     TCP 66 46356 → 47085 [ACK] Seq=1 Ack=38 Win=37888 Len=0 TSval=1886573309 TSecr=1758595217
   17  38.794237     10.0.0.2 → 10.0.0.1     TCP 74 35722 → 19551 [SYN, ACK] Seq=0 Ack=1 Win=37792 Len=0 MSS=9460 SACK_PERM TSval=1886573319 TSecr=1758595233 WS=512
   18  38.801997     10.0.0.2 → 10.0.0.1     TCP 67 [TCP Previous segment not captured] 59433 → 36467 [PSH, ACK] Seq=2 Ack=122 Win=74 Len=1 TSval=1886573320 TSecr=1758595234
   19  38.803488     10.0.0.2 → 10.0.0.1     TCP 66 35722 → 19551 [ACK] Seq=1 Ack=38 Win=37888 Len=0 TSval=1886573328 TSecr=1758595235
   20  38.804597     10.0.0.2 → 10.0.0.1     TCP 74 59433 → 48193 [SYN, ACK] Seq=0 Ack=1 Win=37792 Len=0 MSS=9460 SACK_PERM TSval=1886573330 TSecr=1758595243 WS=512
   21  38.869212     10.0.0.2 → 10.0.0.1     TCP 66 40783 → 58271 [ACK] Seq=2 Ack=42 Win=37888 Len=0 TSval=1886573358 TSecr=1758595217
   22  38.869253     10.0.0.2 → 10.0.0.1     TCP 66 42968 → 49189 [ACK] Seq=2 Ack=5 Win=74 Len=0 TSval=1886573358 TSecr=1758595227
   23  38.869275     10.0.0.2 → 10.0.0.1     TCP 66 59433 → 48193 [ACK] Seq=1 Ack=38 Win=37888 Len=0 TSval=1886573393 TSecr=1758595249
   24  38.870342     10.0.0.2 → 10.0.0.1     TCP 68 [TCP Previous segment not captured] 35722 → 42763 [PSH, ACK] Seq=3 Ack=122 Win=74 Len=2 TSval=1886573394 TSecr=1758595277
   25  38.873493     10.0.0.2 → 10.0.0.1     TCP 66 [TCP Dup ACK 23#1] 59433 → 48193 [ACK] Seq=1 Ack=38 Win=37888 Len=0 TSval=1886573395 TSecr=1758595249
   26  38.876578     10.0.0.2 → 10.0.0.1     TCP 67 47452 → 39475 [PSH, ACK] Seq=2 Ack=159 Win=37888 Len=1 TSval=1886573399 TSecr=1758595309
   27  38.876597     10.0.0.2 → 10.0.0.1     TCP 68 59433 → 36467 [PSH, ACK] Seq=3 Ack=122 Win=74 Len=2 TSval=1886573399 TSecr=1758595285
   28  38.885056     10.0.0.2 → 10.0.0.1     TCP 66 6776 → 55655 [ACK] Seq=1 Ack=1 Win=74 Len=0 TSval=1886573409 TSecr=1758595312
   29  38.888345     10.0.0.2 → 10.0.0.1     TCP 67 [TCP Previous segment not captured] 25904 → 51099 [PSH, ACK] Seq=2 Ack=159 Win=37888 Len=1 TSval=1886573413 TSecr=1758595312
   30  38.901986     10.0.0.2 → 10.0.0.1     TCP 67 40783 → 58271 [PSH, ACK] Seq=2 Ack=159 Win=37888 Len=1 TSval=1886573423 TSecr=1758595314
   31  38.923218     10.0.0.2 → 10.0.0.1     TCP 66 42968 → 49189 [ACK] Seq=2 Ack=122 Win=74 Len=0 TSval=1886573437 TSecr=1758595317
   32  38.958382     10.0.0.2 → 10.0.0.1     TCP 74 42968 → 55943 [SYN, ACK] Seq=0 Ack=1 Win=37792 Len=0 MSS=9460 SACK_PERM TSval=1886573483 TSecr=1758595382 WS=512
   33  38.998486     10.0.0.2 → 10.0.0.1     TCP 66 6776 → 55246 [ACK] Seq=1 Ack=1 Win=74 Len=0 TSval=1886573523 TSecr=1758595400
   34  39.013821     10.0.0.2 → 10.0.0.1     TCP 66 59433 → 48193 [ACK] Seq=1 Ack=3038 Win=35840 Len=0 TSval=1886573539 TSecr=1758595409
   35  39.049960     10.0.0.2 → 10.0.0.1     TCP 66 25904 → 58169 [ACK] Seq=1 Ack=1 Win=74 Len=0 TSval=1886573575 TSecr=1758595410
   36  39.062259     10.0.0.2 → 10.0.0.1     TCP 66 46356 → 54368 [ACK] Seq=1 Ack=1 Win=74 Len=0 TSval=1886573587 TSecr=1758595410
   37  39.074644     10.0.0.2 → 10.0.0.1     TCP 66 42968 → 55943 [ACK] Seq=1 Ack=38 Win=37888 Len=0 TSval=1886573599 TSecr=1758595417
   38  39.076889     10.0.0.2 → 10.0.0.1     TCP 68 [TCP Previous segment not captured] 6776 → 55655 [PSH, ACK] Seq=2 Ack=1 Win=74 Len=2 TSval=1886573602 TSecr=1758595421
   39  39.077904     10.0.0.2 → 10.0.0.1     TCP 68 47452 → 39475 [PSH, ACK] Seq=3 Ack=159 Win=37888 Len=2 TSval=1886573603 TSecr=1758595421
   40  39.085048     10.0.0.2 → 10.0.0.1     TCP 68 [TCP Previous segment not captured] 42968 → 49189 [PSH, ACK] Seq=3 Ack=122 Win=74 Len=2 TSval=1886573610 TSecr=1758595425
   41  39.089076     10.0.0.2 → 10.0.0.1     TCP 68 40783 → 58271 [PSH, ACK] Seq=3 Ack=159 Win=37888 Len=2 TSval=1886573614 TSecr=1758595425
   42  39.090155     10.0.0.2 → 10.0.0.1     TCP 68 [TCP Previous segment not captured] 46356 → 47085 [PSH, ACK] Seq=3 Ack=159 Win=37888 Len=2 TSval=1886573615 TSecr=1758595425
   43  39.094291     10.0.0.2 → 10.0.0.1     TCP 66 59433 → 48193 [ACK] Seq=1 Ack=12038 Win=34304 Len=0 TSval=1886573619 TSecr=1758595532
   44  39.116854     10.0.0.2 → 10.0.0.1     TCP 66 42968 → 55943 [ACK] Seq=1 Ack=1038 Win=37376 Len=0 TSval=1886573641 TSecr=1758595536
   45  39.131355     10.0.0.2 → 10.0.0.1     TCP 66 25904 → 58169 [ACK] Seq=1 Ack=3001 Win=70 Len=0 TSval=1886573656 TSecr=1758595570
   46  39.134569     10.0.0.2 → 10.0.0.1     TCP 66 40783 → 32720 [ACK] Seq=1 Ack=1 Win=73 Len=0 TSval=1886573659 TSecr=1758595534
   47  39.138108     10.0.0.2 → 10.0.0.1     TCP 66 46356 → 54368 [ACK] Seq=1 Ack=1001 Win=73 Len=0 TSval=1886573663 TSecr=1758595536
   48  39.146636     10.0.0.2 → 10.0.0.1     TCP 66 59433 → 48193 [ACK] Seq=1 Ack=14038 Win=34304 Len=0 TSval=1886573672 TSecr=1758595560
   49  39.149078     10.0.0.2 → 10.0.0.1     TCP 66 59433 → 48193 [ACK] Seq=1 Ack=16038 Win=34304 Len=0 TSval=1886573673 TSecr=1758595587
   50  39.150919     10.0.0.2 → 10.0.0.1     TCP 66 35722 → 19551 [ACK] Seq=1 Ack=19038 Win=34304 Len=0 TSval=1886573676 TSecr=1758595562
   51  39.157173     10.0.0.2 → 10.0.0.1     TCP 66 47452 → 53241 [ACK] Seq=1 Ack=1 Win=71 Len=0 TSval=1886573681 TSecr=1758595564
   52  39.159382     10.0.0.2 → 10.0.0.1     TCP 66 47452 → 53241 [ACK] Seq=1 Ack=2001 Win=68 Len=0 TSval=1886573684 TSecr=1758595598
   53  39.160019     10.0.0.2 → 10.0.0.1     TCP 66 6776 → 55246 [ACK] Seq=1 Ack=3001 Win=71 Len=0 TSval=1886573685 TSecr=1758595571
   54  39.164902     10.0.0.2 → 10.0.0.1     TCP 66 40783 → 32720 [ACK] Seq=1 Ack=3001 Win=68 Len=0 TSval=1886573690 TSecr=1758595576
   55  39.175998     10.0.0.2 → 10.0.0.1     TCP 66 46356 → 54368 [ACK] Seq=1 Ack=4001 Win=68 Len=0 TSval=1886573701 TSecr=1758595579
   56  39.177584     10.0.0.2 → 10.0.0.1     TCP 66 46356 → 54368 [ACK] Seq=1 Ack=7001 Win=67 Len=0 TSval=1886573703 TSecr=1758595617
   57  39.196598     10.0.0.2 → 10.0.0.1     TCP 66 25904 → 58169 [ACK] Seq=1 Ack=5001 Win=68 Len=0 TSval=1886573722 TSecr=1758595588
   58  39.210481     10.0.0.2 → 10.0.0.1     TCP 66 47452 → 53241 [ACK] Seq=1 Ack=6001 Win=67 Len=0 TSval=1886573736 TSecr=1758595650
   59  39.221794     10.0.0.2 → 10.0.0.1     TCP 66 59433 → 48193 [ACK] Seq=1 Ack=18038 Win=34304 Len=0 TSval=1886573747 TSecr=1758595607
   60  39.225958     10.0.0.2 → 10.0.0.1     TCP 66 6776 → 55246 [ACK] Seq=1 Ack=7001 Win=67 Len=0 TSval=1886573751 TSecr=1758595624
   61  39.242820     10.0.0.2 → 10.0.0.1     TCP 66 46356 → 54368 [ACK] Seq=1 Ack=8001 Win=67 Len=0 TSval=1886573767 TSecr=1758595630
   62  39.246663     10.0.0.2 → 10.0.0.1     TCP 66 25904 → 58169 [ACK] Seq=1 Ack=8001 Win=67 Len=0 TSval=1886573772 TSecr=1758595638
   63  39.258801     10.0.0.2 → 10.0.0.1     TCP 66 40783 → 32720 [ACK] Seq=1 Ack=8001 Win=67 Len=0 TSval=1886573784 TSecr=1758595654
   64  39.272651     10.0.0.2 → 10.0.0.1     TCP 66 59433 → 48193 [ACK] Seq=1 Ack=25038 Win=34304 Len=0 TSval=1886573798 TSecr=1758595712
   65  39.287736     10.0.0.2 → 10.0.0.1     TCP 66 35722 → 19551 [ACK] Seq=1 Ack=27038 Win=34304 Len=0 TSval=1886573813 TSecr=1758595664
   66  39.293343     10.0.0.2 → 10.0.0.1     TCP 66 6776 → 55246 [ACK] Seq=1 Ack=15001 Win=67 Len=0 TSval=1886573818 TSecr=1758595733
   67  39.308781     10.0.0.2 → 10.0.0.1     TCP 66 42968 → 55943 [ACK] Seq=1 Ack=12038 Win=34304 Len=0 TSval=1886573833 TSecr=1758595683
   68  39.313947     10.0.0.2 → 10.0.0.1     TCP 66 46356 → 54368 [ACK] Seq=1 Ack=17001 Win=67 Len=0 TSval=1886573839 TSecr=1758595753
   69  39.339425     10.0.0.2 → 10.0.0.1     TCP 66 25904 → 58169 [ACK] Seq=1 Ack=19001 Win=67 Len=0 TSval=1886573864 TSecr=1758595774
   70  39.341485     10.0.0.2 → 10.0.0.1     TCP 66 46356 → 54368 [ACK] Seq=1 Ack=19001 Win=67 Len=0 TSval=1886573867 TSecr=1758595776
   71  39.345035     10.0.0.2 → 10.0.0.1     TCP 66 40783 → 32720 [ACK] Seq=1 Ack=12001 Win=67 Len=0 TSval=1886573870 TSecr=1758595700
   72  39.346512     10.0.0.2 → 10.0.0.1     TCP 66 40783 → 32720 [ACK] Seq=1 Ack=18001 Win=67 Len=0 TSval=1886573872 TSecr=1758595786
   73  39.367161     10.0.0.2 → 10.0.0.1     TCP 66 35722 → 19551 [ACK] Seq=1 Ack=37038 Win=34304 Len=0 TSval=1886573892 TSecr=1758595806
   74  39.381846     10.0.0.2 → 10.0.0.1     TCP 66 6776 → 55246 [ACK] Seq=1 Ack=16001 Win=67 Len=0 TSval=1886573907 TSecr=1758595744
   75  39.386278     10.0.0.2 → 10.0.0.1     TCP 66 47452 → 53241 [ACK] Seq=1 Ack=14001 Win=67 Len=0 TSval=1886573911 TSecr=1758595748
   76  39.387118     10.0.0.2 → 10.0.0.1     TCP 66 35722 → 19551 [ACK] Seq=1 Ack=39038 Win=34304 Len=0 TSval=1886573912 TSecr=1758595824
   77  39.395553     10.0.0.2 → 10.0.0.1     TCP 66 47452 → 53241 [ACK] Seq=1 Ack=20001 Win=67 Len=0 TSval=1886573920 TSecr=1758595829
   78  39.397996     10.0.0.2 → 10.0.0.1     TCP 66 35722 → 19551 [ACK] Seq=1 Ack=40038 Win=34304 Len=0 TSval=1886573923 TSecr=1758595837
   79  39.402452     10.0.0.2 → 10.0.0.1     TCP 66 47452 → 53241 [ACK] Seq=1 Ack=21001 Win=67 Len=0 TSval=1886573927 TSecr=1758595841
   80  39.415945     10.0.0.2 → 10.0.0.1     TCP 66 35722 → 19551 [ACK] Seq=1 Ack=41038 Win=34304 Len=0 TSval=1886573940 TSecr=1758595851
   81  39.416868     10.0.0.2 → 10.0.0.1     TCP 66 42968 → 55943 [ACK] Seq=1 Ack=24038 Win=34304 Len=0 TSval=1886573941 TSecr=1758595851
   82  39.426656     10.0.0.2 → 10.0.0.1     TCP 66 25904 → 58169 [ACK] Seq=1 Ack=20001 Win=67 Len=0 TSval=1886573952 TSecr=1758595788
   83  39.428455     10.0.0.2 → 10.0.0.1     TCP 66 47452 → 53241 [ACK] Seq=1 Ack=22001 Win=67 Len=0 TSval=1886573953 TSecr=1758595854
   84  39.434185     10.0.0.2 → 10.0.0.1     TCP 66 25904 → 58169 [ACK] Seq=1 Ack=25001 Win=67 Len=0 TSval=1886573958 TSecr=1758595867
   85  39.439967     10.0.0.2 → 10.0.0.1     TCP 66 59433 → 48193 [ACK] Seq=1 Ack=32038 Win=34304 Len=0 TSval=1886573965 TSecr=1758595803
   86  39.456285     10.0.0.2 → 10.0.0.1     TCP 66 40783 → 32720 [ACK] Seq=1 Ack=25001 Win=67 Len=0 TSval=1886573981 TSecr=1758595879
   87  39.466422     10.0.0.2 → 10.0.0.1     TCP 66 59433 → 48193 [ACK] Seq=1 Ack=38038 Win=34304 Len=0 TSval=1886573991 TSecr=1758595881
   88  39.480665     10.0.0.2 → 10.0.0.1     TCP 66 25904 → 58169 [ACK] Seq=1 Ack=28001 Win=67 Len=0 TSval=1886574006 TSecr=1758595895
   89  39.483967     10.0.0.2 → 10.0.0.1     TCP 66 35722 → 19551 [ACK] Seq=1 Ack=42038 Win=34304 Len=0 TSval=1886574009 TSecr=1758595864
   90  39.488116     10.0.0.2 → 10.0.0.1     TCP 66 47452 → 53241 [ACK] Seq=1 Ack=23001 Win=67 Len=0 TSval=1886574013 TSecr=1758595869
   91  39.496700     10.0.0.2 → 10.0.0.1     TCP 66 40783 → 32720 [ACK] Seq=1 Ack=27001 Win=67 Len=0 TSval=1886574022 TSecr=1758595897
   92  39.511192     10.0.0.2 → 10.0.0.1     TCP 66 47452 → 53241 [ACK] Seq=1 Ack=27001 Win=67 Len=0 TSval=1886574036 TSecr=1758595929
   93  39.519393     10.0.0.2 → 10.0.0.1     TCP 66 35722 → 19551 [ACK] Seq=1 Ack=47038 Win=34304 Len=0 TSval=1886574044 TSecr=1758595944
   94  39.527589     10.0.0.2 → 10.0.0.1     TCP 66 47452 → 53241 [ACK] Seq=1 Ack=29001 Win=67 Len=0 TSval=1886574053 TSecr=1758595952
   95  39.539957     10.0.0.2 → 10.0.0.1     TCP 66 42968 → 55943 [ACK] Seq=1 Ack=34038 Win=34304 Len=0 TSval=1886574065 TSecr=1758595976
   96  39.544579     10.0.0.2 → 10.0.0.1     TCP 66 40783 → 32720 [ACK] Seq=1 Ack=33001 Win=67 Len=0 TSval=1886574069 TSecr=1758595983
   97  39.554442     10.0.0.2 → 10.0.0.1     TCP 66 46356 → 54368 [ACK] Seq=1 Ack=31001 Win=67 Len=0 TSval=1886574079 TSecr=1758595940
   98  39.562709     10.0.0.2 → 10.0.0.1     TCP 66 25904 → 58169 [ACK] Seq=1 Ack=32001 Win=67 Len=0 TSval=1886574088 TSecr=1758595954
   99  39.579123     10.0.0.2 → 10.0.0.1     TCP 66 59433 → 48193 [ACK] Seq=1 Ack=44038 Win=34304 Len=0 TSval=1886574104 TSecr=1758595962
  100  39.581308     10.0.0.2 → 10.0.0.1     TCP 66 59433 → 48193 [ACK] Seq=1 Ack=48038 Win=34304 Len=0 TSval=1886574106 TSecr=1758596020
  101  39.583417     10.0.0.2 → 10.0.0.1     TCP 66 6776 → 55246 [ACK] Seq=1 Ack=32001 Win=67 Len=0 TSval=1886574108 TSecr=1758595963
  102  39.587807     10.0.0.2 → 10.0.0.1     TCP 66 35722 → 19551 [ACK] Seq=1 Ack=54038 Win=34304 Len=0 TSval=1886574113 TSecr=1758596024
  103  39.595809     10.0.0.2 → 10.0.0.1     TCP 66 40783 → 32720 [ACK] Seq=1 Ack=34001 Win=67 Len=0 TSval=1886574121 TSecr=1758595988
  104  39.600700     10.0.0.2 → 10.0.0.1     TCP 66 42968 → 55943 [ACK] Seq=1 Ack=35038 Win=34304 Len=0 TSval=1886574125 TSecr=1758595990
  105  39.618610     10.0.0.2 → 10.0.0.1     TCP 66 46356 → 54368 [ACK] Seq=1 Ack=39001 Win=67 Len=0 TSval=1886574144 TSecr=1758596045
  106  39.620462     10.0.0.2 → 10.0.0.1     TCP 66 25904 → 58169 [ACK] Seq=1 Ack=37001 Win=67 Len=0 TSval=1886574145 TSecr=1758596014
  107  39.624735     10.0.0.2 → 10.0.0.1     TCP 66 40783 → 32720 [ACK] Seq=1 Ack=37001 Win=67 Len=0 TSval=1886574150 TSecr=1758596037
  108  39.630976     10.0.0.2 → 10.0.0.1     TCP 66 25904 → 58169 [ACK] Seq=1 Ack=40001 Win=67 Len=0 TSval=1886574156 TSecr=1758596061
  109  39.641275     10.0.0.2 → 10.0.0.1     TCP 66 6776 → 55246 [ACK] Seq=1 Ack=38001 Win=67 Len=0 TSval=1886574166 TSecr=1758596038
  110  39.645472     10.0.0.2 → 10.0.0.1     TCP 66 47452 → 53241 [ACK] Seq=1 Ack=37001 Win=67 Len=0 TSval=1886574171 TSecr=1758596055
  111  39.651587     10.0.0.2 → 10.0.0.1     TCP 66 6776 → 55246 [ACK] Seq=1 Ack=42001 Win=67 Len=0 TSval=1886574177 TSecr=1758596091
  112  39.674824     10.0.0.2 → 10.0.0.1     TCP 66 59433 → 48193 [ACK] Seq=1 Ack=54038 Win=34304 Len=0 TSval=1886574200 TSecr=1758596089
  113  39.714694     10.0.0.2 → 10.0.0.1     TCP 66 46356 → 54368 [ACK] Seq=1 Ack=41001 Win=67 Len=0 TSval=1886574234 TSecr=1758596070
  114  39.818615     10.0.0.2 → 10.0.0.1     TCP 66 40783 → 32720 [ACK] Seq=1 Ack=47001 Win=67 Len=0 TSval=1886574340 TSecr=1758596174
  115  39.821237     10.0.0.2 → 10.0.0.1     TCP 66 42968 → 55943 [ACK] Seq=1 Ack=54038 Win=34304 Len=0 TSval=1886574340 TSecr=1758596250
  116  39.823536     10.0.0.2 → 10.0.0.1     TCP 66 46356 → 54368 [ACK] Seq=1 Ack=54001 Win=67 Len=0 TSval=1886574348 TSecr=1758596255
  117  39.828231     10.0.0.2 → 10.0.0.1     TCP 66 35722 → 19551 [ACK] Seq=1 Ack=66038 Win=34304 Len=0 TSval=1886574353 TSecr=1758596184
  118  39.835262     10.0.0.2 → 10.0.0.1     TCP 66 35722 → 19551 [ACK] Seq=1 Ack=72038 Win=34304 Len=0 TSval=1886574360 TSecr=1758596269
  119  39.858726     10.0.0.2 → 10.0.0.1     TCP 66 6776 → 55246 [ACK] Seq=1 Ack=49001 Win=67 Len=0 TSval=1886574379 TSecr=1758596188
  120  39.863356     10.0.0.2 → 10.0.0.1     TCP 66 25904 → 58169 [ACK] Seq=1 Ack=51001 Win=67 Len=0 TSval=1886574387 TSecr=1758596203
  121  39.866269     10.0.0.2 → 10.0.0.1     TCP 66 25904 → 58169 [ACK] Seq=1 Ack=58001 Win=67 Len=0 TSval=1886574391 TSecr=1758596304
  122  39.873790     10.0.0.2 → 10.0.0.1     TCP 66 59433 → 48193 [ACK] Seq=1 Ack=65038 Win=34304 Len=0 TSval=1886574399 TSecr=1758596245
  123  39.901572     10.0.0.2 → 10.0.0.1     TCP 66 40783 → 32720 [ACK] Seq=1 Ack=54001 Win=67 Len=0 TSval=1886574427 TSecr=1758596260
  124  39.903557     10.0.0.2 → 10.0.0.1     TCP 66 40783 → 32720 [ACK] Seq=1 Ack=60001 Win=67 Len=0 TSval=1886574428 TSecr=1758596342
  125  39.929994     10.0.0.2 → 10.0.0.1     TCP 66 42968 → 55943 [ACK] Seq=1 Ack=55038 Win=34304 Len=0 TSval=1886574455 TSecr=1758596262
  126  39.932282     10.0.0.2 → 10.0.0.1     TCP 66 42968 → 55943 [ACK] Seq=1 Ack=63038 Win=34304 Len=0 TSval=1886574457 TSecr=1758596371
  127  39.941339     10.0.0.2 → 10.0.0.1     TCP 66 25904 → 58169 [ACK] Seq=1 Ack=60001 Win=67 Len=0 TSval=1886574462 TSecr=1758596321
  128  39.942744     10.0.0.2 → 10.0.0.1     TCP 66 47452 → 53241 [ACK] Seq=1 Ack=53001 Win=67 Len=0 TSval=1886574467 TSecr=1758596275
  129  39.948285     10.0.0.2 → 10.0.0.1     TCP 66 46356 → 54368 [ACK] Seq=1 Ack=64001 Win=67 Len=0 TSval=1886574473 TSecr=1758596381
  130  39.952574     10.0.0.2 → 10.0.0.1     TCP 66 59433 → 48193 [ACK] Seq=1 Ack=73038 Win=34304 Len=0 TSval=1886574478 TSecr=1758596340
  131  39.969683     10.0.0.2 → 10.0.0.1     TCP 66 47452 → 53241 [ACK] Seq=1 Ack=61001 Win=67 Len=0 TSval=1886574491 TSecr=1758596384
  132  39.974557     10.0.0.2 → 10.0.0.1     TCP 66 6776 → 55246 [ACK] Seq=1 Ack=57001 Win=67 Len=0 TSval=1886574498 TSecr=1758596300
  133  39.982164     10.0.0.2 → 10.0.0.1     TCP 66 46356 → 54368 [ACK] Seq=1 Ack=65001 Win=67 Len=0 TSval=1886574507 TSecr=1758596390
  134  39.985006     10.0.0.2 → 10.0.0.1     TCP 66 59433 → 48193 [ACK] Seq=1 Ack=76038 Win=34304 Len=0 TSval=1886574509 TSecr=1758596393
  135  40.003665     10.0.0.2 → 10.0.0.1     TCP 66 40783 → 32720 [ACK] Seq=1 Ack=61001 Win=67 Len=0 TSval=1886574528 TSecr=1758596348
  136  40.011187     10.0.0.2 → 10.0.0.1     TCP 66 6776 → 55246 [ACK] Seq=1 Ack=66001 Win=67 Len=0 TSval=1886574536 TSecr=1758596416
  137  40.038808     10.0.0.2 → 10.0.0.1     TCP 66 59433 → 48193 [ACK] Seq=1 Ack=79038 Win=34304 Len=0 TSval=1886574562 TSecr=1758596426
  138  40.048376     10.0.0.2 → 10.0.0.1     TCP 66 25904 → 58169 [ACK] Seq=1 Ack=69001 Win=67 Len=0 TSval=1886574573 TSecr=1758596448
  139  40.054681     10.0.0.2 → 10.0.0.1     TCP 66 40783 → 32720 [ACK] Seq=1 Ack=70001 Win=67 Len=0 TSval=1886574580 TSecr=1758596479
  140  40.058538     10.0.0.2 → 10.0.0.1     TCP 66 46356 → 54368 [ACK] Seq=1 Ack=72001 Win=67 Len=0 TSval=1886574584 TSecr=1758596487
  141  40.060632     10.0.0.2 → 10.0.0.1     TCP 66 25904 → 58169 [ACK] Seq=1 Ack=72001 Win=67 Len=0 TSval=1886574586 TSecr=1758596489
  142  40.066811     10.0.0.2 → 10.0.0.1     TCP 66 25904 → 58169 [ACK] Seq=1 Ack=73001 Win=67 Len=0 TSval=1886574592 TSecr=1758596501
  143  40.074152     10.0.0.2 → 10.0.0.1     TCP 66 42968 → 55943 [ACK] Seq=1 Ack=74038 Win=34304 Len=0 TSval=1886574599 TSecr=1758596513
  144  40.079214     10.0.0.2 → 10.0.0.1     TCP 66 6776 → 55246 [ACK] Seq=1 Ack=69001 Win=67 Len=0 TSval=1886574604 TSecr=1758596452
  145  40.089810     10.0.0.2 → 10.0.0.1     TCP 66 47452 → 53241 [ACK] Seq=1 Ack=68001 Win=67 Len=0 TSval=1886574615 TSecr=1758596473
  146  40.116558     10.0.0.2 → 10.0.0.1     TCP 66 25904 → 58169 [ACK] Seq=1 Ack=74001 Win=67 Len=0 TSval=1886574642 TSecr=1758596508
  147  40.118113     10.0.0.2 → 10.0.0.1     TCP 66 25904 → 58169 [ACK] Seq=1 Ack=77001 Win=67 Len=0 TSval=1886574643 TSecr=1758596557
  148  40.121952     10.0.0.2 → 10.0.0.1     TCP 66 25904 → 58169 [ACK] Seq=1 Ack=78001 Win=67 Len=0 TSval=1886574647 TSecr=1758596561
  149  40.168647     10.0.0.2 → 10.0.0.1     TCP 66 42968 → 55943 [ACK] Seq=1 Ack=76038 Win=34304 Len=0 TSval=1886574694 TSecr=1758596544
  150  40.168935     10.0.0.2 → 10.0.0.1     TCP 66 47452 → 53241 [ACK] Seq=1 Ack=78001 Win=67 Len=0 TSval=1886574694 TSecr=1758596604
  151  40.178816     10.0.0.2 → 10.0.0.1     TCP 66 59433 → 48193 [ACK] Seq=1 Ack=93038 Win=34304 Len=0 TSval=1886574704 TSecr=1758596608
  152  40.180484     10.0.0.2 → 10.0.0.1     TCP 66 35722 → 19551 [ACK] Seq=1 Ack=95038 Win=34304 Len=0 TSval=1886574706 TSecr=1758596579
  153  40.185006     10.0.0.2 → 10.0.0.1     TCP 66 46356 → 54368 [ACK] Seq=1 Ack=73001 Win=67 Len=0 TSval=1886574710 TSecr=1758596499
  154  40.188907     10.0.0.2 → 10.0.0.1     TCP 66 35722 → 19551 [ACK] Seq=1 Ack=98038 Win=34304 Len=0 TSval=1886574714 TSecr=1758596621
  155  40.191547     10.0.0.2 → 10.0.0.1     TCP 66 42968 → 55943 [ACK] Seq=1 Ack=81038 Win=34304 Len=0 TSval=1886574717 TSecr=1758596609
  156  40.244911     10.0.0.2 → 10.0.0.1     TCP 66 6776 → 55246 [ACK] Seq=1 Ack=81001 Win=67 Len=0 TSval=1886574766 TSecr=1758596611
  157  40.251848     10.0.0.2 → 10.0.0.1     TCP 66 40783 → 32720 [ACK] Seq=1 Ack=81001 Win=67 Len=0 TSval=1886574766 TSecr=1758596618
  158  40.253700     10.0.0.2 → 10.0.0.1     TCP 66 25904 → 58169 [ACK] Seq=1 Ack=79001 Win=67 Len=0 TSval=1886574778 TSecr=1758596574
  159  40.277473     10.0.0.2 → 10.0.0.1     TCP 66 46356 → 54368 [ACK] Seq=1 Ack=83001 Win=67 Len=0 TSval=1886574799 TSecr=1758596636
  160  40.285297     10.0.0.2 → 10.0.0.1     TCP 66 25904 → 58169 [ACK] Seq=1 Ack=88001 Win=67 Len=0 TSval=1886574808 TSecr=1758596695
  161  40.301037     10.0.0.2 → 10.0.0.1     TCP 66 42968 → 55943 [ACK] Seq=1 Ack=89038 Win=34304 Len=0 TSval=1886574824 TSecr=1758596722
  162  40.302111     10.0.0.2 → 10.0.0.1     TCP 66 47452 → 53241 [ACK] Seq=1 Ack=85001 Win=67 Len=0 TSval=1886574825 TSecr=1758596696
  163  40.303469     10.0.0.2 → 10.0.0.1     TCP 66 40783 → 32720 [ACK] Seq=1 Ack=87001 Win=67 Len=0 TSval=1886574827 TSecr=1758596702
  164  40.322580     10.0.0.2 → 10.0.0.1     TCP 66 35722 → 19551 [ACK] Seq=1 Ack=106038 Win=34304 Len=0 TSval=1886574847 TSecr=1758596724
  165  40.328868     10.0.0.2 → 10.0.0.1     TCP 66 6776 → 55246 [ACK] Seq=1 Ack=89001 Win=67 Len=0 TSval=1886574854 TSecr=1758596727
  166  40.336075     10.0.0.2 → 10.0.0.1     TCP 66 42968 → 55943 [ACK] Seq=1 Ack=91038 Win=34304 Len=0 TSval=1886574860 TSecr=1758596742
  167  40.340327     10.0.0.2 → 10.0.0.1     TCP 66 40783 → 32720 [ACK] Seq=1 Ack=90001 Win=67 Len=0 TSval=1886574865 TSecr=1758596744
  168  40.349526     10.0.0.2 → 10.0.0.1     TCP 66 59433 → 48193 [ACK] Seq=1 Ack=103038 Win=34304 Len=0 TSval=1886574873 TSecr=1758596745
  169  40.351318     10.0.0.2 → 10.0.0.1     TCP 66 35722 → 19551 [ACK] Seq=1 Ack=109038 Win=34304 Len=0 TSval=1886574876 TSecr=1758596764
  170  40.378823     10.0.0.2 → 10.0.0.1     TCP 66 25904 → 58169 [ACK] Seq=1 Ack=97001 Win=67 Len=0 TSval=1886574903 TSecr=1758596817
  171  40.396683     10.0.0.2 → 10.0.0.1     TCP 66 47452 → 53241 [ACK] Seq=1 Ack=91001 Win=67 Len=0 TSval=1886574922 TSecr=1758596780
  172  40.447034     10.0.0.2 → 10.0.0.1     TCP 66 25904 → 58169 [ACK] Seq=1 Ack=98001 Win=67 Len=0 TSval=1886574971 TSecr=1758596828
  173  40.455435     10.0.0.2 → 10.0.0.1     TCP 66 42968 → 55943 [ACK] Seq=1 Ack=98038 Win=34304 Len=0 TSval=1886574977 TSecr=1758596834
  174  40.458126     10.0.0.2 → 10.0.0.1     TCP 66 42968 → 55943 [ACK] Seq=1 Ack=103038 Win=34304 Len=0 TSval=1886574983 TSecr=1758596896
  175  40.479272     10.0.0.2 → 10.0.0.1     TCP 66 47452 → 53241 [ACK] Seq=1 Ack=101001 Win=67 Len=0 TSval=1886575004 TSecr=1758596908
  176  40.480086     10.0.0.2 → 10.0.0.1     TCP 78 59433 → 48193 [ACK] Seq=1 Ack=106038 Win=34304 Len=0 TSval=1886575005 TSecr=1758596790 SLE=115486 SRE=116038
  177  40.482372     10.0.0.2 → 10.0.0.1     TCP 66 59433 → 48193 [ACK] Seq=1 Ack=116038 Win=34304 Len=0 TSval=1886575007 TSecr=1758596921
  178  40.496664     10.0.0.2 → 10.0.0.1     TCP 66 40783 → 32720 [ACK] Seq=1 Ack=93001 Win=67 Len=0 TSval=1886575022 TSecr=1758596781
  179  40.501692     10.0.0.2 → 10.0.0.1     TCP 66 6776 → 55246 [ACK] Seq=1 Ack=104001 Win=67 Len=0 TSval=1886575027 TSecr=1758596923
  180  40.513999     10.0.0.2 → 10.0.0.1     TCP 78 [TCP Dup ACK 178#1] 40783 → 32720 [ACK] Seq=1 Ack=93001 Win=67 Len=0 TSval=1886575039 TSecr=1758596781 SLE=102449 SRE=105001
  181  40.534692     10.0.0.2 → 10.0.0.1     TCP 66 46356 → 54368 [ACK] Seq=1 Ack=102001 Win=67 Len=0 TSval=1886575060 TSecr=1758596883
  182  40.581462     10.0.0.2 → 10.0.0.1     TCP 66 42968 → 55943 [ACK] Seq=1 Ack=104038 Win=34304 Len=0 TSval=1886575106 TSecr=1758596910
  183  40.585492     10.0.0.2 → 10.0.0.1     TCP 78 59433 → 48193 [ACK] Seq=1 Ack=117038 Win=34304 Len=0 TSval=1886575110 TSecr=1758596927 SLE=106038 SRE=115486
  184  40.623680     10.0.0.2 → 10.0.0.1     TCP 66 35722 → 19551 [ACK] Seq=1 Ack=123038 Win=34304 Len=0 TSval=1886575149 TSecr=1758596951
  185  40.660234     10.0.0.2 → 10.0.0.1     TCP 66 40783 → 32720 [ACK] Seq=1 Ack=116449 Win=65 Len=0 TSval=1886575185 TSecr=1758596962
  186  40.733689     10.0.0.2 → 10.0.0.1     TCP 66 42968 → 55943 [ACK] Seq=1 Ack=112038 Win=34304 Len=0 TSval=1886575258 TSecr=1758597022
  187  40.757976     10.0.0.2 → 10.0.0.1     TCP 66 46356 → 54368 [ACK] Seq=1 Ack=118001 Win=67 Len=0 TSval=1886575283 TSecr=1758597096
  188  40.759550     10.0.0.2 → 10.0.0.1     TCP 66 6776 → 55246 [ACK] Seq=1 Ack=119001 Win=67 Len=0 TSval=1886575285 TSecr=1758597123
  189  40.760477     10.0.0.2 → 10.0.0.1     TCP 66 47452 → 53241 [ACK] Seq=1 Ack=115449 Win=67 Len=0 TSval=1886575286 TSecr=1758597108
  190  40.763281     10.0.0.2 → 10.0.0.1     TCP 66 40783 → 32720 [ACK] Seq=1 Ack=121001 Win=67 Len=0 TSval=1886575288 TSecr=1758597160
  191  40.765447     10.0.0.2 → 10.0.0.1     TCP 66 59433 → 48193 [ACK] Seq=1 Ack=129038 Win=34304 Len=0 TSval=1886575291 TSecr=1758597074
  192  40.771604     10.0.0.2 → 10.0.0.1     TCP 78 [TCP Dup ACK 186#1] 42968 → 55943 [ACK] Seq=1 Ack=112038 Win=34304 Len=0 TSval=1886575297 TSecr=1758597022 SLE=121486 SRE=123038
  193  40.786825     10.0.0.2 → 10.0.0.1     TCP 66 59433 → 48193 [ACK] Seq=1 Ack=137038 Win=34304 Len=0 TSval=1886575312 TSecr=1758597206
  194  40.804673     10.0.0.2 → 10.0.0.1     TCP 78 35722 → 19551 [ACK] Seq=1 Ack=132038 Win=34304 Len=0 TSval=1886575328 TSecr=1758597065 SLE=133038 SRE=142486
  195  40.806336     10.0.0.2 → 10.0.0.1     TCP 66 35722 → 19551 [ACK] Seq=1 Ack=142486 Win=34304 Len=0 TSval=1886575330 TSecr=1758597077
  196  40.812532     10.0.0.2 → 10.0.0.1     TCP 66 25904 → 58169 [ACK] Seq=1 Ack=118449 Win=67 Len=0 TSval=1886575338 TSecr=1758597108
  197  40.824012     10.0.0.2 → 10.0.0.1     TCP 66 59433 → 48193 [ACK] Seq=1 Ack=139038 Win=34304 Len=0 TSval=1886575349 TSecr=1758597228
  198  40.830413     10.0.0.2 → 10.0.0.1     TCP 78 [TCP Dup ACK 196#1] 25904 → 58169 [ACK] Seq=1 Ack=118449 Win=67 Len=0 TSval=1886575355 TSecr=1758597108 SLE=120001 SRE=129001
  199  40.845878     10.0.0.2 → 10.0.0.1     TCP 78 6776 → 55246 [ACK] Seq=1 Ack=126001 Win=67 Len=0 TSval=1886575371 TSecr=1758597215 SLE=107001 SRE=116449
  200  40.890507     10.0.0.2 → 10.0.0.1     TCP 66 42968 → 55943 [ACK] Seq=1 Ack=123038 Win=34304 Len=0 TSval=1886575416 TSecr=1758597150
  201  40.927102     10.0.0.2 → 10.0.0.1     TCP 66 40783 → 32720 [ACK] Seq=1 Ack=134449 Win=61 Len=0 TSval=1886575452 TSecr=1758597349
  202  40.928467     10.0.0.2 → 10.0.0.1     TCP 66 47452 → 53241 [ACK] Seq=1 Ack=119001 Win=67 Len=0 TSval=1886575453 TSecr=1758597158
  203  40.940466     10.0.0.2 → 10.0.0.1     TCP 78 [TCP Dup ACK 202#1] 47452 → 53241 [ACK] Seq=1 Ack=119001 Win=67 Len=0 TSval=1886575465 TSecr=1758597158 SLE=128449 SRE=135001
  204  40.971257     10.0.0.2 → 10.0.0.1     TCP 78 40783 → 32720 [ACK] Seq=1 Ack=137001 Win=67 Len=0 TSval=1886575496 TSecr=1758597368 SLE=121001 SRE=125001
  205  40.987595     10.0.0.2 → 10.0.0.1     TCP 78 42968 → 55943 [ACK] Seq=1 Ack=132486 Win=34304 Len=0 TSval=1886575513 TSecr=1758597331 SLE=112038 SRE=121486
  206  40.991838     10.0.0.2 → 10.0.0.1     TCP 78 [TCP Dup ACK 199#1] 6776 → 55246 [ACK] Seq=1 Ack=126001 Win=67 Len=0 TSval=1886575517 TSecr=1758597215 SLE=129001 SRE=138449
  207  41.020160     10.0.0.2 → 10.0.0.1     TCP 78 [TCP Dup ACK 197#1] 59433 → 48193 [ACK] Seq=1 Ack=139038 Win=34304 Len=0 TSval=1886575545 TSecr=1758597228 SLE=142038 SRE=151486
  208  41.036067     10.0.0.2 → 10.0.0.1     TCP 66 6776 → 55246 [ACK] Seq=1 Ack=138449 Win=65 Len=0 TSval=1886575561 TSecr=1758597263
  209  41.039203     10.0.0.2 → 10.0.0.1     TCP 78 35722 → 19551 [ACK] Seq=1 Ack=154486 Win=34304 Len=0 TSval=1886575564 TSecr=1758597247 SLE=142486 SRE=145038
  210  41.048478     10.0.0.2 → 10.0.0.1     TCP 66 59433 → 48193 [ACK] Seq=1 Ack=151486 Win=33280 Len=0 TSval=1886575573 TSecr=1758597265
  211  41.060720     10.0.0.2 → 10.0.0.1     TCP 78 25904 → 58169 [ACK] Seq=1 Ack=129001 Win=67 Len=0 TSval=1886575586 TSecr=1758597134 SLE=118449 SRE=120001
  212  41.063491     10.0.0.2 → 10.0.0.1     TCP 78 [TCP Dup ACK 211#1] 25904 → 58169 [ACK] Seq=1 Ack=129001 Win=67 Len=0 TSval=1886575588 TSecr=1758597134 SLE=135001 SRE=144449
  213  41.101588     10.0.0.2 → 10.0.0.1     TCP 78 [TCP Dup ACK 210#1] 59433 → 48193 [ACK] Seq=1 Ack=151486 Win=34304 Len=0 TSval=1886575626 TSecr=1758597265 SLE=139038 SRE=142038
  214  41.107755     10.0.0.2 → 10.0.0.1     TCP 66 35722 → 19551 [ACK] Seq=1 Ack=162038 Win=34304 Len=0 TSval=1886575633 TSecr=1758597466
  215  41.139210     10.0.0.2 → 10.0.0.1     TCP 66 59433 → 48193 [ACK] Seq=1 Ack=159038 Win=34304 Len=0 TSval=1886575664 TSecr=1758597489
  216  41.154426     10.0.0.2 → 10.0.0.1     TCP 78 25904 → 58169 [ACK] Seq=1 Ack=144449 Win=67 Len=0 TSval=1886575679 TSecr=1758597325 SLE=129001 SRE=135001
  217  41.166790     10.0.0.2 → 10.0.0.1     TCP 78 [TCP Dup ACK 204#1] 40783 → 32720 [ACK] Seq=1 Ack=137001 Win=67 Len=0 TSval=1886575691 TSecr=1758597368 SLE=138001 SRE=147449
  218  41.168650     10.0.0.2 → 10.0.0.1     TCP 66 42968 → 55943 [ACK] Seq=1 Ack=144486 Win=33280 Len=0 TSval=1886575693 TSecr=1758597331
  219  41.182422     10.0.0.2 → 10.0.0.1     TCP 66 47452 → 53241 [ACK] Seq=1 Ack=138001 Win=67 Len=0 TSval=1886575707 TSecr=1758597414
  220  41.217501     10.0.0.2 → 10.0.0.1     TCP 78 [TCP Dup ACK 216#1] 25904 → 58169 [ACK] Seq=1 Ack=144449 Win=67 Len=0 TSval=1886575742 TSecr=1758597325 SLE=153897 SRE=154001
  221  41.243930     10.0.0.2 → 10.0.0.1     TCP 66 46356 → 54368 [ACK] Seq=1 Ack=153001 Win=67 Len=0 TSval=1886575769 TSecr=1758597564
  222  41.289069     10.0.0.2 → 10.0.0.1     TCP 66 6776 → 55246 [ACK] Seq=1 Ack=154449 Win=67 Len=0 TSval=1886575802 TSecr=1758597598
  223  41.330627     10.0.0.2 → 10.0.0.1     TCP 66 42968 → 55943 [ACK] Seq=1 Ack=156038 Win=34304 Len=0 TSval=1886575855 TSecr=1758597610
  224  41.348823     10.0.0.2 → 10.0.0.1     TCP 78 [TCP Dup ACK 223#1] 42968 → 55943 [ACK] Seq=1 Ack=156038 Win=34304 Len=0 TSval=1886575874 TSecr=1758597610 SLE=165486 SRE=168038
  225  41.573228     10.0.0.2 → 10.0.0.1     TCP 66 42968 → 55943 [ACK] Seq=1 Ack=168038 Win=34304 Len=0 TSval=1886576097 TSecr=1758597797
  226  41.573737     10.0.0.2 → 10.0.0.1     TCP 66 6776 → 55246 [ACK] Seq=1 Ack=158001 Win=67 Len=0 TSval=1886576098 TSecr=1758597648
  227  41.574306     10.0.0.2 → 10.0.0.1     TCP 66 40783 → 32720 [ACK] Seq=1 Ack=168449 Win=61 Len=0 TSval=1886576098 TSecr=1758597659
  228  41.601803     10.0.0.2 → 10.0.0.1     TCP 78 59433 → 48193 [ACK] Seq=1 Ack=165038 Win=34304 Len=0 TSval=1886576127 TSecr=1758597580 SLE=175038 SRE=184486
  229  41.620893     10.0.0.2 → 10.0.0.1     TCP 78 47452 → 53241 [ACK] Seq=1 Ack=154001 Win=67 Len=0 TSval=1886576146 TSecr=1758597623 SLE=160001 SRE=178897
  230  41.626901     10.0.0.2 → 10.0.0.1     TCP 78 [TCP Dup ACK 225#1] 42968 → 55943 [ACK] Seq=1 Ack=168038 Win=34304 Len=0 TSval=1886576152 TSecr=1758597797 SLE=144486 SRE=153934
  231  41.659108     10.0.0.2 → 10.0.0.1     TCP 78 35722 → 19551 [ACK] Seq=1 Ack=184486 Win=34304 Len=0 TSval=1886576184 TSecr=1758597777 SLE=195486 SRE=204934
  232  41.678298     10.0.0.2 → 10.0.0.1     TCP 78 59433 → 48193 [ACK] Seq=1 Ack=174486 Win=25088 Len=0 TSval=1886576203 TSecr=1758598043 SLE=175038 SRE=193934
  233  41.717503     10.0.0.2 → 10.0.0.1     TCP 78 35722 → 19551 [ACK] Seq=1 Ack=186038 Win=34304 Len=0 TSval=1886576242 TSecr=1758598100 SLE=195486 SRE=204934
  234  41.720519     10.0.0.2 → 10.0.0.1     TCP 66 47452 → 53241 [ACK] Seq=1 Ack=188345 Win=67 Len=0 TSval=1886576246 TSecr=1758598106
  235  41.728648     10.0.0.2 → 10.0.0.1     TCP 78 59433 → 48193 [ACK] Seq=1 Ack=193934 Win=34304 Len=0 TSval=1886576252 TSecr=1758598081 SLE=174486 SRE=175038
  236  41.747394     10.0.0.2 → 10.0.0.1     TCP 78 [TCP Dup ACK 225#2] 42968 → 55943 [ACK] Seq=1 Ack=168038 Win=34304 Len=0 TSval=1886576271 TSecr=1758597797 SLE=186038 SRE=195486
  237  41.763107     10.0.0.2 → 10.0.0.1     TCP 66 59433 → 48193 [ACK] Seq=1 Ack=203382 Win=34304 Len=0 TSval=1886576288 TSecr=1758598157
  238  41.770046     10.0.0.2 → 10.0.0.1     TCP 78 25904 → 58169 [ACK] Seq=1 Ack=164001 Win=67 Len=0 TSval=1886576293 TSecr=1758597711 SLE=154001 SRE=163449
  239  41.817592     10.0.0.2 → 10.0.0.1     TCP 66 35722 → 19551 [ACK] Seq=1 Ack=214038 Win=34304 Len=0 TSval=1886576339 TSecr=1758598158
  240  41.835396     10.0.0.2 → 10.0.0.1     TCP 78 [TCP Dup ACK 238#1] 25904 → 58169 [ACK] Seq=1 Ack=164001 Win=67 Len=0 TSval=1886576356 TSecr=1758597711 SLE=182897 SRE=192345
  241  41.849790     10.0.0.2 → 10.0.0.1     TCP 78 [TCP Dup ACK 238#2] 25904 → 58169 [ACK] Seq=1 Ack=164001 Win=67 Len=0 TSval=1886576374 TSecr=1758597711 SLE=182897 SRE=198001
  242  41.852624     10.0.0.2 → 10.0.0.1     TCP 66 6776 → 55246 [ACK] Seq=1 Ack=167449 Win=67 Len=0 TSval=1886576378 TSecr=1758597771
  243  41.873922     10.0.0.2 → 10.0.0.1     TCP 78 25904 → 58169 [ACK] Seq=1 Ack=173449 Win=57 Len=0 TSval=1886576398 TSecr=1758598281 SLE=182897 SRE=198001
  244  41.882276     10.0.0.2 → 10.0.0.1     TCP 78 [TCP Dup ACK 239#1] 35722 → 19551 [ACK] Seq=1 Ack=214038 Win=34304 Len=0 TSval=1886576407 TSecr=1758598158 SLE=184486 SRE=186038
  245  41.891700     10.0.0.2 → 10.0.0.1     TCP 78 [TCP Dup ACK 225#3] 42968 → 55943 [ACK] Seq=1 Ack=168038 Win=34304 Len=0 TSval=1886576417 TSecr=1758597797 SLE=177486 SRE=195486
  246  41.911617     10.0.0.2 → 10.0.0.1     TCP 66 25904 → 58169 [ACK] Seq=1 Ack=198001 Win=57 Len=0 TSval=1886576435 TSecr=1758598291
  247  41.927840     10.0.0.2 → 10.0.0.1     TCP 78 6776 → 55246 [ACK] Seq=1 Ack=176897 Win=67 Len=0 TSval=1886576453 TSecr=1758597891 SLE=185001 SRE=194449
  248  41.966201     10.0.0.2 → 10.0.0.1     TCP 66 42968 → 55943 [ACK] Seq=1 Ack=195486 Win=20992 Len=0 TSval=1886576472 TSecr=1758598333
  249  42.042338     10.0.0.2 → 10.0.0.1     TCP 78 [TCP Dup ACK 247#1] 6776 → 55246 [ACK] Seq=1 Ack=176897 Win=67 Len=0 TSval=1886576491 TSecr=1758597891 SLE=185001 SRE=203897
  250  42.070393     10.0.0.2 → 10.0.0.1     TCP 78 47452 → 53241 [ACK] Seq=1 Ack=196001 Win=104 Len=0 TSval=1886576515 TSecr=1758598185 SLE=205001 SRE=214449
  251  42.159092     10.0.0.2 → 10.0.0.1     TCP 78 40783 → 32720 [ACK] Seq=1 Ack=170001 Win=67 Len=0 TSval=1886576566 TSecr=1758598002 SLE=179449 SRE=188897
  252  42.197351     10.0.0.2 → 10.0.0.1     TCP 78 46356 → 54368 [ACK] Seq=1 Ack=195449 Win=57 Len=0 TSval=1886576595 TSecr=1758598503 SLE=204897 SRE=214345
  253  42.256019     10.0.0.2 → 10.0.0.1     TCP 78 [TCP Dup ACK 239#2] 35722 → 19551 [ACK] Seq=1 Ack=214038 Win=34304 Len=0 TSval=1886576613 TSecr=1758598158 SLE=230486 SRE=239934
  254  42.256349     10.0.0.2 → 10.0.0.1     TCP 66 40783 → 32720 [ACK] Seq=1 Ack=188897 Win=57 Len=0 TSval=1886576626 TSecr=1758598007
  255  42.378508     10.0.0.2 → 10.0.0.1     TCP 66 40783 → 32720 [ACK] Seq=1 Ack=198345 Win=67 Len=0 TSval=1886576668 TSecr=1758598580
  256  42.414810     10.0.0.2 → 10.0.0.1     TCP 66 40783 → 32720 [ACK] Seq=1 Ack=207793 Win=67 Len=0 TSval=1886576684 TSecr=1758598580
  257  42.414822     10.0.0.2 → 10.0.0.1     TCP 86 [TCP Dup ACK 248#1] 42968 → 55943 [ACK] Seq=1 Ack=195486 Win=34304 Len=0 TSval=1886576684 TSecr=1758598333 SLE=168038 SRE=177486 SLE=214382 SRE=216038
  258  42.468920     10.0.0.2 → 10.0.0.1     TCP 78 59433 → 48193 [ACK] Seq=1 Ack=209038 Win=53248 Len=0 TSval=1886576702 TSecr=1758598157 SLE=232934 SRE=242038
  259  42.468948     10.0.0.2 → 10.0.0.1     TCP 86 [TCP Dup ACK 248#2] 42968 → 55943 [ACK] Seq=1 Ack=195486 Win=34304 Len=0 TSval=1886576722 TSecr=1758598333 SLE=177486 SRE=186038 SLE=214382 SRE=216038
  260  42.671072     10.0.0.2 → 10.0.0.1     TCP 86 [TCP Dup ACK 252#1] 46356 → 54368 [ACK] Seq=1 Ack=195449 Win=67 Len=0 TSval=1886576781 TSecr=1758598503 SLE=186001 SRE=195449 SLE=204897 SRE=214345
  261  42.671174     10.0.0.2 → 10.0.0.1     TCP 78 [TCP Dup ACK 246#1] 25904 → 58169 [ACK] Seq=1 Ack=198001 Win=67 Len=0 TSval=1886576787 TSecr=1758598291 SLE=212001 SRE=221449
  262  42.768039     10.0.0.2 → 10.0.0.1     TCP 78 40783 → 32720 [ACK] Seq=1 Ack=217241 Win=53 Len=0 TSval=1886576852 TSecr=1758598746 SLE=223201 SRE=236137
  263  42.768106     10.0.0.2 → 10.0.0.1     TCP 86 [TCP Dup ACK 246#2] 25904 → 58169 [ACK] Seq=1 Ack=198001 Win=67 Len=0 TSval=1886576863 TSecr=1758598291 SLE=173449 SRE=182897 SLE=212001 SRE=221449
  264  42.768139     10.0.0.2 → 10.0.0.1     TCP 78 [TCP Dup ACK 248#3] 42968 → 55943 [ACK] Seq=1 Ack=195486 Win=34304 Len=0 TSval=1886576904 TSecr=1758598333 SLE=204934 SRE=216038
  265  42.768193     10.0.0.2 → 10.0.0.1     TCP 78 59433 → 48193 [ACK] Seq=1 Ack=214038 Win=72192 Len=0 TSval=1886576940 TSecr=1758598231 SLE=232934 SRE=242038
  266  42.886435     10.0.0.2 → 10.0.0.1     TCP 78 42968 → 55943 [ACK] Seq=1 Ack=216038 Win=34304 Len=0 TSval=1886576994 TSecr=1758598873 SLE=225486 SRE=244382
  267  42.993036     10.0.0.2 → 10.0.0.1     TCP 86 [TCP Dup ACK 265#1] 59433 → 48193 [ACK] Seq=1 Ack=214038 Win=72192 Len=0 TSval=1886577016 TSecr=1758598910 SLE=209038 SRE=214038 SLE=232934 SRE=242038
  268  42.993160     10.0.0.2 → 10.0.0.1     TCP 66 46356 → 54368 [ACK] Seq=1 Ack=239201 Win=67 Len=0 TSval=1886577077 TSecr=1758598954
  269  42.993284     10.0.0.2 → 10.0.0.1     TCP 86 46356 → 54368 [ACK] Seq=1 Ack=248649 Win=141 Len=0 TSval=1886577196 TSecr=1758598954 SLE=195449 SRE=204897 SLE=249489 SRE=258937
  270  43.085935     10.0.0.2 → 10.0.0.1     TCP 78 59433 → 48193 [ACK] Seq=1 Ack=223486 Win=91136 Len=0 TSval=1886577219 TSecr=1758599082 SLE=232934 SRE=242038
  271  43.085965     10.0.0.2 → 10.0.0.1     TCP 66 6776 → 55246 [ACK] Seq=1 Ack=223001 Win=67 Len=0 TSval=1886577242 TSecr=1758599094
  272  43.086981     10.0.0.2 → 10.0.0.1     TCP 66 25904 → 58169 [ACK] Seq=1 Ack=240345 Win=57 Len=0 TSval=1886577293 TSecr=1758599137
  273  43.087004     10.0.0.2 → 10.0.0.1     TCP 86 [TCP Dup ACK 266#1] 42968 → 55943 [ACK] Seq=1 Ack=216038 Win=34304 Len=0 TSval=1886577305 TSecr=1758598873 SLE=204934 SRE=214382 SLE=225486 SRE=245222
  274  43.161285     10.0.0.2 → 10.0.0.1     TCP 66 46356 → 54368 [ACK] Seq=1 Ack=271001 Win=252 Len=0 TSval=1886577331 TSecr=1758599139
  275  43.161314     10.0.0.2 → 10.0.0.1     TCP 78 35722 → 19551 [ACK] Seq=1 Ack=239934 Win=34304 Len=0 TSval=1886577337 TSecr=1758598384 SLE=244038 SRE=253486
  276  43.161339     10.0.0.2 → 10.0.0.1     TCP 86 [TCP Dup ACK 266#2] 42968 → 55943 [ACK] Seq=1 Ack=216038 Win=34304 Len=0 TSval=1886577343 TSecr=1758598873 SLE=195486 SRE=204934 SLE=225486 SRE=245222
