    1   0.000000     10.0.0.2 → 10.0.0.1     TCP 67 35722 → 42763 [PSH, ACK] Seq=1 Ack=1 Win=74 Len=1 TSval=1886573267 TSecr=1758595179
    2   0.002094     10.0.0.2 → 10.0.0.1     TCP 66 59433 → 36467 [ACK] Seq=1 Ack=1 Win=74 Len=0 TSval=1886573270 TSecr=1758595183
    3   0.014517     10.0.0.2 → 10.0.0.1     TCP 74 47452 → 39475 [SYN, ACK] Seq=0 Ack=1 Win=37792 Len=0 MSS=9460 SACK_PERM TSval=1886573281 TSecr=1758595195 WS=512
    4   0.019967     10.0.0.2 → 10.0.0.1     TCP 74 25904 → 51099 [SYN, ACK] Seq=0 Ack=1 Win=37792 Len=0 MSS=9460 SACK_PERM TSval=1886573285 TSecr=1758595198 WS=512
    5   0.020033     10.0.0.2 → 10.0.0.1     TCP 74 40783 → 58271 [SYN, ACK] Seq=0 Ack=1 Win=37792 Len=0 MSS=9460 SACK_PERM TSval=1886573285 TSecr=1758595198 WS=512
    6   0.027473     10.0.0.2 → 10.0.0.1     TCP 66 47452 → 39475 [ACK] Seq=1 Ack=38 Win=37888 Len=0 TSval=1886573293 TSecr=1758595203
    7   0.027837     10.0.0.2 → 10.0.0.1     TCP 67 47452 → 39475 [PSH, ACK] Seq=1 Ack=38 Win=37888 Len=1 TSval=1886573293 TSecr=1758595203
    8   0.031323     10.0.0.2 → 10.0.0.1     TCP 74 46356 → 47085 [SYN, ACK] Seq=0 Ack=1 Win=37792 Len=0 MSS=9460 SACK_PERM TSval=1886573296 TSecr=1758595206 WS=512
    9   0.031836     10.0.0.2 → 10.0.0.1     TCP 66 40783 → 58271 [ACK] Seq=1 Ack=38 Win=37888 Len=0 TSval=1886573298 TSecr=1758595208
   10   0.033198     10.0.0.2 → 10.0.0.1     TCP 66 [TCP Previous segment not captured] 40783 → 58271 [ACK] Seq=2 Ack=38 Win=37888 Len=0 TSval=1886573298 TSecr=1758595208
   11   0.034395     10.0.0.2 → 10.0.0.1     TCP 66 25904 → 51099 [ACK] Seq=1 Ack=38 Win=37888 Len=0 TSval=1886573298 TSecr=1758595208
   12   0.040974     10.0.0.2 → 10.0.0.1     TCP 66 42968 → 49189 [ACK] Seq=1 Ack=1 Win=74 Len=0 TSval=1886573308 TSecr=1758595217
   13   0.041316     10.0.0.2 → 10.0.0.1     TCP 67 42968 → 49189 [PSH, ACK] Seq=1 Ack=1 Win=74 Len=1 TSval=1886573308 TSecr=1758595217
   14   0.041649     10.0.0.2 → 10.0.0.1     TCP 66 46356 → 47085 [ACK] Seq=1 Ack=38 Win=37888 Len=0 TSval=1886573309 TSecr=1758595217
   15   0.051459     10.0.0.2 → 10.0.0.1     TCP 74 35722 → 19551 [SYN, ACK] Seq=0 Ack=1 Win=37792 Len=0 MSS=9460 SACK_PERM TSval=1886573319 TSecr=1758595233 WS=512
   16   0.059219     10.0.0.2 → 10.0.0.1     TCP 67 [TCP Previous segment not captured] 59433 → 36467 [PSH, ACK] Seq=2 Ack=122 Win=74 Len=1 TSval=1886573320 TSecr=1758595234
   17   0.060710     10.0.0.2 → 10.0.0.1     TCP 66 35722 → 19551 [ACK] Seq=1 Ack=38 Win=37888 Len=0 TSval=1886573328 TSecr=1758595235
   18   0.061820     10.0.0.2 → 10.0.0.1     TCP 74 59433 → 48193 [SYN, ACK] Seq=0 Ack=1 Win=37792 Len=0 MSS=9460 SACK_PERM TSval=1886573330 TSecr=1758595243 WS=512
   19   0.126429     10.0.0.2 → 10.0.0.1     TCP 66 40783 → 58271 [ACK] Seq=2 Ack=42 Win=37888 Len=0 TSval=1886573358 TSecr=1758595217
   20   0.126474     10.0.0.2 → 10.0.0.1     TCP 66 42968 → 49189 [ACK] Seq=2 Ack=5 Win=74 Len=0 TSval=1886573358 TSecr=1758595227
   21   0.126497     10.0.0.2 → 10.0.0.1     TCP 66 59433 → 48193 [ACK] Seq=1 Ack=38 Win=37888 Len=0 TSval=1886573393 TSecr=1758595249
   22   0.127564     10.0.0.2 → 10.0.0.1     TCP 68 [TCP Previous segment not captured] 35722 → 42763 [PSH, ACK] Seq=3 Ack=122 Win=74 Len=2 TSval=1886573394 TSecr=1758595277
   23   0.130715     10.0.0.2 → 10.0.0.1     TCP 66 [TCP Dup ACK 21#1] 59433 → 48193 [ACK] Seq=1 Ack=38 Win=37888 Len=0 TSval=1886573395 TSecr=1758595249
   24   0.133800     10.0.0.2 → 10.0.0.1     TCP 67 47452 → 39475 [PSH, ACK] Seq=2 Ack=159 Win=37888 Len=1 TSval=1886573399 TSecr=1758595309
   25   0.133820     10.0.0.2 → 10.0.0.1     TCP 68 59433 → 36467 [PSH, ACK] Seq=3 Ack=122 Win=74 Len=2 TSval=1886573399 TSecr=1758595285
   26   0.142274     10.0.0.2 → 10.0.0.1     TCP 66 6776 → 55655 [ACK] Seq=1 Ack=1 Win=74 Len=0 TSval=1886573409 TSecr=1758595312
   27   0.145565     10.0.0.2 → 10.0.0.1     TCP 67 [TCP Previous segment not captured] 25904 → 51099 [PSH, ACK] Seq=2 Ack=159 Win=37888 Len=1 TSval=1886573413 TSecr=1758595312
   28   0.159202     10.0.0.2 → 10.0.0.1     TCP 67 40783 → 58271 [PSH, ACK] Seq=2 Ack=159 Win=37888 Len=1 TSval=1886573423 TSecr=1758595314
   29   0.180342     10.0.0.2 → 10.0.0.1     TCP 66 42968 → 49189 [ACK] Seq=2 Ack=122 Win=74 Len=0 TSval=1886573437 TSecr=1758595317
   30   0.215603     10.0.0.2 → 10.0.0.1     TCP 74 42968 → 55943 [SYN, ACK] Seq=0 Ack=1 Win=37792 Len=0 MSS=9460 SACK_PERM TSval=1886573483 TSecr=1758595382 WS=512
   31   0.255703     10.0.0.2 → 10.0.0.1     TCP 66 6776 → 55246 [ACK] Seq=1 Ack=1 Win=74 Len=0 TSval=1886573523 TSecr=1758595400
   32   0.271040     10.0.0.2 → 10.0.0.1     TCP 66 59433 → 48193 [ACK] Seq=1 Ack=3038 Win=35840 Len=0 TSval=1886573539 TSecr=1758595409
   33   0.307180     10.0.0.2 → 10.0.0.1     TCP 66 25904 → 58169 [ACK] Seq=1 Ack=1 Win=74 Len=0 TSval=1886573575 TSecr=1758595410
   34   0.319480     10.0.0.2 → 10.0.0.1     TCP 66 46356 → 54368 [ACK] Seq=1 Ack=1 Win=74 Len=0 TSval=1886573587 TSecr=1758595410
   35   0.331860     10.0.0.2 → 10.0.0.1     TCP 66 42968 → 55943 [ACK] Seq=1 Ack=38 Win=37888 Len=0 TSval=1886573599 TSecr=1758595417
   36   0.334111     10.0.0.2 → 10.0.0.1     TCP 68 [TCP Previous segment not captured] 6776 → 55655 [PSH, ACK] Seq=2 Ack=1 Win=74 Len=2 TSval=1886573602 TSecr=1758595421
   37   0.335126     10.0.0.2 → 10.0.0.1     TCP 68 47452 → 39475 [PSH, ACK] Seq=3 Ack=159 Win=37888 Len=2 TSval=1886573603 TSecr=1758595421
   38   0.342271     10.0.0.2 → 10.0.0.1     TCP 68 [TCP Previous segment not captured] 42968 → 49189 [PSH, ACK] Seq=3 Ack=122 Win=74 Len=2 TSval=1886573610 TSecr=1758595425
   39   0.346298     10.0.0.2 → 10.0.0.1     TCP 68 40783 → 58271 [PSH, ACK] Seq=3 Ack=159 Win=37888 Len=2 TSval=1886573614 TSecr=1758595425
   40   0.347378     10.0.0.2 → 10.0.0.1     TCP 68 [TCP Previous segment not captured] 46356 → 47085 [PSH, ACK] Seq=3 Ack=159 Win=37888 Len=2 TSval=1886573615 TSecr=1758595425
   41   0.351514     10.0.0.2 → 10.0.0.1     TCP 66 59433 → 48193 [ACK] Seq=1 Ack=12038 Win=34304 Len=0 TSval=1886573619 TSecr=1758595532
   42   0.374076     10.0.0.2 → 10.0.0.1     TCP 66 42968 → 55943 [ACK] Seq=1 Ack=1038 Win=37376 Len=0 TSval=1886573641 TSecr=1758595536
   43   0.388578     10.0.0.2 → 10.0.0.1     TCP 66 25904 → 58169 [ACK] Seq=1 Ack=3001 Win=70 Len=0 TSval=1886573656 TSecr=1758595570
   44   0.391790     10.0.0.2 → 10.0.0.1     TCP 66 40783 → 32720 [ACK] Seq=1 Ack=1 Win=73 Len=0 TSval=1886573659 TSecr=1758595534
   45   0.395330     10.0.0.2 → 10.0.0.1     TCP 66 46356 → 54368 [ACK] Seq=1 Ack=1001 Win=73 Len=0 TSval=1886573663 TSecr=1758595536
   46   0.403858     10.0.0.2 → 10.0.0.1     TCP 66 59433 → 48193 [ACK] Seq=1 Ack=14038 Win=34304 Len=0 TSval=1886573672 TSecr=1758595560
   47   0.406299     10.0.0.2 → 10.0.0.1     TCP 66 59433 → 48193 [ACK] Seq=1 Ack=16038 Win=34304 Len=0 TSval=1886573673 TSecr=1758595587
   48   0.408141     10.0.0.2 → 10.0.0.1     TCP 66 35722 → 19551 [ACK] Seq=1 Ack=19038 Win=34304 Len=0 TSval=1886573676 TSecr=1758595562
   49   0.414393     10.0.0.2 → 10.0.0.1     TCP 66 47452 → 53241 [ACK] Seq=1 Ack=1 Win=71 Len=0 TSval=1886573681 TSecr=1758595564
   50   0.416604     10.0.0.2 → 10.0.0.1     TCP 66 47452 → 53241 [ACK] Seq=1 Ack=2001 Win=68 Len=0 TSval=1886573684 TSecr=1758595598
   51   0.417241     10.0.0.2 → 10.0.0.1     TCP 66 6776 → 55246 [ACK] Seq=1 Ack=3001 Win=71 Len=0 TSval=1886573685 TSecr=1758595571
   52   0.422122     10.0.0.2 → 10.0.0.1     TCP 66 40783 → 32720 [ACK] Seq=1 Ack=3001 Win=68 Len=0 TSval=1886573690 TSecr=1758595576
   53   0.433220     10.0.0.2 → 10.0.0.1     TCP 66 46356 → 54368 [ACK] Seq=1 Ack=4001 Win=68 Len=0 TSval=1886573701 TSecr=1758595579
   54   0.434806     10.0.0.2 → 10.0.0.1     TCP 66 46356 → 54368 [ACK] Seq=1 Ack=7001 Win=67 Len=0 TSval=1886573703 TSecr=1758595617
   55   0.453817     10.0.0.2 → 10.0.0.1     TCP 66 25904 → 58169 [ACK] Seq=1 Ack=5001 Win=68 Len=0 TSval=1886573722 TSecr=1758595588
   56   0.467703     10.0.0.2 → 10.0.0.1     TCP 66 47452 → 53241 [ACK] Seq=1 Ack=6001 Win=67 Len=0 TSval=1886573736 TSecr=1758595650
   57   0.479013     10.0.0.2 → 10.0.0.1     TCP 66 59433 → 48193 [ACK] Seq=1 Ack=18038 Win=34304 Len=0 TSval=1886573747 TSecr=1758595607
   58   0.483181     10.0.0.2 → 10.0.0.1     TCP 66 6776 → 55246 [ACK] Seq=1 Ack=7001 Win=67 Len=0 TSval=1886573751 TSecr=1758595624
   59   0.500041     10.0.0.2 → 10.0.0.1     TCP 66 46356 → 54368 [ACK] Seq=1 Ack=8001 Win=67 Len=0 TSval=1886573767 TSecr=1758595630
   60   0.503885     10.0.0.2 → 10.0.0.1     TCP 66 25904 → 58169 [ACK] Seq=1 Ack=8001 Win=67 Len=0 TSval=1886573772 TSecr=1758595638
   61   0.516023     10.0.0.2 → 10.0.0.1     TCP 66 40783 → 32720 [ACK] Seq=1 Ack=8001 Win=67 Len=0 TSval=1886573784 TSecr=1758595654
   62   0.529873     10.0.0.2 → 10.0.0.1     TCP 66 59433 → 48193 [ACK] Seq=1 Ack=25038 Win=34304 Len=0 TSval=1886573798 TSecr=1758595712
   63   0.544953     10.0.0.2 → 10.0.0.1     TCP 66 35722 → 19551 [ACK] Seq=1 Ack=27038 Win=34304 Len=0 TSval=1886573813 TSecr=1758595664
   64   0.550564     10.0.0.2 → 10.0.0.1     TCP 66 6776 → 55246 [ACK] Seq=1 Ack=15001 Win=67 Len=0 TSval=1886573818 TSecr=1758595733
   65   0.565998     10.0.0.2 → 10.0.0.1     TCP 66 42968 → 55943 [ACK] Seq=1 Ack=12038 Win=34304 Len=0 TSval=1886573833 TSecr=1758595683
   66   0.571169     10.0.0.2 → 10.0.0.1     TCP 66 46356 → 54368 [ACK] Seq=1 Ack=17001 Win=67 Len=0 TSval=1886573839 TSecr=1758595753
   67   0.596646     10.0.0.2 → 10.0.0.1     TCP 66 25904 → 58169 [ACK] Seq=1 Ack=19001 Win=67 Len=0 TSval=1886573864 TSecr=1758595774
   68   0.598707     10.0.0.2 → 10.0.0.1     TCP 66 46356 → 54368 [ACK] Seq=1 Ack=19001 Win=67 Len=0 TSval=1886573867 TSecr=1758595776
   69   0.602257     10.0.0.2 → 10.0.0.1     TCP 66 40783 → 32720 [ACK] Seq=1 Ack=12001 Win=67 Len=0 TSval=1886573870 TSecr=1758595700
   70   0.603735     10.0.0.2 → 10.0.0.1     TCP 66 40783 → 32720 [ACK] Seq=1 Ack=18001 Win=67 Len=0 TSval=1886573872 TSecr=1758595786
   71   0.624383     10.0.0.2 → 10.0.0.1     TCP 66 35722 → 19551 [ACK] Seq=1 Ack=37038 Win=34304 Len=0 TSval=1886573892 TSecr=1758595806
   72   0.639067     10.0.0.2 → 10.0.0.1     TCP 66 6776 → 55246 [ACK] Seq=1 Ack=16001 Win=67 Len=0 TSval=1886573907 TSecr=1758595744
   73   0.643500     10.0.0.2 → 10.0.0.1     TCP 66 47452 → 53241 [ACK] Seq=1 Ack=14001 Win=67 Len=0 TSval=1886573911 TSecr=1758595748
   74   0.644341     10.0.0.2 → 10.0.0.1     TCP 66 35722 → 19551 [ACK] Seq=1 Ack=39038 Win=34304 Len=0 TSval=1886573912 TSecr=1758595824
   75   0.652774     10.0.0.2 → 10.0.0.1     TCP 66 47452 → 53241 [ACK] Seq=1 Ack=20001 Win=67 Len=0 TSval=1886573920 TSecr=1758595829
   76   0.655218     10.0.0.2 → 10.0.0.1     TCP 66 35722 → 19551 [ACK] Seq=1 Ack=40038 Win=34304 Len=0 TSval=1886573923 TSecr=1758595837
   77   0.659673     10.0.0.2 → 10.0.0.1     TCP 66 47452 → 53241 [ACK] Seq=1 Ack=21001 Win=67 Len=0 TSval=1886573927 TSecr=1758595841
   78   0.673164     10.0.0.2 → 10.0.0.1     TCP 66 35722 → 19551 [ACK] Seq=1 Ack=41038 Win=34304 Len=0 TSval=1886573940 TSecr=1758595851
   79   0.674089     10.0.0.2 → 10.0.0.1     TCP 66 42968 → 55943 [ACK] Seq=1 Ack=24038 Win=34304 Len=0 TSval=1886573941 TSecr=1758595851
   80   0.683878     10.0.0.2 → 10.0.0.1     TCP 66 25904 → 58169 [ACK] Seq=1 Ack=20001 Win=67 Len=0 TSval=1886573952 TSecr=1758595788
   81   0.685677     10.0.0.2 → 10.0.0.1     TCP 66 47452 → 53241 [ACK] Seq=1 Ack=22001 Win=67 Len=0 TSval=1886573953 TSecr=1758595854
   82   0.691406     10.0.0.2 → 10.0.0.1     TCP 66 25904 → 58169 [ACK] Seq=1 Ack=25001 Win=67 Len=0 TSval=1886573958 TSecr=1758595867
   83   0.697188     10.0.0.2 → 10.0.0.1     TCP 66 59433 → 48193 [ACK] Seq=1 Ack=32038 Win=34304 Len=0 TSval=1886573965 TSecr=1758595803
   84   0.713506     10.0.0.2 → 10.0.0.1     TCP 66 40783 → 32720 [ACK] Seq=1 Ack=25001 Win=67 Len=0 TSval=1886573981 TSecr=1758595879
   85   0.723643     10.0.0.2 → 10.0.0.1     TCP 66 59433 → 48193 [ACK] Seq=1 Ack=38038 Win=34304 Len=0 TSval=1886573991 TSecr=1758595881
   86   0.737887     10.0.0.2 → 10.0.0.1     TCP 66 25904 → 58169 [ACK] Seq=1 Ack=28001 Win=67 Len=0 TSval=1886574006 TSecr=1758595895
   87   0.741190     10.0.0.2 → 10.0.0.1     TCP 66 35722 → 19551 [ACK] Seq=1 Ack=42038 Win=34304 Len=0 TSval=1886574009 TSecr=1758595864
   88   0.745338     10.0.0.2 → 10.0.0.1     TCP 66 47452 → 53241 [ACK] Seq=1 Ack=23001 Win=67 Len=0 TSval=1886574013 TSecr=1758595869
   89   0.753921     10.0.0.2 → 10.0.0.1     TCP 66 40783 → 32720 [ACK] Seq=1 Ack=27001 Win=67 Len=0 TSval=1886574022 TSecr=1758595897
   90   0.768413     10.0.0.2 → 10.0.0.1     TCP 66 47452 → 53241 [ACK] Seq=1 Ack=27001 Win=67 Len=0 TSval=1886574036 TSecr=1758595929
   91   0.776614     10.0.0.2 → 10.0.0.1     TCP 66 35722 → 19551 [ACK] Seq=1 Ack=47038 Win=34304 Len=0 TSval=1886574044 TSecr=1758595944
   92   0.784811     10.0.0.2 → 10.0.0.1     TCP 66 47452 → 53241 [ACK] Seq=1 Ack=29001 Win=67 Len=0 TSval=1886574053 TSecr=1758595952
   93   0.797179     10.0.0.2 → 10.0.0.1     TCP 66 42968 → 55943 [ACK] Seq=1 Ack=34038 Win=34304 Len=0 TSval=1886574065 TSecr=1758595976
   94   0.801801     10.0.0.2 → 10.0.0.1     TCP 66 40783 → 32720 [ACK] Seq=1 Ack=33001 Win=67 Len=0 TSval=1886574069 TSecr=1758595983
   95   0.811664     10.0.0.2 → 10.0.0.1     TCP 66 46356 → 54368 [ACK] Seq=1 Ack=31001 Win=67 Len=0 TSval=1886574079 TSecr=1758595940
   96   0.819931     10.0.0.2 → 10.0.0.1     TCP 66 25904 → 58169 [ACK] Seq=1 Ack=32001 Win=67 Len=0 TSval=1886574088 TSecr=1758595954
   97   0.836345     10.0.0.2 → 10.0.0.1     TCP 66 59433 → 48193 [ACK] Seq=1 Ack=44038 Win=34304 Len=0 TSval=1886574104 TSecr=1758595962
   98   0.838529     10.0.0.2 → 10.0.0.1     TCP 66 59433 → 48193 [ACK] Seq=1 Ack=48038 Win=34304 Len=0 TSval=1886574106 TSecr=1758596020
   99   0.840638     10.0.0.2 → 10.0.0.1     TCP 66 6776 → 55246 [ACK] Seq=1 Ack=32001 Win=67 Len=0 TSval=1886574108 TSecr=1758595963
  100   0.845028     10.0.0.2 → 10.0.0.1     TCP 66 35722 → 19551 [ACK] Seq=1 Ack=54038 Win=34304 Len=0 TSval=1886574113 TSecr=1758596024
  101   0.853031     10.0.0.2 → 10.0.0.1     TCP 66 40783 → 32720 [ACK] Seq=1 Ack=34001 Win=67 Len=0 TSval=1886574121 TSecr=1758595988
  102   0.857919     10.0.0.2 → 10.0.0.1     TCP 66 42968 → 55943 [ACK] Seq=1 Ack=35038 Win=34304 Len=0 TSval=1886574125 TSecr=1758595990
  103   0.875831     10.0.0.2 → 10.0.0.1     TCP 66 46356 → 54368 [ACK] Seq=1 Ack=39001 Win=67 Len=0 TSval=1886574144 TSecr=1758596045
  104   0.877684     10.0.0.2 → 10.0.0.1     TCP 66 25904 → 58169 [ACK] Seq=1 Ack=37001 Win=67 Len=0 TSval=1886574145 TSecr=1758596014
  105   0.881958     10.0.0.2 → 10.0.0.1     TCP 66 40783 → 32720 [ACK] Seq=1 Ack=37001 Win=67 Len=0 TSval=1886574150 TSecr=1758596037
  106   0.888197     10.0.0.2 → 10.0.0.1     TCP 66 25904 → 58169 [ACK] Seq=1 Ack=40001 Win=67 Len=0 TSval=1886574156 TSecr=1758596061
  107   0.898496     10.0.0.2 → 10.0.0.1     TCP 66 6776 → 55246 [ACK] Seq=1 Ack=38001 Win=67 Len=0 TSval=1886574166 TSecr=1758596038
  108   0.902694     10.0.0.2 → 10.0.0.1     TCP 66 47452 → 53241 [ACK] Seq=1 Ack=37001 Win=67 Len=0 TSval=1886574171 TSecr=1758596055
  109   0.908810     10.0.0.2 → 10.0.0.1     TCP 66 6776 → 55246 [ACK] Seq=1 Ack=42001 Win=67 Len=0 TSval=1886574177 TSecr=1758596091
  110   0.932046     10.0.0.2 → 10.0.0.1     TCP 66 59433 → 48193 [ACK] Seq=1 Ack=54038 Win=34304 Len=0 TSval=1886574200 TSecr=1758596089
  111   0.971434     10.0.0.2 → 10.0.0.1     TCP 66 46356 → 54368 [ACK] Seq=1 Ack=41001 Win=67 Len=0 TSval=1886574234 TSecr=1758596070
  112   1.075833     10.0.0.2 → 10.0.0.1     TCP 66 40783 → 32720 [ACK] Seq=1 Ack=47001 Win=67 Len=0 TSval=1886574340 TSecr=1758596174
  113   1.078458     10.0.0.2 → 10.0.0.1     TCP 66 42968 → 55943 [ACK] Seq=1 Ack=54038 Win=34304 Len=0 TSval=1886574340 TSecr=1758596250
  114   1.080749     10.0.0.2 → 10.0.0.1     TCP 66 46356 → 54368 [ACK] Seq=1 Ack=54001 Win=67 Len=0 TSval=1886574348 TSecr=1758596255
  115   1.085452     10.0.0.2 → 10.0.0.1     TCP 66 35722 → 19551 [ACK] Seq=1 Ack=66038 Win=34304 Len=0 TSval=1886574353 TSecr=1758596184
  116   1.092484     10.0.0.2 → 10.0.0.1     TCP 66 35722 → 19551 [ACK] Seq=1 Ack=72038 Win=34304 Len=0 TSval=1886574360 TSecr=1758596269
  117   1.115939     10.0.0.2 → 10.0.0.1     TCP 66 6776 → 55246 [ACK] Seq=1 Ack=49001 Win=67 Len=0 TSval=1886574379 TSecr=1758596188
  118   1.120569     10.0.0.2 → 10.0.0.1     TCP 66 25904 → 58169 [ACK] Seq=1 Ack=51001 Win=67 Len=0 TSval=1886574387 TSecr=1758596203
  119   1.123489     10.0.0.2 → 10.0.0.1     TCP 66 25904 → 58169 [ACK] Seq=1 Ack=58001 Win=67 Len=0 TSval=1886574391 TSecr=1758596304
  120   1.131011     10.0.0.2 → 10.0.0.1     TCP 66 59433 → 48193 [ACK] Seq=1 Ack=65038 Win=34304 Len=0 TSval=1886574399 TSecr=1758596245
  121   1.158793     10.0.0.2 → 10.0.0.1     TCP 66 40783 → 32720 [ACK] Seq=1 Ack=54001 Win=67 Len=0 TSval=1886574427 TSecr=1758596260
  122   1.160772     10.0.0.2 → 10.0.0.1     TCP 66 40783 → 32720 [ACK] Seq=1 Ack=60001 Win=67 Len=0 TSval=1886574428 TSecr=1758596342
  123   1.187214     10.0.0.2 → 10.0.0.1     TCP 66 42968 → 55943 [ACK] Seq=1 Ack=55038 Win=34304 Len=0 TSval=1886574455 TSecr=1758596262
  124   1.189503     10.0.0.2 → 10.0.0.1     TCP 66 42968 → 55943 [ACK] Seq=1 Ack=63038 Win=34304 Len=0 TSval=1886574457 TSecr=1758596371
  125   1.198559     10.0.0.2 → 10.0.0.1     TCP 66 25904 → 58169 [ACK] Seq=1 Ack=60001 Win=67 Len=0 TSval=1886574462 TSecr=1758596321
  126   1.199965     10.0.0.2 → 10.0.0.1     TCP 66 47452 → 53241 [ACK] Seq=1 Ack=53001 Win=67 Len=0 TSval=1886574467 TSecr=1758596275
  127   1.205506     10.0.0.2 → 10.0.0.1     TCP 66 46356 → 54368 [ACK] Seq=1 Ack=64001 Win=67 Len=0 TSval=1886574473 TSecr=1758596381
  128   1.209796     10.0.0.2 → 10.0.0.1     TCP 66 59433 → 48193 [ACK] Seq=1 Ack=73038 Win=34304 Len=0 TSval=1886574478 TSecr=1758596340
  129   1.226899     10.0.0.2 → 10.0.0.1     TCP 66 47452 → 53241 [ACK] Seq=1 Ack=61001 Win=67 Len=0 TSval=1886574491 TSecr=1758596384
  130   1.231778     10.0.0.2 → 10.0.0.1     TCP 66 6776 → 55246 [ACK] Seq=1 Ack=57001 Win=67 Len=0 TSval=1886574498 TSecr=1758596300
  131   1.239383     10.0.0.2 → 10.0.0.1     TCP 66 46356 → 54368 [ACK] Seq=1 Ack=65001 Win=67 Len=0 TSval=1886574507 TSecr=1758596390
  132   1.242225     10.0.0.2 → 10.0.0.1     TCP 66 59433 → 48193 [ACK] Seq=1 Ack=76038 Win=34304 Len=0 TSval=1886574509 TSecr=1758596393
  133   1.260883     10.0.0.2 → 10.0.0.1     TCP 66 40783 → 32720 [ACK] Seq=1 Ack=61001 Win=67 Len=0 TSval=1886574528 TSecr=1758596348
  134   1.268407     10.0.0.2 → 10.0.0.1     TCP 66 6776 → 55246 [ACK] Seq=1 Ack=66001 Win=67 Len=0 TSval=1886574536 TSecr=1758596416
  135   1.296027     10.0.0.2 → 10.0.0.1     TCP 66 59433 → 48193 [ACK] Seq=1 Ack=79038 Win=34304 Len=0 TSval=1886574562 TSecr=1758596426
  136   1.305598     10.0.0.2 → 10.0.0.1     TCP 66 25904 → 58169 [ACK] Seq=1 Ack=69001 Win=67 Len=0 TSval=1886574573 TSecr=1758596448
  137   1.311903     10.0.0.2 → 10.0.0.1     TCP 66 40783 → 32720 [ACK] Seq=1 Ack=70001 Win=67 Len=0 TSval=1886574580 TSecr=1758596479
  138   1.315761     10.0.0.2 → 10.0.0.1     TCP 66 46356 → 54368 [ACK] Seq=1 Ack=72001 Win=67 Len=0 TSval=1886574584 TSecr=1758596487
  139   1.317855     10.0.0.2 → 10.0.0.1     TCP 66 25904 → 58169 [ACK] Seq=1 Ack=72001 Win=67 Len=0 TSval=1886574586 TSecr=1758596489
  140   1.324033     10.0.0.2 → 10.0.0.1     TCP 66 25904 → 58169 [ACK] Seq=1 Ack=73001 Win=67 Len=0 TSval=1886574592 TSecr=1758596501
  141   1.331374     10.0.0.2 → 10.0.0.1     TCP 66 42968 → 55943 [ACK] Seq=1 Ack=74038 Win=34304 Len=0 TSval=1886574599 TSecr=1758596513
  142   1.336436     10.0.0.2 → 10.0.0.1     TCP 66 6776 → 55246 [ACK] Seq=1 Ack=69001 Win=67 Len=0 TSval=1886574604 TSecr=1758596452
  143   1.347032     10.0.0.2 → 10.0.0.1     TCP 66 47452 → 53241 [ACK] Seq=1 Ack=68001 Win=67 Len=0 TSval=1886574615 TSecr=1758596473
  144   1.373779     10.0.0.2 → 10.0.0.1     TCP 66 25904 → 58169 [ACK] Seq=1 Ack=74001 Win=67 Len=0 TSval=1886574642 TSecr=1758596508
  145   1.375336     10.0.0.2 → 10.0.0.1     TCP 66 25904 → 58169 [ACK] Seq=1 Ack=77001 Win=67 Len=0 TSval=1886574643 TSecr=1758596557
  146   1.379174     10.0.0.2 → 10.0.0.1     TCP 66 25904 → 58169 [ACK] Seq=1 Ack=78001 Win=67 Len=0 TSval=1886574647 TSecr=1758596561
  147   1.425866     10.0.0.2 → 10.0.0.1     TCP 66 42968 → 55943 [ACK] Seq=1 Ack=76038 Win=34304 Len=0 TSval=1886574694 TSecr=1758596544
  148   1.426158     10.0.0.2 → 10.0.0.1     TCP 66 47452 → 53241 [ACK] Seq=1 Ack=78001 Win=67 Len=0 TSval=1886574694 TSecr=1758596604
  149   1.436037     10.0.0.2 → 10.0.0.1     TCP 66 59433 → 48193 [ACK] Seq=1 Ack=93038 Win=34304 Len=0 TSval=1886574704 TSecr=1758596608
  150   1.437707     10.0.0.2 → 10.0.0.1     TCP 66 35722 → 19551 [ACK] Seq=1 Ack=95038 Win=34304 Len=0 TSval=1886574706 TSecr=1758596579
  151   1.442228     10.0.0.2 → 10.0.0.1     TCP 66 46356 → 54368 [ACK] Seq=1 Ack=73001 Win=67 Len=0 TSval=1886574710 TSecr=1758596499
  152   1.446129     10.0.0.2 → 10.0.0.1     TCP 66 35722 → 19551 [ACK] Seq=1 Ack=98038 Win=34304 Len=0 TSval=1886574714 TSecr=1758596621
  153   1.448770     10.0.0.2 → 10.0.0.1     TCP 66 42968 → 55943 [ACK] Seq=1 Ack=81038 Win=34304 Len=0 TSval=1886574717 TSecr=1758596609
  154   1.502109     10.0.0.2 → 10.0.0.1     TCP 66 6776 → 55246 [ACK] Seq=1 Ack=81001 Win=67 Len=0 TSval=1886574766 TSecr=1758596611
  155   1.509065     10.0.0.2 → 10.0.0.1     TCP 66 40783 → 32720 [ACK] Seq=1 Ack=81001 Win=67 Len=0 TSval=1886574766 TSecr=1758596618
  156   1.510916     10.0.0.2 → 10.0.0.1     TCP 66 25904 → 58169 [ACK] Seq=1 Ack=79001 Win=67 Len=0 TSval=1886574778 TSecr=1758596574
  157   1.534682     10.0.0.2 → 10.0.0.1     TCP 66 46356 → 54368 [ACK] Seq=1 Ack=83001 Win=67 Len=0 TSval=1886574799 TSecr=1758596636
  158   1.542516     10.0.0.2 → 10.0.0.1     TCP 66 25904 → 58169 [ACK] Seq=1 Ack=88001 Win=67 Len=0 TSval=1886574808 TSecr=1758596695
  159   1.558256     10.0.0.2 → 10.0.0.1     TCP 66 42968 → 55943 [ACK] Seq=1 Ack=89038 Win=34304 Len=0 TSval=1886574824 TSecr=1758596722
  160   1.559333     10.0.0.2 → 10.0.0.1     TCP 66 47452 → 53241 [ACK] Seq=1 Ack=85001 Win=67 Len=0 TSval=1886574825 TSecr=1758596696
  161   1.560691     10.0.0.2 → 10.0.0.1     TCP 66 40783 → 32720 [ACK] Seq=1 Ack=87001 Win=67 Len=0 TSval=1886574827 TSecr=1758596702
  162   1.579770     10.0.0.2 → 10.0.0.1     TCP 66 35722 → 19551 [ACK] Seq=1 Ack=106038 Win=34304 Len=0 TSval=1886574847 TSecr=1758596724
  163   1.586088     10.0.0.2 → 10.0.0.1     TCP 66 6776 → 55246 [ACK] Seq=1 Ack=89001 Win=67 Len=0 TSval=1886574854 TSecr=1758596727
  164   1.593293     10.0.0.2 → 10.0.0.1     TCP 66 42968 → 55943 [ACK] Seq=1 Ack=91038 Win=34304 Len=0 TSval=1886574860 TSecr=1758596742
  165   1.597549     10.0.0.2 → 10.0.0.1     TCP 66 40783 → 32720 [ACK] Seq=1 Ack=90001 Win=67 Len=0 TSval=1886574865 TSecr=1758596744
  166   1.606741     10.0.0.2 → 10.0.0.1     TCP 66 59433 → 48193 [ACK] Seq=1 Ack=103038 Win=34304 Len=0 TSval=1886574873 TSecr=1758596745
  167   1.608539     10.0.0.2 → 10.0.0.1     TCP 66 35722 → 19551 [ACK] Seq=1 Ack=109038 Win=34304 Len=0 TSval=1886574876 TSecr=1758596764
  168   1.636041     10.0.0.2 → 10.0.0.1     TCP 66 25904 → 58169 [ACK] Seq=1 Ack=97001 Win=67 Len=0 TSval=1886574903 TSecr=1758596817
  169   1.653904     10.0.0.2 → 10.0.0.1     TCP 66 47452 → 53241 [ACK] Seq=1 Ack=91001 Win=67 Len=0 TSval=1886574922 TSecr=1758596780
  170   1.704254     10.0.0.2 → 10.0.0.1     TCP 66 25904 → 58169 [ACK] Seq=1 Ack=98001 Win=67 Len=0 TSval=1886574971 TSecr=1758596828
  171   1.712654     10.0.0.2 → 10.0.0.1     TCP 66 42968 → 55943 [ACK] Seq=1 Ack=98038 Win=34304 Len=0 TSval=1886574977 TSecr=1758596834
  172   1.715347     10.0.0.2 → 10.0.0.1     TCP 66 42968 → 55943 [ACK] Seq=1 Ack=103038 Win=34304 Len=0 TSval=1886574983 TSecr=1758596896
  173   1.736492     10.0.0.2 → 10.0.0.1     TCP 66 47452 → 53241 [ACK] Seq=1 Ack=101001 Win=67 Len=0 TSval=1886575004 TSecr=1758596908
  174   1.737307     10.0.0.2 → 10.0.0.1     TCP 78 59433 → 48193 [ACK] Seq=1 Ack=106038 Win=34304 Len=0 TSval=1886575005 TSecr=1758596790 SLE=115486 SRE=116038
  175   1.739594     10.0.0.2 → 10.0.0.1     TCP 66 59433 → 48193 [ACK] Seq=1 Ack=116038 Win=34304 Len=0 TSval=1886575007 TSecr=1758596921
  176   1.753885     10.0.0.2 → 10.0.0.1     TCP 66 40783 → 32720 [ACK] Seq=1 Ack=93001 Win=67 Len=0 TSval=1886575022 TSecr=1758596781
  177   1.758913     10.0.0.2 → 10.0.0.1     TCP 66 6776 → 55246 [ACK] Seq=1 Ack=104001 Win=67 Len=0 TSval=1886575027 TSecr=1758596923
  178   1.771220     10.0.0.2 → 10.0.0.1     TCP 78 [TCP Dup ACK 176#1] 40783 → 32720 [ACK] Seq=1 Ack=93001 Win=67 Len=0 TSval=1886575039 TSecr=1758596781 SLE=102449 SRE=105001
  179   1.791912     10.0.0.2 → 10.0.0.1     TCP 66 46356 → 54368 [ACK] Seq=1 Ack=102001 Win=67 Len=0 TSval=1886575060 TSecr=1758596883
  180   1.838680     10.0.0.2 → 10.0.0.1     TCP 66 42968 → 55943 [ACK] Seq=1 Ack=104038 Win=34304 Len=0 TSval=1886575106 TSecr=1758596910
  181   1.842713     10.0.0.2 → 10.0.0.1     TCP 78 59433 → 48193 [ACK] Seq=1 Ack=117038 Win=34304 Len=0 TSval=1886575110 TSecr=1758596927 SLE=106038 SRE=115486
  182   1.880898     10.0.0.2 → 10.0.0.1     TCP 66 35722 → 19551 [ACK] Seq=1 Ack=123038 Win=34304 Len=0 TSval=1886575149 TSecr=1758596951
  183   1.917455     10.0.0.2 → 10.0.0.1     TCP 66 40783 → 32720 [ACK] Seq=1 Ack=116449 Win=65 Len=0 TSval=1886575185 TSecr=1758596962
  184   1.990907     10.0.0.2 → 10.0.0.1     TCP 66 42968 → 55943 [ACK] Seq=1 Ack=112038 Win=34304 Len=0 TSval=1886575258 TSecr=1758597022
  185   2.015196     10.0.0.2 → 10.0.0.1     TCP 66 46356 → 54368 [ACK] Seq=1 Ack=118001 Win=67 Len=0 TSval=1886575283 TSecr=1758597096
  186   2.016773     10.0.0.2 → 10.0.0.1     TCP 66 6776 → 55246 [ACK] Seq=1 Ack=119001 Win=67 Len=0 TSval=1886575285 TSecr=1758597123
  187   2.017699     10.0.0.2 → 10.0.0.1     TCP 66 47452 → 53241 [ACK] Seq=1 Ack=115449 Win=67 Len=0 TSval=1886575286 TSecr=1758597108
  188   2.020503     10.0.0.2 → 10.0.0.1     TCP 66 40783 → 32720 [ACK] Seq=1 Ack=121001 Win=67 Len=0 TSval=1886575288 TSecr=1758597160
  189   2.022669     10.0.0.2 → 10.0.0.1     TCP 66 59433 → 48193 [ACK] Seq=1 Ack=129038 Win=34304 Len=0 TSval=1886575291 TSecr=1758597074
  190   2.028822     10.0.0.2 → 10.0.0.1     TCP 78 [TCP Dup ACK 184#1] 42968 → 55943 [ACK] Seq=1 Ack=112038 Win=34304 Len=0 TSval=1886575297 TSecr=1758597022 SLE=121486 SRE=123038
  191   2.044047     10.0.0.2 → 10.0.0.1     TCP 66 59433 → 48193 [ACK] Seq=1 Ack=137038 Win=34304 Len=0 TSval=1886575312 TSecr=1758597206
  192   2.061888     10.0.0.2 → 10.0.0.1     TCP 78 35722 → 19551 [ACK] Seq=1 Ack=132038 Win=34304 Len=0 TSval=1886575328 TSecr=1758597065 SLE=133038 SRE=142486
  193   2.063558     10.0.0.2 → 10.0.0.1     TCP 66 35722 → 19551 [ACK] Seq=1 Ack=142486 Win=34304 Len=0 TSval=1886575330 TSecr=1758597077
  194   2.069754     10.0.0.2 → 10.0.0.1     TCP 66 25904 → 58169 [ACK] Seq=1 Ack=118449 Win=67 Len=0 TSval=1886575338 TSecr=1758597108
  195   2.081235     10.0.0.2 → 10.0.0.1     TCP 66 59433 → 48193 [ACK] Seq=1 Ack=139038 Win=34304 Len=0 TSval=1886575349 TSecr=1758597228
  196   2.087636     10.0.0.2 → 10.0.0.1     TCP 78 [TCP Dup ACK 194#1] 25904 → 58169 [ACK] Seq=1 Ack=118449 Win=67 Len=0 TSval=1886575355 TSecr=1758597108 SLE=120001 SRE=129001
  197   2.103100     10.0.0.2 → 10.0.0.1     TCP 78 6776 → 55246 [ACK] Seq=1 Ack=126001 Win=67 Len=0 TSval=1886575371 TSecr=1758597215 SLE=107001 SRE=116449
  198   2.147721     10.0.0.2 → 10.0.0.1     TCP 66 42968 → 55943 [ACK] Seq=1 Ack=123038 Win=34304 Len=0 TSval=1886575416 TSecr=1758597150
  199   2.184324     10.0.0.2 → 10.0.0.1     TCP 66 40783 → 32720 [ACK] Seq=1 Ack=134449 Win=61 Len=0 TSval=1886575452 TSecr=1758597349
  200   2.185689     10.0.0.2 → 10.0.0.1     TCP 66 47452 → 53241 [ACK] Seq=1 Ack=119001 Win=67 Len=0 TSval=1886575453 TSecr=1758597158
  201   2.197688     10.0.0.2 → 10.0.0.1     TCP 78 [TCP Dup ACK 200#1] 47452 → 53241 [ACK] Seq=1 Ack=119001 Win=67 Len=0 TSval=1886575465 TSecr=1758597158 SLE=128449 SRE=135001
  202   2.228479     10.0.0.2 → 10.0.0.1     TCP 78 40783 → 32720 [ACK] Seq=1 Ack=137001 Win=67 Len=0 TSval=1886575496 TSecr=1758597368 SLE=121001 SRE=125001
  203   2.244816     10.0.0.2 → 10.0.0.1     TCP 78 42968 → 55943 [ACK] Seq=1 Ack=132486 Win=34304 Len=0 TSval=1886575513 TSecr=1758597331 SLE=112038 SRE=121486
  204   2.249060     10.0.0.2 → 10.0.0.1     TCP 78 [TCP Dup ACK 197#1] 6776 → 55246 [ACK] Seq=1 Ack=126001 Win=67 Len=0 TSval=1886575517 TSecr=1758597215 SLE=129001 SRE=138449
  205   2.277382     10.0.0.2 → 10.0.0.1     TCP 78 [TCP Dup ACK 195#1] 59433 → 48193 [ACK] Seq=1 Ack=139038 Win=34304 Len=0 TSval=1886575545 TSecr=1758597228 SLE=142038 SRE=151486
  206   2.293289     10.0.0.2 → 10.0.0.1     TCP 66 6776 → 55246 [ACK] Seq=1 Ack=138449 Win=65 Len=0 TSval=1886575561 TSecr=1758597263
  207   2.296425     10.0.0.2 → 10.0.0.1     TCP 78 35722 → 19551 [ACK] Seq=1 Ack=154486 Win=34304 Len=0 TSval=1886575564 TSecr=1758597247 SLE=142486 SRE=145038
  208   2.305698     10.0.0.2 → 10.0.0.1     TCP 66 59433 → 48193 [ACK] Seq=1 Ack=151486 Win=33280 Len=0 TSval=1886575573 TSecr=1758597265
  209   2.317941     10.0.0.2 → 10.0.0.1     TCP 78 25904 → 58169 [ACK] Seq=1 Ack=129001 Win=67 Len=0 TSval=1886575586 TSecr=1758597134 SLE=118449 SRE=120001
  210   2.320714     10.0.0.2 → 10.0.0.1     TCP 78 [TCP Dup ACK 209#1] 25904 → 58169 [ACK] Seq=1 Ack=129001 Win=67 Len=0 TSval=1886575588 TSecr=1758597134 SLE=135001 SRE=144449
  211   2.358809     10.0.0.2 → 10.0.0.1     TCP 78 [TCP Dup ACK 208#1] 59433 → 48193 [ACK] Seq=1 Ack=151486 Win=34304 Len=0 TSval=1886575626 TSecr=1758597265 SLE=139038 SRE=142038
  212   2.364976     10.0.0.2 → 10.0.0.1     TCP 66 35722 → 19551 [ACK] Seq=1 Ack=162038 Win=34304 Len=0 TSval=1886575633 TSecr=1758597466
  213   2.396431     10.0.0.2 → 10.0.0.1     TCP 66 59433 → 48193 [ACK] Seq=1 Ack=159038 Win=34304 Len=0 TSval=1886575664 TSecr=1758597489
  214   2.411647     10.0.0.2 → 10.0.0.1     TCP 78 25904 → 58169 [ACK] Seq=1 Ack=144449 Win=67 Len=0 TSval=1886575679 TSecr=1758597325 SLE=129001 SRE=135001
  215   2.424011     10.0.0.2 → 10.0.0.1     TCP 78 [TCP Dup ACK 202#1] 40783 → 32720 [ACK] Seq=1 Ack=137001 Win=67 Len=0 TSval=1886575691 TSecr=1758597368 SLE=138001 SRE=147449
  216   2.425871     10.0.0.2 → 10.0.0.1     TCP 66 42968 → 55943 [ACK] Seq=1 Ack=144486 Win=33280 Len=0 TSval=1886575693 TSecr=1758597331
  217   2.439643     10.0.0.2 → 10.0.0.1     TCP 66 47452 → 53241 [ACK] Seq=1 Ack=138001 Win=67 Len=0 TSval=1886575707 TSecr=1758597414
  218   2.474722     10.0.0.2 → 10.0.0.1     TCP 78 [TCP Dup ACK 214#1] 25904 → 58169 [ACK] Seq=1 Ack=144449 Win=67 Len=0 TSval=1886575742 TSecr=1758597325 SLE=153897 SRE=154001
  219   2.501151     10.0.0.2 → 10.0.0.1     TCP 66 46356 → 54368 [ACK] Seq=1 Ack=153001 Win=67 Len=0 TSval=1886575769 TSecr=1758597564
  220   2.546290     10.0.0.2 → 10.0.0.1     TCP 66 6776 → 55246 [ACK] Seq=1 Ack=154449 Win=67 Len=0 TSval=1886575802 TSecr=1758597598
  221   2.587848     10.0.0.2 → 10.0.0.1     TCP 66 42968 → 55943 [ACK] Seq=1 Ack=156038 Win=34304 Len=0 TSval=1886575855 TSecr=1758597610
  222   2.606044     10.0.0.2 → 10.0.0.1     TCP 78 [TCP Dup ACK 221#1] 42968 → 55943 [ACK] Seq=1 Ack=156038 Win=34304 Len=0 TSval=1886575874 TSecr=1758597610 SLE=165486 SRE=168038
  223   2.830449     10.0.0.2 → 10.0.0.1     TCP 66 42968 → 55943 [ACK] Seq=1 Ack=168038 Win=34304 Len=0 TSval=1886576097 TSecr=1758597797
  224   2.830960     10.0.0.2 → 10.0.0.1     TCP 66 6776 → 55246 [ACK] Seq=1 Ack=158001 Win=67 Len=0 TSval=1886576098 TSecr=1758597648
  225   2.831527     10.0.0.2 → 10.0.0.1     TCP 66 40783 → 32720 [ACK] Seq=1 Ack=168449 Win=61 Len=0 TSval=1886576098 TSecr=1758597659
  226   2.859023     10.0.0.2 → 10.0.0.1     TCP 78 59433 → 48193 [ACK] Seq=1 Ack=165038 Win=34304 Len=0 TSval=1886576127 TSecr=1758597580 SLE=175038 SRE=184486
  227   2.878114     10.0.0.2 → 10.0.0.1     TCP 78 47452 → 53241 [ACK] Seq=1 Ack=154001 Win=67 Len=0 TSval=1886576146 TSecr=1758597623 SLE=160001 SRE=178897
  228   2.884122     10.0.0.2 → 10.0.0.1     TCP 78 [TCP Dup ACK 223#1] 42968 → 55943 [ACK] Seq=1 Ack=168038 Win=34304 Len=0 TSval=1886576152 TSecr=1758597797 SLE=144486 SRE=153934
  229   2.916326     10.0.0.2 → 10.0.0.1     TCP 78 35722 → 19551 [ACK] Seq=1 Ack=184486 Win=34304 Len=0 TSval=1886576184 TSecr=1758597777 SLE=195486 SRE=204934
  230   2.935517     10.0.0.2 → 10.0.0.1     TCP 78 59433 → 48193 [ACK] Seq=1 Ack=174486 Win=25088 Len=0 TSval=1886576203 TSecr=1758598043 SLE=175038 SRE=193934
  231   2.974721     10.0.0.2 → 10.0.0.1     TCP 78 35722 → 19551 [ACK] Seq=1 Ack=186038 Win=34304 Len=0 TSval=1886576242 TSecr=1758598100 SLE=195486 SRE=204934
  232   2.977740     10.0.0.2 → 10.0.0.1     TCP 66 47452 → 53241 [ACK] Seq=1 Ack=188345 Win=67 Len=0 TSval=1886576246 TSecr=1758598106
  233   2.985739     10.0.0.2 → 10.0.0.1     TCP 78 59433 → 48193 [ACK] Seq=1 Ack=193934 Win=34304 Len=0 TSval=1886576252 TSecr=1758598081 SLE=174486 SRE=175038
  234   3.004588     10.0.0.2 → 10.0.0.1     TCP 78 [TCP Dup ACK 223#2] 42968 → 55943 [ACK] Seq=1 Ack=168038 Win=34304 Len=0 TSval=1886576271 TSecr=1758597797 SLE=186038 SRE=195486
  235   3.020324     10.0.0.2 → 10.0.0.1     TCP 66 59433 → 48193 [ACK] Seq=1 Ack=203382 Win=34304 Len=0 TSval=1886576288 TSecr=1758598157
  236   3.027263     10.0.0.2 → 10.0.0.1     TCP 78 25904 → 58169 [ACK] Seq=1 Ack=164001 Win=67 Len=0 TSval=1886576293 TSecr=1758597711 SLE=154001 SRE=163449
  237   3.074798     10.0.0.2 → 10.0.0.1     TCP 66 35722 → 19551 [ACK] Seq=1 Ack=214038 Win=34304 Len=0 TSval=1886576339 TSecr=1758598158
  238   3.092614     10.0.0.2 → 10.0.0.1     TCP 78 [TCP Dup ACK 236#1] 25904 → 58169 [ACK] Seq=1 Ack=164001 Win=67 Len=0 TSval=1886576356 TSecr=1758597711 SLE=182897 SRE=192345
  239   3.107010     10.0.0.2 → 10.0.0.1     TCP 78 [TCP Dup ACK 236#2] 25904 → 58169 [ACK] Seq=1 Ack=164001 Win=67 Len=0 TSval=1886576374 TSecr=1758597711 SLE=182897 SRE=198001
  240   3.109845     10.0.0.2 → 10.0.0.1     TCP 66 6776 → 55246 [ACK] Seq=1 Ack=167449 Win=67 Len=0 TSval=1886576378 TSecr=1758597771
  241   3.131105     10.0.0.2 → 10.0.0.1     TCP 78 25904 → 58169 [ACK] Seq=1 Ack=173449 Win=57 Len=0 TSval=1886576398 TSecr=1758598281 SLE=182897 SRE=198001
  242   3.139496     10.0.0.2 → 10.0.0.1     TCP 78 [TCP Dup ACK 237#1] 35722 → 19551 [ACK] Seq=1 Ack=214038 Win=34304 Len=0 TSval=1886576407 TSecr=1758598158 SLE=184486 SRE=186038
  243   3.148919     10.0.0.2 → 10.0.0.1     TCP 78 [TCP Dup ACK 223#3] 42968 → 55943 [ACK] Seq=1 Ack=168038 Win=34304 Len=0 TSval=1886576417 TSecr=1758597797 SLE=177486 SRE=195486
  244   3.168829     10.0.0.2 → 10.0.0.1     TCP 66 25904 → 58169 [ACK] Seq=1 Ack=198001 Win=57 Len=0 TSval=1886576435 TSecr=1758598291
  245   3.185061     10.0.0.2 → 10.0.0.1     TCP 78 6776 → 55246 [ACK] Seq=1 Ack=176897 Win=67 Len=0 TSval=1886576453 TSecr=1758597891 SLE=185001 SRE=194449
  246   3.223422     10.0.0.2 → 10.0.0.1     TCP 66 42968 → 55943 [ACK] Seq=1 Ack=195486 Win=20992 Len=0 TSval=1886576472 TSecr=1758598333
  247   3.299550     10.0.0.2 → 10.0.0.1     TCP 78 [TCP Dup ACK 245#1] 6776 → 55246 [ACK] Seq=1 Ack=176897 Win=67 Len=0 TSval=1886576491 TSecr=1758597891 SLE=185001 SRE=203897
  248   3.327612     10.0.0.2 → 10.0.0.1     TCP 78 47452 → 53241 [ACK] Seq=1 Ack=196001 Win=104 Len=0 TSval=1886576515 TSecr=1758598185 SLE=205001 SRE=214449
  249   3.416312     10.0.0.2 → 10.0.0.1     TCP 78 40783 → 32720 [ACK] Seq=1 Ack=170001 Win=67 Len=0 TSval=1886576566 TSecr=1758598002 SLE=179449 SRE=188897
  250   3.454570     10.0.0.2 → 10.0.0.1     TCP 78 46356 → 54368 [ACK] Seq=1 Ack=195449 Win=57 Len=0 TSval=1886576595 TSecr=1758598503 SLE=204897 SRE=214345
  251   3.513236     10.0.0.2 → 10.0.0.1     TCP 78 [TCP Dup ACK 237#2] 35722 → 19551 [ACK] Seq=1 Ack=214038 Win=34304 Len=0 TSval=1886576613 TSecr=1758598158 SLE=230486 SRE=239934
  252   3.513570     10.0.0.2 → 10.0.0.1     TCP 66 40783 → 32720 [ACK] Seq=1 Ack=188897 Win=57 Len=0 TSval=1886576626 TSecr=1758598007
  253   3.635727     10.0.0.2 → 10.0.0.1     TCP 66 40783 → 32720 [ACK] Seq=1 Ack=198345 Win=67 Len=0 TSval=1886576668 TSecr=1758598580
  254   3.672029     10.0.0.2 → 10.0.0.1     TCP 66 40783 → 32720 [ACK] Seq=1 Ack=207793 Win=67 Len=0 TSval=1886576684 TSecr=1758598580
  255   3.672045     10.0.0.2 → 10.0.0.1     TCP 86 [TCP Dup ACK 246#1] 42968 → 55943 [ACK] Seq=1 Ack=195486 Win=34304 Len=0 TSval=1886576684 TSecr=1758598333 SLE=168038 SRE=177486 SLE=214382 SRE=216038
  256   3.726140     10.0.0.2 → 10.0.0.1     TCP 78 59433 → 48193 [ACK] Seq=1 Ack=209038 Win=53248 Len=0 TSval=1886576702 TSecr=1758598157 SLE=232934 SRE=242038
  257   3.726171     10.0.0.2 → 10.0.0.1     TCP 86 [TCP Dup ACK 246#2] 42968 → 55943 [ACK] Seq=1 Ack=195486 Win=34304 Len=0 TSval=1886576722 TSecr=1758598333 SLE=177486 SRE=186038 SLE=214382 SRE=216038
  258   3.928266     10.0.0.2 → 10.0.0.1     TCP 86 [TCP Dup ACK 250#1] 46356 → 54368 [ACK] Seq=1 Ack=195449 Win=67 Len=0 TSval=1886576781 TSecr=1758598503 SLE=186001 SRE=195449 SLE=204897 SRE=214345
  259   3.928390     10.0.0.2 → 10.0.0.1     TCP 78 [TCP Dup ACK 244#1] 25904 → 58169 [ACK] Seq=1 Ack=198001 Win=67 Len=0 TSval=1886576787 TSecr=1758598291 SLE=212001 SRE=221449
  260   4.025254     10.0.0.2 → 10.0.0.1     TCP 78 40783 → 32720 [ACK] Seq=1 Ack=217241 Win=53 Len=0 TSval=1886576852 TSecr=1758598746 SLE=223201 SRE=236137
  261   4.025328     10.0.0.2 → 10.0.0.1     TCP 86 [TCP Dup ACK 244#2] 25904 → 58169 [ACK] Seq=1 Ack=198001 Win=67 Len=0 TSval=1886576863 TSecr=1758598291 SLE=173449 SRE=182897 SLE=212001 SRE=221449
  262   4.025362     10.0.0.2 → 10.0.0.1     TCP 78 [TCP Dup ACK 246#3] 42968 → 55943 [ACK] Seq=1 Ack=195486 Win=34304 Len=0 TSval=1886576904 TSecr=1758598333 SLE=204934 SRE=216038
  263   4.025415     10.0.0.2 → 10.0.0.1     TCP 78 59433 → 48193 [ACK] Seq=1 Ack=214038 Win=72192 Len=0 TSval=1886576940 TSecr=1758598231 SLE=232934 SRE=242038
  264   4.143654     10.0.0.2 → 10.0.0.1     TCP 78 42968 → 55943 [ACK] Seq=1 Ack=216038 Win=34304 Len=0 TSval=1886576994 TSecr=1758598873 SLE=225486 SRE=244382
  265   4.250247     10.0.0.2 → 10.0.0.1     TCP 86 [TCP Dup ACK 263#1] 59433 → 48193 [ACK] Seq=1 Ack=214038 Win=72192 Len=0 TSval=1886577016 TSecr=1758598910 SLE=209038 SRE=214038 SLE=232934 SRE=242038
  266   4.250381     10.0.0.2 → 10.0.0.1     TCP 66 46356 → 54368 [ACK] Seq=1 Ack=239201 Win=67 Len=0 TSval=1886577077 TSecr=1758598954
  267   4.250506     10.0.0.2 → 10.0.0.1     TCP 86 46356 → 54368 [ACK] Seq=1 Ack=248649 Win=141 Len=0 TSval=1886577196 TSecr=1758598954 SLE=195449 SRE=204897 SLE=249489 SRE=258937
  268   4.343153     10.0.0.2 → 10.0.0.1     TCP 78 59433 → 48193 [ACK] Seq=1 Ack=223486 Win=91136 Len=0 TSval=1886577219 TSecr=1758599082 SLE=232934 SRE=242038
  269   4.343186     10.0.0.2 → 10.0.0.1     TCP 66 6776 → 55246 [ACK] Seq=1 Ack=223001 Win=67 Len=0 TSval=1886577242 TSecr=1758599094
  270   4.344194     10.0.0.2 → 10.0.0.1     TCP 66 25904 → 58169 [ACK] Seq=1 Ack=240345 Win=57 Len=0 TSval=1886577293 TSecr=1758599137
  271   4.344226     10.0.0.2 → 10.0.0.1     TCP 86 [TCP Dup ACK 264#1] 42968 → 55943 [ACK] Seq=1 Ack=216038 Win=34304 Len=0 TSval=1886577305 TSecr=1758598873 SLE=204934 SRE=214382 SLE=225486 SRE=245222
  272   4.418502     10.0.0.2 → 10.0.0.1     TCP 66 46356 → 54368 [ACK] Seq=1 Ack=271001 Win=252 Len=0 TSval=1886577331 TSecr=1758599139
  273   4.418536     10.0.0.2 → 10.0.0.1     TCP 78 35722 → 19551 [ACK] Seq=1 Ack=239934 Win=34304 Len=0 TSval=1886577337 TSecr=1758598384 SLE=244038 SRE=253486
  274   4.418561     10.0.0.2 → 10.0.0.1     TCP 86 [TCP Dup ACK 264#2] 42968 → 55943 [ACK] Seq=1 Ack=216038 Win=34304 Len=0 TSval=1886577343 TSecr=1758598873 SLE=195486 SRE=204934 SLE=225486 SRE=245222
  275   4.456861     10.0.0.2 → 10.0.0.1     TCP 78 [TCP Dup ACK 273#1] 35722 → 19551 [ACK] Seq=1 Ack=239934 Win=34304 Len=0 TSval=1886577355 TSecr=1758598384 SLE=244038 SRE=262934
