    1   0.000000           :: → ff02::16     ICMPv6 90 Multicast Listener Report Message v2
    2   0.000010           :: → ff02::16     ICMPv6 90 Multicast Listener Report Message v2
    3  38.732730     10.0.0.1 → 10.0.0.2     TCP 74 42763 → 35722 [SYN] Seq=0 Win=37840 Len=0 MSS=9460 SACK_PERM TSval=1758595171 TSecr=0 WS=512
    4  38.739000     10.0.0.1 → 10.0.0.2     TCP 66 42763 → 35722 [ACK] Seq=1 Ack=1 Win=37888 Len=0 TSval=1758595178 TSecr=1886573260
    5  38.739026     10.0.0.1 → 10.0.0.2     TCP 74 36467 → 59433 [SYN] Seq=0 Win=37840 Len=0 MSS=9460 SACK_PERM TSval=1758595179 TSecr=0 WS=512
    6  38.739046     10.0.0.1 → 10.0.0.2     TCP 103 42763 → 35722 [PSH, ACK] Seq=1 Ack=1 Win=37888 Len=37 TSval=1758595179 TSecr=1886573260
    7  38.743419     10.0.0.1 → 10.0.0.2     TCP 103 36467 → 59433 [PSH, ACK] Seq=1 Ack=1 Win=37888 Len=37 TSval=1758595183 TSecr=1886573266
    8  38.746108     10.0.0.1 → 10.0.0.2     TCP 66 42763 → 35722 [ACK] Seq=38 Ack=2 Win=37888 Len=0 TSval=1758595186 TSecr=1886573267
    9  38.747418     10.0.0.1 → 10.0.0.2     TCP 66 36467 → 59433 [ACK] Seq=38 Ack=2 Win=37888 Len=0 TSval=1758595186 TSecr=1886573270
   10  38.758125     10.0.0.1 → 10.0.0.2     TCP 74 51099 → 25904 [SYN] Seq=0 Win=37840 Len=0 MSS=9460 SACK_PERM TSval=1758595198 TSecr=0 WS=512
   11  38.758644     10.0.0.1 → 10.0.0.2     TCP 74 58271 → 40783 [SYN] Seq=0 Win=37840 Len=0 MSS=9460 SACK_PERM TSval=1758595198 TSecr=0 WS=512
   12  38.758957     10.0.0.1 → 10.0.0.2     TCP 66 39475 → 47452 [ACK] Seq=1 Ack=1 Win=74 Len=0 TSval=1758595199 TSecr=1886573281
   13  38.764485     10.0.0.1 → 10.0.0.2     TCP 103 39475 → 47452 [PSH, ACK] Seq=1 Ack=1 Win=74 Len=37 TSval=1758595203 TSecr=1886573281
   14  38.766658     10.0.0.1 → 10.0.0.2     TCP 74 47085 → 46356 [SYN] Seq=0 Win=37840 Len=0 MSS=9460 SACK_PERM TSval=1758595206 TSecr=0 WS=512
   15  38.766679     10.0.0.1 → 10.0.0.2     TCP 74 49189 → 42968 [SYN] Seq=0 Win=37840 Len=0 MSS=9460 SACK_PERM TSval=1758595206 TSecr=0 WS=512
   16  38.767452     10.0.0.1 → 10.0.0.2     TCP 66 58271 → 40783 [ACK] Seq=1 Ack=1 Win=37888 Len=0 TSval=1758595207 TSecr=1886573285
   17  38.769393     10.0.0.1 → 10.0.0.2     TCP 103 51099 → 25904 [PSH, ACK] Seq=1 Ack=1 Win=37888 Len=37 TSval=1758595208 TSecr=1886573285
   18  38.774931     10.0.0.1 → 10.0.0.2     TCP 103 55655 → 6776 [PSH, ACK] Seq=1 Ack=1 Win=74 Len=37 TSval=1758595212 TSecr=1886573293
   19  38.778541     10.0.0.1 → 10.0.0.2     TCP 66 47085 → 46356 [ACK] Seq=1 Ack=1 Win=37888 Len=0 TSval=1758595216 TSecr=1886573296
   20  38.779389     10.0.0.1 → 10.0.0.2     TCP 66 [TCP Previous segment not captured] 58271 → 40783 [ACK] Seq=38 Ack=2 Win=37888 Len=0 TSval=1758595217 TSecr=1886573298
   21  38.784871     10.0.0.1 → 10.0.0.2     TCP 66 51099 → 25904 [ACK] Seq=38 Ack=2 Win=37888 Len=0 TSval=1758595223 TSecr=1886573299
   22  38.785209     10.0.0.1 → 10.0.0.2     TCP 70 51099 → 25904 [PSH, ACK] Seq=38 Ack=2 Win=37888 Len=4 TSval=1758595223 TSecr=1886573299
   23  38.786229     10.0.0.1 → 10.0.0.2     TCP 70 55655 → 6776 [PSH, ACK] Seq=38 Ack=2 Win=74 Len=4 TSval=1758595223 TSecr=1886573304
   24  38.787533     10.0.0.1 → 10.0.0.2     TCP 66 [TCP Previous segment not captured] 49189 → 42968 [ACK] Seq=38 Ack=1 Win=37888 Len=0 TSval=1758595227 TSecr=1886573308
   25  38.788764     10.0.0.1 → 10.0.0.2     TCP 66 [TCP Previous segment not captured] 47085 → 46356 [ACK] Seq=38 Ack=2 Win=37888 Len=0 TSval=1758595228 TSecr=1886573309
   26  38.790350     10.0.0.1 → 10.0.0.2     TCP 183 [TCP Previous segment not captured] 42763 → 35722 [PSH, ACK] Seq=42 Ack=2 Win=37888 Len=117 TSval=1758595230 TSecr=1886573314
   27  38.792836     10.0.0.1 → 10.0.0.2     TCP 74 19551 → 35722 [SYN] Seq=0 Win=37840 Len=0 MSS=9460 SACK_PERM TSval=1758595233 TSecr=0 WS=512
   28  38.793545     10.0.0.1 → 10.0.0.2     TCP 183 [TCP Previous segment not captured] 36467 → 59433 [PSH, ACK] Seq=42 Ack=2 Win=37888 Len=117 TSval=1758595234 TSecr=1886573318
   29  38.801427     10.0.0.1 → 10.0.0.2     TCP 66 19551 → 35722 [ACK] Seq=1 Ack=1 Win=37888 Len=0 TSval=1758595235 TSecr=1886573319
   30  38.802317     10.0.0.1 → 10.0.0.2     TCP 103 19551 → 35722 [PSH, ACK] Seq=1 Ack=1 Win=37888 Len=37 TSval=1758595235 TSecr=1886573319
   31  38.803645     10.0.0.1 → 10.0.0.2     TCP 74 48193 → 59433 [SYN] Seq=0 Win=37840 Len=0 MSS=9460 SACK_PERM TSval=1758595243 TSecr=0 WS=512
   32  38.816519     10.0.0.1 → 10.0.0.2     TCP 66 48193 → 59433 [ACK] Seq=1 Ack=1 Win=37888 Len=0 TSval=1758595249 TSecr=1886573330
   33  38.871090     10.0.0.1 → 10.0.0.2     TCP 66 36467 → 59433 [ACK] Seq=159 Ack=3 Win=37888 Len=0 TSval=1758595285 TSecr=1886573320
   34  38.937530     10.0.0.1 → 10.0.0.2     TCP 1066 19551 → 35722 [PSH, ACK] Seq=38 Ack=1 Win=37888 Len=1000 TSval=1758595317 TSecr=1886573328
   35  38.941786     10.0.0.1 → 10.0.0.2     TCP 74 53241 → 47452 [SYN] Seq=0 Win=37840 Len=0 MSS=9460 SACK_PERM TSval=1758595379 TSecr=0 WS=512
   36  38.942842     10.0.0.1 → 10.0.0.2     TCP 66 36467 → 59433 [ACK] Seq=159 Ack=5 Win=37888 Len=0 TSval=1758595380 TSecr=1886573399
   37  38.943713     10.0.0.1 → 10.0.0.2     TCP 74 55246 → 6776 [SYN] Seq=0 Win=37840 Len=0 MSS=9460 SACK_PERM TSval=1758595380 TSecr=0 WS=512
   38  38.946200     10.0.0.1 → 10.0.0.2     TCP 74 58169 → 25904 [SYN] Seq=0 Win=37840 Len=0 MSS=9460 SACK_PERM TSval=1758595381 TSecr=0 WS=512
   39  38.947373     10.0.0.1 → 10.0.0.2     TCP 74 54368 → 46356 [SYN] Seq=0 Win=37840 Len=0 MSS=9460 SACK_PERM TSval=1758595381 TSecr=0 WS=512
   40  38.957352     10.0.0.1 → 10.0.0.2     TCP 74 55943 → 42968 [SYN] Seq=0 Win=37840 Len=0 MSS=9460 SACK_PERM TSval=1758595382 TSecr=0 WS=512
   41  38.994654     10.0.0.1 → 10.0.0.2     TCP 66 55246 → 6776 [ACK] Seq=1 Ack=1 Win=37888 Len=0 TSval=1758595400 TSecr=1886573470
   42  38.996526     10.0.0.1 → 10.0.0.2     TCP 103 55246 → 6776 [PSH, ACK] Seq=1 Ack=1 Win=37888 Len=37 TSval=1758595400 TSecr=1886573470
   43  39.012644     10.0.0.1 → 10.0.0.2     TCP 2066 [TCP Previous segment not captured] 48193 → 59433 [PSH, ACK] Seq=1038 Ack=1 Win=37888 Len=2000 TSval=1758595409 TSecr=1886573471
   44  39.047697     10.0.0.1 → 10.0.0.2     TCP 103 58169 → 25904 [PSH, ACK] Seq=1 Ack=1 Win=37888 Len=37 TSval=1758595410 TSecr=1886573472
   45  39.060387     10.0.0.1 → 10.0.0.2     TCP 66 54368 → 46356 [ACK] Seq=1 Ack=1 Win=37888 Len=0 TSval=1758595410 TSecr=1886573473
   46  39.066039     10.0.0.1 → 10.0.0.2     TCP 103 32720 → 40783 [PSH, ACK] Seq=1 Ack=1 Win=74 Len=37 TSval=1758595417 TSecr=1886573482
   47  39.100390     10.0.0.1 → 10.0.0.2     TCP 66 [TCP Previous segment not captured] 51099 → 25904 [ACK] Seq=159 Ack=5 Win=37888 Len=0 TSval=1758595533 TSecr=1886573601
   48  39.102738     10.0.0.1 → 10.0.0.2     TCP 8066 [TCP Previous segment not captured] 19551 → 35722 [PSH, ACK] Seq=9038 Ack=1 Win=37888 Len=8000 TSval=1758595534 TSecr=1886573616
   49  39.115673     10.0.0.1 → 10.0.0.2     TCP 1066 58169 → 25904 [PSH, ACK] Seq=38 Ack=1 Win=37888 Len=1000 TSval=1758595534 TSecr=1886573575
   50  39.117804     10.0.0.1 → 10.0.0.2     TCP 1066 32720 → 40783 [PSH, ACK] Seq=38 Ack=1 Win=74 Len=1000 TSval=1758595534 TSecr=1886573592
   51  39.119937     10.0.0.1 → 10.0.0.2     TCP 1066 [TCP Previous segment not captured] 54368 → 46356 [PSH, ACK] Seq=38 Ack=1 Win=37888 Len=1000 TSval=1758595536 TSecr=1886573587
   52  39.122124     10.0.0.1 → 10.0.0.2     TCP 1066 [TCP Previous segment not captured] 55943 → 42968 [PSH, ACK] Seq=1038 Ack=1 Win=37888 Len=1000 TSval=1758595558 TSecr=1886573641
   53  39.124200     10.0.0.1 → 10.0.0.2     TCP 1066 [TCP Previous segment not captured] 48193 → 59433 [PSH, ACK] Seq=13038 Ack=1 Win=37888 Len=1000 TSval=1758595560 TSecr=1886573645
   54  39.126333     10.0.0.1 → 10.0.0.2     TCP 1066 [TCP Previous segment not captured] 19551 → 35722 [PSH, ACK] Seq=18038 Ack=1 Win=37888 Len=1000 TSval=1758595562 TSecr=1886573647
   55  39.128467     10.0.0.1 → 10.0.0.2     TCP 1066 [TCP Previous segment not captured] 53241 → 47452 [PSH, ACK] Seq=2038 Ack=1 Win=37888 Len=1000 TSval=1758595564 TSecr=1886573649
   56  39.130596     10.0.0.1 → 10.0.0.2     TCP 1066 [TCP Previous segment not captured] 55246 → 6776 [PSH, ACK] Seq=2038 Ack=1 Win=37888 Len=1000 TSval=1758595571 TSecr=1886573651
   57  39.135572     10.0.0.1 → 10.0.0.2     TCP 3066 32720 → 40783 [PSH, ACK] Seq=1038 Ack=1 Win=74 Len=3000 TSval=1758595576 TSecr=1886573659
   58  39.138865     10.0.0.1 → 10.0.0.2     TCP 3066 54368 → 46356 [PSH, ACK] Seq=1038 Ack=1 Win=37888 Len=3000 TSval=1758595579 TSecr=1886573663
   59  39.144992     10.0.0.1 → 10.0.0.2     TCP 2066 55943 → 42968 [PSH, ACK] Seq=2038 Ack=1 Win=37888 Len=2000 TSval=1758595583 TSecr=1886573667
   60  39.149124     10.0.0.1 → 10.0.0.2     TCP 1066 [TCP Previous segment not captured] 58169 → 25904 [PSH, ACK] Seq=4038 Ack=1 Win=37888 Len=1000 TSval=1758595588 TSecr=1886573661
   61  39.151477     10.0.0.1 → 10.0.0.2     TCP 2066 19551 → 35722 [PSH, ACK] Seq=19038 Ack=1 Win=37888 Len=2000 TSval=1758595592 TSecr=1886573676
   62  39.160875     10.0.0.1 → 10.0.0.2     TCP 1066 [TCP Previous segment not captured] 53241 → 47452 [PSH, ACK] Seq=5038 Ack=1 Win=37888 Len=1000 TSval=1758595601 TSecr=1886573684
   63  39.165422     10.0.0.1 → 10.0.0.2     TCP 2066 32720 → 40783 [PSH, ACK] Seq=4038 Ack=1 Win=74 Len=2000 TSval=1758595606 TSecr=1886573690
   64  39.166966     10.0.0.1 → 10.0.0.2     TCP 1066 [TCP Previous segment not captured] 48193 → 59433 [PSH, ACK] Seq=17038 Ack=1 Win=37888 Len=1000 TSval=1758595607 TSecr=1886573681
   65  39.183329     10.0.0.1 → 10.0.0.2     TCP 1066 [TCP Previous segment not captured] 55246 → 6776 [PSH, ACK] Seq=6038 Ack=1 Win=37888 Len=1000 TSval=1758595624 TSecr=1886573696
   66  39.188896     10.0.0.1 → 10.0.0.2     TCP 3066 55943 → 42968 [PSH, ACK] Seq=4038 Ack=1 Win=37888 Len=3000 TSval=1758595629 TSecr=1886573713
   67  39.191834     10.0.0.1 → 10.0.0.2     TCP 1066 [TCP Previous segment not captured] 54368 → 46356 [PSH, ACK] Seq=7038 Ack=1 Win=37888 Len=1000 TSval=1758595630 TSecr=1886573703
   68  39.197641     10.0.0.1 → 10.0.0.2     TCP 3066 58169 → 25904 [PSH, ACK] Seq=5038 Ack=1 Win=37888 Len=3000 TSval=1758595638 TSecr=1886573722
   69  39.213858     10.0.0.1 → 10.0.0.2     TCP 3066 32720 → 40783 [PSH, ACK] Seq=6038 Ack=1 Win=74 Len=3000 TSval=1758595654 TSecr=1886573738
   70  39.222349     10.0.0.1 → 10.0.0.2     TCP 4066 48193 → 59433 [PSH, ACK] Seq=18038 Ack=1 Win=37888 Len=4000 TSval=1758595663 TSecr=1886573747
   71  39.227285     10.0.0.1 → 10.0.0.2     TCP 1066 [TCP Previous segment not captured] 19551 → 35722 [PSH, ACK] Seq=26038 Ack=1 Win=37888 Len=1000 TSval=1758595664 TSecr=1886573739
   72  39.229418     10.0.0.1 → 10.0.0.2     TCP 3066 55246 → 6776 [PSH, ACK] Seq=7038 Ack=1 Win=37888 Len=3000 TSval=1758595667 TSecr=1886573751
   73  39.235550     10.0.0.1 → 10.0.0.2     TCP 1066 [TCP Previous segment not captured] 53241 → 47452 [PSH, ACK] Seq=10038 Ack=1 Win=37888 Len=1000 TSval=1758595668 TSecr=1886573741
   74  39.242499     10.0.0.1 → 10.0.0.2     TCP 1066 [TCP Previous segment not captured] 55943 → 42968 [PSH, ACK] Seq=11038 Ack=1 Win=37888 Len=1000 TSval=1758595683 TSecr=1886573757
   75  39.243321     10.0.0.1 → 10.0.0.2     TCP 4066 54368 → 46356 [PSH, ACK] Seq=8038 Ack=1 Win=37888 Len=4000 TSval=1758595684 TSecr=1886573767
   76  39.249567     10.0.0.1 → 10.0.0.2     TCP 4066 58169 → 25904 [PSH, ACK] Seq=8038 Ack=1 Win=37888 Len=4000 TSval=1758595687 TSecr=1886573772
   77  39.259307     10.0.0.1 → 10.0.0.2     TCP 4066 32720 → 40783 [PSH, ACK] Seq=9038 Ack=1 Win=74 Len=4000 TSval=1758595700 TSecr=1886573784
   78  39.275080     10.0.0.1 → 10.0.0.2     TCP 1066 [TCP Previous segment not captured] 48193 → 59433 [PSH, ACK] Seq=25038 Ack=1 Win=37888 Len=1000 TSval=1758595714 TSecr=1886573798
   79  39.288358     10.0.0.1 → 10.0.0.2     TCP 4066 19551 → 35722 [PSH, ACK] Seq=27038 Ack=1 Win=37888 Len=4000 TSval=1758595729 TSecr=1886573813
   80  39.306401     10.0.0.1 → 10.0.0.2     TCP 1066 [TCP Previous segment not captured] 55246 → 6776 [PSH, ACK] Seq=15038 Ack=1 Win=37888 Len=1000 TSval=1758595744 TSecr=1886573818
   81  39.308780     10.0.0.1 → 10.0.0.2     TCP 6066 53241 → 47452 [PSH, ACK] Seq=11038 Ack=1 Win=37888 Len=6000 TSval=1758595748 TSecr=1886573832
   82  39.317732     10.0.0.1 → 10.0.0.2     TCP 4066 55943 → 42968 [PSH, ACK] Seq=12038 Ack=1 Win=37888 Len=4000 TSval=1758595750 TSecr=1886573833
   83  39.347992     10.0.0.1 → 10.0.0.2     TCP 1066 [TCP Previous segment not captured] 58169 → 25904 [PSH, ACK] Seq=19038 Ack=1 Win=37888 Len=1000 TSval=1758595788 TSecr=1886573864
   84  39.349857     10.0.0.1 → 10.0.0.2     TCP 1066 [TCP Previous segment not captured] 54368 → 46356 [PSH, ACK] Seq=19038 Ack=1 Win=37888 Len=1000 TSval=1758595790 TSecr=1886573867
   85  39.361476     10.0.0.1 → 10.0.0.2     TCP 1066 [TCP Previous segment not captured] 32720 → 40783 [PSH, ACK] Seq=20038 Ack=1 Win=74 Len=1000 TSval=1758595801 TSecr=1886573881
   86  39.363260     10.0.0.1 → 10.0.0.2     TCP 6066 48193 → 59433 [PSH, ACK] Seq=26038 Ack=1 Win=37888 Len=6000 TSval=1758595803 TSecr=1886573886
   87  39.383048     10.0.0.1 → 10.0.0.2     TCP 5066 55246 → 6776 [PSH, ACK] Seq=16038 Ack=1 Win=37888 Len=5000 TSval=1758595823 TSecr=1886573907
   88  39.424291     10.0.0.1 → 10.0.0.2     TCP 1066 [TCP Previous segment not captured] 19551 → 35722 [PSH, ACK] Seq=41038 Ack=1 Win=37888 Len=1000 TSval=1758595864 TSecr=1886573940
   89  39.429198     10.0.0.1 → 10.0.0.2     TCP 1066 [TCP Previous segment not captured] 53241 → 47452 [PSH, ACK] Seq=25038 Ack=1 Win=37888 Len=1000 TSval=1758595869 TSecr=1886573953
   90  39.431234     10.0.0.1 → 10.0.0.2     TCP 1066 [TCP Previous segment not captured] 55943 → 42968 [PSH, ACK] Seq=25038 Ack=1 Win=37888 Len=1000 TSval=1758595871 TSecr=1886573955
   91  39.456810     10.0.0.1 → 10.0.0.2     TCP 2066 [TCP Previous segment not captured] 32720 → 40783 [PSH, ACK] Seq=26038 Ack=1 Win=74 Len=2000 TSval=1758595897 TSecr=1886573981
   92  39.466967     10.0.0.1 → 10.0.0.2     TCP 2066 [TCP Previous segment not captured] 48193 → 59433 [PSH, ACK] Seq=38038 Ack=1 Win=37888 Len=2000 TSval=1758595907 TSecr=1886573991
   93  39.481198     10.0.0.1 → 10.0.0.2     TCP 2066 [TCP Previous segment not captured] 58169 → 25904 [PSH, ACK] Seq=28038 Ack=1 Win=37888 Len=2000 TSval=1758595921 TSecr=1886574006
   94  39.485751     10.0.0.1 → 10.0.0.2     TCP 1066 [TCP Previous segment not captured] 55246 → 6776 [PSH, ACK] Seq=28038 Ack=1 Win=37888 Len=1000 TSval=1758595926 TSecr=1886574010
   95  39.494176     10.0.0.1 → 10.0.0.2     TCP 4066 55943 → 42968 [PSH, ACK] Seq=26038 Ack=1 Win=37888 Len=4000 TSval=1758595934 TSecr=1886574017
   96  39.499113     10.0.0.1 → 10.0.0.2     TCP 3066 32720 → 40783 [PSH, ACK] Seq=28038 Ack=1 Win=74 Len=3000 TSval=1758595937 TSecr=1886574022
   97  39.505244     10.0.0.1 → 10.0.0.2     TCP 2066 [TCP Previous segment not captured] 54368 → 46356 [PSH, ACK] Seq=29038 Ack=1 Win=37888 Len=2000 TSval=1758595940 TSecr=1886574024
   98  39.513863     10.0.0.1 → 10.0.0.2     TCP 2066 58169 → 25904 [PSH, ACK] Seq=30038 Ack=1 Win=37888 Len=2000 TSval=1758595954 TSecr=1886574038
   99  39.520010     10.0.0.1 → 10.0.0.2     TCP 2066 [TCP Previous segment not captured] 19551 → 35722 [PSH, ACK] Seq=47038 Ack=1 Win=37888 Len=2000 TSval=1758595960 TSecr=1886574044
  100  39.522270     10.0.0.1 → 10.0.0.2     TCP 1066 [TCP Previous segment not captured] 48193 → 59433 [PSH, ACK] Seq=43038 Ack=1 Win=37888 Len=1000 TSval=1758595962 TSecr=1886574046
  101  39.523079     10.0.0.1 → 10.0.0.2     TCP 3066 55246 → 6776 [PSH, ACK] Seq=29038 Ack=1 Win=37888 Len=3000 TSval=1758595963 TSecr=1886574047
  102  39.548206     10.0.0.1 → 10.0.0.2     TCP 1066 [TCP Previous segment not captured] 32720 → 40783 [PSH, ACK] Seq=34038 Ack=1 Win=74 Len=1000 TSval=1758595988 TSecr=1886574069
  103  39.549477     10.0.0.1 → 10.0.0.2     TCP 1066 [TCP Previous segment not captured] 55943 → 42968 [PSH, ACK] Seq=34038 Ack=1 Win=37888 Len=1000 TSval=1758595990 TSecr=1886574065
  104  39.555011     10.0.0.1 → 10.0.0.2     TCP 4066 54368 → 46356 [PSH, ACK] Seq=31038 Ack=1 Win=37888 Len=4000 TSval=1758595995 TSecr=1886574079
  105  39.573986     10.0.0.1 → 10.0.0.2     TCP 1066 [TCP Previous segment not captured] 58169 → 25904 [PSH, ACK] Seq=36038 Ack=1 Win=37888 Len=1000 TSval=1758596014 TSecr=1886574089
  106  39.596385     10.0.0.1 → 10.0.0.2     TCP 3066 32720 → 40783 [PSH, ACK] Seq=35038 Ack=1 Win=74 Len=3000 TSval=1758596037 TSecr=1886574121
  107  39.599321     10.0.0.1 → 10.0.0.2     TCP 1066 [TCP Previous segment not captured] 19551 → 35722 [PSH, ACK] Seq=54038 Ack=1 Win=37888 Len=1000 TSval=1758596037 TSecr=1886574113
  108  39.601453     10.0.0.1 → 10.0.0.2     TCP 1066 [TCP Previous segment not captured] 55246 → 6776 [PSH, ACK] Seq=37038 Ack=1 Win=37888 Len=1000 TSval=1758596038 TSecr=1886574115
  109  39.614903     10.0.0.1 → 10.0.0.2     TCP 1066 [TCP Previous segment not captured] 53241 → 47452 [PSH, ACK] Seq=39038 Ack=1 Win=37888 Len=1000 TSval=1758596055 TSecr=1886574139
  110  39.625288     10.0.0.1 → 10.0.0.2     TCP 2066 32720 → 40783 [PSH, ACK] Seq=38038 Ack=1 Win=74 Len=2000 TSval=1758596066 TSecr=1886574150
  111  39.629565     10.0.0.1 → 10.0.0.2     TCP 1066 [TCP Previous segment not captured] 54368 → 46356 [PSH, ACK] Seq=40038 Ack=1 Win=37888 Len=1000 TSval=1758596070 TSecr=1886574154
  112  39.641527     10.0.0.1 → 10.0.0.2     TCP 1066 [TCP Previous segment not captured] 58169 → 25904 [PSH, ACK] Seq=41038 Ack=1 Win=37888 Len=1000 TSval=1758596081 TSecr=1886574164
  113  39.646132     10.0.0.1 → 10.0.0.2     TCP 2066 53241 → 47452 [PSH, ACK] Seq=40038 Ack=1 Win=37888 Len=2000 TSval=1758596086 TSecr=1886574171
  114  39.649339     10.0.0.1 → 10.0.0.2     TCP 4066 [TCP Previous segment not captured] 48193 → 59433 [PSH, ACK] Seq=50038 Ack=1 Win=37888 Len=4000 TSval=1758596089 TSecr=1886574174
  115  39.655216     10.0.0.1 → 10.0.0.2     TCP 2066 32720 → 40783 [PSH, ACK] Seq=40038 Ack=1 Win=74 Len=2000 TSval=1758596091 TSecr=1886574175
  116  39.663352     10.0.0.1 → 10.0.0.2     TCP 1066 [TCP Previous segment not captured] 55246 → 6776 [PSH, ACK] Seq=42038 Ack=1 Win=37888 Len=1000 TSval=1758596104 TSecr=1886574177
  117  39.668497     10.0.0.1 → 10.0.0.2     TCP 1066 [TCP Previous segment not captured] 53241 → 47452 [PSH, ACK] Seq=43038 Ack=1 Win=37888 Len=1000 TSval=1758596109 TSecr=1886574193
  118  39.675354     10.0.0.1 → 10.0.0.2     TCP 2066 48193 → 59433 [PSH, ACK] Seq=54038 Ack=1 Win=37888 Len=2000 TSval=1758596116 TSecr=1886574200
  119  39.685789     10.0.0.1 → 10.0.0.2     TCP 5066 [TCP Previous segment not captured] 55943 → 42968 [PSH, ACK] Seq=40038 Ack=1 Win=37888 Len=5000 TSval=1758596126 TSecr=1886574210
  120  39.692765     10.0.0.1 → 10.0.0.2     TCP 6066 19551 → 35722 [PSH, ACK] Seq=55038 Ack=1 Win=37888 Len=6000 TSval=1758596127 TSecr=1886574210
  121  39.710812     10.0.0.1 → 10.0.0.2     TCP 5066 58169 → 25904 [PSH, ACK] Seq=42038 Ack=1 Win=37888 Len=5000 TSval=1758596151 TSecr=1886574234
  122  39.731202     10.0.0.1 → 10.0.0.2     TCP 3066 55943 → 42968 [PSH, ACK] Seq=45038 Ack=1 Win=37888 Len=3000 TSval=1758596169 TSecr=1886574251
  123  39.734141     10.0.0.1 → 10.0.0.2     TCP 1066 [TCP Previous segment not captured] 54368 → 46356 [PSH, ACK] Seq=47038 Ack=1 Win=37888 Len=1000 TSval=1758596173 TSecr=1886574253
  124  39.736290     10.0.0.1 → 10.0.0.2     TCP 6066 32720 → 40783 [PSH, ACK] Seq=42038 Ack=1 Win=74 Len=6000 TSval=1758596174 TSecr=1886574258
  125  39.748405     10.0.0.1 → 10.0.0.2     TCP 1066 [TCP Previous segment not captured] 19551 → 35722 [PSH, ACK] Seq=65038 Ack=1 Win=37888 Len=1000 TSval=1758596184 TSecr=1886574268
  126  39.750600     10.0.0.1 → 10.0.0.2     TCP 5066 53241 → 47452 [PSH, ACK] Seq=44038 Ack=1 Win=37888 Len=5000 TSval=1758596185 TSecr=1886574270
  127  39.760669     10.0.0.1 → 10.0.0.2     TCP 1066 [TCP Previous segment not captured] 55246 → 6776 [PSH, ACK] Seq=48038 Ack=1 Win=37888 Len=1000 TSval=1758596188 TSecr=1886574272
  128  39.762806     10.0.0.1 → 10.0.0.2     TCP 4066 58169 → 25904 [PSH, ACK] Seq=47038 Ack=1 Win=37888 Len=4000 TSval=1758596203 TSecr=1886574286
  129  39.806365     10.0.0.1 → 10.0.0.2     TCP 7066 [TCP Previous segment not captured] 48193 → 59433 [PSH, ACK] Seq=58038 Ack=1 Win=37888 Len=7000 TSval=1758596245 TSecr=1886574322
  130  39.819955     10.0.0.1 → 10.0.0.2     TCP 7066 32720 → 40783 [PSH, ACK] Seq=48038 Ack=1 Win=74 Len=7000 TSval=1758596260 TSecr=1886574340
  131  39.831411     10.0.0.1 → 10.0.0.2     TCP 1066 [TCP Previous segment not captured] 55943 → 42968 [PSH, ACK] Seq=54038 Ack=1 Win=37888 Len=1000 TSval=1758596262 TSecr=1886574340
  132  39.833541     10.0.0.1 → 10.0.0.2     TCP 1066 [TCP Previous segment not captured] 54368 → 46356 [PSH, ACK] Seq=54038 Ack=1 Win=37888 Len=1000 TSval=1758596265 TSecr=1886574348
  133  39.835699     10.0.0.1 → 10.0.0.2     TCP 7066 53241 → 47452 [PSH, ACK] Seq=49038 Ack=1 Win=37888 Len=7000 TSval=1758596275 TSecr=1886574358
  134  39.849900     10.0.0.1 → 10.0.0.2     TCP 1066 [TCP Previous segment not captured] 19551 → 35722 [PSH, ACK] Seq=72038 Ack=1 Win=37888 Len=1000 TSval=1758596278 TSecr=1886574360
  135  39.860062     10.0.0.1 → 10.0.0.2     TCP 8066 55246 → 6776 [PSH, ACK] Seq=49038 Ack=1 Win=37888 Len=8000 TSval=1758596300 TSecr=1886574379
  136  39.907994     10.0.0.1 → 10.0.0.2     TCP 1066 [TCP Previous segment not captured] 32720 → 40783 [PSH, ACK] Seq=61038 Ack=1 Win=74 Len=1000 TSval=1758596348 TSecr=1886574428
  137  39.942204     10.0.0.1 → 10.0.0.2     TCP 4066 [TCP Previous segment not captured] 58169 → 25904 [PSH, ACK] Seq=60038 Ack=1 Win=37888 Len=4000 TSval=1758596382 TSecr=1886574462
  138  39.949523     10.0.0.1 → 10.0.0.2     TCP 1066 [TCP Previous segment not captured] 55943 → 42968 [PSH, ACK] Seq=64038 Ack=1 Win=37888 Len=1000 TSval=1758596390 TSecr=1886574470
  139  39.971873     10.0.0.1 → 10.0.0.2     TCP 2066 [TCP Previous segment not captured] 53241 → 47452 [PSH, ACK] Seq=64038 Ack=1 Win=37888 Len=2000 TSval=1758596411 TSecr=1886574491
  140  39.985978     10.0.0.1 → 10.0.0.2     TCP 3066 [TCP Previous segment not captured] 48193 → 59433 [PSH, ACK] Seq=76038 Ack=1 Win=37888 Len=3000 TSval=1758596426 TSecr=1886574509
  141  40.008516     10.0.0.1 → 10.0.0.2     TCP 5066 58169 → 25904 [PSH, ACK] Seq=64038 Ack=1 Win=37888 Len=5000 TSval=1758596448 TSecr=1886574533
  142  40.015490     10.0.0.1 → 10.0.0.2     TCP 2066 [TCP Previous segment not captured] 19551 → 35722 [PSH, ACK] Seq=83038 Ack=1 Win=37888 Len=2000 TSval=1758596451 TSecr=1886574534
  143  40.019602     10.0.0.1 → 10.0.0.2     TCP 3066 [TCP Previous segment not captured] 55246 → 6776 [PSH, ACK] Seq=66038 Ack=1 Win=37888 Len=3000 TSval=1758596452 TSecr=1886574536
  144  40.033303     10.0.0.1 → 10.0.0.2     TCP 5066 53241 → 47452 [PSH, ACK] Seq=66038 Ack=1 Win=37888 Len=5000 TSval=1758596473 TSecr=1886574555
  145  40.044888     10.0.0.1 → 10.0.0.2     TCP 4066 48193 → 59433 [PSH, ACK] Seq=79038 Ack=1 Win=37888 Len=4000 TSval=1758596483 TSecr=1886574562
  146  40.055306     10.0.0.1 → 10.0.0.2     TCP 2066 [TCP Previous segment not captured] 32720 → 40783 [PSH, ACK] Seq=71038 Ack=1 Win=74 Len=2000 TSval=1758596495 TSecr=1886574580
  147  40.059129     10.0.0.1 → 10.0.0.2     TCP 1066 [TCP Previous segment not captured] 54368 → 46356 [PSH, ACK] Seq=72038 Ack=1 Win=37888 Len=1000 TSval=1758596499 TSecr=1886574584
  148  40.069468     10.0.0.1 → 10.0.0.2     TCP 5066 19551 → 35722 [PSH, ACK] Seq=85038 Ack=1 Win=37888 Len=5000 TSval=1758596510 TSecr=1886574594
  149  40.090659     10.0.0.1 → 10.0.0.2     TCP 1066 [TCP Previous segment not captured] 55246 → 6776 [PSH, ACK] Seq=74038 Ack=1 Win=37888 Len=1000 TSval=1758596531 TSecr=1886574614
  150  40.104913     10.0.0.1 → 10.0.0.2     TCP 1066 [TCP Previous segment not captured] 53241 → 47452 [PSH, ACK] Seq=75038 Ack=1 Win=37888 Len=1000 TSval=1758596545 TSecr=1886574628
  151  40.110125     10.0.0.1 → 10.0.0.2     TCP 5066 48193 → 59433 [PSH, ACK] Seq=83038 Ack=1 Win=37888 Len=5000 TSval=1758596550 TSecr=1886574635
  152  40.133976     10.0.0.1 → 10.0.0.2     TCP 1066 [TCP Previous segment not captured] 58169 → 25904 [PSH, ACK] Seq=78038 Ack=1 Win=37888 Len=1000 TSval=1758596574 TSecr=1886574647
  153  40.169326     10.0.0.1 → 10.0.0.2     TCP 5066 [TCP Previous segment not captured] 55943 → 42968 [PSH, ACK] Seq=76038 Ack=1 Win=37888 Len=5000 TSval=1758596609 TSecr=1886574694
  154  40.176285     10.0.0.1 → 10.0.0.2     TCP 1066 [TCP Previous segment not captured] 55246 → 6776 [PSH, ACK] Seq=80038 Ack=1 Win=37888 Len=1000 TSval=1758596611 TSecr=1886574688
  155  40.178394     10.0.0.1 → 10.0.0.2     TCP 1066 [TCP Previous segment not captured] 53241 → 47452 [PSH, ACK] Seq=81038 Ack=1 Win=37888 Len=1000 TSval=1758596614 TSecr=1886574694
  156  40.180533     10.0.0.1 → 10.0.0.2     TCP 9066 32720 → 40783 [PSH, ACK] Seq=73038 Ack=1 Win=74 Len=9000 TSval=1758596618 TSecr=1886574702
  157  40.198674     10.0.0.1 → 10.0.0.2     TCP 1066 [TCP Previous segment not captured] 48193 → 59433 [PSH, ACK] Seq=93038 Ack=1 Win=37888 Len=1000 TSval=1758596620 TSecr=1886574704
  158  40.200807     10.0.0.1 → 10.0.0.2     TCP 2066 55943 → 42968 [PSH, ACK] Seq=81038 Ack=1 Win=37888 Len=2000 TSval=1758596632 TSecr=1886574717
  159  40.204938     10.0.0.1 → 10.0.0.2     TCP 1066 [TCP Previous segment not captured] 54368 → 46356 [PSH, ACK] Seq=82038 Ack=1 Win=37888 Len=1000 TSval=1758596636 TSecr=1886574720
  160  40.247092     10.0.0.1 → 10.0.0.2     TCP 5066 55246 → 6776 [PSH, ACK] Seq=81038 Ack=1 Win=37888 Len=5000 TSval=1758596686 TSecr=1886574766
  161  40.284411     10.0.0.1 → 10.0.0.2     TCP 6066 55943 → 42968 [PSH, ACK] Seq=83038 Ack=1 Win=37888 Len=6000 TSval=1758596722 TSecr=1886574792
  162  40.293388     10.0.0.1 → 10.0.0.2     TCP 2066 [TCP Previous segment not captured] 19551 → 35722 [PSH, ACK] Seq=104038 Ack=1 Win=37888 Len=2000 TSval=1758596724 TSecr=1886574797
  163  40.297519     10.0.0.1 → 10.0.0.2     TCP 2066 [TCP Previous segment not captured] 58169 → 25904 [PSH, ACK] Seq=88038 Ack=1 Win=37888 Len=2000 TSval=1758596727 TSecr=1886574808
  164  40.303085     10.0.0.1 → 10.0.0.2     TCP 3066 [TCP Previous segment not captured] 53241 → 47452 [PSH, ACK] Seq=88038 Ack=1 Win=37888 Len=3000 TSval=1758596743 TSecr=1886574825
  165  40.323322     10.0.0.1 → 10.0.0.2     TCP 3066 19551 → 35722 [PSH, ACK] Seq=106038 Ack=1 Win=37888 Len=3000 TSval=1758596764 TSecr=1886574847
  166  40.329490     10.0.0.1 → 10.0.0.2     TCP 3066 [TCP Previous segment not captured] 55246 → 6776 [PSH, ACK] Seq=89038 Ack=1 Win=37888 Len=3000 TSval=1758596770 TSecr=1886574854
  167  40.332470     10.0.0.1 → 10.0.0.2     TCP 3066 58169 → 25904 [PSH, ACK] Seq=90038 Ack=1 Win=37888 Len=3000 TSval=1758596771 TSecr=1886574856
  168  40.338558     10.0.0.1 → 10.0.0.2     TCP 3066 [TCP Previous segment not captured] 55943 → 42968 [PSH, ACK] Seq=91038 Ack=1 Win=37888 Len=3000 TSval=1758596777 TSecr=1886574860
  169  40.345382     10.0.0.1 → 10.0.0.2     TCP 3066 [TCP Previous segment not captured] 32720 → 40783 [PSH, ACK] Seq=91038 Ack=1 Win=74 Len=3000 TSval=1758596781 TSecr=1886574865
  170  40.350822     10.0.0.1 → 10.0.0.2     TCP 3066 [TCP Previous segment not captured] 48193 → 59433 [PSH, ACK] Seq=103038 Ack=1 Win=37888 Len=3000 TSval=1758596790 TSecr=1886574873
  171  40.356994     10.0.0.1 → 10.0.0.2     TCP 2066 19551 → 35722 [PSH, ACK] Seq=109038 Ack=1 Win=37888 Len=2000 TSval=1758596792 TSecr=1886574876
  172  40.361106     10.0.0.1 → 10.0.0.2     TCP 3066 [TCP Previous segment not captured] 54368 → 46356 [PSH, ACK] Seq=92038 Ack=1 Win=37888 Len=3000 TSval=1758596793 TSecr=1886574876
  173  40.388011     10.0.0.1 → 10.0.0.2     TCP 1066 [TCP Previous segment not captured] 58169 → 25904 [PSH, ACK] Seq=97038 Ack=1 Win=37888 Len=1000 TSval=1758596828 TSecr=1886574903
  174  40.393415     10.0.0.1 → 10.0.0.2     TCP 4066 55943 → 42968 [PSH, ACK] Seq=94038 Ack=1 Win=37888 Len=4000 TSval=1758596834 TSecr=1886574916
  175  40.398385     10.0.0.1 → 10.0.0.2     TCP 4066 [TCP Previous segment not captured] 53241 → 47452 [PSH, ACK] Seq=94038 Ack=1 Win=37888 Len=4000 TSval=1758596837 TSecr=1886574922
  176  40.417797     10.0.0.1 → 10.0.0.2     TCP 7066 55246 → 6776 [PSH, ACK] Seq=92038 Ack=1 Win=37888 Len=7000 TSval=1758596858 TSecr=1886574942
  177  40.428754     10.0.0.1 → 10.0.0.2     TCP 6066 19551 → 35722 [PSH, ACK] Seq=111038 Ack=1 Win=37888 Len=6000 TSval=1758596866 TSecr=1886574950
  178  40.442568     10.0.0.1 → 10.0.0.2     TCP 1066 [TCP Previous segment not captured] 54368 → 46356 [PSH, ACK] Seq=101038 Ack=1 Win=37888 Len=1000 TSval=1758596883 TSecr=1886574960
  179  40.457352     10.0.0.1 → 10.0.0.2     TCP 1066 [TCP Previous segment not captured] 58169 → 25904 [PSH, ACK] Seq=102038 Ack=1 Win=37888 Len=1000 TSval=1758596898 TSecr=1886574980
  180  40.468284     10.0.0.1 → 10.0.0.2     TCP 9514 32720 → 40783 [ACK] Seq=94038 Ack=1 Win=74 Len=9448 TSval=1758596908 TSecr=1886574865
  181  40.484124     10.0.0.1 → 10.0.0.2     TCP 1066 [TCP Previous segment not captured] 55943 → 42968 [PSH, ACK] Seq=103038 Ack=1 Win=37888 Len=1000 TSval=1758596910 TSecr=1886574983
  182  40.486269     10.0.0.1 → 10.0.0.2     TCP 9514 48193 → 59433 [ACK] Seq=106038 Ack=1 Win=37888 Len=9448 TSval=1758596914 TSecr=1886574873
  183  40.511195     10.0.0.1 → 10.0.0.2     TCP 6066 19551 → 35722 [PSH, ACK] Seq=117038 Ack=1 Win=37888 Len=6000 TSval=1758596951 TSecr=1886575035
  184  40.520136     10.0.0.1 → 10.0.0.2     TCP 1066 [TCP Previous segment not captured] 48193 → 59433 [PSH, ACK] Seq=117038 Ack=1 Win=37888 Len=1000 TSval=1758596953 TSecr=1886575037
  185  40.522288     10.0.0.1 → 10.0.0.2     TCP 2066 [TCP Previous segment not captured] 55246 → 6776 [PSH, ACK] Seq=105038 Ack=1 Win=37888 Len=2000 TSval=1758596960 TSecr=1886575044
  186  40.526436     10.0.0.1 → 10.0.0.2     TCP 2066 [TCP Previous segment not captured] 32720 → 40783 [PSH, ACK] Seq=106038 Ack=1 Win=74 Len=2000 TSval=1758596962 TSecr=1886575046
  187  40.535525     10.0.0.1 → 10.0.0.2     TCP 6066 54368 → 46356 [PSH, ACK] Seq=102038 Ack=1 Win=37888 Len=6000 TSval=1758596976 TSecr=1886575060
  188  40.544505     10.0.0.1 → 10.0.0.2     TCP 6066 58169 → 25904 [PSH, ACK] Seq=103038 Ack=1 Win=37888 Len=6000 TSval=1758596980 TSecr=1886575064
  189  40.556595     10.0.0.1 → 10.0.0.2     TCP 4066 [TCP Previous segment not captured] 53241 → 47452 [PSH, ACK] Seq=105038 Ack=1 Win=37888 Len=4000 TSval=1758596982 TSecr=1886575066
  190  40.582131     10.0.0.1 → 10.0.0.2     TCP 8066 55943 → 42968 [PSH, ACK] Seq=104038 Ack=1 Win=37888 Len=8000 TSval=1758597022 TSecr=1886575106
  191  40.634085     10.0.0.1 → 10.0.0.2     TCP 9514 48193 → 59433 [ACK] Seq=118038 Ack=1 Win=37888 Len=9448 TSval=1758597074 TSecr=1886575110
  192  40.649918     10.0.0.1 → 10.0.0.2     TCP 1066 [TCP Previous segment not captured] 19551 → 35722 [PSH, ACK] Seq=132038 Ack=1 Win=37888 Len=1000 TSval=1758597077 TSecr=1886575151
  193  40.652060     10.0.0.1 → 10.0.0.2     TCP 9514 [TCP Retransmission] 48193 → 59433 [ACK] Seq=118038 Ack=1 Win=37888 Len=9448 TSval=1758597090 TSecr=1886575174
  194  40.675758     10.0.0.1 → 10.0.0.2     TCP 9514 55246 → 6776 [ACK] Seq=107038 Ack=1 Win=37888 Len=9448 TSval=1758597091 TSecr=1886575044
  195  40.693361     10.0.0.1 → 10.0.0.2     TCP 1618 [TCP Previous segment not captured] 58169 → 25904 [PSH, ACK] Seq=118486 Ack=1 Win=37888 Len=1552 TSval=1758597134 TSecr=1886575218
  196  40.709542     10.0.0.1 → 10.0.0.2     TCP 9514 55943 → 42968 [ACK] Seq=112038 Ack=1 Win=37888 Len=9448 TSval=1758597150 TSecr=1886575106
  197  40.725408     10.0.0.1 → 10.0.0.2     TCP 3618 [TCP Previous segment not captured] 53241 → 47452 [PSH, ACK] Seq=118486 Ack=1 Win=37888 Len=3552 TSval=1758597158 TSecr=1886575242
  198  40.758602     10.0.0.1 → 10.0.0.2     TCP 7066 [TCP Previous segment not captured] 54368 → 46356 [PSH, ACK] Seq=118038 Ack=1 Win=37888 Len=7000 TSval=1758597199 TSecr=1886575283
  199  40.769588     10.0.0.1 → 10.0.0.2     TCP 4066 [TCP Previous segment not captured] 32720 → 40783 [PSH, ACK] Seq=122038 Ack=1 Win=74 Len=4000 TSval=1758597204 TSecr=1886575288
  200  40.777691     10.0.0.1 → 10.0.0.2     TCP 9514 [TCP Retransmission] 55943 → 42968 [ACK] Seq=112038 Ack=1 Win=37888 Len=9448 TSval=1758597212 TSecr=1886575297
  201  40.806881     10.0.0.1 → 10.0.0.2     TCP 2618 [TCP Previous segment not captured] 19551 → 35722 [PSH, ACK] Seq=142486 Ack=1 Win=37888 Len=2552 TSval=1758597247 TSecr=1886575330
  202  40.822611     10.0.0.1 → 10.0.0.2     TCP 3066 [TCP Previous segment not captured] 55246 → 6776 [PSH, ACK] Seq=126038 Ack=1 Win=37888 Len=3000 TSval=1758597263 TSecr=1886575347
  203  40.825546     10.0.0.1 → 10.0.0.2     TCP 3066 [TCP Previous segment not captured] 48193 → 59433 [PSH, ACK] Seq=139038 Ack=1 Win=37888 Len=3000 TSval=1758597265 TSecr=1886575349
  204  40.831691     10.0.0.1 → 10.0.0.2     TCP 1618 [TCP Retransmission] 58169 → 25904 [PSH, ACK] Seq=118486 Ack=1 Win=37888 Len=1552 TSval=1758597271 TSecr=1886575355
  205  40.840991     10.0.0.1 → 10.0.0.2     TCP 9514 53241 → 47452 [ACK] Seq=122038 Ack=1 Win=37888 Len=9448 TSval=1758597281 TSecr=1886575286
  206  40.882563     10.0.0.1 → 10.0.0.2     TCP 9514 54368 → 46356 [ACK] Seq=125038 Ack=1 Win=37888 Len=9448 TSval=1758597323 TSecr=1886575283
  207  40.898396     10.0.0.1 → 10.0.0.2     TCP 6066 [TCP Previous segment not captured] 58169 → 25904 [PSH, ACK] Seq=129038 Ack=1 Win=37888 Len=6000 TSval=1758597325 TSecr=1886575409
  208  40.910579     10.0.0.1 → 10.0.0.2     TCP 2618 [TCP Previous segment not captured] 55943 → 42968 [PSH, ACK] Seq=132486 Ack=1 Win=37888 Len=2552 TSval=1758597331 TSecr=1886575416
  209  40.935805     10.0.0.1 → 10.0.0.2     TCP 1066 [TCP Previous segment not captured] 32720 → 40783 [PSH, ACK] Seq=138038 Ack=1 Win=74 Len=1000 TSval=1758597376 TSecr=1886575460
  210  40.973324     10.0.0.1 → 10.0.0.2     TCP 3066 [TCP Previous segment not captured] 53241 → 47452 [PSH, ACK] Seq=138038 Ack=1 Win=37888 Len=3000 TSval=1758597414 TSecr=1886575498
  211  40.992483     10.0.0.1 → 10.0.0.2     TCP 3066 [TCP Retransmission] 55246 → 6776 [PSH, ACK] Seq=126038 Ack=1 Win=37888 Len=3000 TSval=1758597433 TSecr=1886575517
  212  41.036704     10.0.0.1 → 10.0.0.2     TCP 6618 [TCP Previous segment not captured] 55246 → 6776 [PSH, ACK] Seq=138486 Ack=1 Win=37888 Len=6552 TSval=1758597477 TSecr=1886575561
  213  41.083364     10.0.0.1 → 10.0.0.2     TCP 2618 [TCP Retransmission] 55943 → 42968 [PSH, ACK] Seq=132486 Ack=1 Win=37888 Len=2552 TSval=1758597523 TSecr=1886575607
  214  41.123853     10.0.0.1 → 10.0.0.2     TCP 6066 [TCP Previous segment not captured] 54368 → 46356 [PSH, ACK] Seq=147038 Ack=1 Win=37888 Len=6000 TSval=1758597564 TSecr=1886575648
  215  41.139960     10.0.0.1 → 10.0.0.2     TCP 6066 [TCP Previous segment not captured] 48193 → 59433 [PSH, ACK] Seq=159038 Ack=1 Win=37888 Len=6000 TSval=1758597580 TSecr=1886575664
  216  41.148948     10.0.0.1 → 10.0.0.2     TCP 9514 [TCP Previous segment not captured] 58169 → 25904 [ACK] Seq=144486 Ack=1 Win=37888 Len=9448 TSval=1758597584 TSecr=1886575668
  217  41.169537     10.0.0.1 → 10.0.0.2     TCP 9514 [TCP Previous segment not captured] 55943 → 42968 [ACK] Seq=144486 Ack=1 Win=37888 Len=9448 TSval=1758597610 TSecr=1886575693
  218  41.205521     10.0.0.1 → 10.0.0.2     TCP 7066 [TCP Previous segment not captured] 19551 → 35722 [PSH, ACK] Seq=168038 Ack=1 Win=37888 Len=7000 TSval=1758597646 TSecr=1886575730
  219  41.216458     10.0.0.1 → 10.0.0.2     TCP 3618 [TCP Previous segment not captured] 55246 → 6776 [PSH, ACK] Seq=154486 Ack=1 Win=37888 Len=3552 TSval=1758597648 TSecr=1886575732
  220  41.223713     10.0.0.1 → 10.0.0.2     TCP 5066 [TCP Previous segment not captured] 32720 → 40783 [PSH, ACK] Seq=155038 Ack=1 Win=74 Len=5000 TSval=1758597659 TSecr=1886575742
  221  41.244698     10.0.0.1 → 10.0.0.2     TCP 9066 54368 → 46356 [PSH, ACK] Seq=153038 Ack=1 Win=37888 Len=9000 TSval=1758597685 TSecr=1886575769
  222  41.259639     10.0.0.1 → 10.0.0.2     TCP 9514 [TCP Retransmission] 55943 → 42968 [ACK] Seq=144486 Ack=1 Win=37888 Len=9448 TSval=1758597697 TSecr=1886575776
  223  41.278864     10.0.0.1 → 10.0.0.2     TCP 6066 [TCP Previous segment not captured] 53241 → 47452 [PSH, ACK] Seq=157038 Ack=1 Win=37888 Len=6000 TSval=1758597697 TSecr=1886575781
  224  41.290797     10.0.0.1 → 10.0.0.2     TCP 9514 48193 → 59433 [ACK] Seq=165038 Ack=1 Win=37888 Len=9448 TSval=1758597700 TSecr=1886575664
  225  41.309862     10.0.0.1 → 10.0.0.2     TCP 618 48193 → 59433 [PSH, ACK] Seq=174486 Ack=1 Win=37888 Len=552 TSval=1758597709 TSecr=1886575793
  226  41.311080     10.0.0.1 → 10.0.0.2     TCP 9514 [TCP Previous segment not captured] 58169 → 25904 [ACK] Seq=154038 Ack=1 Win=37888 Len=9448 TSval=1758597711 TSecr=1886575795
  227  41.330090     10.0.0.1 → 10.0.0.2     TCP 9514 [TCP Retransmission] 58169 → 25904 [ACK] Seq=154038 Ack=1 Win=37888 Len=9448 TSval=1758597733 TSecr=1886575817
  228  41.349116     10.0.0.1 → 10.0.0.2     TCP 9514 55246 → 6776 [ACK] Seq=158038 Ack=1 Win=37888 Len=9448 TSval=1758597771 TSecr=1886575802
  229  41.368149     10.0.0.1 → 10.0.0.2     TCP 9514 [TCP Previous segment not captured] 55943 → 42968 [ACK] Seq=156038 Ack=1 Win=37888 Len=9448 TSval=1758597772 TSecr=1886575855
  230  41.387177     10.0.0.1 → 10.0.0.2     TCP 1618 [TCP Previous segment not captured] 19551 → 35722 [PSH, ACK] Seq=184486 Ack=1 Win=37888 Len=1552 TSval=1758597795 TSecr=1886575879
  231  41.390447     10.0.0.1 → 10.0.0.2     TCP 9514 54368 → 46356 [ACK] Seq=162038 Ack=1 Win=37888 Len=9448 TSval=1758597816 TSecr=1886575769
  232  41.450808     10.0.0.1 → 10.0.0.2     TCP 9514 55246 → 6776 [ACK] Seq=167486 Ack=1 Win=37888 Len=9448 TSval=1758597891 TSecr=1886575802
  233  41.477365     10.0.0.1 → 10.0.0.2     TCP 9514 19551 → 35722 [ACK] Seq=186038 Ack=1 Win=37888 Len=9448 TSval=1758597917 TSecr=1886575879
  234  41.495817     10.0.0.1 → 10.0.0.2     TCP 9514 54368 → 46356 [ACK] Seq=171486 Ack=1 Win=37888 Len=9448 TSval=1758597936 TSecr=1886575769
  235  41.562208     10.0.0.1 → 10.0.0.2     TCP 1618 [TCP Previous segment not captured] 32720 → 40783 [PSH, ACK] Seq=169486 Ack=1 Win=74 Len=1552 TSval=1758598002 TSecr=1886575774
  236  41.564747     10.0.0.1 → 10.0.0.2     TCP 5170 54368 → 46356 [PSH, ACK] Seq=180934 Ack=1 Win=37888 Len=5104 TSval=1758598005 TSecr=1886575769
  237  41.572592     10.0.0.1 → 10.0.0.2     TCP 8170 55246 → 6776 [PSH, ACK] Seq=176934 Ack=1 Win=37888 Len=8104 TSval=1758598005 TSecr=1886575802
  238  41.588930     10.0.0.1 → 10.0.0.2     TCP 9514 32720 → 40783 [ACK] Seq=171038 Ack=1 Win=74 Len=9448 TSval=1758598007 TSecr=1886575774
  239  41.608003     10.0.0.1 → 10.0.0.2     TCP 5066 [TCP Retransmission] 32720 → 40783 [PSH, ACK] Seq=155038 Ack=1 Win=74 Len=5000 TSval=1758598011 TSecr=1886575893
  240  41.618119     10.0.0.1 → 10.0.0.2     TCP 9514 [TCP Previous segment not captured] 55943 → 42968 [ACK] Seq=168038 Ack=1 Win=37888 Len=9448 TSval=1758598014 TSecr=1886576097
  241  41.637131     10.0.0.1 → 10.0.0.2     TCP 8618 55943 → 42968 [PSH, ACK] Seq=177486 Ack=1 Win=37888 Len=8552 TSval=1758598014 TSecr=1886576097
  242  41.654387     10.0.0.1 → 10.0.0.2     TCP 6066 [TCP Retransmission] 53241 → 47452 [PSH, ACK] Seq=157038 Ack=1 Win=37888 Len=6000 TSval=1758598024 TSecr=1886576108
  243  41.696217     10.0.0.1 → 10.0.0.2     TCP 9514 54368 → 46356 [ACK] Seq=186038 Ack=1 Win=37888 Len=9448 TSval=1758598136 TSecr=1886576116
  244  41.712066     10.0.0.1 → 10.0.0.2     TCP 1618 [TCP Retransmission] 32720 → 40783 [PSH, ACK] Seq=169486 Ack=1 Win=74 Len=1552 TSval=1758598138 TSecr=1886576222
