    1   0.000000     10.0.0.1 → 10.0.0.2     TCP 74 42763 → 35722 [SYN] Seq=0 Win=37840 Len=0 MSS=9460 SACK_PERM TSval=1758595171 TSecr=0 WS=512
    2   0.006261     10.0.0.1 → 10.0.0.2     TCP 66 42763 → 35722 [ACK] Seq=1 Ack=1 Win=37888 Len=0 TSval=1758595178 TSecr=1886573260
    3   0.006289     10.0.0.1 → 10.0.0.2     TCP 74 36467 → 59433 [SYN] Seq=0 Win=37840 Len=0 MSS=9460 SACK_PERM TSval=1758595179 TSecr=0 WS=512
    4   0.006310     10.0.0.1 → 10.0.0.2     TCP 103 42763 → 35722 [PSH, ACK] Seq=1 Ack=1 Win=37888 Len=37 TSval=1758595179 TSecr=1886573260
    5   0.010251     10.0.0.1 → 10.0.0.2     TCP 103 36467 → 59433 [PSH, ACK] Seq=1 Ack=1 Win=37888 Len=37 TSval=1758595183 TSecr=1886573266
    6   0.012897     10.0.0.1 → 10.0.0.2     TCP 66 42763 → 35722 [ACK] Seq=38 Ack=2 Win=37888 Len=0 TSval=1758595186 TSecr=1886573267
    7   0.014201     10.0.0.1 → 10.0.0.2     TCP 66 36467 → 59433 [ACK] Seq=38 Ack=2 Win=37888 Len=0 TSval=1758595186 TSecr=1886573270
    8   0.025993     10.0.0.1 → 10.0.0.2     TCP 74 51099 → 25904 [SYN] Seq=0 Win=37840 Len=0 MSS=9460 SACK_PERM TSval=1758595198 TSecr=0 WS=512
    9   0.026026     10.0.0.1 → 10.0.0.2     TCP 74 58271 → 40783 [SYN] Seq=0 Win=37840 Len=0 MSS=9460 SACK_PERM TSval=1758595198 TSecr=0 WS=512
   10   0.026047     10.0.0.1 → 10.0.0.2     TCP 66 39475 → 47452 [ACK] Seq=1 Ack=1 Win=74 Len=0 TSval=1758595199 TSecr=1886573281
   11   0.032000     10.0.0.1 → 10.0.0.2     TCP 103 39475 → 47452 [PSH, ACK] Seq=1 Ack=1 Win=74 Len=37 TSval=1758595203 TSecr=1886573281
   12   0.035193     10.0.0.1 → 10.0.0.2     TCP 74 47085 → 46356 [SYN] Seq=0 Win=37840 Len=0 MSS=9460 SACK_PERM TSval=1758595206 TSecr=0 WS=512
   13   0.035220     10.0.0.1 → 10.0.0.2     TCP 74 49189 → 42968 [SYN] Seq=0 Win=37840 Len=0 MSS=9460 SACK_PERM TSval=1758595206 TSecr=0 WS=512
   14   0.035239     10.0.0.1 → 10.0.0.2     TCP 66 58271 → 40783 [ACK] Seq=1 Ack=1 Win=37888 Len=0 TSval=1758595207 TSecr=1886573285
   15   0.036193     10.0.0.1 → 10.0.0.2     TCP 103 51099 → 25904 [PSH, ACK] Seq=1 Ack=1 Win=37888 Len=37 TSval=1758595208 TSecr=1886573285
   16   0.041762     10.0.0.1 → 10.0.0.2     TCP 103 55655 → 6776 [PSH, ACK] Seq=1 Ack=1 Win=74 Len=37 TSval=1758595212 TSecr=1886573293
   17   0.045321     10.0.0.1 → 10.0.0.2     TCP 66 47085 → 46356 [ACK] Seq=1 Ack=1 Win=37888 Len=0 TSval=1758595216 TSecr=1886573296
   18   0.046168     10.0.0.1 → 10.0.0.2     TCP 66 [TCP Previous segment not captured] 58271 → 40783 [ACK] Seq=38 Ack=2 Win=37888 Len=0 TSval=1758595217 TSecr=1886573298
   19   0.051650     10.0.0.1 → 10.0.0.2     TCP 66 51099 → 25904 [ACK] Seq=38 Ack=2 Win=37888 Len=0 TSval=1758595223 TSecr=1886573299
   20   0.051986     10.0.0.1 → 10.0.0.2     TCP 70 51099 → 25904 [PSH, ACK] Seq=38 Ack=2 Win=37888 Len=4 TSval=1758595223 TSecr=1886573299
   21   0.053007     10.0.0.1 → 10.0.0.2     TCP 70 55655 → 6776 [PSH, ACK] Seq=38 Ack=2 Win=74 Len=4 TSval=1758595223 TSecr=1886573304
   22   0.054310     10.0.0.1 → 10.0.0.2     TCP 66 [TCP Previous segment not captured] 49189 → 42968 [ACK] Seq=38 Ack=1 Win=37888 Len=0 TSval=1758595227 TSecr=1886573308
   23   0.055635     10.0.0.1 → 10.0.0.2     TCP 66 [TCP Previous segment not captured] 47085 → 46356 [ACK] Seq=38 Ack=2 Win=37888 Len=0 TSval=1758595228 TSecr=1886573309
   24   0.057134     10.0.0.1 → 10.0.0.2     TCP 183 [TCP Previous segment not captured] 42763 → 35722 [PSH, ACK] Seq=42 Ack=2 Win=37888 Len=117 TSval=1758595230 TSecr=1886573314
   25   0.059644     10.0.0.1 → 10.0.0.2     TCP 74 19551 → 35722 [SYN] Seq=0 Win=37840 Len=0 MSS=9460 SACK_PERM TSval=1758595233 TSecr=0 WS=512
   26   0.060332     10.0.0.1 → 10.0.0.2     TCP 183 [TCP Previous segment not captured] 36467 → 59433 [PSH, ACK] Seq=42 Ack=2 Win=37888 Len=117 TSval=1758595234 TSecr=1886573318
   27   0.068247     10.0.0.1 → 10.0.0.2     TCP 66 19551 → 35722 [ACK] Seq=1 Ack=1 Win=37888 Len=0 TSval=1758595235 TSecr=1886573319
   28   0.069124     10.0.0.1 → 10.0.0.2     TCP 103 19551 → 35722 [PSH, ACK] Seq=1 Ack=1 Win=37888 Len=37 TSval=1758595235 TSecr=1886573319
   29   0.070423     10.0.0.1 → 10.0.0.2     TCP 74 48193 → 59433 [SYN] Seq=0 Win=37840 Len=0 MSS=9460 SACK_PERM TSval=1758595243 TSecr=0 WS=512
   30   0.135661     10.0.0.1 → 10.0.0.2     TCP 66 48193 → 59433 [ACK] Seq=1 Ack=1 Win=37888 Len=0 TSval=1758595249 TSecr=1886573330
   31   0.139994     10.0.0.1 → 10.0.0.2     TCP 66 36467 → 59433 [ACK] Seq=159 Ack=3 Win=37888 Len=0 TSval=1758595285 TSecr=1886573320
   32   0.204404     10.0.0.1 → 10.0.0.2     TCP 1066 19551 → 35722 [PSH, ACK] Seq=38 Ack=1 Win=37888 Len=1000 TSval=1758595317 TSecr=1886573328
   33   0.208619     10.0.0.1 → 10.0.0.2     TCP 74 53241 → 47452 [SYN] Seq=0 Win=37840 Len=0 MSS=9460 SACK_PERM TSval=1758595379 TSecr=0 WS=512
   34   0.209647     10.0.0.1 → 10.0.0.2     TCP 66 36467 → 59433 [ACK] Seq=159 Ack=5 Win=37888 Len=0 TSval=1758595380 TSecr=1886573399
   35   0.210719     10.0.0.1 → 10.0.0.2     TCP 74 55246 → 6776 [SYN] Seq=0 Win=37840 Len=0 MSS=9460 SACK_PERM TSval=1758595380 TSecr=0 WS=512
   36   0.213057     10.0.0.1 → 10.0.0.2     TCP 74 58169 → 25904 [SYN] Seq=0 Win=37840 Len=0 MSS=9460 SACK_PERM TSval=1758595381 TSecr=0 WS=512
   37   0.214184     10.0.0.1 → 10.0.0.2     TCP 74 54368 → 46356 [SYN] Seq=0 Win=37840 Len=0 MSS=9460 SACK_PERM TSval=1758595381 TSecr=0 WS=512
   38   0.224185     10.0.0.1 → 10.0.0.2     TCP 74 55943 → 42968 [SYN] Seq=0 Win=37840 Len=0 MSS=9460 SACK_PERM TSval=1758595382 TSecr=0 WS=512
   39   0.261739     10.0.0.1 → 10.0.0.2     TCP 66 55246 → 6776 [ACK] Seq=1 Ack=1 Win=37888 Len=0 TSval=1758595400 TSecr=1886573470
   40   0.263554     10.0.0.1 → 10.0.0.2     TCP 103 55246 → 6776 [PSH, ACK] Seq=1 Ack=1 Win=37888 Len=37 TSval=1758595400 TSecr=1886573470
   41   0.279509     10.0.0.1 → 10.0.0.2     TCP 2066 [TCP Previous segment not captured] 48193 → 59433 [PSH, ACK] Seq=1038 Ack=1 Win=37888 Len=2000 TSval=1758595409 TSecr=1886573471
   42   0.314976     10.0.0.1 → 10.0.0.2     TCP 103 58169 → 25904 [PSH, ACK] Seq=1 Ack=1 Win=37888 Len=37 TSval=1758595410 TSecr=1886573472
   43   0.327229     10.0.0.1 → 10.0.0.2     TCP 66 54368 → 46356 [ACK] Seq=1 Ack=1 Win=37888 Len=0 TSval=1758595410 TSecr=1886573473
   44   0.332830     10.0.0.1 → 10.0.0.2     TCP 103 32720 → 40783 [PSH, ACK] Seq=1 Ack=1 Win=74 Len=37 TSval=1758595417 TSecr=1886573482
   45   0.367205     10.0.0.1 → 10.0.0.2     TCP 66 [TCP Previous segment not captured] 51099 → 25904 [ACK] Seq=159 Ack=5 Win=37888 Len=0 TSval=1758595533 TSecr=1886573601
   46   0.369570     10.0.0.1 → 10.0.0.2     TCP 8066 [TCP Previous segment not captured] 19551 → 35722 [PSH, ACK] Seq=9038 Ack=1 Win=37888 Len=8000 TSval=1758595534 TSecr=1886573616
   47   0.382953     10.0.0.1 → 10.0.0.2     TCP 1066 58169 → 25904 [PSH, ACK] Seq=38 Ack=1 Win=37888 Len=1000 TSval=1758595534 TSecr=1886573575
   48   0.384586     10.0.0.1 → 10.0.0.2     TCP 1066 32720 → 40783 [PSH, ACK] Seq=38 Ack=1 Win=74 Len=1000 TSval=1758595534 TSecr=1886573592
   49   0.386752     10.0.0.1 → 10.0.0.2     TCP 1066 [TCP Previous segment not captured] 54368 → 46356 [PSH, ACK] Seq=38 Ack=1 Win=37888 Len=1000 TSval=1758595536 TSecr=1886573587
   50   0.389208     10.0.0.1 → 10.0.0.2     TCP 1066 [TCP Previous segment not captured] 55943 → 42968 [PSH, ACK] Seq=1038 Ack=1 Win=37888 Len=1000 TSval=1758595558 TSecr=1886573641
   51   0.391061     10.0.0.1 → 10.0.0.2     TCP 1066 [TCP Previous segment not captured] 48193 → 59433 [PSH, ACK] Seq=13038 Ack=1 Win=37888 Len=1000 TSval=1758595560 TSecr=1886573645
   52   0.393132     10.0.0.1 → 10.0.0.2     TCP 1066 [TCP Previous segment not captured] 19551 → 35722 [PSH, ACK] Seq=18038 Ack=1 Win=37888 Len=1000 TSval=1758595562 TSecr=1886573647
   53   0.395248     10.0.0.1 → 10.0.0.2     TCP 1066 [TCP Previous segment not captured] 53241 → 47452 [PSH, ACK] Seq=2038 Ack=1 Win=37888 Len=1000 TSval=1758595564 TSecr=1886573649
   54   0.397493     10.0.0.1 → 10.0.0.2     TCP 1066 [TCP Previous segment not captured] 55246 → 6776 [PSH, ACK] Seq=2038 Ack=1 Win=37888 Len=1000 TSval=1758595571 TSecr=1886573651
   55   0.402382     10.0.0.1 → 10.0.0.2     TCP 3066 32720 → 40783 [PSH, ACK] Seq=1038 Ack=1 Win=74 Len=3000 TSval=1758595576 TSecr=1886573659
   56   0.405675     10.0.0.1 → 10.0.0.2     TCP 3066 54368 → 46356 [PSH, ACK] Seq=1038 Ack=1 Win=37888 Len=3000 TSval=1758595579 TSecr=1886573663
   57   0.411806     10.0.0.1 → 10.0.0.2     TCP 2066 55943 → 42968 [PSH, ACK] Seq=2038 Ack=1 Win=37888 Len=2000 TSval=1758595583 TSecr=1886573667
   58   0.416098     10.0.0.1 → 10.0.0.2     TCP 1066 [TCP Previous segment not captured] 58169 → 25904 [PSH, ACK] Seq=4038 Ack=1 Win=37888 Len=1000 TSval=1758595588 TSecr=1886573661
   59   0.418268     10.0.0.1 → 10.0.0.2     TCP 2066 19551 → 35722 [PSH, ACK] Seq=19038 Ack=1 Win=37888 Len=2000 TSval=1758595592 TSecr=1886573676
   60   0.427811     10.0.0.1 → 10.0.0.2     TCP 1066 [TCP Previous segment not captured] 53241 → 47452 [PSH, ACK] Seq=5038 Ack=1 Win=37888 Len=1000 TSval=1758595601 TSecr=1886573684
   61   0.432263     10.0.0.1 → 10.0.0.2     TCP 2066 32720 → 40783 [PSH, ACK] Seq=4038 Ack=1 Win=74 Len=2000 TSval=1758595606 TSecr=1886573690
   62   0.433750     10.0.0.1 → 10.0.0.2     TCP 1066 [TCP Previous segment not captured] 48193 → 59433 [PSH, ACK] Seq=17038 Ack=1 Win=37888 Len=1000 TSval=1758595607 TSecr=1886573681
   63   0.450142     10.0.0.1 → 10.0.0.2     TCP 1066 [TCP Previous segment not captured] 55246 → 6776 [PSH, ACK] Seq=6038 Ack=1 Win=37888 Len=1000 TSval=1758595624 TSecr=1886573696
   64   0.455719     10.0.0.1 → 10.0.0.2     TCP 3066 55943 → 42968 [PSH, ACK] Seq=4038 Ack=1 Win=37888 Len=3000 TSval=1758595629 TSecr=1886573713
   65   0.458667     10.0.0.1 → 10.0.0.2     TCP 1066 [TCP Previous segment not captured] 54368 → 46356 [PSH, ACK] Seq=7038 Ack=1 Win=37888 Len=1000 TSval=1758595630 TSecr=1886573703
   66   0.464601     10.0.0.1 → 10.0.0.2     TCP 3066 58169 → 25904 [PSH, ACK] Seq=5038 Ack=1 Win=37888 Len=3000 TSval=1758595638 TSecr=1886573722
   67   0.480984     10.0.0.1 → 10.0.0.2     TCP 3066 32720 → 40783 [PSH, ACK] Seq=6038 Ack=1 Win=74 Len=3000 TSval=1758595654 TSecr=1886573738
   68   0.489155     10.0.0.1 → 10.0.0.2     TCP 4066 48193 → 59433 [PSH, ACK] Seq=18038 Ack=1 Win=37888 Len=4000 TSval=1758595663 TSecr=1886573747
   69   0.494064     10.0.0.1 → 10.0.0.2     TCP 1066 [TCP Previous segment not captured] 19551 → 35722 [PSH, ACK] Seq=26038 Ack=1 Win=37888 Len=1000 TSval=1758595664 TSecr=1886573739
   70   0.496336     10.0.0.1 → 10.0.0.2     TCP 3066 55246 → 6776 [PSH, ACK] Seq=7038 Ack=1 Win=37888 Len=3000 TSval=1758595667 TSecr=1886573751
   71   0.502347     10.0.0.1 → 10.0.0.2     TCP 1066 [TCP Previous segment not captured] 53241 → 47452 [PSH, ACK] Seq=10038 Ack=1 Win=37888 Len=1000 TSval=1758595668 TSecr=1886573741
   72   0.509325     10.0.0.1 → 10.0.0.2     TCP 1066 [TCP Previous segment not captured] 55943 → 42968 [PSH, ACK] Seq=11038 Ack=1 Win=37888 Len=1000 TSval=1758595683 TSecr=1886573757
   73   0.510099     10.0.0.1 → 10.0.0.2     TCP 4066 54368 → 46356 [PSH, ACK] Seq=8038 Ack=1 Win=37888 Len=4000 TSval=1758595684 TSecr=1886573767
   74   0.516346     10.0.0.1 → 10.0.0.2     TCP 4066 58169 → 25904 [PSH, ACK] Seq=8038 Ack=1 Win=37888 Len=4000 TSval=1758595687 TSecr=1886573772
   75   0.526086     10.0.0.1 → 10.0.0.2     TCP 4066 32720 → 40783 [PSH, ACK] Seq=9038 Ack=1 Win=74 Len=4000 TSval=1758595700 TSecr=1886573784
   76   0.542051     10.0.0.1 → 10.0.0.2     TCP 1066 [TCP Previous segment not captured] 48193 → 59433 [PSH, ACK] Seq=25038 Ack=1 Win=37888 Len=1000 TSval=1758595714 TSecr=1886573798
   77   0.555176     10.0.0.1 → 10.0.0.2     TCP 4066 19551 → 35722 [PSH, ACK] Seq=27038 Ack=1 Win=37888 Len=4000 TSval=1758595729 TSecr=1886573813
   78   0.573629     10.0.0.1 → 10.0.0.2     TCP 1066 [TCP Previous segment not captured] 55246 → 6776 [PSH, ACK] Seq=15038 Ack=1 Win=37888 Len=1000 TSval=1758595744 TSecr=1886573818
   79   0.575573     10.0.0.1 → 10.0.0.2     TCP 6066 53241 → 47452 [PSH, ACK] Seq=11038 Ack=1 Win=37888 Len=6000 TSval=1758595748 TSecr=1886573832
   80   0.585108     10.0.0.1 → 10.0.0.2     TCP 4066 55943 → 42968 [PSH, ACK] Seq=12038 Ack=1 Win=37888 Len=4000 TSval=1758595750 TSecr=1886573833
   81   0.615715     10.0.0.1 → 10.0.0.2     TCP 1066 [TCP Previous segment not captured] 58169 → 25904 [PSH, ACK] Seq=19038 Ack=1 Win=37888 Len=1000 TSval=1758595788 TSecr=1886573864
   82   0.616868     10.0.0.1 → 10.0.0.2     TCP 1066 [TCP Previous segment not captured] 54368 → 46356 [PSH, ACK] Seq=19038 Ack=1 Win=37888 Len=1000 TSval=1758595790 TSecr=1886573867
   83   0.628517     10.0.0.1 → 10.0.0.2     TCP 1066 [TCP Previous segment not captured] 32720 → 40783 [PSH, ACK] Seq=20038 Ack=1 Win=74 Len=1000 TSval=1758595801 TSecr=1886573881
   84   0.630084     10.0.0.1 → 10.0.0.2     TCP 6066 48193 → 59433 [PSH, ACK] Seq=26038 Ack=1 Win=37888 Len=6000 TSval=1758595803 TSecr=1886573886
   85   0.650343     10.0.0.1 → 10.0.0.2     TCP 5066 55246 → 6776 [PSH, ACK] Seq=16038 Ack=1 Win=37888 Len=5000 TSval=1758595823 TSecr=1886573907
   86   0.691330     10.0.0.1 → 10.0.0.2     TCP 1066 [TCP Previous segment not captured] 19551 → 35722 [PSH, ACK] Seq=41038 Ack=1 Win=37888 Len=1000 TSval=1758595864 TSecr=1886573940
   87   0.696064     10.0.0.1 → 10.0.0.2     TCP 1066 [TCP Previous segment not captured] 53241 → 47452 [PSH, ACK] Seq=25038 Ack=1 Win=37888 Len=1000 TSval=1758595869 TSecr=1886573953
   88   0.699073     10.0.0.1 → 10.0.0.2     TCP 1066 [TCP Previous segment not captured] 55943 → 42968 [PSH, ACK] Seq=25038 Ack=1 Win=37888 Len=1000 TSval=1758595871 TSecr=1886573955
   89   0.723603     10.0.0.1 → 10.0.0.2     TCP 2066 [TCP Previous segment not captured] 32720 → 40783 [PSH, ACK] Seq=26038 Ack=1 Win=74 Len=2000 TSval=1758595897 TSecr=1886573981
   90   0.733765     10.0.0.1 → 10.0.0.2     TCP 2066 [TCP Previous segment not captured] 48193 → 59433 [PSH, ACK] Seq=38038 Ack=1 Win=37888 Len=2000 TSval=1758595907 TSecr=1886573991
   91   0.747988     10.0.0.1 → 10.0.0.2     TCP 2066 [TCP Previous segment not captured] 58169 → 25904 [PSH, ACK] Seq=28038 Ack=1 Win=37888 Len=2000 TSval=1758595921 TSecr=1886574006
   92   0.752534     10.0.0.1 → 10.0.0.2     TCP 1066 [TCP Previous segment not captured] 55246 → 6776 [PSH, ACK] Seq=28038 Ack=1 Win=37888 Len=1000 TSval=1758595926 TSecr=1886574010
   93   0.761320     10.0.0.1 → 10.0.0.2     TCP 4066 55943 → 42968 [PSH, ACK] Seq=26038 Ack=1 Win=37888 Len=4000 TSval=1758595934 TSecr=1886574017
   94   0.766403     10.0.0.1 → 10.0.0.2     TCP 3066 32720 → 40783 [PSH, ACK] Seq=28038 Ack=1 Win=74 Len=3000 TSval=1758595937 TSecr=1886574022
   95   0.772211     10.0.0.1 → 10.0.0.2     TCP 2066 [TCP Previous segment not captured] 54368 → 46356 [PSH, ACK] Seq=29038 Ack=1 Win=37888 Len=2000 TSval=1758595940 TSecr=1886574024
   96   0.780768     10.0.0.1 → 10.0.0.2     TCP 2066 58169 → 25904 [PSH, ACK] Seq=30038 Ack=1 Win=37888 Len=2000 TSval=1758595954 TSecr=1886574038
   97   0.786812     10.0.0.1 → 10.0.0.2     TCP 2066 [TCP Previous segment not captured] 19551 → 35722 [PSH, ACK] Seq=47038 Ack=1 Win=37888 Len=2000 TSval=1758595960 TSecr=1886574044
   98   0.789576     10.0.0.1 → 10.0.0.2     TCP 1066 [TCP Previous segment not captured] 48193 → 59433 [PSH, ACK] Seq=43038 Ack=1 Win=37888 Len=1000 TSval=1758595962 TSecr=1886574046
   99   0.789873     10.0.0.1 → 10.0.0.2     TCP 3066 55246 → 6776 [PSH, ACK] Seq=29038 Ack=1 Win=37888 Len=3000 TSval=1758595963 TSecr=1886574047
  100   0.815034     10.0.0.1 → 10.0.0.2     TCP 1066 [TCP Previous segment not captured] 32720 → 40783 [PSH, ACK] Seq=34038 Ack=1 Win=74 Len=1000 TSval=1758595988 TSecr=1886574069
  101   0.816279     10.0.0.1 → 10.0.0.2     TCP 1066 [TCP Previous segment not captured] 55943 → 42968 [PSH, ACK] Seq=34038 Ack=1 Win=37888 Len=1000 TSval=1758595990 TSecr=1886574065
  102   0.821799     10.0.0.1 → 10.0.0.2     TCP 4066 54368 → 46356 [PSH, ACK] Seq=31038 Ack=1 Win=37888 Len=4000 TSval=1758595995 TSecr=1886574079
  103   0.840802     10.0.0.1 → 10.0.0.2     TCP 1066 [TCP Previous segment not captured] 58169 → 25904 [PSH, ACK] Seq=36038 Ack=1 Win=37888 Len=1000 TSval=1758596014 TSecr=1886574089
  104   0.863177     10.0.0.1 → 10.0.0.2     TCP 3066 32720 → 40783 [PSH, ACK] Seq=35038 Ack=1 Win=74 Len=3000 TSval=1758596037 TSecr=1886574121
  105   0.866470     10.0.0.1 → 10.0.0.2     TCP 1066 [TCP Previous segment not captured] 19551 → 35722 [PSH, ACK] Seq=54038 Ack=1 Win=37888 Len=1000 TSval=1758596037 TSecr=1886574113
  106   0.868243     10.0.0.1 → 10.0.0.2     TCP 1066 [TCP Previous segment not captured] 55246 → 6776 [PSH, ACK] Seq=37038 Ack=1 Win=37888 Len=1000 TSval=1758596038 TSecr=1886574115
  107   0.881728     10.0.0.1 → 10.0.0.2     TCP 1066 [TCP Previous segment not captured] 53241 → 47452 [PSH, ACK] Seq=39038 Ack=1 Win=37888 Len=1000 TSval=1758596055 TSecr=1886574139
  108   0.892074     10.0.0.1 → 10.0.0.2     TCP 2066 32720 → 40783 [PSH, ACK] Seq=38038 Ack=1 Win=74 Len=2000 TSval=1758596066 TSecr=1886574150
  109   0.896361     10.0.0.1 → 10.0.0.2     TCP 1066 [TCP Previous segment not captured] 54368 → 46356 [PSH, ACK] Seq=40038 Ack=1 Win=37888 Len=1000 TSval=1758596070 TSecr=1886574154
  110   0.908306     10.0.0.1 → 10.0.0.2     TCP 1066 [TCP Previous segment not captured] 58169 → 25904 [PSH, ACK] Seq=41038 Ack=1 Win=37888 Len=1000 TSval=1758596081 TSecr=1886574164
  111   0.912925     10.0.0.1 → 10.0.0.2     TCP 2066 53241 → 47452 [PSH, ACK] Seq=40038 Ack=1 Win=37888 Len=2000 TSval=1758596086 TSecr=1886574171
  112   0.916119     10.0.0.1 → 10.0.0.2     TCP 4066 [TCP Previous segment not captured] 48193 → 59433 [PSH, ACK] Seq=50038 Ack=1 Win=37888 Len=4000 TSval=1758596089 TSecr=1886574174
  113   0.922003     10.0.0.1 → 10.0.0.2     TCP 2066 32720 → 40783 [PSH, ACK] Seq=40038 Ack=1 Win=74 Len=2000 TSval=1758596091 TSecr=1886574175
  114   0.930126     10.0.0.1 → 10.0.0.2     TCP 1066 [TCP Previous segment not captured] 55246 → 6776 [PSH, ACK] Seq=42038 Ack=1 Win=37888 Len=1000 TSval=1758596104 TSecr=1886574177
  115   0.935287     10.0.0.1 → 10.0.0.2     TCP 1066 [TCP Previous segment not captured] 53241 → 47452 [PSH, ACK] Seq=43038 Ack=1 Win=37888 Len=1000 TSval=1758596109 TSecr=1886574193
  116   0.942133     10.0.0.1 → 10.0.0.2     TCP 2066 48193 → 59433 [PSH, ACK] Seq=54038 Ack=1 Win=37888 Len=2000 TSval=1758596116 TSecr=1886574200
  117   0.952584     10.0.0.1 → 10.0.0.2     TCP 5066 [TCP Previous segment not captured] 55943 → 42968 [PSH, ACK] Seq=40038 Ack=1 Win=37888 Len=5000 TSval=1758596126 TSecr=1886574210
  118   0.959625     10.0.0.1 → 10.0.0.2     TCP 6066 19551 → 35722 [PSH, ACK] Seq=55038 Ack=1 Win=37888 Len=6000 TSval=1758596127 TSecr=1886574210
  119   0.977770     10.0.0.1 → 10.0.0.2     TCP 5066 58169 → 25904 [PSH, ACK] Seq=42038 Ack=1 Win=37888 Len=5000 TSval=1758596151 TSecr=1886574234
  120   0.998194     10.0.0.1 → 10.0.0.2     TCP 3066 55943 → 42968 [PSH, ACK] Seq=45038 Ack=1 Win=37888 Len=3000 TSval=1758596169 TSecr=1886574251
  121   1.001045     10.0.0.1 → 10.0.0.2     TCP 1066 [TCP Previous segment not captured] 54368 → 46356 [PSH, ACK] Seq=47038 Ack=1 Win=37888 Len=1000 TSval=1758596173 TSecr=1886574253
  122   1.004058     10.0.0.1 → 10.0.0.2     TCP 6066 32720 → 40783 [PSH, ACK] Seq=42038 Ack=1 Win=74 Len=6000 TSval=1758596174 TSecr=1886574258
  123   1.015866     10.0.0.1 → 10.0.0.2     TCP 1066 [TCP Previous segment not captured] 19551 → 35722 [PSH, ACK] Seq=65038 Ack=1 Win=37888 Len=1000 TSval=1758596184 TSecr=1886574268
  124   1.017447     10.0.0.1 → 10.0.0.2     TCP 5066 53241 → 47452 [PSH, ACK] Seq=44038 Ack=1 Win=37888 Len=5000 TSval=1758596185 TSecr=1886574270
  125   1.027737     10.0.0.1 → 10.0.0.2     TCP 1066 [TCP Previous segment not captured] 55246 → 6776 [PSH, ACK] Seq=48038 Ack=1 Win=37888 Len=1000 TSval=1758596188 TSecr=1886574272
  126   1.029772     10.0.0.1 → 10.0.0.2     TCP 4066 58169 → 25904 [PSH, ACK] Seq=47038 Ack=1 Win=37888 Len=4000 TSval=1758596203 TSecr=1886574286
  127   1.074255     10.0.0.1 → 10.0.0.2     TCP 7066 [TCP Previous segment not captured] 48193 → 59433 [PSH, ACK] Seq=58038 Ack=1 Win=37888 Len=7000 TSval=1758596245 TSecr=1886574322
  128   1.086798     10.0.0.1 → 10.0.0.2     TCP 7066 32720 → 40783 [PSH, ACK] Seq=48038 Ack=1 Win=74 Len=7000 TSval=1758596260 TSecr=1886574340
  129   1.098928     10.0.0.1 → 10.0.0.2     TCP 1066 [TCP Previous segment not captured] 55943 → 42968 [PSH, ACK] Seq=54038 Ack=1 Win=37888 Len=1000 TSval=1758596262 TSecr=1886574340
  130   1.100447     10.0.0.1 → 10.0.0.2     TCP 1066 [TCP Previous segment not captured] 54368 → 46356 [PSH, ACK] Seq=54038 Ack=1 Win=37888 Len=1000 TSval=1758596265 TSecr=1886574348
  131   1.102557     10.0.0.1 → 10.0.0.2     TCP 7066 53241 → 47452 [PSH, ACK] Seq=49038 Ack=1 Win=37888 Len=7000 TSval=1758596275 TSecr=1886574358
  132   1.118176     10.0.0.1 → 10.0.0.2     TCP 1066 [TCP Previous segment not captured] 19551 → 35722 [PSH, ACK] Seq=72038 Ack=1 Win=37888 Len=1000 TSval=1758596278 TSecr=1886574360
  133   1.127040     10.0.0.1 → 10.0.0.2     TCP 8066 55246 → 6776 [PSH, ACK] Seq=49038 Ack=1 Win=37888 Len=8000 TSval=1758596300 TSecr=1886574379
  134   1.174921     10.0.0.1 → 10.0.0.2     TCP 1066 [TCP Previous segment not captured] 32720 → 40783 [PSH, ACK] Seq=61038 Ack=1 Win=74 Len=1000 TSval=1758596348 TSecr=1886574428
  135   1.209029     10.0.0.1 → 10.0.0.2     TCP 4066 [TCP Previous segment not captured] 58169 → 25904 [PSH, ACK] Seq=60038 Ack=1 Win=37888 Len=4000 TSval=1758596382 TSecr=1886574462
  136   1.216349     10.0.0.1 → 10.0.0.2     TCP 1066 [TCP Previous segment not captured] 55943 → 42968 [PSH, ACK] Seq=64038 Ack=1 Win=37888 Len=1000 TSval=1758596390 TSecr=1886574470
  137   1.238926     10.0.0.1 → 10.0.0.2     TCP 2066 [TCP Previous segment not captured] 53241 → 47452 [PSH, ACK] Seq=64038 Ack=1 Win=37888 Len=2000 TSval=1758596411 TSecr=1886574491
  138   1.252846     10.0.0.1 → 10.0.0.2     TCP 3066 [TCP Previous segment not captured] 48193 → 59433 [PSH, ACK] Seq=76038 Ack=1 Win=37888 Len=3000 TSval=1758596426 TSecr=1886574509
  139   1.275492     10.0.0.1 → 10.0.0.2     TCP 5066 58169 → 25904 [PSH, ACK] Seq=64038 Ack=1 Win=37888 Len=5000 TSval=1758596448 TSecr=1886574533
  140   1.282434     10.0.0.1 → 10.0.0.2     TCP 2066 [TCP Previous segment not captured] 19551 → 35722 [PSH, ACK] Seq=83038 Ack=1 Win=37888 Len=2000 TSval=1758596451 TSecr=1886574534
  141   1.287791     10.0.0.1 → 10.0.0.2     TCP 3066 [TCP Previous segment not captured] 55246 → 6776 [PSH, ACK] Seq=66038 Ack=1 Win=37888 Len=3000 TSval=1758596452 TSecr=1886574536
  142   1.300293     10.0.0.1 → 10.0.0.2     TCP 5066 53241 → 47452 [PSH, ACK] Seq=66038 Ack=1 Win=37888 Len=5000 TSval=1758596473 TSecr=1886574555
  143   1.311853     10.0.0.1 → 10.0.0.2     TCP 4066 48193 → 59433 [PSH, ACK] Seq=79038 Ack=1 Win=37888 Len=4000 TSval=1758596483 TSecr=1886574562
  144   1.322143     10.0.0.1 → 10.0.0.2     TCP 2066 [TCP Previous segment not captured] 32720 → 40783 [PSH, ACK] Seq=71038 Ack=1 Win=74 Len=2000 TSval=1758596495 TSecr=1886574580
  145   1.325909     10.0.0.1 → 10.0.0.2     TCP 1066 [TCP Previous segment not captured] 54368 → 46356 [PSH, ACK] Seq=72038 Ack=1 Win=37888 Len=1000 TSval=1758596499 TSecr=1886574584
  146   1.336301     10.0.0.1 → 10.0.0.2     TCP 5066 19551 → 35722 [PSH, ACK] Seq=85038 Ack=1 Win=37888 Len=5000 TSval=1758596510 TSecr=1886574594
  147   1.357514     10.0.0.1 → 10.0.0.2     TCP 1066 [TCP Previous segment not captured] 55246 → 6776 [PSH, ACK] Seq=74038 Ack=1 Win=37888 Len=1000 TSval=1758596531 TSecr=1886574614
  148   1.371744     10.0.0.1 → 10.0.0.2     TCP 1066 [TCP Previous segment not captured] 53241 → 47452 [PSH, ACK] Seq=75038 Ack=1 Win=37888 Len=1000 TSval=1758596545 TSecr=1886574628
  149   1.376953     10.0.0.1 → 10.0.0.2     TCP 5066 48193 → 59433 [PSH, ACK] Seq=83038 Ack=1 Win=37888 Len=5000 TSval=1758596550 TSecr=1886574635
  150   1.400794     10.0.0.1 → 10.0.0.2     TCP 1066 [TCP Previous segment not captured] 58169 → 25904 [PSH, ACK] Seq=78038 Ack=1 Win=37888 Len=1000 TSval=1758596574 TSecr=1886574647
  151   1.436110     10.0.0.1 → 10.0.0.2     TCP 5066 [TCP Previous segment not captured] 55943 → 42968 [PSH, ACK] Seq=76038 Ack=1 Win=37888 Len=5000 TSval=1758596609 TSecr=1886574694
  152   1.443555     10.0.0.1 → 10.0.0.2     TCP 1066 [TCP Previous segment not captured] 55246 → 6776 [PSH, ACK] Seq=80038 Ack=1 Win=37888 Len=1000 TSval=1758596611 TSecr=1886574688
  153   1.445189     10.0.0.1 → 10.0.0.2     TCP 1066 [TCP Previous segment not captured] 53241 → 47452 [PSH, ACK] Seq=81038 Ack=1 Win=37888 Len=1000 TSval=1758596614 TSecr=1886574694
  154   1.447341     10.0.0.1 → 10.0.0.2     TCP 9066 32720 → 40783 [PSH, ACK] Seq=73038 Ack=1 Win=74 Len=9000 TSval=1758596618 TSecr=1886574702
  155   1.465478     10.0.0.1 → 10.0.0.2     TCP 1066 [TCP Previous segment not captured] 48193 → 59433 [PSH, ACK] Seq=93038 Ack=1 Win=37888 Len=1000 TSval=1758596620 TSecr=1886574704
  156   1.467634     10.0.0.1 → 10.0.0.2     TCP 2066 55943 → 42968 [PSH, ACK] Seq=81038 Ack=1 Win=37888 Len=2000 TSval=1758596632 TSecr=1886574717
  157   1.471835     10.0.0.1 → 10.0.0.2     TCP 1066 [TCP Previous segment not captured] 54368 → 46356 [PSH, ACK] Seq=82038 Ack=1 Win=37888 Len=1000 TSval=1758596636 TSecr=1886574720
  158   1.514509     10.0.0.1 → 10.0.0.2     TCP 5066 55246 → 6776 [PSH, ACK] Seq=81038 Ack=1 Win=37888 Len=5000 TSval=1758596686 TSecr=1886574766
  159   1.551274     10.0.0.1 → 10.0.0.2     TCP 6066 55943 → 42968 [PSH, ACK] Seq=83038 Ack=1 Win=37888 Len=6000 TSval=1758596722 TSecr=1886574792
  160   1.560377     10.0.0.1 → 10.0.0.2     TCP 2066 [TCP Previous segment not captured] 19551 → 35722 [PSH, ACK] Seq=104038 Ack=1 Win=37888 Len=2000 TSval=1758596724 TSecr=1886574797
  161   1.564685     10.0.0.1 → 10.0.0.2     TCP 2066 [TCP Previous segment not captured] 58169 → 25904 [PSH, ACK] Seq=88038 Ack=1 Win=37888 Len=2000 TSval=1758596727 TSecr=1886574808
  162   1.569913     10.0.0.1 → 10.0.0.2     TCP 3066 [TCP Previous segment not captured] 53241 → 47452 [PSH, ACK] Seq=88038 Ack=1 Win=37888 Len=3000 TSval=1758596743 TSecr=1886574825
  163   1.590121     10.0.0.1 → 10.0.0.2     TCP 3066 19551 → 35722 [PSH, ACK] Seq=106038 Ack=1 Win=37888 Len=3000 TSval=1758596764 TSecr=1886574847
  164   1.596299     10.0.0.1 → 10.0.0.2     TCP 3066 [TCP Previous segment not captured] 55246 → 6776 [PSH, ACK] Seq=89038 Ack=1 Win=37888 Len=3000 TSval=1758596770 TSecr=1886574854
  165   1.599313     10.0.0.1 → 10.0.0.2     TCP 3066 58169 → 25904 [PSH, ACK] Seq=90038 Ack=1 Win=37888 Len=3000 TSval=1758596771 TSecr=1886574856
  166   1.605385     10.0.0.1 → 10.0.0.2     TCP 3066 [TCP Previous segment not captured] 55943 → 42968 [PSH, ACK] Seq=91038 Ack=1 Win=37888 Len=3000 TSval=1758596777 TSecr=1886574860
  167   1.613361     10.0.0.1 → 10.0.0.2     TCP 3066 [TCP Previous segment not captured] 32720 → 40783 [PSH, ACK] Seq=91038 Ack=1 Win=74 Len=3000 TSval=1758596781 TSecr=1886574865
  168   1.617643     10.0.0.1 → 10.0.0.2     TCP 3066 [TCP Previous segment not captured] 48193 → 59433 [PSH, ACK] Seq=103038 Ack=1 Win=37888 Len=3000 TSval=1758596790 TSecr=1886574873
  169   1.623810     10.0.0.1 → 10.0.0.2     TCP 2066 19551 → 35722 [PSH, ACK] Seq=109038 Ack=1 Win=37888 Len=2000 TSval=1758596792 TSecr=1886574876
  170   1.627924     10.0.0.1 → 10.0.0.2     TCP 3066 [TCP Previous segment not captured] 54368 → 46356 [PSH, ACK] Seq=92038 Ack=1 Win=37888 Len=3000 TSval=1758596793 TSecr=1886574876
  171   1.654833     10.0.0.1 → 10.0.0.2     TCP 1066 [TCP Previous segment not captured] 58169 → 25904 [PSH, ACK] Seq=97038 Ack=1 Win=37888 Len=1000 TSval=1758596828 TSecr=1886574903
  172   1.660235     10.0.0.1 → 10.0.0.2     TCP 4066 55943 → 42968 [PSH, ACK] Seq=94038 Ack=1 Win=37888 Len=4000 TSval=1758596834 TSecr=1886574916
  173   1.665235     10.0.0.1 → 10.0.0.2     TCP 4066 [TCP Previous segment not captured] 53241 → 47452 [PSH, ACK] Seq=94038 Ack=1 Win=37888 Len=4000 TSval=1758596837 TSecr=1886574922
  174   1.684667     10.0.0.1 → 10.0.0.2     TCP 7066 55246 → 6776 [PSH, ACK] Seq=92038 Ack=1 Win=37888 Len=7000 TSval=1758596858 TSecr=1886574942
  175   1.695577     10.0.0.1 → 10.0.0.2     TCP 6066 19551 → 35722 [PSH, ACK] Seq=111038 Ack=1 Win=37888 Len=6000 TSval=1758596866 TSecr=1886574950
  176   1.709404     10.0.0.1 → 10.0.0.2     TCP 1066 [TCP Previous segment not captured] 54368 → 46356 [PSH, ACK] Seq=101038 Ack=1 Win=37888 Len=1000 TSval=1758596883 TSecr=1886574960
  177   1.724159     10.0.0.1 → 10.0.0.2     TCP 1066 [TCP Previous segment not captured] 58169 → 25904 [PSH, ACK] Seq=102038 Ack=1 Win=37888 Len=1000 TSval=1758596898 TSecr=1886574980
  178   1.735100     10.0.0.1 → 10.0.0.2     TCP 9514 32720 → 40783 [ACK] Seq=94038 Ack=1 Win=74 Len=9448 TSval=1758596908 TSecr=1886574865
  179   1.750921     10.0.0.1 → 10.0.0.2     TCP 1066 [TCP Previous segment not captured] 55943 → 42968 [PSH, ACK] Seq=103038 Ack=1 Win=37888 Len=1000 TSval=1758596910 TSecr=1886574983
  180   1.753039     10.0.0.1 → 10.0.0.2     TCP 9514 48193 → 59433 [ACK] Seq=106038 Ack=1 Win=37888 Len=9448 TSval=1758596914 TSecr=1886574873
  181   1.778002     10.0.0.1 → 10.0.0.2     TCP 6066 19551 → 35722 [PSH, ACK] Seq=117038 Ack=1 Win=37888 Len=6000 TSval=1758596951 TSecr=1886575035
  182   1.786936     10.0.0.1 → 10.0.0.2     TCP 1066 [TCP Previous segment not captured] 48193 → 59433 [PSH, ACK] Seq=117038 Ack=1 Win=37888 Len=1000 TSval=1758596953 TSecr=1886575037
  183   1.789097     10.0.0.1 → 10.0.0.2     TCP 2066 [TCP Previous segment not captured] 55246 → 6776 [PSH, ACK] Seq=105038 Ack=1 Win=37888 Len=2000 TSval=1758596960 TSecr=1886575044
  184   1.793265     10.0.0.1 → 10.0.0.2     TCP 2066 [TCP Previous segment not captured] 32720 → 40783 [PSH, ACK] Seq=106038 Ack=1 Win=74 Len=2000 TSval=1758596962 TSecr=1886575046
  185   1.802355     10.0.0.1 → 10.0.0.2     TCP 6066 54368 → 46356 [PSH, ACK] Seq=102038 Ack=1 Win=37888 Len=6000 TSval=1758596976 TSecr=1886575060
  186   1.811342     10.0.0.1 → 10.0.0.2     TCP 6066 58169 → 25904 [PSH, ACK] Seq=103038 Ack=1 Win=37888 Len=6000 TSval=1758596980 TSecr=1886575064
  187   1.823483     10.0.0.1 → 10.0.0.2     TCP 4066 [TCP Previous segment not captured] 53241 → 47452 [PSH, ACK] Seq=105038 Ack=1 Win=37888 Len=4000 TSval=1758596982 TSecr=1886575066
  188   1.848916     10.0.0.1 → 10.0.0.2     TCP 8066 55943 → 42968 [PSH, ACK] Seq=104038 Ack=1 Win=37888 Len=8000 TSval=1758597022 TSecr=1886575106
  189   1.900945     10.0.0.1 → 10.0.0.2     TCP 9514 48193 → 59433 [ACK] Seq=118038 Ack=1 Win=37888 Len=9448 TSval=1758597074 TSecr=1886575110
  190   1.916758     10.0.0.1 → 10.0.0.2     TCP 1066 [TCP Previous segment not captured] 19551 → 35722 [PSH, ACK] Seq=132038 Ack=1 Win=37888 Len=1000 TSval=1758597077 TSecr=1886575151
  191   1.918859     10.0.0.1 → 10.0.0.2     TCP 9514 [TCP Retransmission] 48193 → 59433 [ACK] Seq=118038 Ack=1 Win=37888 Len=9448 TSval=1758597090 TSecr=1886575174
  192   1.945220     10.0.0.1 → 10.0.0.2     TCP 9514 55246 → 6776 [ACK] Seq=107038 Ack=1 Win=37888 Len=9448 TSval=1758597091 TSecr=1886575044
  193   1.960195     10.0.0.1 → 10.0.0.2     TCP 1618 [TCP Previous segment not captured] 58169 → 25904 [PSH, ACK] Seq=118486 Ack=1 Win=37888 Len=1552 TSval=1758597134 TSecr=1886575218
  194   1.976402     10.0.0.1 → 10.0.0.2     TCP 9514 55943 → 42968 [ACK] Seq=112038 Ack=1 Win=37888 Len=9448 TSval=1758597150 TSecr=1886575106
  195   1.992457     10.0.0.1 → 10.0.0.2     TCP 3618 [TCP Previous segment not captured] 53241 → 47452 [PSH, ACK] Seq=118486 Ack=1 Win=37888 Len=3552 TSval=1758597158 TSecr=1886575242
  196   2.025424     10.0.0.1 → 10.0.0.2     TCP 7066 [TCP Previous segment not captured] 54368 → 46356 [PSH, ACK] Seq=118038 Ack=1 Win=37888 Len=7000 TSval=1758597199 TSecr=1886575283
  197   2.036420     10.0.0.1 → 10.0.0.2     TCP 4066 [TCP Previous segment not captured] 32720 → 40783 [PSH, ACK] Seq=122038 Ack=1 Win=74 Len=4000 TSval=1758597204 TSecr=1886575288
  198   2.044556     10.0.0.1 → 10.0.0.2     TCP 9514 [TCP Retransmission] 55943 → 42968 [ACK] Seq=112038 Ack=1 Win=37888 Len=9448 TSval=1758597212 TSecr=1886575297
  199   2.073722     10.0.0.1 → 10.0.0.2     TCP 2618 [TCP Previous segment not captured] 19551 → 35722 [PSH, ACK] Seq=142486 Ack=1 Win=37888 Len=2552 TSval=1758597247 TSecr=1886575330
  200   2.089439     10.0.0.1 → 10.0.0.2     TCP 3066 [TCP Previous segment not captured] 55246 → 6776 [PSH, ACK] Seq=126038 Ack=1 Win=37888 Len=3000 TSval=1758597263 TSecr=1886575347
  201   2.092353     10.0.0.1 → 10.0.0.2     TCP 3066 [TCP Previous segment not captured] 48193 → 59433 [PSH, ACK] Seq=139038 Ack=1 Win=37888 Len=3000 TSval=1758597265 TSecr=1886575349
  202   2.098493     10.0.0.1 → 10.0.0.2     TCP 1618 [TCP Retransmission] 58169 → 25904 [PSH, ACK] Seq=118486 Ack=1 Win=37888 Len=1552 TSval=1758597271 TSecr=1886575355
  203   2.107811     10.0.0.1 → 10.0.0.2     TCP 9514 53241 → 47452 [ACK] Seq=122038 Ack=1 Win=37888 Len=9448 TSval=1758597281 TSecr=1886575286
  204   2.149383     10.0.0.1 → 10.0.0.2     TCP 9514 54368 → 46356 [ACK] Seq=125038 Ack=1 Win=37888 Len=9448 TSval=1758597323 TSecr=1886575283
  205   2.165236     10.0.0.1 → 10.0.0.2     TCP 6066 [TCP Previous segment not captured] 58169 → 25904 [PSH, ACK] Seq=129038 Ack=1 Win=37888 Len=6000 TSval=1758597325 TSecr=1886575409
  206   2.177388     10.0.0.1 → 10.0.0.2     TCP 2618 [TCP Previous segment not captured] 55943 → 42968 [PSH, ACK] Seq=132486 Ack=1 Win=37888 Len=2552 TSval=1758597331 TSecr=1886575416
  207   2.202613     10.0.0.1 → 10.0.0.2     TCP 1066 [TCP Previous segment not captured] 32720 → 40783 [PSH, ACK] Seq=138038 Ack=1 Win=74 Len=1000 TSval=1758597376 TSecr=1886575460
  208   2.240132     10.0.0.1 → 10.0.0.2     TCP 3066 [TCP Previous segment not captured] 53241 → 47452 [PSH, ACK] Seq=138038 Ack=1 Win=37888 Len=3000 TSval=1758597414 TSecr=1886575498
  209   2.259303     10.0.0.1 → 10.0.0.2     TCP 3066 [TCP Retransmission] 55246 → 6776 [PSH, ACK] Seq=126038 Ack=1 Win=37888 Len=3000 TSval=1758597433 TSecr=1886575517
  210   2.303536     10.0.0.1 → 10.0.0.2     TCP 6618 [TCP Previous segment not captured] 55246 → 6776 [PSH, ACK] Seq=138486 Ack=1 Win=37888 Len=6552 TSval=1758597477 TSecr=1886575561
  211   2.350238     10.0.0.1 → 10.0.0.2     TCP 2618 [TCP Retransmission] 55943 → 42968 [PSH, ACK] Seq=132486 Ack=1 Win=37888 Len=2552 TSval=1758597523 TSecr=1886575607
  212   2.390749     10.0.0.1 → 10.0.0.2     TCP 6066 [TCP Previous segment not captured] 54368 → 46356 [PSH, ACK] Seq=147038 Ack=1 Win=37888 Len=6000 TSval=1758597564 TSecr=1886575648
  213   2.406857     10.0.0.1 → 10.0.0.2     TCP 6066 [TCP Previous segment not captured] 48193 → 59433 [PSH, ACK] Seq=159038 Ack=1 Win=37888 Len=6000 TSval=1758597580 TSecr=1886575664
  214   2.415839     10.0.0.1 → 10.0.0.2     TCP 9514 [TCP Previous segment not captured] 58169 → 25904 [ACK] Seq=144486 Ack=1 Win=37888 Len=9448 TSval=1758597584 TSecr=1886575668
  215   2.436492     10.0.0.1 → 10.0.0.2     TCP 9514 [TCP Previous segment not captured] 55943 → 42968 [ACK] Seq=144486 Ack=1 Win=37888 Len=9448 TSval=1758597610 TSecr=1886575693
  216   2.472514     10.0.0.1 → 10.0.0.2     TCP 7066 [TCP Previous segment not captured] 19551 → 35722 [PSH, ACK] Seq=168038 Ack=1 Win=37888 Len=7000 TSval=1758597646 TSecr=1886575730
  217   2.483359     10.0.0.1 → 10.0.0.2     TCP 3618 [TCP Previous segment not captured] 55246 → 6776 [PSH, ACK] Seq=154486 Ack=1 Win=37888 Len=3552 TSval=1758597648 TSecr=1886575732
  218   2.490610     10.0.0.1 → 10.0.0.2     TCP 5066 [TCP Previous segment not captured] 32720 → 40783 [PSH, ACK] Seq=155038 Ack=1 Win=74 Len=5000 TSval=1758597659 TSecr=1886575742
  219   2.511574     10.0.0.1 → 10.0.0.2     TCP 9066 54368 → 46356 [PSH, ACK] Seq=153038 Ack=1 Win=37888 Len=9000 TSval=1758597685 TSecr=1886575769
  220   2.526541     10.0.0.1 → 10.0.0.2     TCP 9514 [TCP Retransmission] 55943 → 42968 [ACK] Seq=144486 Ack=1 Win=37888 Len=9448 TSval=1758597697 TSecr=1886575776
  221   2.547456     10.0.0.1 → 10.0.0.2     TCP 6066 [TCP Previous segment not captured] 53241 → 47452 [PSH, ACK] Seq=157038 Ack=1 Win=37888 Len=6000 TSval=1758597697 TSecr=1886575781
  222   2.557666     10.0.0.1 → 10.0.0.2     TCP 9514 48193 → 59433 [ACK] Seq=165038 Ack=1 Win=37888 Len=9448 TSval=1758597700 TSecr=1886575664
  223   2.576718     10.0.0.1 → 10.0.0.2     TCP 618 48193 → 59433 [PSH, ACK] Seq=174486 Ack=1 Win=37888 Len=552 TSval=1758597709 TSecr=1886575793
  224   2.577946     10.0.0.1 → 10.0.0.2     TCP 9514 [TCP Previous segment not captured] 58169 → 25904 [ACK] Seq=154038 Ack=1 Win=37888 Len=9448 TSval=1758597711 TSecr=1886575795
  225   2.596934     10.0.0.1 → 10.0.0.2     TCP 9514 [TCP Retransmission] 58169 → 25904 [ACK] Seq=154038 Ack=1 Win=37888 Len=9448 TSval=1758597733 TSecr=1886575817
  226   2.615948     10.0.0.1 → 10.0.0.2     TCP 9514 55246 → 6776 [ACK] Seq=158038 Ack=1 Win=37888 Len=9448 TSval=1758597771 TSecr=1886575802
  227   2.828805     10.0.0.1 → 10.0.0.2     TCP 9514 [TCP Previous segment not captured] 55943 → 42968 [ACK] Seq=156038 Ack=1 Win=37888 Len=9448 TSval=1758597772 TSecr=1886575855
  228   2.829052     10.0.0.1 → 10.0.0.2     TCP 1618 [TCP Previous segment not captured] 19551 → 35722 [PSH, ACK] Seq=184486 Ack=1 Win=37888 Len=1552 TSval=1758597795 TSecr=1886575879
  229   2.829225     10.0.0.1 → 10.0.0.2     TCP 9514 54368 → 46356 [ACK] Seq=162038 Ack=1 Win=37888 Len=9448 TSval=1758597816 TSecr=1886575769
  230   2.829445     10.0.0.1 → 10.0.0.2     TCP 9514 55246 → 6776 [ACK] Seq=167486 Ack=1 Win=37888 Len=9448 TSval=1758597891 TSecr=1886575802
  231   2.829976     10.0.0.1 → 10.0.0.2     TCP 9514 19551 → 35722 [ACK] Seq=186038 Ack=1 Win=37888 Len=9448 TSval=1758597917 TSecr=1886575879
  232   2.834181     10.0.0.1 → 10.0.0.2     TCP 9514 54368 → 46356 [ACK] Seq=171486 Ack=1 Win=37888 Len=9448 TSval=1758597936 TSecr=1886575769
  233   2.834790     10.0.0.1 → 10.0.0.2     TCP 1618 [TCP Previous segment not captured] 32720 → 40783 [PSH, ACK] Seq=169486 Ack=1 Win=74 Len=1552 TSval=1758598002 TSecr=1886575774
  234   2.835156     10.0.0.1 → 10.0.0.2     TCP 5170 54368 → 46356 [PSH, ACK] Seq=180934 Ack=1 Win=37888 Len=5104 TSval=1758598005 TSecr=1886575769
  235   2.839425     10.0.0.1 → 10.0.0.2     TCP 8170 55246 → 6776 [PSH, ACK] Seq=176934 Ack=1 Win=37888 Len=8104 TSval=1758598005 TSecr=1886575802
  236   2.855786     10.0.0.1 → 10.0.0.2     TCP 9514 32720 → 40783 [ACK] Seq=171038 Ack=1 Win=74 Len=9448 TSval=1758598007 TSecr=1886575774
  237   2.874824     10.0.0.1 → 10.0.0.2     TCP 5066 [TCP Retransmission] 32720 → 40783 [PSH, ACK] Seq=155038 Ack=1 Win=74 Len=5000 TSval=1758598011 TSecr=1886575893
  238   2.885180     10.0.0.1 → 10.0.0.2     TCP 9514 [TCP Previous segment not captured] 55943 → 42968 [ACK] Seq=168038 Ack=1 Win=37888 Len=9448 TSval=1758598014 TSecr=1886576097
  239   2.904893     10.0.0.1 → 10.0.0.2     TCP 8618 55943 → 42968 [PSH, ACK] Seq=177486 Ack=1 Win=37888 Len=8552 TSval=1758598014 TSecr=1886576097
  240   2.921545     10.0.0.1 → 10.0.0.2     TCP 6066 [TCP Retransmission] 53241 → 47452 [PSH, ACK] Seq=157038 Ack=1 Win=37888 Len=6000 TSval=1758598024 TSecr=1886576108
  241   2.963374     10.0.0.1 → 10.0.0.2     TCP 9514 54368 → 46356 [ACK] Seq=186038 Ack=1 Win=37888 Len=9448 TSval=1758598136 TSecr=1886576116
  242   2.979038     10.0.0.1 → 10.0.0.2     TCP 1618 [TCP Retransmission] 32720 → 40783 [PSH, ACK] Seq=169486 Ack=1 Win=74 Len=1552 TSval=1758598138 TSecr=1886576222
  243   3.000411     10.0.0.1 → 10.0.0.2     TCP 9514 [TCP Previous segment not captured] 58169 → 25904 [ACK] Seq=164038 Ack=1 Win=37888 Len=9448 TSval=1758598171 TSecr=1886576255
  244   3.014620     10.0.0.1 → 10.0.0.2     TCP 9514 58169 → 25904 [PSH, ACK] Seq=173486 Ack=1 Win=37888 Len=9448 TSval=1758598171 TSecr=1886576255
