    1   0.000000           :: → ff02::16     ICMPv6 90 Multicast Listener Report Message v2
    2  38.805869     10.0.0.2 → 10.0.0.1     TCP 67 35722 → 42763 [PSH, ACK] Seq=1 Ack=1 Win=74 Len=1 TSval=1886573267 TSecr=1758595179
    3  38.808408     10.0.0.2 → 10.0.0.1     TCP 66 59433 → 36467 [ACK] Seq=1 Ack=1 Win=74 Len=0 TSval=1886573270 TSecr=1758595183
    4  38.820130     10.0.0.2 → 10.0.0.1     TCP 74 47452 → 39475 [SYN, ACK] Seq=0 Ack=1 Win=37792 Len=0 MSS=9460 SACK_PERM TSval=1886573281 TSecr=1758595195 WS=512
    5  38.824374     10.0.0.2 → 10.0.0.1     TCP 74 25904 → 51099 [SYN, ACK] Seq=0 Ack=1 Win=37792 Len=0 MSS=9460 SACK_PERM TSval=1886573285 TSecr=1758595198 WS=512
    6  38.824712     10.0.0.2 → 10.0.0.1     TCP 74 40783 → 58271 [SYN, ACK] Seq=0 Ack=1 Win=37792 Len=0 MSS=9460 SACK_PERM TSval=1886573285 TSecr=1758595198 WS=512
    7  38.833997     10.0.0.2 → 10.0.0.1     TCP 66 47452 → 39475 [ACK] Seq=1 Ack=38 Win=37888 Len=0 TSval=1886573293 TSecr=1758595203
    8  38.834364     10.0.0.2 → 10.0.0.1     TCP 67 47452 → 39475 [PSH, ACK] Seq=1 Ack=38 Win=37888 Len=1 TSval=1886573293 TSecr=1758595203
    9  38.837844     10.0.0.2 → 10.0.0.1     TCP 74 46356 → 47085 [SYN, ACK] Seq=0 Ack=1 Win=37792 Len=0 MSS=9460 SACK_PERM TSval=1886573296 TSecr=1758595206 WS=512
   10  38.838368     10.0.0.2 → 10.0.0.1     TCP 66 40783 → 58271 [ACK] Seq=1 Ack=38 Win=37888 Len=0 TSval=1886573298 TSecr=1758595208
   11  38.839727     10.0.0.2 → 10.0.0.1     TCP 66 [TCP Previous segment not captured] 40783 → 58271 [ACK] Seq=2 Ack=38 Win=37888 Len=0 TSval=1886573298 TSecr=1758595208
   12  38.840936     10.0.0.2 → 10.0.0.1     TCP 66 25904 → 51099 [ACK] Seq=1 Ack=38 Win=37888 Len=0 TSval=1886573298 TSecr=1758595208
   13  38.847514     10.0.0.2 → 10.0.0.1     TCP 66 42968 → 49189 [ACK] Seq=1 Ack=1 Win=74 Len=0 TSval=1886573308 TSecr=1758595217
   14  38.847860     10.0.0.2 → 10.0.0.1     TCP 67 42968 → 49189 [PSH, ACK] Seq=1 Ack=1 Win=74 Len=1 TSval=1886573308 TSecr=1758595217
   15  38.848194     10.0.0.2 → 10.0.0.1     TCP 66 46356 → 47085 [ACK] Seq=1 Ack=38 Win=37888 Len=0 TSval=1886573309 TSecr=1758595217
   16  38.857989     10.0.0.2 → 10.0.0.1     TCP 74 35722 → 19551 [SYN, ACK] Seq=0 Ack=1 Win=37792 Len=0 MSS=9460 SACK_PERM TSval=1886573319 TSecr=1758595233 WS=512
   17  38.865746     10.0.0.2 → 10.0.0.1     TCP 67 [TCP Previous segment not captured] 59433 → 36467 [PSH, ACK] Seq=2 Ack=122 Win=74 Len=1 TSval=1886573320 TSecr=1758595234
   18  38.867246     10.0.0.2 → 10.0.0.1     TCP 66 35722 → 19551 [ACK] Seq=1 Ack=38 Win=37888 Len=0 TSval=1886573328 TSecr=1758595235
   19  38.868346     10.0.0.2 → 10.0.0.1     TCP 74 59433 → 48193 [SYN, ACK] Seq=0 Ack=1 Win=37792 Len=0 MSS=9460 SACK_PERM TSval=1886573330 TSecr=1758595243 WS=512
   20  38.914593     10.0.0.2 → 10.0.0.1     TCP 66 40783 → 58271 [ACK] Seq=2 Ack=42 Win=37888 Len=0 TSval=1886573358 TSecr=1758595217
   21  38.922995     10.0.0.2 → 10.0.0.1     TCP 66 42968 → 49189 [ACK] Seq=2 Ack=5 Win=74 Len=0 TSval=1886573358 TSecr=1758595227
   22  38.931449     10.0.0.2 → 10.0.0.1     TCP 66 59433 → 48193 [ACK] Seq=1 Ack=38 Win=37888 Len=0 TSval=1886573393 TSecr=1758595249
   23  38.932751     10.0.0.2 → 10.0.0.1     TCP 68 [TCP Previous segment not captured] 35722 → 42763 [PSH, ACK] Seq=3 Ack=122 Win=74 Len=2 TSval=1886573394 TSecr=1758595277
   24  38.934109     10.0.0.2 → 10.0.0.1     TCP 66 [TCP Dup ACK 22#1] 59433 → 48193 [ACK] Seq=1 Ack=38 Win=37888 Len=0 TSval=1886573395 TSecr=1758595249
   25  38.938583     10.0.0.2 → 10.0.0.1     TCP 67 47452 → 39475 [PSH, ACK] Seq=2 Ack=159 Win=37888 Len=1 TSval=1886573399 TSecr=1758595309
   26  38.939011     10.0.0.2 → 10.0.0.1     TCP 68 59433 → 36467 [PSH, ACK] Seq=3 Ack=122 Win=74 Len=2 TSval=1886573399 TSecr=1758595285
   27  38.947893     10.0.0.2 → 10.0.0.1     TCP 66 6776 → 55655 [ACK] Seq=1 Ack=1 Win=74 Len=0 TSval=1886573409 TSecr=1758595312
   28  38.952005     10.0.0.2 → 10.0.0.1     TCP 67 [TCP Previous segment not captured] 25904 → 51099 [PSH, ACK] Seq=2 Ack=159 Win=37888 Len=1 TSval=1886573413 TSecr=1758595312
   29  38.965414     10.0.0.2 → 10.0.0.1     TCP 67 40783 → 58271 [PSH, ACK] Seq=2 Ack=159 Win=37888 Len=1 TSval=1886573423 TSecr=1758595314
   30  38.976775     10.0.0.2 → 10.0.0.1     TCP 66 42968 → 49189 [ACK] Seq=2 Ack=122 Win=74 Len=0 TSval=1886573437 TSecr=1758595317
   31  39.022113     10.0.0.2 → 10.0.0.1     TCP 74 42968 → 55943 [SYN, ACK] Seq=0 Ack=1 Win=37792 Len=0 MSS=9460 SACK_PERM TSval=1886573483 TSecr=1758595382 WS=512
   32  39.062000     10.0.0.2 → 10.0.0.1     TCP 66 6776 → 55246 [ACK] Seq=1 Ack=1 Win=74 Len=0 TSval=1886573523 TSecr=1758595400
   33  39.077534     10.0.0.2 → 10.0.0.1     TCP 66 59433 → 48193 [ACK] Seq=1 Ack=3038 Win=35840 Len=0 TSval=1886573539 TSecr=1758595409
   34  39.113682     10.0.0.2 → 10.0.0.1     TCP 66 25904 → 58169 [ACK] Seq=1 Ack=1 Win=74 Len=0 TSval=1886573575 TSecr=1758595410
   35  39.126006     10.0.0.2 → 10.0.0.1     TCP 66 46356 → 54368 [ACK] Seq=1 Ack=1 Win=74 Len=0 TSval=1886573587 TSecr=1758595410
   36  39.138170     10.0.0.2 → 10.0.0.1     TCP 66 42968 → 55943 [ACK] Seq=1 Ack=38 Win=37888 Len=0 TSval=1886573599 TSecr=1758595417
   37  39.140627     10.0.0.2 → 10.0.0.1     TCP 68 [TCP Previous segment not captured] 6776 → 55655 [PSH, ACK] Seq=2 Ack=1 Win=74 Len=2 TSval=1886573602 TSecr=1758595421
   38  39.141663     10.0.0.2 → 10.0.0.1     TCP 68 47452 → 39475 [PSH, ACK] Seq=3 Ack=159 Win=37888 Len=2 TSval=1886573603 TSecr=1758595421
   39  39.148807     10.0.0.2 → 10.0.0.1     TCP 68 [TCP Previous segment not captured] 42968 → 49189 [PSH, ACK] Seq=3 Ack=122 Win=74 Len=2 TSval=1886573610 TSecr=1758595425
   40  39.152812     10.0.0.2 → 10.0.0.1     TCP 68 40783 → 58271 [PSH, ACK] Seq=3 Ack=159 Win=37888 Len=2 TSval=1886573614 TSecr=1758595425
   41  39.153910     10.0.0.2 → 10.0.0.1     TCP 68 [TCP Previous segment not captured] 46356 → 47085 [PSH, ACK] Seq=3 Ack=159 Win=37888 Len=2 TSval=1886573615 TSecr=1758595425
   42  39.158042     10.0.0.2 → 10.0.0.1     TCP 66 59433 → 48193 [ACK] Seq=1 Ack=12038 Win=34304 Len=0 TSval=1886573619 TSecr=1758595532
   43  39.180610     10.0.0.2 → 10.0.0.1     TCP 66 42968 → 55943 [ACK] Seq=1 Ack=1038 Win=37376 Len=0 TSval=1886573641 TSecr=1758595536
   44  39.195124     10.0.0.2 → 10.0.0.1     TCP 66 25904 → 58169 [ACK] Seq=1 Ack=3001 Win=70 Len=0 TSval=1886573656 TSecr=1758595570
   45  39.197603     10.0.0.2 → 10.0.0.1     TCP 66 40783 → 32720 [ACK] Seq=1 Ack=1 Win=73 Len=0 TSval=1886573659 TSecr=1758595534
   46  39.201862     10.0.0.2 → 10.0.0.1     TCP 66 46356 → 54368 [ACK] Seq=1 Ack=1001 Win=73 Len=0 TSval=1886573663 TSecr=1758595536
   47  39.210394     10.0.0.2 → 10.0.0.1     TCP 66 59433 → 48193 [ACK] Seq=1 Ack=14038 Win=34304 Len=0 TSval=1886573672 TSecr=1758595560
   48  39.212801     10.0.0.2 → 10.0.0.1     TCP 66 59433 → 48193 [ACK] Seq=1 Ack=16038 Win=34304 Len=0 TSval=1886573673 TSecr=1758595587
   49  39.214667     10.0.0.2 → 10.0.0.1     TCP 66 35722 → 19551 [ACK] Seq=1 Ack=19038 Win=34304 Len=0 TSval=1886573676 TSecr=1758595562
   50  39.220737     10.0.0.2 → 10.0.0.1     TCP 66 47452 → 53241 [ACK] Seq=1 Ack=1 Win=71 Len=0 TSval=1886573681 TSecr=1758595564
   51  39.222924     10.0.0.2 → 10.0.0.1     TCP 66 47452 → 53241 [ACK] Seq=1 Ack=2001 Win=68 Len=0 TSval=1886573684 TSecr=1758595598
   52  39.223640     10.0.0.2 → 10.0.0.1     TCP 66 6776 → 55246 [ACK] Seq=1 Ack=3001 Win=71 Len=0 TSval=1886573685 TSecr=1758595571
   53  39.228578     10.0.0.2 → 10.0.0.1     TCP 66 40783 → 32720 [ACK] Seq=1 Ack=3001 Win=68 Len=0 TSval=1886573690 TSecr=1758595576
   54  39.239735     10.0.0.2 → 10.0.0.1     TCP 66 46356 → 54368 [ACK] Seq=1 Ack=4001 Win=68 Len=0 TSval=1886573701 TSecr=1758595579
   55  39.241337     10.0.0.2 → 10.0.0.1     TCP 66 46356 → 54368 [ACK] Seq=1 Ack=7001 Win=67 Len=0 TSval=1886573703 TSecr=1758595617
   56  39.260271     10.0.0.2 → 10.0.0.1     TCP 66 25904 → 58169 [ACK] Seq=1 Ack=5001 Win=68 Len=0 TSval=1886573722 TSecr=1758595588
   57  39.274218     10.0.0.2 → 10.0.0.1     TCP 66 47452 → 53241 [ACK] Seq=1 Ack=6001 Win=67 Len=0 TSval=1886573736 TSecr=1758595650
   58  39.285513     10.0.0.2 → 10.0.0.1     TCP 66 59433 → 48193 [ACK] Seq=1 Ack=18038 Win=34304 Len=0 TSval=1886573747 TSecr=1758595607
   59  39.289706     10.0.0.2 → 10.0.0.1     TCP 66 6776 → 55246 [ACK] Seq=1 Ack=7001 Win=67 Len=0 TSval=1886573751 TSecr=1758595624
   60  39.306115     10.0.0.2 → 10.0.0.1     TCP 66 46356 → 54368 [ACK] Seq=1 Ack=8001 Win=67 Len=0 TSval=1886573767 TSecr=1758595630
   61  39.310361     10.0.0.2 → 10.0.0.1     TCP 66 25904 → 58169 [ACK] Seq=1 Ack=8001 Win=67 Len=0 TSval=1886573772 TSecr=1758595638
   62  39.322568     10.0.0.2 → 10.0.0.1     TCP 66 40783 → 32720 [ACK] Seq=1 Ack=8001 Win=67 Len=0 TSval=1886573784 TSecr=1758595654
   63  39.336283     10.0.0.2 → 10.0.0.1     TCP 66 59433 → 48193 [ACK] Seq=1 Ack=25038 Win=34304 Len=0 TSval=1886573798 TSecr=1758595712
   64  39.351440     10.0.0.2 → 10.0.0.1     TCP 66 35722 → 19551 [ACK] Seq=1 Ack=27038 Win=34304 Len=0 TSval=1886573813 TSecr=1758595664
   65  39.357082     10.0.0.2 → 10.0.0.1     TCP 66 6776 → 55246 [ACK] Seq=1 Ack=15001 Win=67 Len=0 TSval=1886573818 TSecr=1758595733
   66  39.372221     10.0.0.2 → 10.0.0.1     TCP 66 42968 → 55943 [ACK] Seq=1 Ack=12038 Win=34304 Len=0 TSval=1886573833 TSecr=1758595683
   67  39.377704     10.0.0.2 → 10.0.0.1     TCP 66 46356 → 54368 [ACK] Seq=1 Ack=17001 Win=67 Len=0 TSval=1886573839 TSecr=1758595753
   68  39.403141     10.0.0.2 → 10.0.0.1     TCP 66 25904 → 58169 [ACK] Seq=1 Ack=19001 Win=67 Len=0 TSval=1886573864 TSecr=1758595774
   69  39.405237     10.0.0.2 → 10.0.0.1     TCP 66 46356 → 54368 [ACK] Seq=1 Ack=19001 Win=67 Len=0 TSval=1886573867 TSecr=1758595776
   70  39.408764     10.0.0.2 → 10.0.0.1     TCP 66 40783 → 32720 [ACK] Seq=1 Ack=12001 Win=67 Len=0 TSval=1886573870 TSecr=1758595700
   71  39.410274     10.0.0.2 → 10.0.0.1     TCP 66 40783 → 32720 [ACK] Seq=1 Ack=18001 Win=67 Len=0 TSval=1886573872 TSecr=1758595786
   72  39.430905     10.0.0.2 → 10.0.0.1     TCP 66 35722 → 19551 [ACK] Seq=1 Ack=37038 Win=34304 Len=0 TSval=1886573892 TSecr=1758595806
   73  39.445577     10.0.0.2 → 10.0.0.1     TCP 66 6776 → 55246 [ACK] Seq=1 Ack=16001 Win=67 Len=0 TSval=1886573907 TSecr=1758595744
   74  39.449921     10.0.0.2 → 10.0.0.1     TCP 66 47452 → 53241 [ACK] Seq=1 Ack=14001 Win=67 Len=0 TSval=1886573911 TSecr=1758595748
   75  39.450522     10.0.0.2 → 10.0.0.1     TCP 66 35722 → 19551 [ACK] Seq=1 Ack=39038 Win=34304 Len=0 TSval=1886573912 TSecr=1758595824
   76  39.459260     10.0.0.2 → 10.0.0.1     TCP 66 47452 → 53241 [ACK] Seq=1 Ack=20001 Win=67 Len=0 TSval=1886573920 TSecr=1758595829
   77  39.461731     10.0.0.2 → 10.0.0.1     TCP 66 35722 → 19551 [ACK] Seq=1 Ack=40038 Win=34304 Len=0 TSval=1886573923 TSecr=1758595837
   78  39.466119     10.0.0.2 → 10.0.0.1     TCP 66 47452 → 53241 [ACK] Seq=1 Ack=21001 Win=67 Len=0 TSval=1886573927 TSecr=1758595841
   79  39.479640     10.0.0.2 → 10.0.0.1     TCP 66 35722 → 19551 [ACK] Seq=1 Ack=41038 Win=34304 Len=0 TSval=1886573940 TSecr=1758595851
   80  39.480519     10.0.0.2 → 10.0.0.1     TCP 66 42968 → 55943 [ACK] Seq=1 Ack=24038 Win=34304 Len=0 TSval=1886573941 TSecr=1758595851
   81  39.490386     10.0.0.2 → 10.0.0.1     TCP 66 25904 → 58169 [ACK] Seq=1 Ack=20001 Win=67 Len=0 TSval=1886573952 TSecr=1758595788
   82  39.492090     10.0.0.2 → 10.0.0.1     TCP 66 47452 → 53241 [ACK] Seq=1 Ack=22001 Win=67 Len=0 TSval=1886573953 TSecr=1758595854
   83  39.497257     10.0.0.2 → 10.0.0.1     TCP 66 25904 → 58169 [ACK] Seq=1 Ack=25001 Win=67 Len=0 TSval=1886573958 TSecr=1758595867
   84  39.503563     10.0.0.2 → 10.0.0.1     TCP 66 59433 → 48193 [ACK] Seq=1 Ack=32038 Win=34304 Len=0 TSval=1886573965 TSecr=1758595803
   85  39.519992     10.0.0.2 → 10.0.0.1     TCP 66 40783 → 32720 [ACK] Seq=1 Ack=25001 Win=67 Len=0 TSval=1886573981 TSecr=1758595879
   86  39.530156     10.0.0.2 → 10.0.0.1     TCP 66 59433 → 48193 [ACK] Seq=1 Ack=38038 Win=34304 Len=0 TSval=1886573991 TSecr=1758595881
   87  39.544414     10.0.0.2 → 10.0.0.1     TCP 66 25904 → 58169 [ACK] Seq=1 Ack=28001 Win=67 Len=0 TSval=1886574006 TSecr=1758595895
   88  39.547723     10.0.0.2 → 10.0.0.1     TCP 66 35722 → 19551 [ACK] Seq=1 Ack=42038 Win=34304 Len=0 TSval=1886574009 TSecr=1758595864
   89  39.551881     10.0.0.2 → 10.0.0.1     TCP 66 47452 → 53241 [ACK] Seq=1 Ack=23001 Win=67 Len=0 TSval=1886574013 TSecr=1758595869
   90  39.560453     10.0.0.2 → 10.0.0.1     TCP 66 40783 → 32720 [ACK] Seq=1 Ack=27001 Win=67 Len=0 TSval=1886574022 TSecr=1758595897
   91  39.574928     10.0.0.2 → 10.0.0.1     TCP 66 47452 → 53241 [ACK] Seq=1 Ack=27001 Win=67 Len=0 TSval=1886574036 TSecr=1758595929
   92  39.583122     10.0.0.2 → 10.0.0.1     TCP 66 35722 → 19551 [ACK] Seq=1 Ack=47038 Win=34304 Len=0 TSval=1886574044 TSecr=1758595944
   93  39.591334     10.0.0.2 → 10.0.0.1     TCP 66 47452 → 53241 [ACK] Seq=1 Ack=29001 Win=67 Len=0 TSval=1886574053 TSecr=1758595952
   94  39.603690     10.0.0.2 → 10.0.0.1     TCP 66 42968 → 55943 [ACK] Seq=1 Ack=34038 Win=34304 Len=0 TSval=1886574065 TSecr=1758595976
   95  39.608027     10.0.0.2 → 10.0.0.1     TCP 66 40783 → 32720 [ACK] Seq=1 Ack=33001 Win=67 Len=0 TSval=1886574069 TSecr=1758595983
   96  39.618187     10.0.0.2 → 10.0.0.1     TCP 66 46356 → 54368 [ACK] Seq=1 Ack=31001 Win=67 Len=0 TSval=1886574079 TSecr=1758595940
   97  39.626453     10.0.0.2 → 10.0.0.1     TCP 66 25904 → 58169 [ACK] Seq=1 Ack=32001 Win=67 Len=0 TSval=1886574088 TSecr=1758595954
   98  39.642859     10.0.0.2 → 10.0.0.1     TCP 66 59433 → 48193 [ACK] Seq=1 Ack=44038 Win=34304 Len=0 TSval=1886574104 TSecr=1758595962
   99  39.645045     10.0.0.2 → 10.0.0.1     TCP 66 59433 → 48193 [ACK] Seq=1 Ack=48038 Win=34304 Len=0 TSval=1886574106 TSecr=1758596020
  100  39.647156     10.0.0.2 → 10.0.0.1     TCP 66 6776 → 55246 [ACK] Seq=1 Ack=32001 Win=67 Len=0 TSval=1886574108 TSecr=1758595963
  101  39.651546     10.0.0.2 → 10.0.0.1     TCP 66 35722 → 19551 [ACK] Seq=1 Ack=54038 Win=34304 Len=0 TSval=1886574113 TSecr=1758596024
  102  39.659556     10.0.0.2 → 10.0.0.1     TCP 66 40783 → 32720 [ACK] Seq=1 Ack=34001 Win=67 Len=0 TSval=1886574121 TSecr=1758595988
  103  39.664449     10.0.0.2 → 10.0.0.1     TCP 66 42968 → 55943 [ACK] Seq=1 Ack=35038 Win=34304 Len=0 TSval=1886574125 TSecr=1758595990
  104  39.682344     10.0.0.2 → 10.0.0.1     TCP 66 46356 → 54368 [ACK] Seq=1 Ack=39001 Win=67 Len=0 TSval=1886574144 TSecr=1758596045
  105  39.684208     10.0.0.2 → 10.0.0.1     TCP 66 25904 → 58169 [ACK] Seq=1 Ack=37001 Win=67 Len=0 TSval=1886574145 TSecr=1758596014
  106  39.688485     10.0.0.2 → 10.0.0.1     TCP 66 40783 → 32720 [ACK] Seq=1 Ack=37001 Win=67 Len=0 TSval=1886574150 TSecr=1758596037
  107  39.694714     10.0.0.2 → 10.0.0.1     TCP 66 25904 → 58169 [ACK] Seq=1 Ack=40001 Win=67 Len=0 TSval=1886574156 TSecr=1758596061
  108  39.704998     10.0.0.2 → 10.0.0.1     TCP 66 6776 → 55246 [ACK] Seq=1 Ack=38001 Win=67 Len=0 TSval=1886574166 TSecr=1758596038
  109  39.709217     10.0.0.2 → 10.0.0.1     TCP 66 47452 → 53241 [ACK] Seq=1 Ack=37001 Win=67 Len=0 TSval=1886574171 TSecr=1758596055
  110  39.715347     10.0.0.2 → 10.0.0.1     TCP 66 6776 → 55246 [ACK] Seq=1 Ack=42001 Win=67 Len=0 TSval=1886574177 TSecr=1758596091
  111  39.738572     10.0.0.2 → 10.0.0.1     TCP 66 59433 → 48193 [ACK] Seq=1 Ack=54038 Win=34304 Len=0 TSval=1886574200 TSecr=1758596089
  112  39.775793     10.0.0.2 → 10.0.0.1     TCP 66 46356 → 54368 [ACK] Seq=1 Ack=41001 Win=67 Len=0 TSval=1886574234 TSecr=1758596070
  113  39.881943     10.0.0.2 → 10.0.0.1     TCP 66 40783 → 32720 [ACK] Seq=1 Ack=47001 Win=67 Len=0 TSval=1886574340 TSecr=1758596174
  114  39.884911     10.0.0.2 → 10.0.0.1     TCP 66 42968 → 55943 [ACK] Seq=1 Ack=54038 Win=34304 Len=0 TSval=1886574340 TSecr=1758596250
  115  39.887207     10.0.0.2 → 10.0.0.1     TCP 66 46356 → 54368 [ACK] Seq=1 Ack=54001 Win=67 Len=0 TSval=1886574348 TSecr=1758596255
  116  39.891952     10.0.0.2 → 10.0.0.1     TCP 66 35722 → 19551 [ACK] Seq=1 Ack=66038 Win=34304 Len=0 TSval=1886574353 TSecr=1758596184
  117  39.899018     10.0.0.2 → 10.0.0.1     TCP 66 35722 → 19551 [ACK] Seq=1 Ack=72038 Win=34304 Len=0 TSval=1886574360 TSecr=1758596269
  118  39.922115     10.0.0.2 → 10.0.0.1     TCP 66 6776 → 55246 [ACK] Seq=1 Ack=49001 Win=67 Len=0 TSval=1886574379 TSecr=1758596188
  119  39.926712     10.0.0.2 → 10.0.0.1     TCP 66 25904 → 58169 [ACK] Seq=1 Ack=51001 Win=67 Len=0 TSval=1886574387 TSecr=1758596203
  120  39.929940     10.0.0.2 → 10.0.0.1     TCP 66 25904 → 58169 [ACK] Seq=1 Ack=58001 Win=67 Len=0 TSval=1886574391 TSecr=1758596304
  121  39.937460     10.0.0.2 → 10.0.0.1     TCP 66 59433 → 48193 [ACK] Seq=1 Ack=65038 Win=34304 Len=0 TSval=1886574399 TSecr=1758596245
  122  39.965283     10.0.0.2 → 10.0.0.1     TCP 66 40783 → 32720 [ACK] Seq=1 Ack=54001 Win=67 Len=0 TSval=1886574427 TSecr=1758596260
  123  39.967278     10.0.0.2 → 10.0.0.1     TCP 66 40783 → 32720 [ACK] Seq=1 Ack=60001 Win=67 Len=0 TSval=1886574428 TSecr=1758596342
  124  39.993697     10.0.0.2 → 10.0.0.1     TCP 66 42968 → 55943 [ACK] Seq=1 Ack=55038 Win=34304 Len=0 TSval=1886574455 TSecr=1758596262
  125  39.995956     10.0.0.2 → 10.0.0.1     TCP 66 42968 → 55943 [ACK] Seq=1 Ack=63038 Win=34304 Len=0 TSval=1886574457 TSecr=1758596371
  126  40.004963     10.0.0.2 → 10.0.0.1     TCP 66 25904 → 58169 [ACK] Seq=1 Ack=60001 Win=67 Len=0 TSval=1886574462 TSecr=1758596321
  127  40.006425     10.0.0.2 → 10.0.0.1     TCP 66 47452 → 53241 [ACK] Seq=1 Ack=53001 Win=67 Len=0 TSval=1886574467 TSecr=1758596275
  128  40.012012     10.0.0.2 → 10.0.0.1     TCP 66 46356 → 54368 [ACK] Seq=1 Ack=64001 Win=67 Len=0 TSval=1886574473 TSecr=1758596381
  129  40.016316     10.0.0.2 → 10.0.0.1     TCP 66 59433 → 48193 [ACK] Seq=1 Ack=73038 Win=34304 Len=0 TSval=1886574478 TSecr=1758596340
  130  40.030892     10.0.0.2 → 10.0.0.1     TCP 66 47452 → 53241 [ACK] Seq=1 Ack=61001 Win=67 Len=0 TSval=1886574491 TSecr=1758596384
  131  40.038217     10.0.0.2 → 10.0.0.1     TCP 66 6776 → 55246 [ACK] Seq=1 Ack=57001 Win=67 Len=0 TSval=1886574498 TSecr=1758596300
  132  40.045510     10.0.0.2 → 10.0.0.1     TCP 66 46356 → 54368 [ACK] Seq=1 Ack=65001 Win=67 Len=0 TSval=1886574507 TSecr=1758596390
  133  40.048488     10.0.0.2 → 10.0.0.1     TCP 66 59433 → 48193 [ACK] Seq=1 Ack=76038 Win=34304 Len=0 TSval=1886574509 TSecr=1758596393
  134  40.067264     10.0.0.2 → 10.0.0.1     TCP 66 40783 → 32720 [ACK] Seq=1 Ack=61001 Win=67 Len=0 TSval=1886574528 TSecr=1758596348
  135  40.074918     10.0.0.2 → 10.0.0.1     TCP 66 6776 → 55246 [ACK] Seq=1 Ack=66001 Win=67 Len=0 TSval=1886574536 TSecr=1758596416
  136  40.102479     10.0.0.2 → 10.0.0.1     TCP 66 59433 → 48193 [ACK] Seq=1 Ack=79038 Win=34304 Len=0 TSval=1886574562 TSecr=1758596426
  137  40.112122     10.0.0.2 → 10.0.0.1     TCP 66 25904 → 58169 [ACK] Seq=1 Ack=69001 Win=67 Len=0 TSval=1886574573 TSecr=1758596448
  138  40.118432     10.0.0.2 → 10.0.0.1     TCP 66 40783 → 32720 [ACK] Seq=1 Ack=70001 Win=67 Len=0 TSval=1886574580 TSecr=1758596479
  139  40.122295     10.0.0.2 → 10.0.0.1     TCP 66 46356 → 54368 [ACK] Seq=1 Ack=72001 Win=67 Len=0 TSval=1886574584 TSecr=1758596487
  140  40.124394     10.0.0.2 → 10.0.0.1     TCP 66 25904 → 58169 [ACK] Seq=1 Ack=72001 Win=67 Len=0 TSval=1886574586 TSecr=1758596489
  141  40.130570     10.0.0.2 → 10.0.0.1     TCP 66 25904 → 58169 [ACK] Seq=1 Ack=73001 Win=67 Len=0 TSval=1886574592 TSecr=1758596501
  142  40.137901     10.0.0.2 → 10.0.0.1     TCP 66 42968 → 55943 [ACK] Seq=1 Ack=74038 Win=34304 Len=0 TSval=1886574599 TSecr=1758596513
  143  40.142968     10.0.0.2 → 10.0.0.1     TCP 66 6776 → 55246 [ACK] Seq=1 Ack=69001 Win=67 Len=0 TSval=1886574604 TSecr=1758596452
  144  40.153488     10.0.0.2 → 10.0.0.1     TCP 66 47452 → 53241 [ACK] Seq=1 Ack=68001 Win=67 Len=0 TSval=1886574615 TSecr=1758596473
  145  40.180308     10.0.0.2 → 10.0.0.1     TCP 66 25904 → 58169 [ACK] Seq=1 Ack=74001 Win=67 Len=0 TSval=1886574642 TSecr=1758596508
  146  40.181884     10.0.0.2 → 10.0.0.1     TCP 66 25904 → 58169 [ACK] Seq=1 Ack=77001 Win=67 Len=0 TSval=1886574643 TSecr=1758596557
  147  40.185710     10.0.0.2 → 10.0.0.1     TCP 66 25904 → 58169 [ACK] Seq=1 Ack=78001 Win=67 Len=0 TSval=1886574647 TSecr=1758596561
  148  40.232350     10.0.0.2 → 10.0.0.1     TCP 66 42968 → 55943 [ACK] Seq=1 Ack=76038 Win=34304 Len=0 TSval=1886574694 TSecr=1758596544
  149  40.232699     10.0.0.2 → 10.0.0.1     TCP 66 47452 → 53241 [ACK] Seq=1 Ack=78001 Win=67 Len=0 TSval=1886574694 TSecr=1758596604
  150  40.242586     10.0.0.2 → 10.0.0.1     TCP 66 59433 → 48193 [ACK] Seq=1 Ack=93038 Win=34304 Len=0 TSval=1886574704 TSecr=1758596608
  151  40.244262     10.0.0.2 → 10.0.0.1     TCP 66 35722 → 19551 [ACK] Seq=1 Ack=95038 Win=34304 Len=0 TSval=1886574706 TSecr=1758596579
  152  40.248745     10.0.0.2 → 10.0.0.1     TCP 66 46356 → 54368 [ACK] Seq=1 Ack=73001 Win=67 Len=0 TSval=1886574710 TSecr=1758596499
  153  40.252668     10.0.0.2 → 10.0.0.1     TCP 66 35722 → 19551 [ACK] Seq=1 Ack=98038 Win=34304 Len=0 TSval=1886574714 TSecr=1758596621
  154  40.255304     10.0.0.2 → 10.0.0.1     TCP 66 42968 → 55943 [ACK] Seq=1 Ack=81038 Win=34304 Len=0 TSval=1886574717 TSecr=1758596609
  155  40.307145     10.0.0.2 → 10.0.0.1     TCP 66 6776 → 55246 [ACK] Seq=1 Ack=81001 Win=67 Len=0 TSval=1886574766 TSecr=1758596611
  156  40.315237     10.0.0.2 → 10.0.0.1     TCP 66 40783 → 32720 [ACK] Seq=1 Ack=81001 Win=67 Len=0 TSval=1886574766 TSecr=1758596618
  157  40.317435     10.0.0.2 → 10.0.0.1     TCP 66 25904 → 58169 [ACK] Seq=1 Ack=79001 Win=67 Len=0 TSval=1886574778 TSecr=1758596574
  158  40.340014     10.0.0.2 → 10.0.0.1     TCP 66 46356 → 54368 [ACK] Seq=1 Ack=83001 Win=67 Len=0 TSval=1886574799 TSecr=1758596636
  159  40.348988     10.0.0.2 → 10.0.0.1     TCP 66 25904 → 58169 [ACK] Seq=1 Ack=88001 Win=67 Len=0 TSval=1886574808 TSecr=1758596695
  160  40.364326     10.0.0.2 → 10.0.0.1     TCP 66 42968 → 55943 [ACK] Seq=1 Ack=89038 Win=34304 Len=0 TSval=1886574824 TSecr=1758596722
  161  40.365843     10.0.0.2 → 10.0.0.1     TCP 66 47452 → 53241 [ACK] Seq=1 Ack=85001 Win=67 Len=0 TSval=1886574825 TSecr=1758596696
  162  40.367051     10.0.0.2 → 10.0.0.1     TCP 66 40783 → 32720 [ACK] Seq=1 Ack=87001 Win=67 Len=0 TSval=1886574827 TSecr=1758596702
  163  40.386214     10.0.0.2 → 10.0.0.1     TCP 66 35722 → 19551 [ACK] Seq=1 Ack=106038 Win=34304 Len=0 TSval=1886574847 TSecr=1758596724
  164  40.392610     10.0.0.2 → 10.0.0.1     TCP 66 6776 → 55246 [ACK] Seq=1 Ack=89001 Win=67 Len=0 TSval=1886574854 TSecr=1758596727
  165  40.399774     10.0.0.2 → 10.0.0.1     TCP 66 42968 → 55943 [ACK] Seq=1 Ack=91038 Win=34304 Len=0 TSval=1886574860 TSecr=1758596742
  166  40.404089     10.0.0.2 → 10.0.0.1     TCP 66 40783 → 32720 [ACK] Seq=1 Ack=90001 Win=67 Len=0 TSval=1886574865 TSecr=1758596744
  167  40.413255     10.0.0.2 → 10.0.0.1     TCP 66 59433 → 48193 [ACK] Seq=1 Ack=103038 Win=34304 Len=0 TSval=1886574873 TSecr=1758596745
  168  40.415068     10.0.0.2 → 10.0.0.1     TCP 66 35722 → 19551 [ACK] Seq=1 Ack=109038 Win=34304 Len=0 TSval=1886574876 TSecr=1758596764
  169  40.442502     10.0.0.2 → 10.0.0.1     TCP 66 25904 → 58169 [ACK] Seq=1 Ack=97001 Win=67 Len=0 TSval=1886574903 TSecr=1758596817
  170  40.460394     10.0.0.2 → 10.0.0.1     TCP 66 47452 → 53241 [ACK] Seq=1 Ack=91001 Win=67 Len=0 TSval=1886574922 TSecr=1758596780
  171  40.510740     10.0.0.2 → 10.0.0.1     TCP 66 25904 → 58169 [ACK] Seq=1 Ack=98001 Win=67 Len=0 TSval=1886574971 TSecr=1758596828
  172  40.519144     10.0.0.2 → 10.0.0.1     TCP 66 42968 → 55943 [ACK] Seq=1 Ack=98038 Win=34304 Len=0 TSval=1886574977 TSecr=1758596834
  173  40.521892     10.0.0.2 → 10.0.0.1     TCP 66 42968 → 55943 [ACK] Seq=1 Ack=103038 Win=34304 Len=0 TSval=1886574983 TSecr=1758596896
  174  40.543004     10.0.0.2 → 10.0.0.1     TCP 66 47452 → 53241 [ACK] Seq=1 Ack=101001 Win=67 Len=0 TSval=1886575004 TSecr=1758596908
  175  40.543834     10.0.0.2 → 10.0.0.1     TCP 78 59433 → 48193 [ACK] Seq=1 Ack=106038 Win=34304 Len=0 TSval=1886575005 TSecr=1758596790 SLE=115486 SRE=116038
  176  40.545826     10.0.0.2 → 10.0.0.1     TCP 66 59433 → 48193 [ACK] Seq=1 Ack=116038 Win=34304 Len=0 TSval=1886575007 TSecr=1758596921
  177  40.560394     10.0.0.2 → 10.0.0.1     TCP 66 40783 → 32720 [ACK] Seq=1 Ack=93001 Win=67 Len=0 TSval=1886575022 TSecr=1758596781
  178  40.565413     10.0.0.2 → 10.0.0.1     TCP 66 6776 → 55246 [ACK] Seq=1 Ack=104001 Win=67 Len=0 TSval=1886575027 TSecr=1758596923
  179  40.577625     10.0.0.2 → 10.0.0.1     TCP 78 [TCP Dup ACK 177#1] 40783 → 32720 [ACK] Seq=1 Ack=93001 Win=67 Len=0 TSval=1886575039 TSecr=1758596781 SLE=102449 SRE=105001
  180  40.598367     10.0.0.2 → 10.0.0.1     TCP 66 46356 → 54368 [ACK] Seq=1 Ack=102001 Win=67 Len=0 TSval=1886575060 TSecr=1758596883
  181  40.645086     10.0.0.2 → 10.0.0.1     TCP 66 42968 → 55943 [ACK] Seq=1 Ack=104038 Win=34304 Len=0 TSval=1886575106 TSecr=1758596910
  182  40.649234     10.0.0.2 → 10.0.0.1     TCP 78 59433 → 48193 [ACK] Seq=1 Ack=117038 Win=34304 Len=0 TSval=1886575110 TSecr=1758596927 SLE=106038 SRE=115486
  183  40.687380     10.0.0.2 → 10.0.0.1     TCP 66 35722 → 19551 [ACK] Seq=1 Ack=123038 Win=34304 Len=0 TSval=1886575149 TSecr=1758596951
  184  40.723965     10.0.0.2 → 10.0.0.1     TCP 66 40783 → 32720 [ACK] Seq=1 Ack=116449 Win=65 Len=0 TSval=1886575185 TSecr=1758596962
  185  40.797336     10.0.0.2 → 10.0.0.1     TCP 66 42968 → 55943 [ACK] Seq=1 Ack=112038 Win=34304 Len=0 TSval=1886575258 TSecr=1758597022
  186  40.821700     10.0.0.2 → 10.0.0.1     TCP 66 46356 → 54368 [ACK] Seq=1 Ack=118001 Win=67 Len=0 TSval=1886575283 TSecr=1758597096
  187  40.823314     10.0.0.2 → 10.0.0.1     TCP 66 6776 → 55246 [ACK] Seq=1 Ack=119001 Win=67 Len=0 TSval=1886575285 TSecr=1758597123
  188  40.824230     10.0.0.2 → 10.0.0.1     TCP 66 47452 → 53241 [ACK] Seq=1 Ack=115449 Win=67 Len=0 TSval=1886575286 TSecr=1758597108
  189  40.827037     10.0.0.2 → 10.0.0.1     TCP 66 40783 → 32720 [ACK] Seq=1 Ack=121001 Win=67 Len=0 TSval=1886575288 TSecr=1758597160
  190  40.829228     10.0.0.2 → 10.0.0.1     TCP 66 59433 → 48193 [ACK] Seq=1 Ack=129038 Win=34304 Len=0 TSval=1886575291 TSecr=1758597074
  191  40.835357     10.0.0.2 → 10.0.0.1     TCP 78 [TCP Dup ACK 185#1] 42968 → 55943 [ACK] Seq=1 Ack=112038 Win=34304 Len=0 TSval=1886575297 TSecr=1758597022 SLE=121486 SRE=123038
  192  40.850581     10.0.0.2 → 10.0.0.1     TCP 66 59433 → 48193 [ACK] Seq=1 Ack=137038 Win=34304 Len=0 TSval=1886575312 TSecr=1758597206
  193  40.868311     10.0.0.2 → 10.0.0.1     TCP 78 35722 → 19551 [ACK] Seq=1 Ack=132038 Win=34304 Len=0 TSval=1886575328 TSecr=1758597065 SLE=133038 SRE=142486
  194  40.870080     10.0.0.2 → 10.0.0.1     TCP 66 35722 → 19551 [ACK] Seq=1 Ack=142486 Win=34304 Len=0 TSval=1886575330 TSecr=1758597077
  195  40.876292     10.0.0.2 → 10.0.0.1     TCP 66 25904 → 58169 [ACK] Seq=1 Ack=118449 Win=67 Len=0 TSval=1886575338 TSecr=1758597108
  196  40.887783     10.0.0.2 → 10.0.0.1     TCP 66 59433 → 48193 [ACK] Seq=1 Ack=139038 Win=34304 Len=0 TSval=1886575349 TSecr=1758597228
  197  40.894172     10.0.0.2 → 10.0.0.1     TCP 78 [TCP Dup ACK 195#1] 25904 → 58169 [ACK] Seq=1 Ack=118449 Win=67 Len=0 TSval=1886575355 TSecr=1758597108 SLE=120001 SRE=129001
  198  40.909634     10.0.0.2 → 10.0.0.1     TCP 78 6776 → 55246 [ACK] Seq=1 Ack=126001 Win=67 Len=0 TSval=1886575371 TSecr=1758597215 SLE=107001 SRE=116449
  199  40.954256     10.0.0.2 → 10.0.0.1     TCP 66 42968 → 55943 [ACK] Seq=1 Ack=123038 Win=34304 Len=0 TSval=1886575416 TSecr=1758597150
  200  40.990862     10.0.0.2 → 10.0.0.1     TCP 66 40783 → 32720 [ACK] Seq=1 Ack=134449 Win=61 Len=0 TSval=1886575452 TSecr=1758597349
  201  40.992219     10.0.0.2 → 10.0.0.1     TCP 66 47452 → 53241 [ACK] Seq=1 Ack=119001 Win=67 Len=0 TSval=1886575453 TSecr=1758597158
  202  41.004221     10.0.0.2 → 10.0.0.1     TCP 78 [TCP Dup ACK 201#1] 47452 → 53241 [ACK] Seq=1 Ack=119001 Win=67 Len=0 TSval=1886575465 TSecr=1758597158 SLE=128449 SRE=135001
  203  41.034998     10.0.0.2 → 10.0.0.1     TCP 78 40783 → 32720 [ACK] Seq=1 Ack=137001 Win=67 Len=0 TSval=1886575496 TSecr=1758597368 SLE=121001 SRE=125001
  204  41.051312     10.0.0.2 → 10.0.0.1     TCP 78 42968 → 55943 [ACK] Seq=1 Ack=132486 Win=34304 Len=0 TSval=1886575513 TSecr=1758597331 SLE=112038 SRE=121486
  205  41.055543     10.0.0.2 → 10.0.0.1     TCP 78 [TCP Dup ACK 198#1] 6776 → 55246 [ACK] Seq=1 Ack=126001 Win=67 Len=0 TSval=1886575517 TSecr=1758597215 SLE=129001 SRE=138449
  206  41.083872     10.0.0.2 → 10.0.0.1     TCP 78 [TCP Dup ACK 196#1] 59433 → 48193 [ACK] Seq=1 Ack=139038 Win=34304 Len=0 TSval=1886575545 TSecr=1758597228 SLE=142038 SRE=151486
  207  41.099781     10.0.0.2 → 10.0.0.1     TCP 66 6776 → 55246 [ACK] Seq=1 Ack=138449 Win=65 Len=0 TSval=1886575561 TSecr=1758597263
  208  41.102913     10.0.0.2 → 10.0.0.1     TCP 78 35722 → 19551 [ACK] Seq=1 Ack=154486 Win=34304 Len=0 TSval=1886575564 TSecr=1758597247 SLE=142486 SRE=145038
  209  41.112184     10.0.0.2 → 10.0.0.1     TCP 66 59433 → 48193 [ACK] Seq=1 Ack=151486 Win=33280 Len=0 TSval=1886575573 TSecr=1758597265
  210  41.124423     10.0.0.2 → 10.0.0.1     TCP 78 25904 → 58169 [ACK] Seq=1 Ack=129001 Win=67 Len=0 TSval=1886575586 TSecr=1758597134 SLE=118449 SRE=120001
  211  41.127210     10.0.0.2 → 10.0.0.1     TCP 78 [TCP Dup ACK 210#1] 25904 → 58169 [ACK] Seq=1 Ack=129001 Win=67 Len=0 TSval=1886575588 TSecr=1758597134 SLE=135001 SRE=144449
  212  41.165276     10.0.0.2 → 10.0.0.1     TCP 78 [TCP Dup ACK 209#1] 59433 → 48193 [ACK] Seq=1 Ack=151486 Win=34304 Len=0 TSval=1886575626 TSecr=1758597265 SLE=139038 SRE=142038
  213  41.171431     10.0.0.2 → 10.0.0.1     TCP 66 35722 → 19551 [ACK] Seq=1 Ack=162038 Win=34304 Len=0 TSval=1886575633 TSecr=1758597466
  214  41.202899     10.0.0.2 → 10.0.0.1     TCP 66 59433 → 48193 [ACK] Seq=1 Ack=159038 Win=34304 Len=0 TSval=1886575664 TSecr=1758597489
  215  41.218081     10.0.0.2 → 10.0.0.1     TCP 78 25904 → 58169 [ACK] Seq=1 Ack=144449 Win=67 Len=0 TSval=1886575679 TSecr=1758597325 SLE=129001 SRE=135001
  216  41.230403     10.0.0.2 → 10.0.0.1     TCP 78 [TCP Dup ACK 203#1] 40783 → 32720 [ACK] Seq=1 Ack=137001 Win=67 Len=0 TSval=1886575691 TSecr=1758597368 SLE=138001 SRE=147449
  217  41.232279     10.0.0.2 → 10.0.0.1     TCP 66 42968 → 55943 [ACK] Seq=1 Ack=144486 Win=33280 Len=0 TSval=1886575693 TSecr=1758597331
  218  41.246090     10.0.0.2 → 10.0.0.1     TCP 66 47452 → 53241 [ACK] Seq=1 Ack=138001 Win=67 Len=0 TSval=1886575707 TSecr=1758597414
  219  41.281203     10.0.0.2 → 10.0.0.1     TCP 78 [TCP Dup ACK 215#1] 25904 → 58169 [ACK] Seq=1 Ack=144449 Win=67 Len=0 TSval=1886575742 TSecr=1758597325 SLE=153897 SRE=154001
  220  41.307594     10.0.0.2 → 10.0.0.1     TCP 66 46356 → 54368 [ACK] Seq=1 Ack=153001 Win=67 Len=0 TSval=1886575769 TSecr=1758597564
  221  41.352796     10.0.0.2 → 10.0.0.1     TCP 66 6776 → 55246 [ACK] Seq=1 Ack=154449 Win=67 Len=0 TSval=1886575802 TSecr=1758597598
  222  41.394344     10.0.0.2 → 10.0.0.1     TCP 66 42968 → 55943 [ACK] Seq=1 Ack=156038 Win=34304 Len=0 TSval=1886575855 TSecr=1758597610
  223  41.412531     10.0.0.2 → 10.0.0.1     TCP 78 [TCP Dup ACK 222#1] 42968 → 55943 [ACK] Seq=1 Ack=156038 Win=34304 Len=0 TSval=1886575874 TSecr=1758597610 SLE=165486 SRE=168038
  224  41.636976     10.0.0.2 → 10.0.0.1     TCP 66 42968 → 55943 [ACK] Seq=1 Ack=168038 Win=34304 Len=0 TSval=1886576097 TSecr=1758597797
  225  41.637496     10.0.0.2 → 10.0.0.1     TCP 66 6776 → 55246 [ACK] Seq=1 Ack=158001 Win=67 Len=0 TSval=1886576098 TSecr=1758597648
  226  41.638020     10.0.0.2 → 10.0.0.1     TCP 66 40783 → 32720 [ACK] Seq=1 Ack=168449 Win=61 Len=0 TSval=1886576098 TSecr=1758597659
  227  41.665533     10.0.0.2 → 10.0.0.1     TCP 78 59433 → 48193 [ACK] Seq=1 Ack=165038 Win=34304 Len=0 TSval=1886576127 TSecr=1758597580 SLE=175038 SRE=184486
  228  41.684626     10.0.0.2 → 10.0.0.1     TCP 78 47452 → 53241 [ACK] Seq=1 Ack=154001 Win=67 Len=0 TSval=1886576146 TSecr=1758597623 SLE=160001 SRE=178897
  229  41.690616     10.0.0.2 → 10.0.0.1     TCP 78 [TCP Dup ACK 224#1] 42968 → 55943 [ACK] Seq=1 Ack=168038 Win=34304 Len=0 TSval=1886576152 TSecr=1758597797 SLE=144486 SRE=153934
  230  41.722808     10.0.0.2 → 10.0.0.1     TCP 78 35722 → 19551 [ACK] Seq=1 Ack=184486 Win=34304 Len=0 TSval=1886576184 TSecr=1758597777 SLE=195486 SRE=204934
  231  41.741973     10.0.0.2 → 10.0.0.1     TCP 78 59433 → 48193 [ACK] Seq=1 Ack=174486 Win=25088 Len=0 TSval=1886576203 TSecr=1758598043 SLE=175038 SRE=193934
  232  41.781142     10.0.0.2 → 10.0.0.1     TCP 78 35722 → 19551 [ACK] Seq=1 Ack=186038 Win=34304 Len=0 TSval=1886576242 TSecr=1758598100 SLE=195486 SRE=204934
  233  41.784259     10.0.0.2 → 10.0.0.1     TCP 66 47452 → 53241 [ACK] Seq=1 Ack=188345 Win=67 Len=0 TSval=1886576246 TSecr=1758598106
  234  41.792080     10.0.0.2 → 10.0.0.1     TCP 78 59433 → 48193 [ACK] Seq=1 Ack=193934 Win=34304 Len=0 TSval=1886576252 TSecr=1758598081 SLE=174486 SRE=175038
  235  41.810311     10.0.0.2 → 10.0.0.1     TCP 78 [TCP Dup ACK 224#2] 42968 → 55943 [ACK] Seq=1 Ack=168038 Win=34304 Len=0 TSval=1886576271 TSecr=1758597797 SLE=186038 SRE=195486
  236  41.826776     10.0.0.2 → 10.0.0.1     TCP 66 59433 → 48193 [ACK] Seq=1 Ack=203382 Win=34304 Len=0 TSval=1886576288 TSecr=1758598157
  237  41.833696     10.0.0.2 → 10.0.0.1     TCP 78 25904 → 58169 [ACK] Seq=1 Ack=164001 Win=67 Len=0 TSval=1886576293 TSecr=1758597711 SLE=154001 SRE=163449
  238  41.880758     10.0.0.2 → 10.0.0.1     TCP 66 35722 → 19551 [ACK] Seq=1 Ack=214038 Win=34304 Len=0 TSval=1886576339 TSecr=1758598158
  239  41.899092     10.0.0.2 → 10.0.0.1     TCP 78 [TCP Dup ACK 237#1] 25904 → 58169 [ACK] Seq=1 Ack=164001 Win=67 Len=0 TSval=1886576356 TSecr=1758597711 SLE=182897 SRE=192345
  240  41.913421     10.0.0.2 → 10.0.0.1     TCP 78 [TCP Dup ACK 237#2] 25904 → 58169 [ACK] Seq=1 Ack=164001 Win=67 Len=0 TSval=1886576374 TSecr=1758597711 SLE=182897 SRE=198001
  241  41.916343     10.0.0.2 → 10.0.0.1     TCP 66 6776 → 55246 [ACK] Seq=1 Ack=167449 Win=67 Len=0 TSval=1886576378 TSecr=1758597771
  242  41.937277     10.0.0.2 → 10.0.0.1     TCP 78 25904 → 58169 [ACK] Seq=1 Ack=173449 Win=57 Len=0 TSval=1886576398 TSecr=1758598281 SLE=182897 SRE=198001
  243  41.945852     10.0.0.2 → 10.0.0.1     TCP 78 [TCP Dup ACK 238#1] 35722 → 19551 [ACK] Seq=1 Ack=214038 Win=34304 Len=0 TSval=1886576407 TSecr=1758598158 SLE=184486 SRE=186038
  244  41.955349     10.0.0.2 → 10.0.0.1     TCP 78 [TCP Dup ACK 224#3] 42968 → 55943 [ACK] Seq=1 Ack=168038 Win=34304 Len=0 TSval=1886576417 TSecr=1758597797 SLE=177486 SRE=195486
  245  41.974632     10.0.0.2 → 10.0.0.1     TCP 66 25904 → 58169 [ACK] Seq=1 Ack=198001 Win=57 Len=0 TSval=1886576435 TSecr=1758598291
  246  41.991578     10.0.0.2 → 10.0.0.1     TCP 78 6776 → 55246 [ACK] Seq=1 Ack=176897 Win=67 Len=0 TSval=1886576453 TSecr=1758597891 SLE=185001 SRE=194449
  247  42.010746     10.0.0.2 → 10.0.0.1     TCP 66 42968 → 55943 [ACK] Seq=1 Ack=195486 Win=20992 Len=0 TSval=1886576472 TSecr=1758598333
  248  42.030055     10.0.0.2 → 10.0.0.1     TCP 78 [TCP Dup ACK 246#1] 6776 → 55246 [ACK] Seq=1 Ack=176897 Win=67 Len=0 TSval=1886576491 TSecr=1758597891 SLE=185001 SRE=203897
  249  42.053691     10.0.0.2 → 10.0.0.1     TCP 78 47452 → 53241 [ACK] Seq=1 Ack=196001 Win=104 Len=0 TSval=1886576515 TSecr=1758598185 SLE=205001 SRE=214449
  250  42.106156     10.0.0.2 → 10.0.0.1     TCP 78 40783 → 32720 [ACK] Seq=1 Ack=170001 Win=67 Len=0 TSval=1886576566 TSecr=1758598002 SLE=179449 SRE=188897
  251  42.134281     10.0.0.2 → 10.0.0.1     TCP 78 46356 → 54368 [ACK] Seq=1 Ack=195449 Win=57 Len=0 TSval=1886576595 TSecr=1758598503 SLE=204897 SRE=214345
  252  42.152202     10.0.0.2 → 10.0.0.1     TCP 78 [TCP Dup ACK 238#2] 35722 → 19551 [ACK] Seq=1 Ack=214038 Win=34304 Len=0 TSval=1886576613 TSecr=1758598158 SLE=230486 SRE=239934
  253  42.164361     10.0.0.2 → 10.0.0.1     TCP 66 40783 → 32720 [ACK] Seq=1 Ack=188897 Win=57 Len=0 TSval=1886576626 TSecr=1758598007
  254  42.206317     10.0.0.2 → 10.0.0.1     TCP 66 40783 → 32720 [ACK] Seq=1 Ack=198345 Win=67 Len=0 TSval=1886576668 TSecr=1758598580
  255  42.222770     10.0.0.2 → 10.0.0.1     TCP 66 40783 → 32720 [ACK] Seq=1 Ack=207793 Win=67 Len=0 TSval=1886576684 TSecr=1758598580
  256  42.223383     10.0.0.2 → 10.0.0.1     TCP 86 [TCP Dup ACK 247#1] 42968 → 55943 [ACK] Seq=1 Ack=195486 Win=34304 Len=0 TSval=1886576684 TSecr=1758598333 SLE=168038 SRE=177486 SLE=214382 SRE=216038
  257  42.241182     10.0.0.2 → 10.0.0.1     TCP 78 59433 → 48193 [ACK] Seq=1 Ack=209038 Win=53248 Len=0 TSval=1886576702 TSecr=1758598157 SLE=232934 SRE=242038
  258  42.261240     10.0.0.2 → 10.0.0.1     TCP 86 [TCP Dup ACK 247#2] 42968 → 55943 [ACK] Seq=1 Ack=195486 Win=34304 Len=0 TSval=1886576722 TSecr=1758598333 SLE=177486 SRE=186038 SLE=214382 SRE=216038
  259  42.319892     10.0.0.2 → 10.0.0.1     TCP 86 [TCP Dup ACK 251#1] 46356 → 54368 [ACK] Seq=1 Ack=195449 Win=67 Len=0 TSval=1886576781 TSecr=1758598503 SLE=186001 SRE=195449 SLE=204897 SRE=214345
  260  42.325258     10.0.0.2 → 10.0.0.1     TCP 78 [TCP Dup ACK 245#1] 25904 → 58169 [ACK] Seq=1 Ack=198001 Win=67 Len=0 TSval=1886576787 TSecr=1758598291 SLE=212001 SRE=221449
  261  42.390494     10.0.0.2 → 10.0.0.1     TCP 78 40783 → 32720 [ACK] Seq=1 Ack=217241 Win=53 Len=0 TSval=1886576852 TSecr=1758598746 SLE=223201 SRE=236137
  262  42.402673     10.0.0.2 → 10.0.0.1     TCP 86 [TCP Dup ACK 245#2] 25904 → 58169 [ACK] Seq=1 Ack=198001 Win=67 Len=0 TSval=1886576863 TSecr=1758598291 SLE=173449 SRE=182897 SLE=212001 SRE=221449
  263  42.442407     10.0.0.2 → 10.0.0.1     TCP 78 [TCP Dup ACK 247#3] 42968 → 55943 [ACK] Seq=1 Ack=195486 Win=34304 Len=0 TSval=1886576904 TSecr=1758598333 SLE=204934 SRE=216038
  264  42.478609     10.0.0.2 → 10.0.0.1     TCP 78 59433 → 48193 [ACK] Seq=1 Ack=214038 Win=72192 Len=0 TSval=1886576940 TSecr=1758598231 SLE=232934 SRE=242038
  265  42.532823     10.0.0.2 → 10.0.0.1     TCP 78 42968 → 55943 [ACK] Seq=1 Ack=216038 Win=34304 Len=0 TSval=1886576994 TSecr=1758598873 SLE=225486 SRE=244382
  266  42.554723     10.0.0.2 → 10.0.0.1     TCP 86 [TCP Dup ACK 264#1] 59433 → 48193 [ACK] Seq=1 Ack=214038 Win=72192 Len=0 TSval=1886577016 TSecr=1758598910 SLE=209038 SRE=214038 SLE=232934 SRE=242038
  267  42.615303     10.0.0.2 → 10.0.0.1     TCP 66 46356 → 54368 [ACK] Seq=1 Ack=239201 Win=67 Len=0 TSval=1886577077 TSecr=1758598954
  268  42.734830     10.0.0.2 → 10.0.0.1     TCP 86 46356 → 54368 [ACK] Seq=1 Ack=248649 Win=141 Len=0 TSval=1886577196 TSecr=1758598954 SLE=195449 SRE=204897 SLE=249489 SRE=258937
  269  42.758417     10.0.0.2 → 10.0.0.1     TCP 78 59433 → 48193 [ACK] Seq=1 Ack=223486 Win=91136 Len=0 TSval=1886577219 TSecr=1758599082 SLE=232934 SRE=242038
  270  42.784661     10.0.0.2 → 10.0.0.1     TCP 66 6776 → 55246 [ACK] Seq=1 Ack=223001 Win=67 Len=0 TSval=1886577242 TSecr=1758599094
  271  42.831763     10.0.0.2 → 10.0.0.1     TCP 66 25904 → 58169 [ACK] Seq=1 Ack=240345 Win=57 Len=0 TSval=1886577293 TSecr=1758599137
  272  42.844258     10.0.0.2 → 10.0.0.1     TCP 86 [TCP Dup ACK 265#1] 42968 → 55943 [ACK] Seq=1 Ack=216038 Win=34304 Len=0 TSval=1886577305 TSecr=1758598873 SLE=204934 SRE=214382 SLE=225486 SRE=245222
  273  42.870186     10.0.0.2 → 10.0.0.1     TCP 66 46356 → 54368 [ACK] Seq=1 Ack=271001 Win=252 Len=0 TSval=1886577331 TSecr=1758599139
  274  42.877593     10.0.0.2 → 10.0.0.1     TCP 78 35722 → 19551 [ACK] Seq=1 Ack=239934 Win=34304 Len=0 TSval=1886577337 TSecr=1758598384 SLE=244038 SRE=253486
  275  42.882445     10.0.0.2 → 10.0.0.1     TCP 86 [TCP Dup ACK 265#2] 42968 → 55943 [ACK] Seq=1 Ack=216038 Win=34304 Len=0 TSval=1886577343 TSecr=1758598873 SLE=195486 SRE=204934 SLE=225486 SRE=245222
