    1   0.000000     10.0.0.2 → 10.0.0.1     TCP 67 35722 → 42763 [PSH, ACK] Seq=1 Ack=1 Win=74 Len=1 TSval=1886573267 TSecr=1758595179
    2   0.002543     10.0.0.2 → 10.0.0.1     TCP 66 59433 → 36467 [ACK] Seq=1 Ack=1 Win=74 Len=0 TSval=1886573270 TSecr=1758595183
    3   0.014265     10.0.0.2 → 10.0.0.1     TCP 74 47452 → 39475 [SYN, ACK] Seq=0 Ack=1 Win=37792 Len=0 MSS=9460 SACK_PERM TSval=1886573281 TSecr=1758595195 WS=512
    4   0.018509     10.0.0.2 → 10.0.0.1     TCP 74 25904 → 51099 [SYN, ACK] Seq=0 Ack=1 Win=37792 Len=0 MSS=9460 SACK_PERM TSval=1886573285 TSecr=1758595198 WS=512
    5   0.018847     10.0.0.2 → 10.0.0.1     TCP 74 40783 → 58271 [SYN, ACK] Seq=0 Ack=1 Win=37792 Len=0 MSS=9460 SACK_PERM TSval=1886573285 TSecr=1758595198 WS=512
    6   0.028131     10.0.0.2 → 10.0.0.1     TCP 66 47452 → 39475 [ACK] Seq=1 Ack=38 Win=37888 Len=0 TSval=1886573293 TSecr=1758595203
    7   0.028500     10.0.0.2 → 10.0.0.1     TCP 67 47452 → 39475 [PSH, ACK] Seq=1 Ack=38 Win=37888 Len=1 TSval=1886573293 TSecr=1758595203
    8   0.031979     10.0.0.2 → 10.0.0.1     TCP 74 46356 → 47085 [SYN, ACK] Seq=0 Ack=1 Win=37792 Len=0 MSS=9460 SACK_PERM TSval=1886573296 TSecr=1758595206 WS=512
    9   0.032504     10.0.0.2 → 10.0.0.1     TCP 66 40783 → 58271 [ACK] Seq=1 Ack=38 Win=37888 Len=0 TSval=1886573298 TSecr=1758595208
   10   0.033863     10.0.0.2 → 10.0.0.1     TCP 66 [TCP Previous segment not captured] 40783 → 58271 [ACK] Seq=2 Ack=38 Win=37888 Len=0 TSval=1886573298 TSecr=1758595208
   11   0.035071     10.0.0.2 → 10.0.0.1     TCP 66 25904 → 51099 [ACK] Seq=1 Ack=38 Win=37888 Len=0 TSval=1886573298 TSecr=1758595208
   12   0.041648     10.0.0.2 → 10.0.0.1     TCP 66 42968 → 49189 [ACK] Seq=1 Ack=1 Win=74 Len=0 TSval=1886573308 TSecr=1758595217
   13   0.041996     10.0.0.2 → 10.0.0.1     TCP 67 42968 → 49189 [PSH, ACK] Seq=1 Ack=1 Win=74 Len=1 TSval=1886573308 TSecr=1758595217
   14   0.042330     10.0.0.2 → 10.0.0.1     TCP 66 46356 → 47085 [ACK] Seq=1 Ack=38 Win=37888 Len=0 TSval=1886573309 TSecr=1758595217
   15   0.052124     10.0.0.2 → 10.0.0.1     TCP 74 35722 → 19551 [SYN, ACK] Seq=0 Ack=1 Win=37792 Len=0 MSS=9460 SACK_PERM TSval=1886573319 TSecr=1758595233 WS=512
   16   0.059881     10.0.0.2 → 10.0.0.1     TCP 67 [TCP Previous segment not captured] 59433 → 36467 [PSH, ACK] Seq=2 Ack=122 Win=74 Len=1 TSval=1886573320 TSecr=1758595234
   17   0.061382     10.0.0.2 → 10.0.0.1     TCP 66 35722 → 19551 [ACK] Seq=1 Ack=38 Win=37888 Len=0 TSval=1886573328 TSecr=1758595235
   18   0.062481     10.0.0.2 → 10.0.0.1     TCP 74 59433 → 48193 [SYN, ACK] Seq=0 Ack=1 Win=37792 Len=0 MSS=9460 SACK_PERM TSval=1886573330 TSecr=1758595243 WS=512
   19   0.108688     10.0.0.2 → 10.0.0.1     TCP 66 40783 → 58271 [ACK] Seq=2 Ack=42 Win=37888 Len=0 TSval=1886573358 TSecr=1758595217
   20   0.117127     10.0.0.2 → 10.0.0.1     TCP 66 42968 → 49189 [ACK] Seq=2 Ack=5 Win=74 Len=0 TSval=1886573358 TSecr=1758595227
   21   0.125581     10.0.0.2 → 10.0.0.1     TCP 66 59433 → 48193 [ACK] Seq=1 Ack=38 Win=37888 Len=0 TSval=1886573393 TSecr=1758595249
   22   0.126856     10.0.0.2 → 10.0.0.1     TCP 68 [TCP Previous segment not captured] 35722 → 42763 [PSH, ACK] Seq=3 Ack=122 Win=74 Len=2 TSval=1886573394 TSecr=1758595277
   23   0.128242     10.0.0.2 → 10.0.0.1     TCP 66 [TCP Dup ACK 21#1] 59433 → 48193 [ACK] Seq=1 Ack=38 Win=37888 Len=0 TSval=1886573395 TSecr=1758595249
   24   0.132717     10.0.0.2 → 10.0.0.1     TCP 67 47452 → 39475 [PSH, ACK] Seq=2 Ack=159 Win=37888 Len=1 TSval=1886573399 TSecr=1758595309
   25   0.133145     10.0.0.2 → 10.0.0.1     TCP 68 59433 → 36467 [PSH, ACK] Seq=3 Ack=122 Win=74 Len=2 TSval=1886573399 TSecr=1758595285
   26   0.142024     10.0.0.2 → 10.0.0.1     TCP 66 6776 → 55655 [ACK] Seq=1 Ack=1 Win=74 Len=0 TSval=1886573409 TSecr=1758595312
   27   0.146139     10.0.0.2 → 10.0.0.1     TCP 67 [TCP Previous segment not captured] 25904 → 51099 [PSH, ACK] Seq=2 Ack=159 Win=37888 Len=1 TSval=1886573413 TSecr=1758595312
   28   0.159544     10.0.0.2 → 10.0.0.1     TCP 67 40783 → 58271 [PSH, ACK] Seq=2 Ack=159 Win=37888 Len=1 TSval=1886573423 TSecr=1758595314
   29   0.170904     10.0.0.2 → 10.0.0.1     TCP 66 42968 → 49189 [ACK] Seq=2 Ack=122 Win=74 Len=0 TSval=1886573437 TSecr=1758595317
   30   0.216247     10.0.0.2 → 10.0.0.1     TCP 74 42968 → 55943 [SYN, ACK] Seq=0 Ack=1 Win=37792 Len=0 MSS=9460 SACK_PERM TSval=1886573483 TSecr=1758595382 WS=512
   31   0.256133     10.0.0.2 → 10.0.0.1     TCP 66 6776 → 55246 [ACK] Seq=1 Ack=1 Win=74 Len=0 TSval=1886573523 TSecr=1758595400
   32   0.271667     10.0.0.2 → 10.0.0.1     TCP 66 59433 → 48193 [ACK] Seq=1 Ack=3038 Win=35840 Len=0 TSval=1886573539 TSecr=1758595409
   33   0.307812     10.0.0.2 → 10.0.0.1     TCP 66 25904 → 58169 [ACK] Seq=1 Ack=1 Win=74 Len=0 TSval=1886573575 TSecr=1758595410
   34   0.320137     10.0.0.2 → 10.0.0.1     TCP 66 46356 → 54368 [ACK] Seq=1 Ack=1 Win=74 Len=0 TSval=1886573587 TSecr=1758595410
   35   0.332301     10.0.0.2 → 10.0.0.1     TCP 66 42968 → 55943 [ACK] Seq=1 Ack=38 Win=37888 Len=0 TSval=1886573599 TSecr=1758595417
   36   0.334762     10.0.0.2 → 10.0.0.1     TCP 68 [TCP Previous segment not captured] 6776 → 55655 [PSH, ACK] Seq=2 Ack=1 Win=74 Len=2 TSval=1886573602 TSecr=1758595421
   37   0.335798     10.0.0.2 → 10.0.0.1     TCP 68 47452 → 39475 [PSH, ACK] Seq=3 Ack=159 Win=37888 Len=2 TSval=1886573603 TSecr=1758595421
   38   0.342942     10.0.0.2 → 10.0.0.1     TCP 68 [TCP Previous segment not captured] 42968 → 49189 [PSH, ACK] Seq=3 Ack=122 Win=74 Len=2 TSval=1886573610 TSecr=1758595425
   39   0.346946     10.0.0.2 → 10.0.0.1     TCP 68 40783 → 58271 [PSH, ACK] Seq=3 Ack=159 Win=37888 Len=2 TSval=1886573614 TSecr=1758595425
   40   0.348045     10.0.0.2 → 10.0.0.1     TCP 68 [TCP Previous segment not captured] 46356 → 47085 [PSH, ACK] Seq=3 Ack=159 Win=37888 Len=2 TSval=1886573615 TSecr=1758595425
   41   0.352177     10.0.0.2 → 10.0.0.1     TCP 66 59433 → 48193 [ACK] Seq=1 Ack=12038 Win=34304 Len=0 TSval=1886573619 TSecr=1758595532
   42   0.374744     10.0.0.2 → 10.0.0.1     TCP 66 42968 → 55943 [ACK] Seq=1 Ack=1038 Win=37376 Len=0 TSval=1886573641 TSecr=1758595536
   43   0.389258     10.0.0.2 → 10.0.0.1     TCP 66 25904 → 58169 [ACK] Seq=1 Ack=3001 Win=70 Len=0 TSval=1886573656 TSecr=1758595570
   44   0.391738     10.0.0.2 → 10.0.0.1     TCP 66 40783 → 32720 [ACK] Seq=1 Ack=1 Win=73 Len=0 TSval=1886573659 TSecr=1758595534
   45   0.395997     10.0.0.2 → 10.0.0.1     TCP 66 46356 → 54368 [ACK] Seq=1 Ack=1001 Win=73 Len=0 TSval=1886573663 TSecr=1758595536
   46   0.404530     10.0.0.2 → 10.0.0.1     TCP 66 59433 → 48193 [ACK] Seq=1 Ack=14038 Win=34304 Len=0 TSval=1886573672 TSecr=1758595560
   47   0.406935     10.0.0.2 → 10.0.0.1     TCP 66 59433 → 48193 [ACK] Seq=1 Ack=16038 Win=34304 Len=0 TSval=1886573673 TSecr=1758595587
   48   0.408803     10.0.0.2 → 10.0.0.1     TCP 66 35722 → 19551 [ACK] Seq=1 Ack=19038 Win=34304 Len=0 TSval=1886573676 TSecr=1758595562
   49   0.414869     10.0.0.2 → 10.0.0.1     TCP 66 47452 → 53241 [ACK] Seq=1 Ack=1 Win=71 Len=0 TSval=1886573681 TSecr=1758595564
   50   0.417055     10.0.0.2 → 10.0.0.1     TCP 66 47452 → 53241 [ACK] Seq=1 Ack=2001 Win=68 Len=0 TSval=1886573684 TSecr=1758595598
   51   0.417775     10.0.0.2 → 10.0.0.1     TCP 66 6776 → 55246 [ACK] Seq=1 Ack=3001 Win=71 Len=0 TSval=1886573685 TSecr=1758595571
   52   0.422710     10.0.0.2 → 10.0.0.1     TCP 66 40783 → 32720 [ACK] Seq=1 Ack=3001 Win=68 Len=0 TSval=1886573690 TSecr=1758595576
   53   0.433870     10.0.0.2 → 10.0.0.1     TCP 66 46356 → 54368 [ACK] Seq=1 Ack=4001 Win=68 Len=0 TSval=1886573701 TSecr=1758595579
   54   0.435472     10.0.0.2 → 10.0.0.1     TCP 66 46356 → 54368 [ACK] Seq=1 Ack=7001 Win=67 Len=0 TSval=1886573703 TSecr=1758595617
   55   0.454405     10.0.0.2 → 10.0.0.1     TCP 66 25904 → 58169 [ACK] Seq=1 Ack=5001 Win=68 Len=0 TSval=1886573722 TSecr=1758595588
   56   0.468354     10.0.0.2 → 10.0.0.1     TCP 66 47452 → 53241 [ACK] Seq=1 Ack=6001 Win=67 Len=0 TSval=1886573736 TSecr=1758595650
   57   0.479647     10.0.0.2 → 10.0.0.1     TCP 66 59433 → 48193 [ACK] Seq=1 Ack=18038 Win=34304 Len=0 TSval=1886573747 TSecr=1758595607
   58   0.483841     10.0.0.2 → 10.0.0.1     TCP 66 6776 → 55246 [ACK] Seq=1 Ack=7001 Win=67 Len=0 TSval=1886573751 TSecr=1758595624
   59   0.500248     10.0.0.2 → 10.0.0.1     TCP 66 46356 → 54368 [ACK] Seq=1 Ack=8001 Win=67 Len=0 TSval=1886573767 TSecr=1758595630
   60   0.504496     10.0.0.2 → 10.0.0.1     TCP 66 25904 → 58169 [ACK] Seq=1 Ack=8001 Win=67 Len=0 TSval=1886573772 TSecr=1758595638
   61   0.516703     10.0.0.2 → 10.0.0.1     TCP 66 40783 → 32720 [ACK] Seq=1 Ack=8001 Win=67 Len=0 TSval=1886573784 TSecr=1758595654
   62   0.530418     10.0.0.2 → 10.0.0.1     TCP 66 59433 → 48193 [ACK] Seq=1 Ack=25038 Win=34304 Len=0 TSval=1886573798 TSecr=1758595712
   63   0.545569     10.0.0.2 → 10.0.0.1     TCP 66 35722 → 19551 [ACK] Seq=1 Ack=27038 Win=34304 Len=0 TSval=1886573813 TSecr=1758595664
   64   0.551217     10.0.0.2 → 10.0.0.1     TCP 66 6776 → 55246 [ACK] Seq=1 Ack=15001 Win=67 Len=0 TSval=1886573818 TSecr=1758595733
   65   0.566351     10.0.0.2 → 10.0.0.1     TCP 66 42968 → 55943 [ACK] Seq=1 Ack=12038 Win=34304 Len=0 TSval=1886573833 TSecr=1758595683
   66   0.571839     10.0.0.2 → 10.0.0.1     TCP 66 46356 → 54368 [ACK] Seq=1 Ack=17001 Win=67 Len=0 TSval=1886573839 TSecr=1758595753
   67   0.597275     10.0.0.2 → 10.0.0.1     TCP 66 25904 → 58169 [ACK] Seq=1 Ack=19001 Win=67 Len=0 TSval=1886573864 TSecr=1758595774
   68   0.599372     10.0.0.2 → 10.0.0.1     TCP 66 46356 → 54368 [ACK] Seq=1 Ack=19001 Win=67 Len=0 TSval=1886573867 TSecr=1758595776
   69   0.602899     10.0.0.2 → 10.0.0.1     TCP 66 40783 → 32720 [ACK] Seq=1 Ack=12001 Win=67 Len=0 TSval=1886573870 TSecr=1758595700
   70   0.604410     10.0.0.2 → 10.0.0.1     TCP 66 40783 → 32720 [ACK] Seq=1 Ack=18001 Win=67 Len=0 TSval=1886573872 TSecr=1758595786
   71   0.625039     10.0.0.2 → 10.0.0.1     TCP 66 35722 → 19551 [ACK] Seq=1 Ack=37038 Win=34304 Len=0 TSval=1886573892 TSecr=1758595806
   72   0.639709     10.0.0.2 → 10.0.0.1     TCP 66 6776 → 55246 [ACK] Seq=1 Ack=16001 Win=67 Len=0 TSval=1886573907 TSecr=1758595744
   73   0.644056     10.0.0.2 → 10.0.0.1     TCP 66 47452 → 53241 [ACK] Seq=1 Ack=14001 Win=67 Len=0 TSval=1886573911 TSecr=1758595748
   74   0.644658     10.0.0.2 → 10.0.0.1     TCP 66 35722 → 19551 [ACK] Seq=1 Ack=39038 Win=34304 Len=0 TSval=1886573912 TSecr=1758595824
   75   0.653394     10.0.0.2 → 10.0.0.1     TCP 66 47452 → 53241 [ACK] Seq=1 Ack=20001 Win=67 Len=0 TSval=1886573920 TSecr=1758595829
   76   0.655865     10.0.0.2 → 10.0.0.1     TCP 66 35722 → 19551 [ACK] Seq=1 Ack=40038 Win=34304 Len=0 TSval=1886573923 TSecr=1758595837
   77   0.660253     10.0.0.2 → 10.0.0.1     TCP 66 47452 → 53241 [ACK] Seq=1 Ack=21001 Win=67 Len=0 TSval=1886573927 TSecr=1758595841
   78   0.673772     10.0.0.2 → 10.0.0.1     TCP 66 35722 → 19551 [ACK] Seq=1 Ack=41038 Win=34304 Len=0 TSval=1886573940 TSecr=1758595851
   79   0.674653     10.0.0.2 → 10.0.0.1     TCP 66 42968 → 55943 [ACK] Seq=1 Ack=24038 Win=34304 Len=0 TSval=1886573941 TSecr=1758595851
   80   0.684517     10.0.0.2 → 10.0.0.1     TCP 66 25904 → 58169 [ACK] Seq=1 Ack=20001 Win=67 Len=0 TSval=1886573952 TSecr=1758595788
   81   0.686224     10.0.0.2 → 10.0.0.1     TCP 66 47452 → 53241 [ACK] Seq=1 Ack=22001 Win=67 Len=0 TSval=1886573953 TSecr=1758595854
   82   0.691389     10.0.0.2 → 10.0.0.1     TCP 66 25904 → 58169 [ACK] Seq=1 Ack=25001 Win=67 Len=0 TSval=1886573958 TSecr=1758595867
   83   0.697697     10.0.0.2 → 10.0.0.1     TCP 66 59433 → 48193 [ACK] Seq=1 Ack=32038 Win=34304 Len=0 TSval=1886573965 TSecr=1758595803
   84   0.714126     10.0.0.2 → 10.0.0.1     TCP 66 40783 → 32720 [ACK] Seq=1 Ack=25001 Win=67 Len=0 TSval=1886573981 TSecr=1758595879
   85   0.724290     10.0.0.2 → 10.0.0.1     TCP 66 59433 → 48193 [ACK] Seq=1 Ack=38038 Win=34304 Len=0 TSval=1886573991 TSecr=1758595881
   86   0.738549     10.0.0.2 → 10.0.0.1     TCP 66 25904 → 58169 [ACK] Seq=1 Ack=28001 Win=67 Len=0 TSval=1886574006 TSecr=1758595895
   87   0.741859     10.0.0.2 → 10.0.0.1     TCP 66 35722 → 19551 [ACK] Seq=1 Ack=42038 Win=34304 Len=0 TSval=1886574009 TSecr=1758595864
   88   0.746017     10.0.0.2 → 10.0.0.1     TCP 66 47452 → 53241 [ACK] Seq=1 Ack=23001 Win=67 Len=0 TSval=1886574013 TSecr=1758595869
   89   0.754587     10.0.0.2 → 10.0.0.1     TCP 66 40783 → 32720 [ACK] Seq=1 Ack=27001 Win=67 Len=0 TSval=1886574022 TSecr=1758595897
   90   0.769063     10.0.0.2 → 10.0.0.1     TCP 66 47452 → 53241 [ACK] Seq=1 Ack=27001 Win=67 Len=0 TSval=1886574036 TSecr=1758595929
   91   0.777256     10.0.0.2 → 10.0.0.1     TCP 66 35722 → 19551 [ACK] Seq=1 Ack=47038 Win=34304 Len=0 TSval=1886574044 TSecr=1758595944
   92   0.785467     10.0.0.2 → 10.0.0.1     TCP 66 47452 → 53241 [ACK] Seq=1 Ack=29001 Win=67 Len=0 TSval=1886574053 TSecr=1758595952
   93   0.797825     10.0.0.2 → 10.0.0.1     TCP 66 42968 → 55943 [ACK] Seq=1 Ack=34038 Win=34304 Len=0 TSval=1886574065 TSecr=1758595976
   94   0.802158     10.0.0.2 → 10.0.0.1     TCP 66 40783 → 32720 [ACK] Seq=1 Ack=33001 Win=67 Len=0 TSval=1886574069 TSecr=1758595983
   95   0.812321     10.0.0.2 → 10.0.0.1     TCP 66 46356 → 54368 [ACK] Seq=1 Ack=31001 Win=67 Len=0 TSval=1886574079 TSecr=1758595940
   96   0.820588     10.0.0.2 → 10.0.0.1     TCP 66 25904 → 58169 [ACK] Seq=1 Ack=32001 Win=67 Len=0 TSval=1886574088 TSecr=1758595954
   97   0.836995     10.0.0.2 → 10.0.0.1     TCP 66 59433 → 48193 [ACK] Seq=1 Ack=44038 Win=34304 Len=0 TSval=1886574104 TSecr=1758595962
   98   0.839180     10.0.0.2 → 10.0.0.1     TCP 66 59433 → 48193 [ACK] Seq=1 Ack=48038 Win=34304 Len=0 TSval=1886574106 TSecr=1758596020
   99   0.841290     10.0.0.2 → 10.0.0.1     TCP 66 6776 → 55246 [ACK] Seq=1 Ack=32001 Win=67 Len=0 TSval=1886574108 TSecr=1758595963
  100   0.845676     10.0.0.2 → 10.0.0.1     TCP 66 35722 → 19551 [ACK] Seq=1 Ack=54038 Win=34304 Len=0 TSval=1886574113 TSecr=1758596024
  101   0.853690     10.0.0.2 → 10.0.0.1     TCP 66 40783 → 32720 [ACK] Seq=1 Ack=34001 Win=67 Len=0 TSval=1886574121 TSecr=1758595988
  102   0.858584     10.0.0.2 → 10.0.0.1     TCP 66 42968 → 55943 [ACK] Seq=1 Ack=35038 Win=34304 Len=0 TSval=1886574125 TSecr=1758595990
  103   0.876479     10.0.0.2 → 10.0.0.1     TCP 66 46356 → 54368 [ACK] Seq=1 Ack=39001 Win=67 Len=0 TSval=1886574144 TSecr=1758596045
  104   0.878344     10.0.0.2 → 10.0.0.1     TCP 66 25904 → 58169 [ACK] Seq=1 Ack=37001 Win=67 Len=0 TSval=1886574145 TSecr=1758596014
  105   0.882621     10.0.0.2 → 10.0.0.1     TCP 66 40783 → 32720 [ACK] Seq=1 Ack=37001 Win=67 Len=0 TSval=1886574150 TSecr=1758596037
  106   0.888849     10.0.0.2 → 10.0.0.1     TCP 66 25904 → 58169 [ACK] Seq=1 Ack=40001 Win=67 Len=0 TSval=1886574156 TSecr=1758596061
  107   0.899132     10.0.0.2 → 10.0.0.1     TCP 66 6776 → 55246 [ACK] Seq=1 Ack=38001 Win=67 Len=0 TSval=1886574166 TSecr=1758596038
  108   0.903353     10.0.0.2 → 10.0.0.1     TCP 66 47452 → 53241 [ACK] Seq=1 Ack=37001 Win=67 Len=0 TSval=1886574171 TSecr=1758596055
  109   0.909483     10.0.0.2 → 10.0.0.1     TCP 66 6776 → 55246 [ACK] Seq=1 Ack=42001 Win=67 Len=0 TSval=1886574177 TSecr=1758596091
  110   0.932707     10.0.0.2 → 10.0.0.1     TCP 66 59433 → 48193 [ACK] Seq=1 Ack=54038 Win=34304 Len=0 TSval=1886574200 TSecr=1758596089
  111   0.969914     10.0.0.2 → 10.0.0.1     TCP 66 46356 → 54368 [ACK] Seq=1 Ack=41001 Win=67 Len=0 TSval=1886574234 TSecr=1758596070
  112   1.076065     10.0.0.2 → 10.0.0.1     TCP 66 40783 → 32720 [ACK] Seq=1 Ack=47001 Win=67 Len=0 TSval=1886574340 TSecr=1758596174
  113   1.079044     10.0.0.2 → 10.0.0.1     TCP 66 42968 → 55943 [ACK] Seq=1 Ack=54038 Win=34304 Len=0 TSval=1886574340 TSecr=1758596250
  114   1.081341     10.0.0.2 → 10.0.0.1     TCP 66 46356 → 54368 [ACK] Seq=1 Ack=54001 Win=67 Len=0 TSval=1886574348 TSecr=1758596255
  115   1.086086     10.0.0.2 → 10.0.0.1     TCP 66 35722 → 19551 [ACK] Seq=1 Ack=66038 Win=34304 Len=0 TSval=1886574353 TSecr=1758596184
  116   1.093152     10.0.0.2 → 10.0.0.1     TCP 66 35722 → 19551 [ACK] Seq=1 Ack=72038 Win=34304 Len=0 TSval=1886574360 TSecr=1758596269
  117   1.116234     10.0.0.2 → 10.0.0.1     TCP 66 6776 → 55246 [ACK] Seq=1 Ack=49001 Win=67 Len=0 TSval=1886574379 TSecr=1758596188
  118   1.120844     10.0.0.2 → 10.0.0.1     TCP 66 25904 → 58169 [ACK] Seq=1 Ack=51001 Win=67 Len=0 TSval=1886574387 TSecr=1758596203
  119   1.124074     10.0.0.2 → 10.0.0.1     TCP 66 25904 → 58169 [ACK] Seq=1 Ack=58001 Win=67 Len=0 TSval=1886574391 TSecr=1758596304
  120   1.131594     10.0.0.2 → 10.0.0.1     TCP 66 59433 → 48193 [ACK] Seq=1 Ack=65038 Win=34304 Len=0 TSval=1886574399 TSecr=1758596245
  121   1.159417     10.0.0.2 → 10.0.0.1     TCP 66 40783 → 32720 [ACK] Seq=1 Ack=54001 Win=67 Len=0 TSval=1886574427 TSecr=1758596260
  122   1.161412     10.0.0.2 → 10.0.0.1     TCP 66 40783 → 32720 [ACK] Seq=1 Ack=60001 Win=67 Len=0 TSval=1886574428 TSecr=1758596342
  123   1.187829     10.0.0.2 → 10.0.0.1     TCP 66 42968 → 55943 [ACK] Seq=1 Ack=55038 Win=34304 Len=0 TSval=1886574455 TSecr=1758596262
  124   1.190089     10.0.0.2 → 10.0.0.1     TCP 66 42968 → 55943 [ACK] Seq=1 Ack=63038 Win=34304 Len=0 TSval=1886574457 TSecr=1758596371
  125   1.199094     10.0.0.2 → 10.0.0.1     TCP 66 25904 → 58169 [ACK] Seq=1 Ack=60001 Win=67 Len=0 TSval=1886574462 TSecr=1758596321
  126   1.200560     10.0.0.2 → 10.0.0.1     TCP 66 47452 → 53241 [ACK] Seq=1 Ack=53001 Win=67 Len=0 TSval=1886574467 TSecr=1758596275
  127   1.206146     10.0.0.2 → 10.0.0.1     TCP 66 46356 → 54368 [ACK] Seq=1 Ack=64001 Win=67 Len=0 TSval=1886574473 TSecr=1758596381
  128   1.210451     10.0.0.2 → 10.0.0.1     TCP 66 59433 → 48193 [ACK] Seq=1 Ack=73038 Win=34304 Len=0 TSval=1886574478 TSecr=1758596340
  129   1.224979     10.0.0.2 → 10.0.0.1     TCP 66 47452 → 53241 [ACK] Seq=1 Ack=61001 Win=67 Len=0 TSval=1886574491 TSecr=1758596384
  130   1.232349     10.0.0.2 → 10.0.0.1     TCP 66 6776 → 55246 [ACK] Seq=1 Ack=57001 Win=67 Len=0 TSval=1886574498 TSecr=1758596300
  131   1.239642     10.0.0.2 → 10.0.0.1     TCP 66 46356 → 54368 [ACK] Seq=1 Ack=65001 Win=67 Len=0 TSval=1886574507 TSecr=1758596390
  132   1.242620     10.0.0.2 → 10.0.0.1     TCP 66 59433 → 48193 [ACK] Seq=1 Ack=76038 Win=34304 Len=0 TSval=1886574509 TSecr=1758596393
  133   1.261394     10.0.0.2 → 10.0.0.1     TCP 66 40783 → 32720 [ACK] Seq=1 Ack=61001 Win=67 Len=0 TSval=1886574528 TSecr=1758596348
  134   1.269050     10.0.0.2 → 10.0.0.1     TCP 66 6776 → 55246 [ACK] Seq=1 Ack=66001 Win=67 Len=0 TSval=1886574536 TSecr=1758596416
  135   1.296577     10.0.0.2 → 10.0.0.1     TCP 66 59433 → 48193 [ACK] Seq=1 Ack=79038 Win=34304 Len=0 TSval=1886574562 TSecr=1758596426
  136   1.306256     10.0.0.2 → 10.0.0.1     TCP 66 25904 → 58169 [ACK] Seq=1 Ack=69001 Win=67 Len=0 TSval=1886574573 TSecr=1758596448
  137   1.312566     10.0.0.2 → 10.0.0.1     TCP 66 40783 → 32720 [ACK] Seq=1 Ack=70001 Win=67 Len=0 TSval=1886574580 TSecr=1758596479
  138   1.316431     10.0.0.2 → 10.0.0.1     TCP 66 46356 → 54368 [ACK] Seq=1 Ack=72001 Win=67 Len=0 TSval=1886574584 TSecr=1758596487
  139   1.318529     10.0.0.2 → 10.0.0.1     TCP 66 25904 → 58169 [ACK] Seq=1 Ack=72001 Win=67 Len=0 TSval=1886574586 TSecr=1758596489
  140   1.324705     10.0.0.2 → 10.0.0.1     TCP 66 25904 → 58169 [ACK] Seq=1 Ack=73001 Win=67 Len=0 TSval=1886574592 TSecr=1758596501
  141   1.332036     10.0.0.2 → 10.0.0.1     TCP 66 42968 → 55943 [ACK] Seq=1 Ack=74038 Win=34304 Len=0 TSval=1886574599 TSecr=1758596513
  142   1.337103     10.0.0.2 → 10.0.0.1     TCP 66 6776 → 55246 [ACK] Seq=1 Ack=69001 Win=67 Len=0 TSval=1886574604 TSecr=1758596452
  143   1.347623     10.0.0.2 → 10.0.0.1     TCP 66 47452 → 53241 [ACK] Seq=1 Ack=68001 Win=67 Len=0 TSval=1886574615 TSecr=1758596473
  144   1.374442     10.0.0.2 → 10.0.0.1     TCP 66 25904 → 58169 [ACK] Seq=1 Ack=74001 Win=67 Len=0 TSval=1886574642 TSecr=1758596508
  145   1.376020     10.0.0.2 → 10.0.0.1     TCP 66 25904 → 58169 [ACK] Seq=1 Ack=77001 Win=67 Len=0 TSval=1886574643 TSecr=1758596557
  146   1.379845     10.0.0.2 → 10.0.0.1     TCP 66 25904 → 58169 [ACK] Seq=1 Ack=78001 Win=67 Len=0 TSval=1886574647 TSecr=1758596561
  147   1.426484     10.0.0.2 → 10.0.0.1     TCP 66 42968 → 55943 [ACK] Seq=1 Ack=76038 Win=34304 Len=0 TSval=1886574694 TSecr=1758596544
  148   1.426835     10.0.0.2 → 10.0.0.1     TCP 66 47452 → 53241 [ACK] Seq=1 Ack=78001 Win=67 Len=0 TSval=1886574694 TSecr=1758596604
  149   1.436720     10.0.0.2 → 10.0.0.1     TCP 66 59433 → 48193 [ACK] Seq=1 Ack=93038 Win=34304 Len=0 TSval=1886574704 TSecr=1758596608
  150   1.438397     10.0.0.2 → 10.0.0.1     TCP 66 35722 → 19551 [ACK] Seq=1 Ack=95038 Win=34304 Len=0 TSval=1886574706 TSecr=1758596579
  151   1.442879     10.0.0.2 → 10.0.0.1     TCP 66 46356 → 54368 [ACK] Seq=1 Ack=73001 Win=67 Len=0 TSval=1886574710 TSecr=1758596499
  152   1.446803     10.0.0.2 → 10.0.0.1     TCP 66 35722 → 19551 [ACK] Seq=1 Ack=98038 Win=34304 Len=0 TSval=1886574714 TSecr=1758596621
  153   1.449440     10.0.0.2 → 10.0.0.1     TCP 66 42968 → 55943 [ACK] Seq=1 Ack=81038 Win=34304 Len=0 TSval=1886574717 TSecr=1758596609
  154   1.501179     10.0.0.2 → 10.0.0.1     TCP 66 6776 → 55246 [ACK] Seq=1 Ack=81001 Win=67 Len=0 TSval=1886574766 TSecr=1758596611
  155   1.508551     10.0.0.2 → 10.0.0.1     TCP 66 40783 → 32720 [ACK] Seq=1 Ack=81001 Win=67 Len=0 TSval=1886574766 TSecr=1758596618
  156   1.511568     10.0.0.2 → 10.0.0.1     TCP 66 25904 → 58169 [ACK] Seq=1 Ack=79001 Win=67 Len=0 TSval=1886574778 TSecr=1758596574
  157   1.534136     10.0.0.2 → 10.0.0.1     TCP 66 46356 → 54368 [ACK] Seq=1 Ack=83001 Win=67 Len=0 TSval=1886574799 TSecr=1758596636
  158   1.543120     10.0.0.2 → 10.0.0.1     TCP 66 25904 → 58169 [ACK] Seq=1 Ack=88001 Win=67 Len=0 TSval=1886574808 TSecr=1758596695
  159   1.558459     10.0.0.2 → 10.0.0.1     TCP 66 42968 → 55943 [ACK] Seq=1 Ack=89038 Win=34304 Len=0 TSval=1886574824 TSecr=1758596722
  160   1.559978     10.0.0.2 → 10.0.0.1     TCP 66 47452 → 53241 [ACK] Seq=1 Ack=85001 Win=67 Len=0 TSval=1886574825 TSecr=1758596696
  161   1.561176     10.0.0.2 → 10.0.0.1     TCP 66 40783 → 32720 [ACK] Seq=1 Ack=87001 Win=67 Len=0 TSval=1886574827 TSecr=1758596702
  162   1.580346     10.0.0.2 → 10.0.0.1     TCP 66 35722 → 19551 [ACK] Seq=1 Ack=106038 Win=34304 Len=0 TSval=1886574847 TSecr=1758596724
  163   1.586744     10.0.0.2 → 10.0.0.1     TCP 66 6776 → 55246 [ACK] Seq=1 Ack=89001 Win=67 Len=0 TSval=1886574854 TSecr=1758596727
  164   1.593907     10.0.0.2 → 10.0.0.1     TCP 66 42968 → 55943 [ACK] Seq=1 Ack=91038 Win=34304 Len=0 TSval=1886574860 TSecr=1758596742
  165   1.598224     10.0.0.2 → 10.0.0.1     TCP 66 40783 → 32720 [ACK] Seq=1 Ack=90001 Win=67 Len=0 TSval=1886574865 TSecr=1758596744
  166   1.607384     10.0.0.2 → 10.0.0.1     TCP 66 59433 → 48193 [ACK] Seq=1 Ack=103038 Win=34304 Len=0 TSval=1886574873 TSecr=1758596745
  167   1.609203     10.0.0.2 → 10.0.0.1     TCP 66 35722 → 19551 [ACK] Seq=1 Ack=109038 Win=34304 Len=0 TSval=1886574876 TSecr=1758596764
  168   1.636626     10.0.0.2 → 10.0.0.1     TCP 66 25904 → 58169 [ACK] Seq=1 Ack=97001 Win=67 Len=0 TSval=1886574903 TSecr=1758596817
  169   1.654528     10.0.0.2 → 10.0.0.1     TCP 66 47452 → 53241 [ACK] Seq=1 Ack=91001 Win=67 Len=0 TSval=1886574922 TSecr=1758596780
  170   1.704871     10.0.0.2 → 10.0.0.1     TCP 66 25904 → 58169 [ACK] Seq=1 Ack=98001 Win=67 Len=0 TSval=1886574971 TSecr=1758596828
  171   1.713239     10.0.0.2 → 10.0.0.1     TCP 66 42968 → 55943 [ACK] Seq=1 Ack=98038 Win=34304 Len=0 TSval=1886574977 TSecr=1758596834
  172   1.716027     10.0.0.2 → 10.0.0.1     TCP 66 42968 → 55943 [ACK] Seq=1 Ack=103038 Win=34304 Len=0 TSval=1886574983 TSecr=1758596896
  173   1.737137     10.0.0.2 → 10.0.0.1     TCP 66 47452 → 53241 [ACK] Seq=1 Ack=101001 Win=67 Len=0 TSval=1886575004 TSecr=1758596908
  174   1.737970     10.0.0.2 → 10.0.0.1     TCP 78 59433 → 48193 [ACK] Seq=1 Ack=106038 Win=34304 Len=0 TSval=1886575005 TSecr=1758596790 SLE=115486 SRE=116038
  175   1.739960     10.0.0.2 → 10.0.0.1     TCP 66 59433 → 48193 [ACK] Seq=1 Ack=116038 Win=34304 Len=0 TSval=1886575007 TSecr=1758596921
  176   1.754526     10.0.0.2 → 10.0.0.1     TCP 66 40783 → 32720 [ACK] Seq=1 Ack=93001 Win=67 Len=0 TSval=1886575022 TSecr=1758596781
  177   1.759548     10.0.0.2 → 10.0.0.1     TCP 66 6776 → 55246 [ACK] Seq=1 Ack=104001 Win=67 Len=0 TSval=1886575027 TSecr=1758596923
  178   1.771759     10.0.0.2 → 10.0.0.1     TCP 78 [TCP Dup ACK 176#1] 40783 → 32720 [ACK] Seq=1 Ack=93001 Win=67 Len=0 TSval=1886575039 TSecr=1758596781 SLE=102449 SRE=105001
  179   1.792499     10.0.0.2 → 10.0.0.1     TCP 66 46356 → 54368 [ACK] Seq=1 Ack=102001 Win=67 Len=0 TSval=1886575060 TSecr=1758596883
  180   1.839217     10.0.0.2 → 10.0.0.1     TCP 66 42968 → 55943 [ACK] Seq=1 Ack=104038 Win=34304 Len=0 TSval=1886575106 TSecr=1758596910
  181   1.843368     10.0.0.2 → 10.0.0.1     TCP 78 59433 → 48193 [ACK] Seq=1 Ack=117038 Win=34304 Len=0 TSval=1886575110 TSecr=1758596927 SLE=106038 SRE=115486
  182   1.881510     10.0.0.2 → 10.0.0.1     TCP 66 35722 → 19551 [ACK] Seq=1 Ack=123038 Win=34304 Len=0 TSval=1886575149 TSecr=1758596951
  183   1.918097     10.0.0.2 → 10.0.0.1     TCP 66 40783 → 32720 [ACK] Seq=1 Ack=116449 Win=65 Len=0 TSval=1886575185 TSecr=1758596962
  184   1.991467     10.0.0.2 → 10.0.0.1     TCP 66 42968 → 55943 [ACK] Seq=1 Ack=112038 Win=34304 Len=0 TSval=1886575258 TSecr=1758597022
  185   2.015833     10.0.0.2 → 10.0.0.1     TCP 66 46356 → 54368 [ACK] Seq=1 Ack=118001 Win=67 Len=0 TSval=1886575283 TSecr=1758597096
  186   2.017450     10.0.0.2 → 10.0.0.1     TCP 66 6776 → 55246 [ACK] Seq=1 Ack=119001 Win=67 Len=0 TSval=1886575285 TSecr=1758597123
  187   2.018365     10.0.0.2 → 10.0.0.1     TCP 66 47452 → 53241 [ACK] Seq=1 Ack=115449 Win=67 Len=0 TSval=1886575286 TSecr=1758597108
  188   2.021173     10.0.0.2 → 10.0.0.1     TCP 66 40783 → 32720 [ACK] Seq=1 Ack=121001 Win=67 Len=0 TSval=1886575288 TSecr=1758597160
  189   2.023363     10.0.0.2 → 10.0.0.1     TCP 66 59433 → 48193 [ACK] Seq=1 Ack=129038 Win=34304 Len=0 TSval=1886575291 TSecr=1758597074
  190   2.029492     10.0.0.2 → 10.0.0.1     TCP 78 [TCP Dup ACK 184#1] 42968 → 55943 [ACK] Seq=1 Ack=112038 Win=34304 Len=0 TSval=1886575297 TSecr=1758597022 SLE=121486 SRE=123038
  191   2.044716     10.0.0.2 → 10.0.0.1     TCP 66 59433 → 48193 [ACK] Seq=1 Ack=137038 Win=34304 Len=0 TSval=1886575312 TSecr=1758597206
  192   2.062445     10.0.0.2 → 10.0.0.1     TCP 78 35722 → 19551 [ACK] Seq=1 Ack=132038 Win=34304 Len=0 TSval=1886575328 TSecr=1758597065 SLE=133038 SRE=142486
  193   2.064216     10.0.0.2 → 10.0.0.1     TCP 66 35722 → 19551 [ACK] Seq=1 Ack=142486 Win=34304 Len=0 TSval=1886575330 TSecr=1758597077
  194   2.070426     10.0.0.2 → 10.0.0.1     TCP 66 25904 → 58169 [ACK] Seq=1 Ack=118449 Win=67 Len=0 TSval=1886575338 TSecr=1758597108
  195   2.081918     10.0.0.2 → 10.0.0.1     TCP 66 59433 → 48193 [ACK] Seq=1 Ack=139038 Win=34304 Len=0 TSval=1886575349 TSecr=1758597228
  196   2.088308     10.0.0.2 → 10.0.0.1     TCP 78 [TCP Dup ACK 194#1] 25904 → 58169 [ACK] Seq=1 Ack=118449 Win=67 Len=0 TSval=1886575355 TSecr=1758597108 SLE=120001 SRE=129001
  197   2.103768     10.0.0.2 → 10.0.0.1     TCP 78 6776 → 55246 [ACK] Seq=1 Ack=126001 Win=67 Len=0 TSval=1886575371 TSecr=1758597215 SLE=107001 SRE=116449
  198   2.148389     10.0.0.2 → 10.0.0.1     TCP 66 42968 → 55943 [ACK] Seq=1 Ack=123038 Win=34304 Len=0 TSval=1886575416 TSecr=1758597150
  199   2.184997     10.0.0.2 → 10.0.0.1     TCP 66 40783 → 32720 [ACK] Seq=1 Ack=134449 Win=61 Len=0 TSval=1886575452 TSecr=1758597349
  200   2.186354     10.0.0.2 → 10.0.0.1     TCP 66 47452 → 53241 [ACK] Seq=1 Ack=119001 Win=67 Len=0 TSval=1886575453 TSecr=1758597158
  201   2.198357     10.0.0.2 → 10.0.0.1     TCP 78 [TCP Dup ACK 200#1] 47452 → 53241 [ACK] Seq=1 Ack=119001 Win=67 Len=0 TSval=1886575465 TSecr=1758597158 SLE=128449 SRE=135001
  202   2.229133     10.0.0.2 → 10.0.0.1     TCP 78 40783 → 32720 [ACK] Seq=1 Ack=137001 Win=67 Len=0 TSval=1886575496 TSecr=1758597368 SLE=121001 SRE=125001
  203   2.245447     10.0.0.2 → 10.0.0.1     TCP 78 42968 → 55943 [ACK] Seq=1 Ack=132486 Win=34304 Len=0 TSval=1886575513 TSecr=1758597331 SLE=112038 SRE=121486
  204   2.249678     10.0.0.2 → 10.0.0.1     TCP 78 [TCP Dup ACK 197#1] 6776 → 55246 [ACK] Seq=1 Ack=126001 Win=67 Len=0 TSval=1886575517 TSecr=1758597215 SLE=129001 SRE=138449
  205   2.278008     10.0.0.2 → 10.0.0.1     TCP 78 [TCP Dup ACK 195#1] 59433 → 48193 [ACK] Seq=1 Ack=139038 Win=34304 Len=0 TSval=1886575545 TSecr=1758597228 SLE=142038 SRE=151486
  206   2.293916     10.0.0.2 → 10.0.0.1     TCP 66 6776 → 55246 [ACK] Seq=1 Ack=138449 Win=65 Len=0 TSval=1886575561 TSecr=1758597263
  207   2.297048     10.0.0.2 → 10.0.0.1     TCP 78 35722 → 19551 [ACK] Seq=1 Ack=154486 Win=34304 Len=0 TSval=1886575564 TSecr=1758597247 SLE=142486 SRE=145038
  208   2.306319     10.0.0.2 → 10.0.0.1     TCP 66 59433 → 48193 [ACK] Seq=1 Ack=151486 Win=33280 Len=0 TSval=1886575573 TSecr=1758597265
  209   2.318558     10.0.0.2 → 10.0.0.1     TCP 78 25904 → 58169 [ACK] Seq=1 Ack=129001 Win=67 Len=0 TSval=1886575586 TSecr=1758597134 SLE=118449 SRE=120001
  210   2.321346     10.0.0.2 → 10.0.0.1     TCP 78 [TCP Dup ACK 209#1] 25904 → 58169 [ACK] Seq=1 Ack=129001 Win=67 Len=0 TSval=1886575588 TSecr=1758597134 SLE=135001 SRE=144449
  211   2.359411     10.0.0.2 → 10.0.0.1     TCP 78 [TCP Dup ACK 208#1] 59433 → 48193 [ACK] Seq=1 Ack=151486 Win=34304 Len=0 TSval=1886575626 TSecr=1758597265 SLE=139038 SRE=142038
  212   2.365566     10.0.0.2 → 10.0.0.1     TCP 66 35722 → 19551 [ACK] Seq=1 Ack=162038 Win=34304 Len=0 TSval=1886575633 TSecr=1758597466
  213   2.397033     10.0.0.2 → 10.0.0.1     TCP 66 59433 → 48193 [ACK] Seq=1 Ack=159038 Win=34304 Len=0 TSval=1886575664 TSecr=1758597489
  214   2.412215     10.0.0.2 → 10.0.0.1     TCP 78 25904 → 58169 [ACK] Seq=1 Ack=144449 Win=67 Len=0 TSval=1886575679 TSecr=1758597325 SLE=129001 SRE=135001
  215   2.424537     10.0.0.2 → 10.0.0.1     TCP 78 [TCP Dup ACK 202#1] 40783 → 32720 [ACK] Seq=1 Ack=137001 Win=67 Len=0 TSval=1886575691 TSecr=1758597368 SLE=138001 SRE=147449
  216   2.426413     10.0.0.2 → 10.0.0.1     TCP 66 42968 → 55943 [ACK] Seq=1 Ack=144486 Win=33280 Len=0 TSval=1886575693 TSecr=1758597331
  217   2.440224     10.0.0.2 → 10.0.0.1     TCP 66 47452 → 53241 [ACK] Seq=1 Ack=138001 Win=67 Len=0 TSval=1886575707 TSecr=1758597414
  218   2.475337     10.0.0.2 → 10.0.0.1     TCP 78 [TCP Dup ACK 214#1] 25904 → 58169 [ACK] Seq=1 Ack=144449 Win=67 Len=0 TSval=1886575742 TSecr=1758597325 SLE=153897 SRE=154001
  219   2.501728     10.0.0.2 → 10.0.0.1     TCP 66 46356 → 54368 [ACK] Seq=1 Ack=153001 Win=67 Len=0 TSval=1886575769 TSecr=1758597564
  220   2.546930     10.0.0.2 → 10.0.0.1     TCP 66 6776 → 55246 [ACK] Seq=1 Ack=154449 Win=67 Len=0 TSval=1886575802 TSecr=1758597598
  221   2.588477     10.0.0.2 → 10.0.0.1     TCP 66 42968 → 55943 [ACK] Seq=1 Ack=156038 Win=34304 Len=0 TSval=1886575855 TSecr=1758597610
  222   2.606665     10.0.0.2 → 10.0.0.1     TCP 78 [TCP Dup ACK 221#1] 42968 → 55943 [ACK] Seq=1 Ack=156038 Win=34304 Len=0 TSval=1886575874 TSecr=1758597610 SLE=165486 SRE=168038
  223   2.831108     10.0.0.2 → 10.0.0.1     TCP 66 42968 → 55943 [ACK] Seq=1 Ack=168038 Win=34304 Len=0 TSval=1886576097 TSecr=1758597797
  224   2.831632     10.0.0.2 → 10.0.0.1     TCP 66 6776 → 55246 [ACK] Seq=1 Ack=158001 Win=67 Len=0 TSval=1886576098 TSecr=1758597648
  225   2.832156     10.0.0.2 → 10.0.0.1     TCP 66 40783 → 32720 [ACK] Seq=1 Ack=168449 Win=61 Len=0 TSval=1886576098 TSecr=1758597659
  226   2.859667     10.0.0.2 → 10.0.0.1     TCP 78 59433 → 48193 [ACK] Seq=1 Ack=165038 Win=34304 Len=0 TSval=1886576127 TSecr=1758597580 SLE=175038 SRE=184486
  227   2.878761     10.0.0.2 → 10.0.0.1     TCP 78 47452 → 53241 [ACK] Seq=1 Ack=154001 Win=67 Len=0 TSval=1886576146 TSecr=1758597623 SLE=160001 SRE=178897
  228   2.884750     10.0.0.2 → 10.0.0.1     TCP 78 [TCP Dup ACK 223#1] 42968 → 55943 [ACK] Seq=1 Ack=168038 Win=34304 Len=0 TSval=1886576152 TSecr=1758597797 SLE=144486 SRE=153934
  229   2.916940     10.0.0.2 → 10.0.0.1     TCP 78 35722 → 19551 [ACK] Seq=1 Ack=184486 Win=34304 Len=0 TSval=1886576184 TSecr=1758597777 SLE=195486 SRE=204934
  230   2.936104     10.0.0.2 → 10.0.0.1     TCP 78 59433 → 48193 [ACK] Seq=1 Ack=174486 Win=25088 Len=0 TSval=1886576203 TSecr=1758598043 SLE=175038 SRE=193934
  231   2.975275     10.0.0.2 → 10.0.0.1     TCP 78 35722 → 19551 [ACK] Seq=1 Ack=186038 Win=34304 Len=0 TSval=1886576242 TSecr=1758598100 SLE=195486 SRE=204934
  232   2.978393     10.0.0.2 → 10.0.0.1     TCP 66 47452 → 53241 [ACK] Seq=1 Ack=188345 Win=67 Len=0 TSval=1886576246 TSecr=1758598106
  233   2.986209     10.0.0.2 → 10.0.0.1     TCP 78 59433 → 48193 [ACK] Seq=1 Ack=193934 Win=34304 Len=0 TSval=1886576252 TSecr=1758598081 SLE=174486 SRE=175038
  234   3.004434     10.0.0.2 → 10.0.0.1     TCP 78 [TCP Dup ACK 223#2] 42968 → 55943 [ACK] Seq=1 Ack=168038 Win=34304 Len=0 TSval=1886576271 TSecr=1758597797 SLE=186038 SRE=195486
  235   3.020906     10.0.0.2 → 10.0.0.1     TCP 66 59433 → 48193 [ACK] Seq=1 Ack=203382 Win=34304 Len=0 TSval=1886576288 TSecr=1758598157
  236   3.027825     10.0.0.2 → 10.0.0.1     TCP 78 25904 → 58169 [ACK] Seq=1 Ack=164001 Win=67 Len=0 TSval=1886576293 TSecr=1758597711 SLE=154001 SRE=163449
  237   3.074886     10.0.0.2 → 10.0.0.1     TCP 66 35722 → 19551 [ACK] Seq=1 Ack=214038 Win=34304 Len=0 TSval=1886576339 TSecr=1758598158
  238   3.093216     10.0.0.2 → 10.0.0.1     TCP 78 [TCP Dup ACK 236#1] 25904 → 58169 [ACK] Seq=1 Ack=164001 Win=67 Len=0 TSval=1886576356 TSecr=1758597711 SLE=182897 SRE=192345
  239   3.107554     10.0.0.2 → 10.0.0.1     TCP 78 [TCP Dup ACK 236#2] 25904 → 58169 [ACK] Seq=1 Ack=164001 Win=67 Len=0 TSval=1886576374 TSecr=1758597711 SLE=182897 SRE=198001
  240   3.110477     10.0.0.2 → 10.0.0.1     TCP 66 6776 → 55246 [ACK] Seq=1 Ack=167449 Win=67 Len=0 TSval=1886576378 TSecr=1758597771
  241   3.131404     10.0.0.2 → 10.0.0.1     TCP 78 25904 → 58169 [ACK] Seq=1 Ack=173449 Win=57 Len=0 TSval=1886576398 TSecr=1758598281 SLE=182897 SRE=198001
  242   3.139985     10.0.0.2 → 10.0.0.1     TCP 78 [TCP Dup ACK 237#1] 35722 → 19551 [ACK] Seq=1 Ack=214038 Win=34304 Len=0 TSval=1886576407 TSecr=1758598158 SLE=184486 SRE=186038
  243   3.149482     10.0.0.2 → 10.0.0.1     TCP 78 [TCP Dup ACK 223#3] 42968 → 55943 [ACK] Seq=1 Ack=168038 Win=34304 Len=0 TSval=1886576417 TSecr=1758597797 SLE=177486 SRE=195486
  244   3.168751     10.0.0.2 → 10.0.0.1     TCP 66 25904 → 58169 [ACK] Seq=1 Ack=198001 Win=57 Len=0 TSval=1886576435 TSecr=1758598291
  245   3.185712     10.0.0.2 → 10.0.0.1     TCP 78 6776 → 55246 [ACK] Seq=1 Ack=176897 Win=67 Len=0 TSval=1886576453 TSecr=1758597891 SLE=185001 SRE=194449
  246   3.204878     10.0.0.2 → 10.0.0.1     TCP 66 42968 → 55943 [ACK] Seq=1 Ack=195486 Win=20992 Len=0 TSval=1886576472 TSecr=1758598333
  247   3.224188     10.0.0.2 → 10.0.0.1     TCP 78 [TCP Dup ACK 245#1] 6776 → 55246 [ACK] Seq=1 Ack=176897 Win=67 Len=0 TSval=1886576491 TSecr=1758597891 SLE=185001 SRE=203897
  248   3.247822     10.0.0.2 → 10.0.0.1     TCP 78 47452 → 53241 [ACK] Seq=1 Ack=196001 Win=104 Len=0 TSval=1886576515 TSecr=1758598185 SLE=205001 SRE=214449
  249   3.300286     10.0.0.2 → 10.0.0.1     TCP 78 40783 → 32720 [ACK] Seq=1 Ack=170001 Win=67 Len=0 TSval=1886576566 TSecr=1758598002 SLE=179449 SRE=188897
  250   3.328413     10.0.0.2 → 10.0.0.1     TCP 78 46356 → 54368 [ACK] Seq=1 Ack=195449 Win=57 Len=0 TSval=1886576595 TSecr=1758598503 SLE=204897 SRE=214345
  251   3.346335     10.0.0.2 → 10.0.0.1     TCP 78 [TCP Dup ACK 237#2] 35722 → 19551 [ACK] Seq=1 Ack=214038 Win=34304 Len=0 TSval=1886576613 TSecr=1758598158 SLE=230486 SRE=239934
  252   3.358495     10.0.0.2 → 10.0.0.1     TCP 66 40783 → 32720 [ACK] Seq=1 Ack=188897 Win=57 Len=0 TSval=1886576626 TSecr=1758598007
  253   3.400446     10.0.0.2 → 10.0.0.1     TCP 66 40783 → 32720 [ACK] Seq=1 Ack=198345 Win=67 Len=0 TSval=1886576668 TSecr=1758598580
  254   3.416904     10.0.0.2 → 10.0.0.1     TCP 66 40783 → 32720 [ACK] Seq=1 Ack=207793 Win=67 Len=0 TSval=1886576684 TSecr=1758598580
  255   3.417518     10.0.0.2 → 10.0.0.1     TCP 86 [TCP Dup ACK 246#1] 42968 → 55943 [ACK] Seq=1 Ack=195486 Win=34304 Len=0 TSval=1886576684 TSecr=1758598333 SLE=168038 SRE=177486 SLE=214382 SRE=216038
  256   3.435316     10.0.0.2 → 10.0.0.1     TCP 78 59433 → 48193 [ACK] Seq=1 Ack=209038 Win=53248 Len=0 TSval=1886576702 TSecr=1758598157 SLE=232934 SRE=242038
  257   3.455364     10.0.0.2 → 10.0.0.1     TCP 86 [TCP Dup ACK 246#2] 42968 → 55943 [ACK] Seq=1 Ack=195486 Win=34304 Len=0 TSval=1886576722 TSecr=1758598333 SLE=177486 SRE=186038 SLE=214382 SRE=216038
  258   3.514022     10.0.0.2 → 10.0.0.1     TCP 86 [TCP Dup ACK 250#1] 46356 → 54368 [ACK] Seq=1 Ack=195449 Win=67 Len=0 TSval=1886576781 TSecr=1758598503 SLE=186001 SRE=195449 SLE=204897 SRE=214345
  259   3.519393     10.0.0.2 → 10.0.0.1     TCP 78 [TCP Dup ACK 244#1] 25904 → 58169 [ACK] Seq=1 Ack=198001 Win=67 Len=0 TSval=1886576787 TSecr=1758598291 SLE=212001 SRE=221449
  260   3.584627     10.0.0.2 → 10.0.0.1     TCP 78 40783 → 32720 [ACK] Seq=1 Ack=217241 Win=53 Len=0 TSval=1886576852 TSecr=1758598746 SLE=223201 SRE=236137
  261   3.596786     10.0.0.2 → 10.0.0.1     TCP 86 [TCP Dup ACK 244#2] 25904 → 58169 [ACK] Seq=1 Ack=198001 Win=67 Len=0 TSval=1886576863 TSecr=1758598291 SLE=173449 SRE=182897 SLE=212001 SRE=221449
  262   3.636540     10.0.0.2 → 10.0.0.1     TCP 78 [TCP Dup ACK 246#3] 42968 → 55943 [ACK] Seq=1 Ack=195486 Win=34304 Len=0 TSval=1886576904 TSecr=1758598333 SLE=204934 SRE=216038
  263   3.672738     10.0.0.2 → 10.0.0.1     TCP 78 59433 → 48193 [ACK] Seq=1 Ack=214038 Win=72192 Len=0 TSval=1886576940 TSecr=1758598231 SLE=232934 SRE=242038
  264   3.726953     10.0.0.2 → 10.0.0.1     TCP 78 42968 → 55943 [ACK] Seq=1 Ack=216038 Win=34304 Len=0 TSval=1886576994 TSecr=1758598873 SLE=225486 SRE=244382
  265   3.748856     10.0.0.2 → 10.0.0.1     TCP 86 [TCP Dup ACK 263#1] 59433 → 48193 [ACK] Seq=1 Ack=214038 Win=72192 Len=0 TSval=1886577016 TSecr=1758598910 SLE=209038 SRE=214038 SLE=232934 SRE=242038
  266   3.809436     10.0.0.2 → 10.0.0.1     TCP 66 46356 → 54368 [ACK] Seq=1 Ack=239201 Win=67 Len=0 TSval=1886577077 TSecr=1758598954
  267   3.928958     10.0.0.2 → 10.0.0.1     TCP 86 46356 → 54368 [ACK] Seq=1 Ack=248649 Win=141 Len=0 TSval=1886577196 TSecr=1758598954 SLE=195449 SRE=204897 SLE=249489 SRE=258937
  268   3.952548     10.0.0.2 → 10.0.0.1     TCP 78 59433 → 48193 [ACK] Seq=1 Ack=223486 Win=91136 Len=0 TSval=1886577219 TSecr=1758599082 SLE=232934 SRE=242038
  269   3.978791     10.0.0.2 → 10.0.0.1     TCP 66 6776 → 55246 [ACK] Seq=1 Ack=223001 Win=67 Len=0 TSval=1886577242 TSecr=1758599094
  270   4.025890     10.0.0.2 → 10.0.0.1     TCP 66 25904 → 58169 [ACK] Seq=1 Ack=240345 Win=57 Len=0 TSval=1886577293 TSecr=1758599137
  271   4.038390     10.0.0.2 → 10.0.0.1     TCP 86 [TCP Dup ACK 264#1] 42968 → 55943 [ACK] Seq=1 Ack=216038 Win=34304 Len=0 TSval=1886577305 TSecr=1758598873 SLE=204934 SRE=214382 SLE=225486 SRE=245222
  272   4.064314     10.0.0.2 → 10.0.0.1     TCP 66 46356 → 54368 [ACK] Seq=1 Ack=271001 Win=252 Len=0 TSval=1886577331 TSecr=1758599139
  273   4.071722     10.0.0.2 → 10.0.0.1     TCP 78 35722 → 19551 [ACK] Seq=1 Ack=239934 Win=34304 Len=0 TSval=1886577337 TSecr=1758598384 SLE=244038 SRE=253486
  274   4.076578     10.0.0.2 → 10.0.0.1     TCP 86 [TCP Dup ACK 264#2] 42968 → 55943 [ACK] Seq=1 Ack=216038 Win=34304 Len=0 TSval=1886577343 TSecr=1758598873 SLE=195486 SRE=204934 SLE=225486 SRE=245222
  275   4.089291     10.0.0.2 → 10.0.0.1     TCP 78 [TCP Dup ACK 273#1] 35722 → 19551 [ACK] Seq=1 Ack=239934 Win=34304 Len=0 TSval=1886577355 TSecr=1758598384 SLE=244038 SRE=262934
