    1   0.000000     10.0.0.1 → 10.0.0.2     TCP 66 36467 → 59433 [ACK] Seq=1 Ack=1 Win=74 Len=0 TSval=1758595183 TSecr=1886573266
    2   0.003521     10.0.0.1 → 10.0.0.2     TCP 70 42763 → 35722 [PSH, ACK] Seq=1 Ack=1 Win=74 Len=4 TSval=1758595186 TSecr=1886573267
    3   0.004872     10.0.0.1 → 10.0.0.2     TCP 70 [TCP Previous segment not captured] 36467 → 59433 [PSH, ACK] Seq=38 Ack=2 Win=74 Len=4 TSval=1758595186 TSecr=1886573270
    4   0.012126     10.0.0.1 → 10.0.0.2     TCP 74 39475 → 47452 [SYN] Seq=0 Win=37840 Len=0 MSS=9460 SACK_PERM TSval=1758595195 TSecr=0 WS=512
    5   0.021697     10.0.0.1 → 10.0.0.2     TCP 74 55655 → 6776 [SYN] Seq=0 Win=37840 Len=0 MSS=9460 SACK_PERM TSval=1758595202 TSecr=0 WS=512
    6   0.024605     10.0.0.1 → 10.0.0.2     TCP 66 51099 → 25904 [ACK] Seq=1 Ack=1 Win=74 Len=0 TSval=1758595207 TSecr=1886573285
    7   0.025186     10.0.0.1 → 10.0.0.2     TCP 103 58271 → 40783 [PSH, ACK] Seq=1 Ack=1 Win=74 Len=37 TSval=1758595208 TSecr=1886573285
    8   0.028281     10.0.0.1 → 10.0.0.2     TCP 66 55655 → 6776 [ACK] Seq=1 Ack=1 Win=37888 Len=0 TSval=1758595211 TSecr=1886573293
    9   0.029259     10.0.0.1 → 10.0.0.2     TCP 66 [TCP Previous segment not captured] 39475 → 47452 [ACK] Seq=38 Ack=1 Win=37888 Len=0 TSval=1758595212 TSecr=1886573293
   10   0.029848     10.0.0.1 → 10.0.0.2     TCP 70 39475 → 47452 [PSH, ACK] Seq=38 Ack=1 Win=37888 Len=4 TSval=1758595212 TSecr=1886573293
   11   0.037056     10.0.0.1 → 10.0.0.2     TCP 70 58271 → 40783 [PSH, ACK] Seq=38 Ack=2 Win=74 Len=4 TSval=1758595217 TSecr=1886573298
   12   0.037427     10.0.0.1 → 10.0.0.2     TCP 66 49189 → 42968 [ACK] Seq=1 Ack=1 Win=74 Len=0 TSval=1758595217 TSecr=1886573298
   13   0.037977     10.0.0.1 → 10.0.0.2     TCP 103 49189 → 42968 [PSH, ACK] Seq=1 Ack=1 Win=74 Len=37 TSval=1758595217 TSecr=1886573298
   14   0.038519     10.0.0.1 → 10.0.0.2     TCP 103 47085 → 46356 [PSH, ACK] Seq=1 Ack=1 Win=74 Len=37 TSval=1758595217 TSecr=1886573296
   15   0.042575     10.0.0.1 → 10.0.0.2     TCP 66 [TCP Previous segment not captured] 55655 → 6776 [ACK] Seq=38 Ack=2 Win=37888 Len=0 TSval=1758595223 TSecr=1886573304
   16   0.045585     10.0.0.1 → 10.0.0.2     TCP 70 49189 → 42968 [PSH, ACK] Seq=38 Ack=2 Win=74 Len=4 TSval=1758595227 TSecr=1886573308
   17   0.046157     10.0.0.1 → 10.0.0.2     TCP 70 47085 → 46356 [PSH, ACK] Seq=38 Ack=2 Win=74 Len=4 TSval=1758595228 TSecr=1886573309
   18   0.123083     10.0.0.1 → 10.0.0.2     TCP 103 48193 → 59433 [PSH, ACK] Seq=1 Ack=1 Win=74 Len=37 TSval=1758595249 TSecr=1886573330
   19   0.124686     10.0.0.1 → 10.0.0.2     TCP 66 [TCP Previous segment not captured] 42763 → 35722 [ACK] Seq=122 Ack=2 Win=74 Len=0 TSval=1758595277 TSecr=1886573316
   20   0.129632     10.0.0.1 → 10.0.0.2     TCP 183 39475 → 47452 [PSH, ACK] Seq=42 Ack=1 Win=37888 Len=117 TSval=1758595309 TSecr=1886573358
   21   0.135203     10.0.0.1 → 10.0.0.2     TCP 183 [TCP Previous segment not captured] 55655 → 6776 [PSH, ACK] Seq=42 Ack=2 Win=37888 Len=117 TSval=1758595312 TSecr=1886573358
   22   0.142974     10.0.0.1 → 10.0.0.2     TCP 183 [TCP Previous segment not captured] 51099 → 25904 [PSH, ACK] Seq=42 Ack=2 Win=74 Len=117 TSval=1758595312 TSecr=1886573358
   23   0.145666     10.0.0.1 → 10.0.0.2     TCP 183 47085 → 46356 [PSH, ACK] Seq=42 Ack=2 Win=74 Len=117 TSval=1758595313 TSecr=1886573358
   24   0.152565     10.0.0.1 → 10.0.0.2     TCP 183 58271 → 40783 [PSH, ACK] Seq=42 Ack=2 Win=74 Len=117 TSval=1758595314 TSecr=1886573358
   25   0.167556     10.0.0.1 → 10.0.0.2     TCP 183 49189 → 42968 [PSH, ACK] Seq=42 Ack=2 Win=74 Len=117 TSval=1758595317 TSecr=1886573358
   26   0.184366     10.0.0.1 → 10.0.0.2     TCP 66 42763 → 35722 [ACK] Seq=122 Ack=4 Win=74 Len=0 TSval=1758595317 TSecr=1886573394
   27   0.202014     10.0.0.1 → 10.0.0.2     TCP 1066 48193 → 59433 [PSH, ACK] Seq=38 Ack=1 Win=74 Len=1000 TSval=1758595380 TSecr=1886573395
   28   0.213120     10.0.0.1 → 10.0.0.2     TCP 74 32720 → 40783 [SYN] Seq=0 Win=37840 Len=0 MSS=9460 SACK_PERM TSval=1758595382 TSecr=0 WS=512
   29   0.221482     10.0.0.1 → 10.0.0.2     TCP 5066 19551 → 35722 [PSH, ACK] Seq=1 Ack=1 Win=74 Len=5000 TSval=1758595385 TSecr=1886573464
   30   0.236721     10.0.0.1 → 10.0.0.2     TCP 66 53241 → 47452 [ACK] Seq=1 Ack=1 Win=74 Len=0 TSval=1758595399 TSecr=1886573468
   31   0.250242     10.0.0.1 → 10.0.0.2     TCP 103 53241 → 47452 [PSH, ACK] Seq=1 Ack=1 Win=74 Len=37 TSval=1758595399 TSecr=1886573468
   32   0.271078     10.0.0.1 → 10.0.0.2     TCP 66 58169 → 25904 [ACK] Seq=1 Ack=1 Win=74 Len=0 TSval=1758595410 TSecr=1886573472
   33   0.317936     10.0.0.1 → 10.0.0.2     TCP 103 54368 → 46356 [PSH, ACK] Seq=1 Ack=1 Win=74 Len=37 TSval=1758595410 TSecr=1886573473
   34   0.319051     10.0.0.1 → 10.0.0.2     TCP 66 32720 → 40783 [ACK] Seq=1 Ack=1 Win=37888 Len=0 TSval=1758595417 TSecr=1886573482
   35   0.329204     10.0.0.1 → 10.0.0.2     TCP 66 55943 → 42968 [ACK] Seq=1 Ack=1 Win=74 Len=0 TSval=1758595417 TSecr=1886573483
   36   0.329766     10.0.0.1 → 10.0.0.2     TCP 103 55943 → 42968 [PSH, ACK] Seq=1 Ack=1 Win=74 Len=37 TSval=1758595417 TSecr=1886573483
   37   0.331684     10.0.0.1 → 10.0.0.2     TCP 66 51099 → 25904 [ACK] Seq=159 Ack=3 Win=74 Len=0 TSval=1758595421 TSecr=1886573413
   38   0.332690     10.0.0.1 → 10.0.0.2     TCP 66 55655 → 6776 [ACK] Seq=159 Ack=3 Win=37888 Len=0 TSval=1758595421 TSecr=1886573409
   39   0.333738     10.0.0.1 → 10.0.0.2     TCP 66 39475 → 47452 [ACK] Seq=159 Ack=2 Win=37888 Len=0 TSval=1758595421 TSecr=1886573399
   40   0.340864     10.0.0.1 → 10.0.0.2     TCP 66 49189 → 42968 [ACK] Seq=159 Ack=3 Win=74 Len=0 TSval=1758595425 TSecr=1886573438
   41   0.344845     10.0.0.1 → 10.0.0.2     TCP 66 58271 → 40783 [ACK] Seq=159 Ack=3 Win=74 Len=0 TSval=1758595425 TSecr=1886573423
   42   0.345944     10.0.0.1 → 10.0.0.2     TCP 66 47085 → 46356 [ACK] Seq=159 Ack=3 Win=74 Len=0 TSval=1758595425 TSecr=1886573415
   43   0.347146     10.0.0.1 → 10.0.0.2     TCP 3066 19551 → 35722 [PSH, ACK] Seq=5001 Ack=1 Win=74 Len=3000 TSval=1758595436 TSecr=1886573491
   44   0.350091     10.0.0.1 → 10.0.0.2     TCP 9066 [TCP Previous segment not captured] 48193 → 59433 [PSH, ACK] Seq=3038 Ack=1 Win=74 Len=9000 TSval=1758595532 TSecr=1886573539
   45   0.368666     10.0.0.1 → 10.0.0.2     TCP 66 55655 → 6776 [ACK] Seq=159 Ack=5 Win=37888 Len=0 TSval=1758595533 TSecr=1886573602
   46   0.368978     10.0.0.1 → 10.0.0.2     TCP 66 39475 → 47452 [ACK] Seq=159 Ack=4 Win=37888 Len=0 TSval=1758595533 TSecr=1886573603
   47   0.369005     10.0.0.1 → 10.0.0.2     TCP 66 49189 → 42968 [ACK] Seq=159 Ack=5 Win=74 Len=0 TSval=1758595533 TSecr=1886573610
   48   0.369594     10.0.0.1 → 10.0.0.2     TCP 66 58271 → 40783 [ACK] Seq=159 Ack=5 Win=74 Len=0 TSval=1758595533 TSecr=1886573614
   49   0.369690     10.0.0.1 → 10.0.0.2     TCP 66 47085 → 46356 [ACK] Seq=159 Ack=5 Win=74 Len=0 TSval=1758595533 TSecr=1886573615
   50   0.369774     10.0.0.1 → 10.0.0.2     TCP 1066 53241 → 47452 [PSH, ACK] Seq=38 Ack=1 Win=74 Len=1000 TSval=1758595534 TSecr=1886573520
   51   0.371244     10.0.0.1 → 10.0.0.2     TCP 1066 55943 → 42968 [PSH, ACK] Seq=38 Ack=1 Win=74 Len=1000 TSval=1758595536 TSecr=1886573599
   52   0.373220     10.0.0.1 → 10.0.0.2     TCP 1066 55246 → 6776 [PSH, ACK] Seq=1 Ack=1 Win=74 Len=1000 TSval=1758595543 TSecr=1886573523
   53   0.375301     10.0.0.1 → 10.0.0.2     TCP 1066 48193 → 59433 [PSH, ACK] Seq=12038 Ack=1 Win=74 Len=1000 TSval=1758595544 TSecr=1886573619
   54   0.377402     10.0.0.1 → 10.0.0.2     TCP 1066 [TCP Previous segment not captured] 19551 → 35722 [PSH, ACK] Seq=16001 Ack=1 Win=74 Len=1000 TSval=1758595549 TSecr=1886573629
   55   0.379534     10.0.0.1 → 10.0.0.2     TCP 1066 53241 → 47452 [PSH, ACK] Seq=1038 Ack=1 Win=74 Len=1000 TSval=1758595556 TSecr=1886573640
   56   0.381666     10.0.0.1 → 10.0.0.2     TCP 1066 55246 → 6776 [PSH, ACK] Seq=1001 Ack=1 Win=74 Len=1000 TSval=1758595559 TSecr=1886573643
   57   0.387050     10.0.0.1 → 10.0.0.2     TCP 2066 [TCP Previous segment not captured] 58169 → 25904 [PSH, ACK] Seq=1038 Ack=1 Win=74 Len=2000 TSval=1758595570 TSecr=1886573655
   58   0.391159     10.0.0.1 → 10.0.0.2     TCP 1066 58169 → 25904 [PSH, ACK] Seq=3038 Ack=1 Win=74 Len=1000 TSval=1758595574 TSecr=1886573656
   59   0.403935     10.0.0.1 → 10.0.0.2     TCP 2066 [TCP Previous segment not captured] 48193 → 59433 [PSH, ACK] Seq=14038 Ack=1 Win=74 Len=2000 TSval=1758595587 TSecr=1886573672
   60   0.410976     10.0.0.1 → 10.0.0.2     TCP 1066 48193 → 59433 [PSH, ACK] Seq=16038 Ack=1 Win=74 Len=1000 TSval=1758595594 TSecr=1886573673
   61   0.414488     10.0.0.1 → 10.0.0.2     TCP 2066 [TCP Previous segment not captured] 53241 → 47452 [PSH, ACK] Seq=3038 Ack=1 Win=74 Len=2000 TSval=1758595598 TSecr=1886573681
   62   0.417535     10.0.0.1 → 10.0.0.2     TCP 2066 [TCP Previous segment not captured] 55246 → 6776 [PSH, ACK] Seq=3001 Ack=1 Win=74 Len=2000 TSval=1758595601 TSecr=1886573685
   63   0.427038     10.0.0.1 → 10.0.0.2     TCP 1066 55246 → 6776 [PSH, ACK] Seq=5001 Ack=1 Win=74 Len=1000 TSval=1758595611 TSecr=1886573687
   64   0.433331     10.0.0.1 → 10.0.0.2     TCP 3066 [TCP Previous segment not captured] 54368 → 46356 [PSH, ACK] Seq=4038 Ack=1 Win=74 Len=3000 TSval=1758595617 TSecr=1886573701
   65   0.458255     10.0.0.1 → 10.0.0.2     TCP 4066 [TCP Previous segment not captured] 19551 → 35722 [PSH, ACK] Seq=20001 Ack=1 Win=74 Len=4000 TSval=1758595642 TSecr=1886573726
   66   0.466284     10.0.0.1 → 10.0.0.2     TCP 3066 [TCP Previous segment not captured] 53241 → 47452 [PSH, ACK] Seq=6038 Ack=1 Win=74 Len=3000 TSval=1758595650 TSecr=1886573734
   67   0.469323     10.0.0.1 → 10.0.0.2     TCP 1066 19551 → 35722 [PSH, ACK] Seq=24001 Ack=1 Win=74 Len=1000 TSval=1758595651 TSecr=1886573728
   68   0.471619     10.0.0.1 → 10.0.0.2     TCP 1066 53241 → 47452 [PSH, ACK] Seq=9038 Ack=1 Win=74 Len=1000 TSval=1758595654 TSecr=1886573736
   69   0.487470     10.0.0.1 → 10.0.0.2     TCP 4066 [TCP Previous segment not captured] 55943 → 42968 [PSH, ACK] Seq=7038 Ack=1 Win=74 Len=4000 TSval=1758595671 TSecr=1886573755
   70   0.528343     10.0.0.1 → 10.0.0.2     TCP 3066 [TCP Previous segment not captured] 48193 → 59433 [PSH, ACK] Seq=22038 Ack=1 Win=74 Len=3000 TSval=1758595712 TSecr=1886573796
   71   0.549102     10.0.0.1 → 10.0.0.2     TCP 5066 [TCP Previous segment not captured] 55246 → 6776 [PSH, ACK] Seq=10001 Ack=1 Win=74 Len=5000 TSval=1758595733 TSecr=1886573817
   72   0.569773     10.0.0.1 → 10.0.0.2     TCP 5066 [TCP Previous segment not captured] 54368 → 46356 [PSH, ACK] Seq=12038 Ack=1 Win=74 Len=5000 TSval=1758595753 TSecr=1886573838
   73   0.579285     10.0.0.1 → 10.0.0.2     TCP 1066 54368 → 46356 [PSH, ACK] Seq=17038 Ack=1 Win=74 Len=1000 TSval=1758595763 TSecr=1886573839
   74   0.586224     10.0.0.1 → 10.0.0.2     TCP 6066 [TCP Previous segment not captured] 58169 → 25904 [PSH, ACK] Seq=12038 Ack=1 Win=74 Len=6000 TSval=1758595770 TSecr=1886573854
   75   0.595173     10.0.0.1 → 10.0.0.2     TCP 1066 58169 → 25904 [PSH, ACK] Seq=18038 Ack=1 Win=74 Len=1000 TSval=1758595774 TSecr=1886573855
   76   0.597291     10.0.0.1 → 10.0.0.2     TCP 1066 54368 → 46356 [PSH, ACK] Seq=18038 Ack=1 Win=74 Len=1000 TSval=1758595776 TSecr=1886573849
   77   0.602319     10.0.0.1 → 10.0.0.2     TCP 6066 [TCP Previous segment not captured] 32720 → 40783 [PSH, ACK] Seq=13038 Ack=1 Win=37888 Len=6000 TSval=1758595786 TSecr=1886573870
   78   0.611555     10.0.0.1 → 10.0.0.2     TCP 1066 32720 → 40783 [PSH, ACK] Seq=19038 Ack=1 Win=37888 Len=1000 TSval=1758595788 TSecr=1886573872
   79   0.622944     10.0.0.1 → 10.0.0.2     TCP 6066 [TCP Previous segment not captured] 19551 → 35722 [PSH, ACK] Seq=30001 Ack=1 Win=74 Len=6000 TSval=1758595806 TSecr=1886573891
   80   0.631879     10.0.0.1 → 10.0.0.2     TCP 1066 19551 → 35722 [PSH, ACK] Seq=36001 Ack=1 Win=74 Len=1000 TSval=1758595811 TSecr=1886573892
   81   0.642115     10.0.0.1 → 10.0.0.2     TCP 1066 19551 → 35722 [PSH, ACK] Seq=37001 Ack=1 Win=74 Len=1000 TSval=1758595824 TSecr=1886573901
   82   0.643991     10.0.0.1 → 10.0.0.2     TCP 5066 [TCP Previous segment not captured] 53241 → 47452 [PSH, ACK] Seq=17038 Ack=1 Win=74 Len=5000 TSval=1758595827 TSecr=1886573911
   83   0.651209     10.0.0.1 → 10.0.0.2     TCP 1066 53241 → 47452 [PSH, ACK] Seq=22038 Ack=1 Win=74 Len=1000 TSval=1758595829 TSecr=1886573913
   84   0.653759     10.0.0.1 → 10.0.0.2     TCP 1066 19551 → 35722 [PSH, ACK] Seq=38001 Ack=1 Win=74 Len=1000 TSval=1758595837 TSecr=1886573912
   85   0.658031     10.0.0.1 → 10.0.0.2     TCP 1066 53241 → 47452 [PSH, ACK] Seq=23038 Ack=1 Win=74 Len=1000 TSval=1758595841 TSecr=1886573920
   86   0.668289     10.0.0.1 → 10.0.0.2     TCP 1066 19551 → 35722 [PSH, ACK] Seq=39001 Ack=1 Win=74 Len=1000 TSval=1758595851 TSecr=1886573923
   87   0.668854     10.0.0.1 → 10.0.0.2     TCP 8066 [TCP Previous segment not captured] 55943 → 42968 [PSH, ACK] Seq=16038 Ack=1 Win=74 Len=8000 TSval=1758595851 TSecr=1886573935
   88   0.683357     10.0.0.1 → 10.0.0.2     TCP 1066 53241 → 47452 [PSH, ACK] Seq=24038 Ack=1 Win=74 Len=1000 TSval=1758595854 TSecr=1886573927
   89   0.685490     10.0.0.1 → 10.0.0.2     TCP 1066 55943 → 42968 [PSH, ACK] Seq=24038 Ack=1 Win=74 Len=1000 TSval=1758595858 TSecr=1886573941
   90   0.688603     10.0.0.1 → 10.0.0.2     TCP 5066 [TCP Previous segment not captured] 58169 → 25904 [PSH, ACK] Seq=20038 Ack=1 Win=74 Len=5000 TSval=1758595867 TSecr=1886573952
   91   0.697755     10.0.0.1 → 10.0.0.2     TCP 6066 [TCP Previous segment not captured] 54368 → 46356 [PSH, ACK] Seq=20038 Ack=1 Win=74 Len=6000 TSval=1758595874 TSecr=1886573956
   92   0.709918     10.0.0.1 → 10.0.0.2     TCP 1066 58169 → 25904 [PSH, ACK] Seq=25038 Ack=1 Win=74 Len=1000 TSval=1758595875 TSecr=1886573958
   93   0.712019     10.0.0.1 → 10.0.0.2     TCP 5066 [TCP Previous segment not captured] 32720 → 40783 [PSH, ACK] Seq=21038 Ack=1 Win=37888 Len=5000 TSval=1758595879 TSecr=1886573961
   94   0.722151     10.0.0.1 → 10.0.0.2     TCP 6066 [TCP Previous segment not captured] 48193 → 59433 [PSH, ACK] Seq=32038 Ack=1 Win=74 Len=6000 TSval=1758595881 TSecr=1886573965
   95   0.734299     10.0.0.1 → 10.0.0.2     TCP 1066 54368 → 46356 [PSH, ACK] Seq=26038 Ack=1 Win=74 Len=1000 TSval=1758595883 TSecr=1886573967
   96   0.736451     10.0.0.1 → 10.0.0.2     TCP 2066 58169 → 25904 [PSH, ACK] Seq=26038 Ack=1 Win=74 Len=2000 TSval=1758595895 TSecr=1886573979
   97   0.740546     10.0.0.1 → 10.0.0.2     TCP 7066 [TCP Previous segment not captured] 55246 → 6776 [PSH, ACK] Seq=21001 Ack=1 Win=74 Len=7000 TSval=1758595905 TSecr=1886573989
   98   0.754741     10.0.0.1 → 10.0.0.2     TCP 2066 54368 → 46356 [PSH, ACK] Seq=27038 Ack=1 Win=74 Len=2000 TSval=1758595919 TSecr=1886574004
   99   0.758829     10.0.0.1 → 10.0.0.2     TCP 4066 [TCP Previous segment not captured] 19551 → 35722 [PSH, ACK] Seq=41001 Ack=1 Win=74 Len=4000 TSval=1758595925 TSecr=1886574009
  100   0.766941     10.0.0.1 → 10.0.0.2     TCP 4066 [TCP Previous segment not captured] 53241 → 47452 [PSH, ACK] Seq=26038 Ack=1 Win=74 Len=4000 TSval=1758595929 TSecr=1886574013
  101   0.775078     10.0.0.1 → 10.0.0.2     TCP 1066 19551 → 35722 [PSH, ACK] Seq=45001 Ack=1 Win=74 Len=1000 TSval=1758595944 TSecr=1886574028
  102   0.777205     10.0.0.1 → 10.0.0.2     TCP 3066 [TCP Previous segment not captured] 48193 → 59433 [PSH, ACK] Seq=40038 Ack=1 Win=74 Len=3000 TSval=1758595946 TSecr=1886574030
  103   0.783338     10.0.0.1 → 10.0.0.2     TCP 2066 53241 → 47452 [PSH, ACK] Seq=30038 Ack=1 Win=74 Len=2000 TSval=1758595952 TSecr=1886574036
  104   0.787469     10.0.0.1 → 10.0.0.2     TCP 3066 [TCP Previous segment not captured] 55943 → 42968 [PSH, ACK] Seq=30038 Ack=1 Win=74 Len=3000 TSval=1758595967 TSecr=1886574051
  105   0.793617     10.0.0.1 → 10.0.0.2     TCP 1066 53241 → 47452 [PSH, ACK] Seq=32038 Ack=1 Win=74 Len=1000 TSval=1758595968 TSecr=1886574053
  106   0.795747     10.0.0.1 → 10.0.0.2     TCP 1066 55943 → 42968 [PSH, ACK] Seq=33038 Ack=1 Win=74 Len=1000 TSval=1758595976 TSecr=1886574057
  107   0.797865     10.0.0.1 → 10.0.0.2     TCP 1066 53241 → 47452 [PSH, ACK] Seq=33038 Ack=1 Win=74 Len=1000 TSval=1758595979 TSecr=1886574063
  108   0.800047     10.0.0.1 → 10.0.0.2     TCP 3066 [TCP Previous segment not captured] 32720 → 40783 [PSH, ACK] Seq=31038 Ack=1 Win=37888 Len=3000 TSval=1758595983 TSecr=1886574067
  109   0.820065     10.0.0.1 → 10.0.0.2     TCP 4066 [TCP Previous segment not captured] 58169 → 25904 [PSH, ACK] Seq=32038 Ack=1 Win=74 Len=4000 TSval=1758596004 TSecr=1886574088
  110   0.828161     10.0.0.1 → 10.0.0.2     TCP 4066 [TCP Previous segment not captured] 19551 → 35722 [PSH, ACK] Seq=48001 Ack=1 Win=74 Len=4000 TSval=1758596012 TSecr=1886574096
  111   0.836394     10.0.0.1 → 10.0.0.2     TCP 4066 [TCP Previous segment not captured] 48193 → 59433 [PSH, ACK] Seq=44038 Ack=1 Win=74 Len=4000 TSval=1758596020 TSecr=1886574104
  112   0.841336     10.0.0.1 → 10.0.0.2     TCP 1066 48193 → 59433 [PSH, ACK] Seq=48038 Ack=1 Win=74 Len=1000 TSval=1758596022 TSecr=1886574106
  113   0.843558     10.0.0.1 → 10.0.0.2     TCP 1066 19551 → 35722 [PSH, ACK] Seq=52001 Ack=1 Win=74 Len=1000 TSval=1758596024 TSecr=1886574097
  114   0.845721     10.0.0.1 → 10.0.0.2     TCP 5066 [TCP Previous segment not captured] 55246 → 6776 [PSH, ACK] Seq=32001 Ack=1 Win=74 Len=5000 TSval=1758596024 TSecr=1886574108
  115   0.855918     10.0.0.1 → 10.0.0.2     TCP 3066 53241 → 47452 [PSH, ACK] Seq=34038 Ack=1 Win=74 Len=3000 TSval=1758596025 TSecr=1886574110
  116   0.861872     10.0.0.1 → 10.0.0.2     TCP 1066 48193 → 59433 [PSH, ACK] Seq=49038 Ack=1 Win=74 Len=1000 TSval=1758596034 TSecr=1886574111
  117   0.864077     10.0.0.1 → 10.0.0.2     TCP 3066 [TCP Previous segment not captured] 55943 → 42968 [PSH, ACK] Seq=35038 Ack=1 Win=74 Len=3000 TSval=1758596042 TSecr=1886574125
  118   0.870169     10.0.0.1 → 10.0.0.2     TCP 2066 53241 → 47452 [PSH, ACK] Seq=37038 Ack=1 Win=74 Len=2000 TSval=1758596042 TSecr=1886574126
  119   0.874339     10.0.0.1 → 10.0.0.2     TCP 4066 [TCP Previous segment not captured] 54368 → 46356 [PSH, ACK] Seq=35038 Ack=1 Win=74 Len=4000 TSval=1758596045 TSecr=1886574129
  120   0.882428     10.0.0.1 → 10.0.0.2     TCP 1066 55943 → 42968 [PSH, ACK] Seq=38038 Ack=1 Win=74 Len=1000 TSval=1758596049 TSecr=1886574133
  121   0.884616     10.0.0.1 → 10.0.0.2     TCP 1066 54368 → 46356 [PSH, ACK] Seq=39038 Ack=1 Win=74 Len=1000 TSval=1758596059 TSecr=1886574144
  122   0.886721     10.0.0.1 → 10.0.0.2     TCP 3066 [TCP Previous segment not captured] 58169 → 25904 [PSH, ACK] Seq=37038 Ack=1 Win=74 Len=3000 TSval=1758596061 TSecr=1886574145
  123   0.892883     10.0.0.1 → 10.0.0.2     TCP 1066 55943 → 42968 [PSH, ACK] Seq=39038 Ack=1 Win=74 Len=1000 TSval=1758596067 TSecr=1886574152
  124   0.894933     10.0.0.1 → 10.0.0.2     TCP 1066 58169 → 25904 [PSH, ACK] Seq=40038 Ack=1 Win=74 Len=1000 TSval=1758596072 TSecr=1886574156
  125   0.898919     10.0.0.1 → 10.0.0.2     TCP 3066 [TCP Previous segment not captured] 55246 → 6776 [PSH, ACK] Seq=38001 Ack=1 Win=74 Len=3000 TSval=1758596082 TSecr=1886574166
  126   0.907059     10.0.0.1 → 10.0.0.2     TCP 1066 55246 → 6776 [PSH, ACK] Seq=41001 Ack=1 Win=74 Len=1000 TSval=1758596091 TSecr=1886574168
  127   0.923789     10.0.0.1 → 10.0.0.2     TCP 1066 [TCP Previous segment not captured] 53241 → 47452 [PSH, ACK] Seq=42038 Ack=1 Win=74 Len=1000 TSval=1758596107 TSecr=1886574192
  128   0.966555     10.0.0.1 → 10.0.0.2     TCP 2066 [TCP Previous segment not captured] 48193 → 59433 [PSH, ACK] Seq=56038 Ack=1 Win=74 Len=2000 TSval=1758596150 TSecr=1886574233
  129   0.981882     10.0.0.1 → 10.0.0.2     TCP 6066 [TCP Previous segment not captured] 54368 → 46356 [PSH, ACK] Seq=41038 Ack=1 Win=74 Len=6000 TSval=1758596159 TSecr=1886574234
  130   0.998191     10.0.0.1 → 10.0.0.2     TCP 4066 [TCP Previous segment not captured] 19551 → 35722 [PSH, ACK] Seq=60001 Ack=1 Win=74 Len=4000 TSval=1758596180 TSecr=1886574261
  131   1.003129     10.0.0.1 → 10.0.0.2     TCP 5066 [TCP Previous segment not captured] 55246 → 6776 [PSH, ACK] Seq=43001 Ack=1 Win=74 Len=5000 TSval=1758596182 TSecr=1886574266
  132   1.069147     10.0.0.1 → 10.0.0.2     TCP 6066 [TCP Previous segment not captured] 55943 → 42968 [PSH, ACK] Seq=48038 Ack=1 Win=74 Len=6000 TSval=1758596250 TSecr=1886574325
  133   1.078084     10.0.0.1 → 10.0.0.2     TCP 6066 [TCP Previous segment not captured] 54368 → 46356 [PSH, ACK] Seq=48038 Ack=1 Win=74 Len=6000 TSval=1758596255 TSecr=1886574328
  134   1.090217     10.0.0.1 → 10.0.0.2     TCP 6066 [TCP Previous segment not captured] 19551 → 35722 [PSH, ACK] Seq=65001 Ack=1 Win=74 Len=6000 TSval=1758596269 TSecr=1886574353
  135   1.121809     10.0.0.1 → 10.0.0.2     TCP 7066 [TCP Previous segment not captured] 58169 → 25904 [PSH, ACK] Seq=51038 Ack=1 Win=74 Len=7000 TSval=1758596304 TSecr=1886574387
  136   1.132891     10.0.0.1 → 10.0.0.2     TCP 1066 58169 → 25904 [PSH, ACK] Seq=58038 Ack=1 Win=74 Len=1000 TSval=1758596308 TSecr=1886574391
  137   1.134877     10.0.0.1 → 10.0.0.2     TCP 6066 [TCP Previous segment not captured] 48193 → 59433 [PSH, ACK] Seq=65038 Ack=1 Win=74 Len=6000 TSval=1758596315 TSecr=1886574399
  138   1.147015     10.0.0.1 → 10.0.0.2     TCP 1066 58169 → 25904 [PSH, ACK] Seq=59038 Ack=1 Win=74 Len=1000 TSval=1758596321 TSecr=1886574402
  139   1.149147     10.0.0.1 → 10.0.0.2     TCP 1066 48193 → 59433 [PSH, ACK] Seq=71038 Ack=1 Win=74 Len=1000 TSval=1758596327 TSecr=1886574404
  140   1.156811     10.0.0.1 → 10.0.0.2     TCP 1066 48193 → 59433 [PSH, ACK] Seq=72038 Ack=1 Win=74 Len=1000 TSval=1758596340 TSecr=1886574419
  141   1.159053     10.0.0.1 → 10.0.0.2     TCP 6066 [TCP Previous segment not captured] 32720 → 40783 [PSH, ACK] Seq=55038 Ack=1 Win=37888 Len=6000 TSval=1758596342 TSecr=1886574427
  142   1.187718     10.0.0.1 → 10.0.0.2     TCP 8066 [TCP Previous segment not captured] 55943 → 42968 [PSH, ACK] Seq=55038 Ack=1 Win=74 Len=8000 TSval=1758596371 TSecr=1886574455
  143   1.200653     10.0.0.1 → 10.0.0.2     TCP 1066 55943 → 42968 [PSH, ACK] Seq=63038 Ack=1 Win=74 Len=1000 TSval=1758596376 TSecr=1886574457
  144   1.203467     10.0.0.1 → 10.0.0.2     TCP 9066 [TCP Previous segment not captured] 54368 → 46356 [PSH, ACK] Seq=55038 Ack=1 Win=74 Len=9000 TSval=1758596381 TSecr=1886574459
  145   1.221343     10.0.0.1 → 10.0.0.2     TCP 8066 [TCP Previous segment not captured] 53241 → 47452 [PSH, ACK] Seq=56038 Ack=1 Win=74 Len=8000 TSval=1758596384 TSecr=1886574467
  146   1.237062     10.0.0.1 → 10.0.0.2     TCP 1066 54368 → 46356 [PSH, ACK] Seq=64038 Ack=1 Win=74 Len=1000 TSval=1758596390 TSecr=1886574473
  147   1.239231     10.0.0.1 → 10.0.0.2     TCP 3066 48193 → 59433 [PSH, ACK] Seq=73038 Ack=1 Win=74 Len=3000 TSval=1758596393 TSecr=1886574478
  148   1.245339     10.0.0.1 → 10.0.0.2     TCP 9514 [TCP Previous segment not captured] 19551 → 35722 [ACK] Seq=72001 Ack=1 Win=74 Len=9448 TSval=1758596411 TSecr=1886574360
  149   1.264375     10.0.0.1 → 10.0.0.2     TCP 618 19551 → 35722 [PSH, ACK] Seq=81449 Ack=1 Win=74 Len=552 TSval=1758596415 TSecr=1886574496
  150   1.265677     10.0.0.1 → 10.0.0.2     TCP 9066 [TCP Previous segment not captured] 55246 → 6776 [PSH, ACK] Seq=57001 Ack=1 Win=74 Len=9000 TSval=1758596416 TSecr=1886574498
  151   1.285070     10.0.0.1 → 10.0.0.2     TCP 2066 54368 → 46356 [PSH, ACK] Seq=65038 Ack=1 Win=74 Len=2000 TSval=1758596424 TSecr=1886574507
  152   1.288317     10.0.0.1 → 10.0.0.2     TCP 7066 [TCP Previous segment not captured] 32720 → 40783 [PSH, ACK] Seq=62038 Ack=1 Win=37888 Len=7000 TSval=1758596445 TSecr=1886574528
  153   1.302082     10.0.0.1 → 10.0.0.2     TCP 4066 54368 → 46356 [PSH, ACK] Seq=67038 Ack=1 Win=74 Len=4000 TSval=1758596475 TSecr=1886574556
  154   1.310365     10.0.0.1 → 10.0.0.2     TCP 2066 32720 → 40783 [PSH, ACK] Seq=69038 Ack=1 Win=37888 Len=2000 TSval=1758596479 TSecr=1886574559
  155   1.314243     10.0.0.1 → 10.0.0.2     TCP 1066 54368 → 46356 [PSH, ACK] Seq=71038 Ack=1 Win=74 Len=1000 TSval=1758596487 TSecr=1886574571
  156   1.316368     10.0.0.1 → 10.0.0.2     TCP 3066 [TCP Previous segment not captured] 58169 → 25904 [PSH, ACK] Seq=69038 Ack=1 Win=74 Len=3000 TSval=1758596489 TSecr=1886574573
  157   1.322508     10.0.0.1 → 10.0.0.2     TCP 1066 58169 → 25904 [PSH, ACK] Seq=72038 Ack=1 Win=74 Len=1000 TSval=1758596501 TSecr=1886574586
  158   1.325403     10.0.0.1 → 10.0.0.2     TCP 1066 58169 → 25904 [PSH, ACK] Seq=73038 Ack=1 Win=74 Len=1000 TSval=1758596508 TSecr=1886574592
  159   1.329907     10.0.0.1 → 10.0.0.2     TCP 9066 [TCP Previous segment not captured] 55943 → 42968 [PSH, ACK] Seq=65038 Ack=1 Win=74 Len=9000 TSval=1758596513 TSecr=1886574598
  160   1.344901     10.0.0.1 → 10.0.0.2     TCP 5066 [TCP Previous segment not captured] 55246 → 6776 [PSH, ACK] Seq=69001 Ack=1 Win=74 Len=5000 TSval=1758596520 TSecr=1886574604
  161   1.355684     10.0.0.1 → 10.0.0.2     TCP 1066 55943 → 42968 [PSH, ACK] Seq=74038 Ack=1 Win=74 Len=1000 TSval=1758596523 TSecr=1886574599
  162   1.358321     10.0.0.1 → 10.0.0.2     TCP 4066 [TCP Previous segment not captured] 53241 → 47452 [PSH, ACK] Seq=71038 Ack=1 Win=74 Len=4000 TSval=1758596531 TSecr=1886574615
  163   1.365295     10.0.0.1 → 10.0.0.2     TCP 1066 55943 → 42968 [PSH, ACK] Seq=75038 Ack=1 Win=74 Len=1000 TSval=1758596544 TSecr=1886574627
  164   1.373897     10.0.0.1 → 10.0.0.2     TCP 3066 58169 → 25904 [PSH, ACK] Seq=74038 Ack=1 Win=74 Len=3000 TSval=1758596557 TSecr=1886574642
  165   1.377729     10.0.0.1 → 10.0.0.2     TCP 1066 58169 → 25904 [PSH, ACK] Seq=77038 Ack=1 Win=74 Len=1000 TSval=1758596561 TSecr=1886574643
  166   1.395709     10.0.0.1 → 10.0.0.2     TCP 5066 [TCP Previous segment not captured] 19551 → 35722 [PSH, ACK] Seq=89001 Ack=1 Win=74 Len=5000 TSval=1758596579 TSecr=1886574663
  167   1.417418     10.0.0.1 → 10.0.0.2     TCP 5066 [TCP Previous segment not captured] 55246 → 6776 [PSH, ACK] Seq=75001 Ack=1 Win=74 Len=5000 TSval=1758596600 TSecr=1886574684
  168   1.424350     10.0.0.1 → 10.0.0.2     TCP 5066 [TCP Previous segment not captured] 53241 → 47452 [PSH, ACK] Seq=76038 Ack=1 Win=74 Len=5000 TSval=1758596604 TSecr=1886574688
  169   1.434482     10.0.0.1 → 10.0.0.2     TCP 5066 [TCP Previous segment not captured] 48193 → 59433 [PSH, ACK] Seq=88038 Ack=1 Win=74 Len=5000 TSval=1758596608 TSecr=1886574692
  170   1.444623     10.0.0.1 → 10.0.0.2     TCP 3066 19551 → 35722 [PSH, ACK] Seq=94001 Ack=1 Win=74 Len=3000 TSval=1758596621 TSecr=1886574706
  171   1.450758     10.0.0.1 → 10.0.0.2     TCP 9066 [TCP Previous segment not captured] 54368 → 46356 [PSH, ACK] Seq=73038 Ack=1 Win=74 Len=9000 TSval=1758596626 TSecr=1886574710
  172   1.491884     10.0.0.1 → 10.0.0.2     TCP 1066 19551 → 35722 [PSH, ACK] Seq=97001 Ack=1 Win=74 Len=1000 TSval=1758596630 TSecr=1886574714
  173   1.508619     10.0.0.1 → 10.0.0.2     TCP 5066 [TCP Previous segment not captured] 53241 → 47452 [PSH, ACK] Seq=82038 Ack=1 Win=74 Len=5000 TSval=1758596688 TSecr=1886574766
  174   1.515659     10.0.0.1 → 10.0.0.2     TCP 5066 [TCP Previous segment not captured] 32720 → 40783 [PSH, ACK] Seq=82038 Ack=1 Win=37888 Len=5000 TSval=1758596693 TSecr=1886574766
  175   1.527227     10.0.0.1 → 10.0.0.2     TCP 5066 19551 → 35722 [PSH, ACK] Seq=98001 Ack=1 Win=74 Len=5000 TSval=1758596694 TSecr=1886574767
  176   1.537352     10.0.0.1 → 10.0.0.2     TCP 9066 [TCP Previous segment not captured] 58169 → 25904 [PSH, ACK] Seq=79038 Ack=1 Win=74 Len=9000 TSval=1758596695 TSecr=1886574778
  177   1.553964     10.0.0.1 → 10.0.0.2     TCP 1066 53241 → 47452 [PSH, ACK] Seq=87038 Ack=1 Win=74 Len=1000 TSval=1758596696 TSecr=1886574779
  178   1.556081     10.0.0.1 → 10.0.0.2     TCP 1066 32720 → 40783 [PSH, ACK] Seq=87038 Ack=1 Win=37888 Len=1000 TSval=1758596702 TSecr=1886574785
  179   1.558215     10.0.0.1 → 10.0.0.2     TCP 6066 [TCP Previous segment not captured] 48193 → 59433 [PSH, ACK] Seq=94038 Ack=1 Win=74 Len=6000 TSval=1758596704 TSecr=1886574787
  180   1.570344     10.0.0.1 → 10.0.0.2     TCP 7066 [TCP Previous segment not captured] 54368 → 46356 [PSH, ACK] Seq=83038 Ack=1 Win=74 Len=7000 TSval=1758596723 TSecr=1886574799
  181   1.584532     10.0.0.1 → 10.0.0.2     TCP 3066 [TCP Previous segment not captured] 55246 → 6776 [PSH, ACK] Seq=86001 Ack=1 Win=74 Len=3000 TSval=1758596727 TSecr=1886574806
  182   1.590626     10.0.0.1 → 10.0.0.2     TCP 2066 [TCP Previous segment not captured] 55943 → 42968 [PSH, ACK] Seq=89038 Ack=1 Win=74 Len=2000 TSval=1758596742 TSecr=1886574824
  183   1.594739     10.0.0.1 → 10.0.0.2     TCP 3066 32720 → 40783 [PSH, ACK] Seq=88038 Ack=1 Win=37888 Len=3000 TSval=1758596744 TSecr=1886574827
  184   1.601849     10.0.0.1 → 10.0.0.2     TCP 3066 48193 → 59433 [PSH, ACK] Seq=100038 Ack=1 Win=74 Len=3000 TSval=1758596745 TSecr=1886574828
  185   1.607005     10.0.0.1 → 10.0.0.2     TCP 2066 54368 → 46356 [PSH, ACK] Seq=90038 Ack=1 Win=74 Len=2000 TSval=1758596756 TSecr=1886574840
  186   1.611135     10.0.0.1 → 10.0.0.2     TCP 3066 [TCP Previous segment not captured] 53241 → 47452 [PSH, ACK] Seq=91038 Ack=1 Win=74 Len=3000 TSval=1758596780 TSecr=1886574864
  187   1.633529     10.0.0.1 → 10.0.0.2     TCP 4066 [TCP Previous segment not captured] 58169 → 25904 [PSH, ACK] Seq=93038 Ack=1 Win=74 Len=4000 TSval=1758596817 TSecr=1886574901
  188   1.690300     10.0.0.1 → 10.0.0.2     TCP 6066 [TCP Previous segment not captured] 54368 → 46356 [PSH, ACK] Seq=95038 Ack=1 Win=74 Len=6000 TSval=1758596874 TSecr=1886574958
  189   1.707607     10.0.0.1 → 10.0.0.2     TCP 4066 [TCP Previous segment not captured] 58169 → 25904 [PSH, ACK] Seq=98038 Ack=1 Win=74 Len=4000 TSval=1758596890 TSecr=1886574971
  190   1.713158     10.0.0.1 → 10.0.0.2     TCP 5066 [TCP Previous segment not captured] 55943 → 42968 [PSH, ACK] Seq=98038 Ack=1 Win=74 Len=5000 TSval=1758596896 TSecr=1886574977
  191   1.723082     10.0.0.1 → 10.0.0.2     TCP 5066 [TCP Previous segment not captured] 53241 → 47452 [PSH, ACK] Seq=98038 Ack=1 Win=74 Len=5000 TSval=1758596907 TSecr=1886574991
  192   1.732894     10.0.0.1 → 10.0.0.2     TCP 1066 53241 → 47452 [PSH, ACK] Seq=103038 Ack=1 Win=74 Len=1000 TSval=1758596908 TSecr=1886574992
  193   1.735584     10.0.0.1 → 10.0.0.2     TCP 618 [TCP Previous segment not captured] 48193 → 59433 [PSH, ACK] Seq=115486 Ack=1 Win=74 Len=552 TSval=1758596919 TSecr=1886575002
  194   1.737557     10.0.0.1 → 10.0.0.2     TCP 9514 [TCP Out-Of-Order] 48193 → 59433 [ACK] Seq=106038 Ack=1 Win=74 Len=9448 TSval=1758596921 TSecr=1886575005
  195   1.755222     10.0.0.1 → 10.0.0.2     TCP 1066 53241 → 47452 [PSH, ACK] Seq=104038 Ack=1 Win=74 Len=1000 TSval=1758596921 TSecr=1886575004
  196   1.757350     10.0.0.1 → 10.0.0.2     TCP 5066 [TCP Previous segment not captured] 55246 → 6776 [PSH, ACK] Seq=99001 Ack=1 Win=74 Len=5000 TSval=1758596923 TSecr=1886575007
  197   1.767467     10.0.0.1 → 10.0.0.2     TCP 1066 48193 → 59433 [PSH, ACK] Seq=116038 Ack=1 Win=74 Len=1000 TSval=1758596927 TSecr=1886575007
  198   1.769599     10.0.0.1 → 10.0.0.2     TCP 2618 [TCP Previous segment not captured] 32720 → 40783 [PSH, ACK] Seq=103486 Ack=1 Win=37888 Len=2552 TSval=1758596937 TSecr=1886575022
  199   1.774873     10.0.0.1 → 10.0.0.2     TCP 1066 55246 → 6776 [PSH, ACK] Seq=104001 Ack=1 Win=74 Len=1000 TSval=1758596942 TSecr=1886575027
  200   1.776967     10.0.0.1 → 10.0.0.2     TCP 9514 [TCP Out-Of-Order] 32720 → 40783 [ACK] Seq=94038 Ack=1 Win=37888 Len=9448 TSval=1758596955 TSecr=1886575039
  201   1.881175     10.0.0.1 → 10.0.0.2     TCP 9066 [TCP Previous segment not captured] 19551 → 35722 [PSH, ACK] Seq=122001 Ack=1 Win=74 Len=9000 TSval=1758597065 TSecr=1886575149
  202   1.905171     10.0.0.1 → 10.0.0.2     TCP 1618 [TCP Previous segment not captured] 48193 → 59433 [PSH, ACK] Seq=127486 Ack=1 Win=74 Len=1552 TSval=1758597089 TSecr=1886575173
  203   1.909239     10.0.0.1 → 10.0.0.2     TCP 618 [TCP Previous segment not captured] 55246 → 6776 [PSH, ACK] Seq=116449 Ack=1 Win=74 Len=552 TSval=1758597093 TSecr=1886575177
  204   1.910756     10.0.0.1 → 10.0.0.2     TCP 9514 [TCP Previous segment not captured] 32720 → 40783 [ACK] Seq=108038 Ack=1 Win=37888 Len=9448 TSval=1758597094 TSecr=1886575068
  205   1.935319     10.0.0.1 → 10.0.0.2     TCP 9514 [TCP Retransmission] 55246 → 6776 [ACK] Seq=107001 Ack=1 Win=74 Len=9448 TSval=1758597094 TSecr=1886575179
  206   1.951153     10.0.0.1 → 10.0.0.2     TCP 9514 [TCP Previous segment not captured] 54368 → 46356 [ACK] Seq=108038 Ack=1 Win=74 Len=9448 TSval=1758597096 TSecr=1886575060
  207   1.970181     10.0.0.1 → 10.0.0.2     TCP 2066 [TCP Out-Of-Order] 32720 → 40783 [PSH, ACK] Seq=106038 Ack=1 Win=37888 Len=2000 TSval=1758597096 TSecr=1886575180
  208   1.974330     10.0.0.1 → 10.0.0.2     TCP 618 32720 → 40783 [PSH, ACK] Seq=117486 Ack=1 Win=37888 Len=552 TSval=1758597101 TSecr=1886575185
  209   1.975547     10.0.0.1 → 10.0.0.2     TCP 9514 [TCP Previous segment not captured] 53241 → 47452 [ACK] Seq=109038 Ack=1 Win=74 Len=9448 TSval=1758597108 TSecr=1886575066
  210   1.994620     10.0.0.1 → 10.0.0.2     TCP 9514 [TCP Previous segment not captured] 58169 → 25904 [ACK] Seq=109038 Ack=1 Win=74 Len=9448 TSval=1758597108 TSecr=1886575064
  211   2.013621     10.0.0.1 → 10.0.0.2     TCP 618 54368 → 46356 [PSH, ACK] Seq=117486 Ack=1 Win=74 Len=552 TSval=1758597109 TSecr=1886575194
  212   2.014886     10.0.0.1 → 10.0.0.2     TCP 2066 55246 → 6776 [PSH, ACK] Seq=117001 Ack=1 Win=74 Len=2000 TSval=1758597123 TSecr=1886575206
  213   2.019042     10.0.0.1 → 10.0.0.2     TCP 4066 32720 → 40783 [PSH, ACK] Seq=118038 Ack=1 Win=37888 Len=4000 TSval=1758597160 TSecr=1886575244
  214   2.027123     10.0.0.1 → 10.0.0.2     TCP 1618 [TCP Previous segment not captured] 55943 → 42968 [PSH, ACK] Seq=121486 Ack=1 Win=74 Len=1552 TSval=1758597175 TSecr=1886575258
  215   2.030367     10.0.0.1 → 10.0.0.2     TCP 6066 55246 → 6776 [PSH, ACK] Seq=119001 Ack=1 Win=74 Len=6000 TSval=1758597200 TSecr=1886575285
  216   2.042516     10.0.0.1 → 10.0.0.2     TCP 8066 48193 → 59433 [PSH, ACK] Seq=129038 Ack=1 Win=74 Len=8000 TSval=1758597206 TSecr=1886575291
  217   2.058619     10.0.0.1 → 10.0.0.2     TCP 9514 [TCP Previous segment not captured] 19551 → 35722 [ACK] Seq=132001 Ack=1 Win=74 Len=9448 TSval=1758597211 TSecr=1886575151
  218   2.077657     10.0.0.1 → 10.0.0.2     TCP 1066 55246 → 6776 [PSH, ACK] Seq=125001 Ack=1 Win=74 Len=1000 TSval=1758597215 TSecr=1886575300
  219   2.079783     10.0.0.1 → 10.0.0.2     TCP 2066 48193 → 59433 [PSH, ACK] Seq=137038 Ack=1 Win=74 Len=2000 TSval=1758597228 TSecr=1886575312
  220   2.083936     10.0.0.1 → 10.0.0.2     TCP 1066 [TCP Retransmission] 19551 → 35722 [PSH, ACK] Seq=131001 Ack=1 Win=74 Len=1000 TSval=1758597246 TSecr=1886575328
  221   2.086084     10.0.0.1 → 10.0.0.2     TCP 9066 [TCP Previous segment not captured] 58169 → 25904 [PSH, ACK] Seq=120038 Ack=1 Win=74 Len=9000 TSval=1758597249 TSecr=1886575218
  222   2.147984     10.0.0.1 → 10.0.0.2     TCP 9514 55943 → 42968 [ACK] Seq=123038 Ack=1 Win=74 Len=9448 TSval=1758597331 TSecr=1886575416
  223   2.163824     10.0.0.1 → 10.0.0.2     TCP 9514 [TCP Previous segment not captured] 32720 → 40783 [ACK] Seq=126038 Ack=1 Win=37888 Len=9448 TSval=1758597334 TSecr=1886575288
  224   2.182852     10.0.0.1 → 10.0.0.2     TCP 4066 [TCP Out-Of-Order] 32720 → 40783 [PSH, ACK] Seq=122038 Ack=1 Win=37888 Len=4000 TSval=1758597349 TSecr=1886575433
  225   2.190982     10.0.0.1 → 10.0.0.2     TCP 2618 32720 → 40783 [PSH, ACK] Seq=135486 Ack=1 Win=37888 Len=2552 TSval=1758597368 TSecr=1886575452
  226   2.196232     10.0.0.1 → 10.0.0.2     TCP 6618 [TCP Previous segment not captured] 53241 → 47452 [PSH, ACK] Seq=131486 Ack=1 Win=74 Len=6552 TSval=1758597369 TSecr=1886575453
  227   2.209449     10.0.0.1 → 10.0.0.2     TCP 9514 [TCP Previous segment not captured] 19551 → 35722 [ACK] Seq=144001 Ack=1 Win=74 Len=9448 TSval=1758597371 TSecr=1886575353
  228   2.228483     10.0.0.1 → 10.0.0.2     TCP 9514 [TCP Retransmission] 53241 → 47452 [ACK] Seq=122038 Ack=1 Win=74 Len=9448 TSval=1758597381 TSecr=1886575465
  229   2.247511     10.0.0.1 → 10.0.0.2     TCP 9514 [TCP Previous segment not captured] 55246 → 6776 [ACK] Seq=129001 Ack=1 Win=74 Len=9448 TSval=1758597384 TSecr=1886575371
  230   2.266539     10.0.0.1 → 10.0.0.2     TCP 4618 [TCP Previous segment not captured] 54368 → 46356 [PSH, ACK] Seq=134486 Ack=1 Win=74 Len=4552 TSval=1758597384 TSecr=1886575468
  231   2.275771     10.0.0.1 → 10.0.0.2     TCP 9514 [TCP Previous segment not captured] 48193 → 59433 [ACK] Seq=142038 Ack=1 Win=74 Len=9448 TSval=1758597394 TSecr=1886575349
  232   2.294808     10.0.0.1 → 10.0.0.2     TCP 2618 [TCP Retransmission] 19551 → 35722 [PSH, ACK] Seq=141449 Ack=1 Win=74 Len=2552 TSval=1758597394 TSecr=1886575479
  233   2.300066     10.0.0.1 → 10.0.0.2     TCP 9514 [TCP Retransmission] 54368 → 46356 [ACK] Seq=125038 Ack=1 Win=74 Len=9448 TSval=1758597452 TSecr=1886575536
  234   2.319075     10.0.0.1 → 10.0.0.2     TCP 9514 [TCP Previous segment not captured] 58169 → 25904 [ACK] Seq=135038 Ack=1 Win=74 Len=9448 TSval=1758597454 TSecr=1886575409
  235   2.338091     10.0.0.1 → 10.0.0.2     TCP 9514 [TCP Previous segment not captured] 55943 → 42968 [ACK] Seq=135038 Ack=1 Win=74 Len=9448 TSval=1758597456 TSecr=1886575513
  236   2.357129     10.0.0.1 → 10.0.0.2     TCP 3066 [TCP Retransmission] 48193 → 59433 [PSH, ACK] Seq=139038 Ack=1 Win=74 Len=3000 TSval=1758597461 TSecr=1886575545
  237   2.363263     10.0.0.1 → 10.0.0.2     TCP 7618 19551 → 35722 [PSH, ACK] Seq=153449 Ack=1 Win=74 Len=7552 TSval=1758597466 TSecr=1886575551
  238   2.378489     10.0.0.1 → 10.0.0.2     TCP 8066 54368 → 46356 [PSH, ACK] Seq=139038 Ack=1 Win=74 Len=8000 TSval=1758597485 TSecr=1886575569
  239   2.394635     10.0.0.1 → 10.0.0.2     TCP 7618 48193 → 59433 [PSH, ACK] Seq=151486 Ack=1 Win=74 Len=7552 TSval=1758597489 TSecr=1886575573
  240   2.409866     10.0.0.1 → 10.0.0.2     TCP 6066 [TCP Retransmission] 58169 → 25904 [PSH, ACK] Seq=129038 Ack=1 Win=74 Len=6000 TSval=1758597504 TSecr=1886575588
  241   2.422023     10.0.0.1 → 10.0.0.2     TCP 9514 [TCP Previous segment not captured] 32720 → 40783 [ACK] Seq=139038 Ack=1 Win=37888 Len=9448 TSval=1758597508 TSecr=1886575496
  242   2.444325     10.0.0.1 → 10.0.0.2     TCP 9514 [TCP Previous segment not captured] 53241 → 47452 [ACK] Seq=141038 Ack=1 Win=74 Len=9448 TSval=1758597534 TSecr=1886575592
  243   2.460158     10.0.0.1 → 10.0.0.2     TCP 6066 19551 → 35722 [PSH, ACK] Seq=161001 Ack=1 Win=74 Len=6000 TSval=1758597549 TSecr=1886575633
  244   2.472289     10.0.0.1 → 10.0.0.2     TCP 170 [TCP Previous segment not captured] 58169 → 25904 [PSH, ACK] Seq=153934 Ack=1 Win=74 Len=104 TSval=1758597584 TSecr=1886575668
  245   2.472629     10.0.0.1 → 10.0.0.2     TCP 6618 32720 → 40783 [PSH, ACK] Seq=148486 Ack=1 Win=37888 Len=6552 TSval=1758597597 TSecr=1886575496
  246   2.485873     10.0.0.1 → 10.0.0.2     TCP 9514 [TCP Previous segment not captured] 55246 → 6776 [ACK] Seq=145001 Ack=1 Win=74 Len=9448 TSval=1758597598 TSecr=1886575561
  247   2.504908     10.0.0.1 → 10.0.0.2     TCP 1066 [TCP Out-Of-Order] 32720 → 40783 [PSH, ACK] Seq=138038 Ack=1 Win=37888 Len=1000 TSval=1758597608 TSecr=1886575691
  248   2.507047     10.0.0.1 → 10.0.0.2     TCP 2170 [TCP Previous segment not captured] 55943 → 42968 [PSH, ACK] Seq=153934 Ack=1 Win=74 Len=2104 TSval=1758597610 TSecr=1886575693
  249   2.511375     10.0.0.1 → 10.0.0.2     TCP 6618 53241 → 47452 [PSH, ACK] Seq=150486 Ack=1 Win=74 Len=6552 TSval=1758597623 TSecr=1886575707
  250   2.524602     10.0.0.1 → 10.0.0.2     TCP 9514 [TCP Retransmission] 58169 → 25904 [ACK] Seq=144486 Ack=1 Win=74 Len=9448 TSval=1758597665 TSecr=1886575742
