    1   0.000000     10.0.0.2 → 10.0.0.1     TCP 74 35722 → 42763 [SYN, ACK] Seq=0 Ack=1 Win=37792 Len=0 MSS=9460 SACK_PERM TSval=1886573260 TSecr=1758595171 WS=512
    2   0.006299     10.0.0.2 → 10.0.0.1     TCP 74 59433 → 36467 [SYN, ACK] Seq=0 Ack=1 Win=37792 Len=0 MSS=9460 SACK_PERM TSval=1886573266 TSecr=1758595179 WS=512
    3   0.006322     10.0.0.2 → 10.0.0.1     TCP 66 35722 → 42763 [ACK] Seq=1 Ack=38 Win=37888 Len=0 TSval=1886573266 TSecr=1758595179
    4   0.010335     10.0.0.2 → 10.0.0.1     TCP 67 59433 → 36467 [PSH, ACK] Seq=1 Ack=38 Win=37888 Len=1 TSval=1886573270 TSecr=1758595183
    5   0.034988     10.0.0.2 → 10.0.0.1     TCP 74 6776 → 55655 [SYN, ACK] Seq=0 Ack=1 Win=37792 Len=0 MSS=9460 SACK_PERM TSval=1886573293 TSecr=1758595202 WS=512
    6   0.039984     10.0.0.2 → 10.0.0.1     TCP 67 40783 → 58271 [PSH, ACK] Seq=1 Ack=1 Win=74 Len=1 TSval=1886573298 TSecr=1758595208
    7   0.040508     10.0.0.2 → 10.0.0.1     TCP 74 42968 → 49189 [SYN, ACK] Seq=0 Ack=1 Win=37792 Len=0 MSS=9460 SACK_PERM TSval=1886573298 TSecr=1758595206 WS=512
    8   0.042542     10.0.0.2 → 10.0.0.1     TCP 67 25904 → 51099 [PSH, ACK] Seq=1 Ack=1 Win=74 Len=1 TSval=1886573299 TSecr=1758595208
    9   0.044126     10.0.0.2 → 10.0.0.1     TCP 66 6776 → 55655 [ACK] Seq=1 Ack=38 Win=37888 Len=0 TSval=1886573304 TSecr=1758595212
   10   0.044932     10.0.0.2 → 10.0.0.1     TCP 67 6776 → 55655 [PSH, ACK] Seq=1 Ack=38 Win=37888 Len=1 TSval=1886573304 TSecr=1758595212
   11   0.049797     10.0.0.2 → 10.0.0.1     TCP 67 46356 → 47085 [PSH, ACK] Seq=1 Ack=1 Win=74 Len=1 TSval=1886573309 TSecr=1758595217
   12   0.054059     10.0.0.2 → 10.0.0.1     TCP 66 [TCP Previous segment not captured] 35722 → 42763 [ACK] Seq=2 Ack=42 Win=37888 Len=0 TSval=1886573314 TSecr=1758595186
   13   0.056622     10.0.0.2 → 10.0.0.1     TCP 66 35722 → 42763 [ACK] Seq=2 Ack=159 Win=37888 Len=0 TSval=1886573316 TSecr=1758595230
   14   0.056899     10.0.0.2 → 10.0.0.1     TCP 67 35722 → 42763 [PSH, ACK] Seq=2 Ack=159 Win=37888 Len=1 TSval=1886573316 TSecr=1758595230
   15   0.057694     10.0.0.2 → 10.0.0.1     TCP 66 59433 → 36467 [ACK] Seq=2 Ack=42 Win=37888 Len=0 TSval=1886573318 TSecr=1758595186
   16   0.066012     10.0.0.2 → 10.0.0.1     TCP 66 59433 → 36467 [ACK] Seq=2 Ack=159 Win=37888 Len=0 TSval=1886573320 TSecr=1758595234
   17   0.112664     10.0.0.2 → 10.0.0.1     TCP 66 47452 → 39475 [ACK] Seq=1 Ack=1 Win=74 Len=0 TSval=1886573358 TSecr=1758595212
   18   0.122025     10.0.0.2 → 10.0.0.1     TCP 66 6776 → 55655 [ACK] Seq=2 Ack=42 Win=37888 Len=0 TSval=1886573358 TSecr=1758595223
   19   0.123235     10.0.0.2 → 10.0.0.1     TCP 66 25904 → 51099 [ACK] Seq=2 Ack=5 Win=74 Len=0 TSval=1886573358 TSecr=1758595223
   20   0.123879     10.0.0.2 → 10.0.0.1     TCP 66 46356 → 47085 [ACK] Seq=2 Ack=5 Win=74 Len=0 TSval=1886573358 TSecr=1758595228
   21   0.139473     10.0.0.2 → 10.0.0.1     TCP 66 47452 → 39475 [ACK] Seq=1 Ack=118 Win=74 Len=0 TSval=1886573399 TSecr=1758595309
   22   0.149667     10.0.0.2 → 10.0.0.1     TCP 67 6776 → 55655 [PSH, ACK] Seq=2 Ack=159 Win=37888 Len=1 TSval=1886573409 TSecr=1758595312
   23   0.152920     10.0.0.2 → 10.0.0.1     TCP 66 25904 → 51099 [ACK] Seq=2 Ack=122 Win=74 Len=0 TSval=1886573413 TSecr=1758595312
   24   0.155126     10.0.0.2 → 10.0.0.1     TCP 66 46356 → 47085 [ACK] Seq=2 Ack=122 Win=74 Len=0 TSval=1886573415 TSecr=1758595313
   25   0.155480     10.0.0.2 → 10.0.0.1     TCP 67 46356 → 47085 [PSH, ACK] Seq=2 Ack=122 Win=74 Len=1 TSval=1886573415 TSecr=1758595313
   26   0.163083     10.0.0.2 → 10.0.0.1     TCP 66 40783 → 58271 [ACK] Seq=2 Ack=122 Win=74 Len=0 TSval=1886573422 TSecr=1758595314
   27   0.185014     10.0.0.2 → 10.0.0.1     TCP 67 [TCP Previous segment not captured] 42968 → 49189 [PSH, ACK] Seq=2 Ack=159 Win=37888 Len=1 TSval=1886573438 TSecr=1758595317
   28   0.203908     10.0.0.2 → 10.0.0.1     TCP 66 35722 → 19551 [ACK] Seq=1 Ack=1 Win=73 Len=0 TSval=1886573464 TSecr=1758595317
   29   0.207855     10.0.0.2 → 10.0.0.1     TCP 74 47452 → 53241 [SYN, ACK] Seq=0 Ack=1 Win=37792 Len=0 MSS=9460 SACK_PERM TSval=1886573468 TSecr=1758595379 WS=512
   30   0.209973     10.0.0.2 → 10.0.0.1     TCP 74 6776 → 55246 [SYN, ACK] Seq=0 Ack=1 Win=37792 Len=0 MSS=9460 SACK_PERM TSval=1886573470 TSecr=1758595380 WS=512
   31   0.211247     10.0.0.2 → 10.0.0.1     TCP 66 59433 → 48193 [ACK] Seq=1 Ack=1 Win=73 Len=0 TSval=1886573471 TSecr=1758595380
   32   0.212266     10.0.0.2 → 10.0.0.1     TCP 74 25904 → 58169 [SYN, ACK] Seq=0 Ack=1 Win=37792 Len=0 MSS=9460 SACK_PERM TSval=1886573472 TSecr=1758595381 WS=512
   33   0.213704     10.0.0.2 → 10.0.0.1     TCP 74 46356 → 54368 [SYN, ACK] Seq=0 Ack=1 Win=37792 Len=0 MSS=9460 SACK_PERM TSval=1886573473 TSecr=1758595381 WS=512
   34   0.222453     10.0.0.2 → 10.0.0.1     TCP 74 40783 → 32720 [SYN, ACK] Seq=0 Ack=1 Win=37792 Len=0 MSS=9460 SACK_PERM TSval=1886573482 TSecr=1758595382 WS=512
   35   0.230833     10.0.0.2 → 10.0.0.1     TCP 66 35722 → 19551 [ACK] Seq=1 Ack=5001 Win=67 Len=0 TSval=1886573491 TSecr=1758595385
   36   0.259644     10.0.0.2 → 10.0.0.1     TCP 66 47452 → 53241 [ACK] Seq=1 Ack=38 Win=37888 Len=0 TSval=1886573520 TSecr=1758595399
   37   0.331992     10.0.0.2 → 10.0.0.1     TCP 66 40783 → 32720 [ACK] Seq=1 Ack=38 Win=37888 Len=0 TSval=1886573592 TSecr=1758595417
   38   0.340930     10.0.0.2 → 10.0.0.1     TCP 68 [TCP Previous segment not captured] 25904 → 51099 [PSH, ACK] Seq=3 Ack=122 Win=74 Len=2 TSval=1886573601 TSecr=1758595421
   39   0.356375     10.0.0.2 → 10.0.0.1     TCP 66 35722 → 19551 [ACK] Seq=1 Ack=8001 Win=67 Len=0 TSval=1886573616 TSecr=1758595436
   40   0.368864     10.0.0.2 → 10.0.0.1     TCP 66 35722 → 19551 [ACK] Seq=1 Ack=16001 Win=67 Len=0 TSval=1886573629 TSecr=1758595534
   41   0.380545     10.0.0.2 → 10.0.0.1     TCP 66 47452 → 53241 [ACK] Seq=1 Ack=1038 Win=37376 Len=0 TSval=1886573640 TSecr=1758595534
   42   0.383228     10.0.0.2 → 10.0.0.1     TCP 66 6776 → 55246 [ACK] Seq=1 Ack=1038 Win=37376 Len=0 TSval=1886573643 TSecr=1758595543
   43   0.384504     10.0.0.2 → 10.0.0.1     TCP 66 59433 → 48193 [ACK] Seq=1 Ack=12001 Win=67 Len=0 TSval=1886573645 TSecr=1758595544
   44   0.386693     10.0.0.2 → 10.0.0.1     TCP 66 35722 → 19551 [ACK] Seq=1 Ack=17001 Win=67 Len=0 TSval=1886573647 TSecr=1758595549
   45   0.388754     10.0.0.2 → 10.0.0.1     TCP 66 47452 → 53241 [ACK] Seq=1 Ack=2038 Win=36864 Len=0 TSval=1886573649 TSecr=1758595556
   46   0.390890     10.0.0.2 → 10.0.0.1     TCP 66 6776 → 55246 [ACK] Seq=1 Ack=2038 Win=36864 Len=0 TSval=1886573651 TSecr=1758595559
   47   0.394613     10.0.0.2 → 10.0.0.1     TCP 66 25904 → 58169 [ACK] Seq=1 Ack=1038 Win=37376 Len=0 TSval=1886573655 TSecr=1758595534
   48   0.401558     10.0.0.2 → 10.0.0.1     TCP 66 25904 → 58169 [ACK] Seq=1 Ack=4038 Win=35328 Len=0 TSval=1886573661 TSecr=1758595574
   49   0.407494     10.0.0.2 → 10.0.0.1     TCP 66 42968 → 55943 [ACK] Seq=1 Ack=1 Win=72 Len=0 TSval=1886573667 TSecr=1758595558
   50   0.420903     10.0.0.2 → 10.0.0.1     TCP 66 59433 → 48193 [ACK] Seq=1 Ack=16001 Win=67 Len=0 TSval=1886573681 TSecr=1758595594
   51   0.426948     10.0.0.2 → 10.0.0.1     TCP 66 6776 → 55246 [ACK] Seq=1 Ack=5038 Win=34816 Len=0 TSval=1886573687 TSecr=1758595601
   52   0.436238     10.0.0.2 → 10.0.0.1     TCP 66 6776 → 55246 [ACK] Seq=1 Ack=6038 Win=34304 Len=0 TSval=1886573696 TSecr=1758595611
   53   0.453265     10.0.0.2 → 10.0.0.1     TCP 66 42968 → 55943 [ACK] Seq=1 Ack=2001 Win=69 Len=0 TSval=1886573713 TSecr=1758595583
   54   0.465810     10.0.0.2 → 10.0.0.1     TCP 66 35722 → 19551 [ACK] Seq=1 Ack=20001 Win=67 Len=0 TSval=1886573726 TSecr=1758595592
   55   0.467520     10.0.0.2 → 10.0.0.1     TCP 66 35722 → 19551 [ACK] Seq=1 Ack=24001 Win=67 Len=0 TSval=1886573728 TSecr=1758595642
   56   0.474004     10.0.0.2 → 10.0.0.1     TCP 66 47452 → 53241 [ACK] Seq=1 Ack=6038 Win=34304 Len=0 TSval=1886573734 TSecr=1758595601
   57   0.478365     10.0.0.2 → 10.0.0.1     TCP 66 40783 → 32720 [ACK] Seq=1 Ack=6038 Win=34304 Len=0 TSval=1886573738 TSecr=1758595606
   58   0.479867     10.0.0.2 → 10.0.0.1     TCP 66 35722 → 19551 [ACK] Seq=1 Ack=25001 Win=67 Len=0 TSval=1886573739 TSecr=1758595651
   59   0.480802     10.0.0.2 → 10.0.0.1     TCP 66 47452 → 53241 [ACK] Seq=1 Ack=10038 Win=34304 Len=0 TSval=1886573741 TSecr=1758595654
   60   0.495224     10.0.0.2 → 10.0.0.1     TCP 66 42968 → 55943 [ACK] Seq=1 Ack=5001 Win=67 Len=0 TSval=1886573755 TSecr=1758595629
   61   0.496710     10.0.0.2 → 10.0.0.1     TCP 66 42968 → 55943 [ACK] Seq=1 Ack=9001 Win=67 Len=0 TSval=1886573757 TSecr=1758595671
   62   0.536110     10.0.0.2 → 10.0.0.1     TCP 66 59433 → 48193 [ACK] Seq=1 Ack=21001 Win=67 Len=0 TSval=1886573796 TSecr=1758595663
   63   0.556735     10.0.0.2 → 10.0.0.1     TCP 66 6776 → 55246 [ACK] Seq=1 Ack=10038 Win=34304 Len=0 TSval=1886573817 TSecr=1758595667
   64   0.572610     10.0.0.2 → 10.0.0.1     TCP 66 47452 → 53241 [ACK] Seq=1 Ack=11038 Win=34304 Len=0 TSval=1886573832 TSecr=1758595668
   65   0.577529     10.0.0.2 → 10.0.0.1     TCP 66 46356 → 54368 [ACK] Seq=1 Ack=12038 Win=34304 Len=0 TSval=1886573838 TSecr=1758595684
   66   0.588565     10.0.0.2 → 10.0.0.1     TCP 66 46356 → 54368 [ACK] Seq=1 Ack=18038 Win=34304 Len=0 TSval=1886573849 TSecr=1758595763
   67   0.593878     10.0.0.2 → 10.0.0.1     TCP 66 25904 → 58169 [ACK] Seq=1 Ack=12038 Win=34304 Len=0 TSval=1886573854 TSecr=1758595687
   68   0.595465     10.0.0.2 → 10.0.0.1     TCP 66 25904 → 58169 [ACK] Seq=1 Ack=18038 Win=34304 Len=0 TSval=1886573855 TSecr=1758595770
   69   0.620791     10.0.0.2 → 10.0.0.1     TCP 66 40783 → 32720 [ACK] Seq=1 Ack=20038 Win=34304 Len=0 TSval=1886573881 TSecr=1758595788
   70   0.627460     10.0.0.2 → 10.0.0.1     TCP 66 59433 → 48193 [ACK] Seq=1 Ack=25001 Win=67 Len=0 TSval=1886573886 TSecr=1758595714
   71   0.630583     10.0.0.2 → 10.0.0.1     TCP 66 35722 → 19551 [ACK] Seq=1 Ack=30001 Win=67 Len=0 TSval=1886573891 TSecr=1758595729
   72   0.641087     10.0.0.2 → 10.0.0.1     TCP 66 35722 → 19551 [ACK] Seq=1 Ack=37001 Win=67 Len=0 TSval=1886573901 TSecr=1758595811
   73   0.653224     10.0.0.2 → 10.0.0.1     TCP 66 47452 → 53241 [ACK] Seq=1 Ack=22038 Win=34304 Len=0 TSval=1886573913 TSecr=1758595827
   74   0.675366     10.0.0.2 → 10.0.0.1     TCP 66 42968 → 55943 [ACK] Seq=1 Ack=14001 Win=67 Len=0 TSval=1886573935 TSecr=1758595750
   75   0.695333     10.0.0.2 → 10.0.0.1     TCP 66 42968 → 55943 [ACK] Seq=1 Ack=23001 Win=67 Len=0 TSval=1886573955 TSecr=1758595858
   76   0.698213     10.0.0.2 → 10.0.0.1     TCP 66 46356 → 54368 [ACK] Seq=1 Ack=20038 Win=34304 Len=0 TSval=1886573956 TSecr=1758595790
   77   0.702523     10.0.0.2 → 10.0.0.1     TCP 66 40783 → 32720 [ACK] Seq=1 Ack=21038 Win=34304 Len=0 TSval=1886573961 TSecr=1758595801
   78   0.707181     10.0.0.2 → 10.0.0.1     TCP 66 46356 → 54368 [ACK] Seq=1 Ack=26038 Win=34304 Len=0 TSval=1886573967 TSecr=1758595874
   79   0.719227     10.0.0.2 → 10.0.0.1     TCP 66 25904 → 58169 [ACK] Seq=1 Ack=26038 Win=34304 Len=0 TSval=1886573979 TSecr=1758595875
   80   0.728728     10.0.0.2 → 10.0.0.1     TCP 66 6776 → 55246 [ACK] Seq=1 Ack=21038 Win=34304 Len=0 TSval=1886573989 TSecr=1758595823
   81   0.743536     10.0.0.2 → 10.0.0.1     TCP 66 46356 → 54368 [ACK] Seq=1 Ack=27038 Win=34304 Len=0 TSval=1886574004 TSecr=1758595883
   82   0.750276     10.0.0.2 → 10.0.0.1     TCP 66 6776 → 55246 [ACK] Seq=1 Ack=28038 Win=34304 Len=0 TSval=1886574010 TSecr=1758595905
   83   0.758145     10.0.0.2 → 10.0.0.1     TCP 66 42968 → 55943 [ACK] Seq=1 Ack=24001 Win=67 Len=0 TSval=1886574017 TSecr=1758595871
   84   0.763967     10.0.0.2 → 10.0.0.1     TCP 66 46356 → 54368 [ACK] Seq=1 Ack=29038 Win=34304 Len=0 TSval=1886574024 TSecr=1758595919
   85   0.768075     10.0.0.2 → 10.0.0.1     TCP 66 35722 → 19551 [ACK] Seq=1 Ack=45001 Win=67 Len=0 TSval=1886574028 TSecr=1758595925
   86   0.769993     10.0.0.2 → 10.0.0.1     TCP 66 59433 → 48193 [ACK] Seq=1 Ack=39001 Win=67 Len=0 TSval=1886574030 TSecr=1758595907
   87   0.778201     10.0.0.2 → 10.0.0.1     TCP 66 25904 → 58169 [ACK] Seq=1 Ack=30038 Win=34304 Len=0 TSval=1886574038 TSecr=1758595921
   88   0.786629     10.0.0.2 → 10.0.0.1     TCP 66 59433 → 48193 [ACK] Seq=1 Ack=42001 Win=67 Len=0 TSval=1886574046 TSecr=1758595946
   89   0.786949     10.0.0.2 → 10.0.0.1     TCP 66 6776 → 55246 [ACK] Seq=1 Ack=29038 Win=34304 Len=0 TSval=1886574047 TSecr=1758595926
   90   0.790761     10.0.0.2 → 10.0.0.1     TCP 66 42968 → 55943 [ACK] Seq=1 Ack=28001 Win=67 Len=0 TSval=1886574051 TSecr=1758595934
   91   0.796755     10.0.0.2 → 10.0.0.1     TCP 66 42968 → 55943 [ACK] Seq=1 Ack=31001 Win=67 Len=0 TSval=1886574057 TSecr=1758595967
   92   0.802853     10.0.0.2 → 10.0.0.1     TCP 66 47452 → 53241 [ACK] Seq=1 Ack=33038 Win=34304 Len=0 TSval=1886574063 TSecr=1758595968
   93   0.807232     10.0.0.2 → 10.0.0.1     TCP 66 40783 → 32720 [ACK] Seq=1 Ack=31038 Win=34304 Len=0 TSval=1886574067 TSecr=1758595937
   94   0.829321     10.0.0.2 → 10.0.0.1     TCP 66 25904 → 58169 [ACK] Seq=1 Ack=36038 Win=34304 Len=0 TSval=1886574089 TSecr=1758596004
   95   0.835867     10.0.0.2 → 10.0.0.1     TCP 66 35722 → 19551 [ACK] Seq=1 Ack=48001 Win=67 Len=0 TSval=1886574096 TSecr=1758595960
   96   0.837402     10.0.0.2 → 10.0.0.1     TCP 66 35722 → 19551 [ACK] Seq=1 Ack=52001 Win=67 Len=0 TSval=1886574097 TSecr=1758596012
   97   0.849483     10.0.0.2 → 10.0.0.1     TCP 66 47452 → 53241 [ACK] Seq=1 Ack=34038 Win=34304 Len=0 TSval=1886574110 TSecr=1758595979
   98   0.850980     10.0.0.2 → 10.0.0.1     TCP 66 59433 → 48193 [ACK] Seq=1 Ack=48001 Win=67 Len=0 TSval=1886574111 TSecr=1758596022
   99   0.854945     10.0.0.2 → 10.0.0.1     TCP 66 6776 → 55246 [ACK] Seq=1 Ack=37038 Win=34304 Len=0 TSval=1886574115 TSecr=1758596024
  100   0.866114     10.0.0.2 → 10.0.0.1     TCP 66 47452 → 53241 [ACK] Seq=1 Ack=37038 Win=34304 Len=0 TSval=1886574126 TSecr=1758596025
  101   0.869170     10.0.0.2 → 10.0.0.1     TCP 66 46356 → 54368 [ACK] Seq=1 Ack=35038 Win=34304 Len=0 TSval=1886574129 TSecr=1758595995
  102   0.873336     10.0.0.2 → 10.0.0.1     TCP 66 42968 → 55943 [ACK] Seq=1 Ack=36001 Win=67 Len=0 TSval=1886574133 TSecr=1758596042
  103   0.879410     10.0.0.2 → 10.0.0.1     TCP 66 47452 → 53241 [ACK] Seq=1 Ack=39038 Win=34304 Len=0 TSval=1886574139 TSecr=1758596042
  104   0.891715     10.0.0.2 → 10.0.0.1     TCP 66 42968 → 55943 [ACK] Seq=1 Ack=37001 Win=67 Len=0 TSval=1886574152 TSecr=1758596049
  105   0.893916     10.0.0.2 → 10.0.0.1     TCP 66 46356 → 54368 [ACK] Seq=1 Ack=40038 Win=34304 Len=0 TSval=1886574154 TSecr=1758596059
  106   0.904184     10.0.0.2 → 10.0.0.1     TCP 66 25904 → 58169 [ACK] Seq=1 Ack=41038 Win=34304 Len=0 TSval=1886574164 TSecr=1758596072
  107   0.908148     10.0.0.2 → 10.0.0.1     TCP 66 6776 → 55246 [ACK] Seq=1 Ack=41038 Win=34304 Len=0 TSval=1886574168 TSecr=1758596082
  108   0.913623     10.0.0.2 → 10.0.0.1     TCP 66 59433 → 48193 [ACK] Seq=1 Ack=49001 Win=67 Len=0 TSval=1886574174 TSecr=1758596034
  109   0.914990     10.0.0.2 → 10.0.0.1     TCP 66 40783 → 32720 [ACK] Seq=1 Ack=40038 Win=34304 Len=0 TSval=1886574175 TSecr=1758596066
  110   0.931569     10.0.0.2 → 10.0.0.1     TCP 66 47452 → 53241 [ACK] Seq=1 Ack=42038 Win=34304 Len=0 TSval=1886574192 TSecr=1758596086
  111   0.932990     10.0.0.2 → 10.0.0.1     TCP 66 47452 → 53241 [ACK] Seq=1 Ack=43038 Win=34304 Len=0 TSval=1886574193 TSecr=1758596107
  112   0.949917     10.0.0.2 → 10.0.0.1     TCP 66 42968 → 55943 [ACK] Seq=1 Ack=38001 Win=67 Len=0 TSval=1886574210 TSecr=1758596067
  113   0.950408     10.0.0.2 → 10.0.0.1     TCP 66 35722 → 19551 [ACK] Seq=1 Ack=54001 Win=67 Len=0 TSval=1886574210 TSecr=1758596037
  114   0.973579     10.0.0.2 → 10.0.0.1     TCP 66 59433 → 48193 [ACK] Seq=1 Ack=55001 Win=67 Len=0 TSval=1886574233 TSecr=1758596116
  115   0.973916     10.0.0.2 → 10.0.0.1     TCP 66 25904 → 58169 [ACK] Seq=1 Ack=42038 Win=34304 Len=0 TSval=1886574234 TSecr=1758596081
  116   0.992371     10.0.0.2 → 10.0.0.1     TCP 66 42968 → 55943 [ACK] Seq=1 Ack=43001 Win=67 Len=0 TSval=1886574251 TSecr=1758596126
  117   0.997182     10.0.0.2 → 10.0.0.1     TCP 66 46356 → 54368 [ACK] Seq=1 Ack=47038 Win=34304 Len=0 TSval=1886574253 TSecr=1758596159
  118   0.997660     10.0.0.2 → 10.0.0.1     TCP 66 40783 → 32720 [ACK] Seq=1 Ack=42038 Win=34304 Len=0 TSval=1886574258 TSecr=1758596091
  119   1.002949     10.0.0.2 → 10.0.0.1     TCP 66 35722 → 19551 [ACK] Seq=1 Ack=60001 Win=67 Len=0 TSval=1886574261 TSecr=1758596127
  120   1.006050     10.0.0.2 → 10.0.0.1     TCP 66 6776 → 55246 [ACK] Seq=1 Ack=43038 Win=34304 Len=0 TSval=1886574266 TSecr=1758596104
  121   1.007842     10.0.0.2 → 10.0.0.1     TCP 66 35722 → 19551 [ACK] Seq=1 Ack=64001 Win=67 Len=0 TSval=1886574268 TSecr=1758596180
  122   1.009542     10.0.0.2 → 10.0.0.1     TCP 66 47452 → 53241 [ACK] Seq=1 Ack=44038 Win=34304 Len=0 TSval=1886574270 TSecr=1758596109
  123   1.012522     10.0.0.2 → 10.0.0.1     TCP 66 6776 → 55246 [ACK] Seq=1 Ack=48038 Win=34304 Len=0 TSval=1886574272 TSecr=1758596182
  124   1.026809     10.0.0.2 → 10.0.0.1     TCP 66 25904 → 58169 [ACK] Seq=1 Ack=47038 Win=34304 Len=0 TSval=1886574286 TSecr=1758596151
  125   1.067469     10.0.0.2 → 10.0.0.1     TCP 66 59433 → 48193 [ACK] Seq=1 Ack=57001 Win=67 Len=0 TSval=1886574322 TSecr=1758596150
  126   1.073994     10.0.0.2 → 10.0.0.1     TCP 66 42968 → 55943 [ACK] Seq=1 Ack=46001 Win=67 Len=0 TSval=1886574325 TSecr=1758596169
  127   1.077591     10.0.0.2 → 10.0.0.1     TCP 66 46356 → 54368 [ACK] Seq=1 Ack=48038 Win=34304 Len=0 TSval=1886574328 TSecr=1758596173
  128   1.098263     10.0.0.2 → 10.0.0.1     TCP 66 47452 → 53241 [ACK] Seq=1 Ack=49038 Win=34304 Len=0 TSval=1886574358 TSecr=1758596185
  129   1.142635     10.0.0.2 → 10.0.0.1     TCP 66 25904 → 58169 [ACK] Seq=1 Ack=59038 Win=34304 Len=0 TSval=1886574402 TSecr=1758596308
  130   1.144249     10.0.0.2 → 10.0.0.1     TCP 66 59433 → 48193 [ACK] Seq=1 Ack=70001 Win=67 Len=0 TSval=1886574404 TSecr=1758596315
  131   1.158651     10.0.0.2 → 10.0.0.1     TCP 66 59433 → 48193 [ACK] Seq=1 Ack=71001 Win=67 Len=0 TSval=1886574419 TSecr=1758596327
  132   1.199685     10.0.0.2 → 10.0.0.1     TCP 66 46356 → 54368 [ACK] Seq=1 Ack=55038 Win=34304 Len=0 TSval=1886574459 TSecr=1758596265
  133   1.210383     10.0.0.2 → 10.0.0.1     TCP 66 42968 → 55943 [ACK] Seq=1 Ack=62001 Win=67 Len=0 TSval=1886574470 TSecr=1758596376
  134   1.238838     10.0.0.2 → 10.0.0.1     TCP 66 35722 → 19551 [ACK] Seq=1 Ack=72001 Win=67 Len=0 TSval=1886574496 TSecr=1758596278
  135   1.272540     10.0.0.2 → 10.0.0.1     TCP 66 25904 → 58169 [ACK] Seq=1 Ack=64038 Win=34304 Len=0 TSval=1886574533 TSecr=1758596382
  136   1.274300     10.0.0.2 → 10.0.0.1     TCP 66 35722 → 19551 [ACK] Seq=1 Ack=82001 Win=67 Len=0 TSval=1886574534 TSecr=1758596411
  137   1.295835     10.0.0.2 → 10.0.0.1     TCP 66 47452 → 53241 [ACK] Seq=1 Ack=66038 Win=34304 Len=0 TSval=1886574555 TSecr=1758596411
  138   1.298067     10.0.0.2 → 10.0.0.1     TCP 66 46356 → 54368 [ACK] Seq=1 Ack=67038 Win=34304 Len=0 TSval=1886574556 TSecr=1758596424
  139   1.299498     10.0.0.2 → 10.0.0.1     TCP 66 40783 → 32720 [ACK] Seq=1 Ack=69038 Win=34304 Len=0 TSval=1886574559 TSecr=1758596445
  140   1.311473     10.0.0.2 → 10.0.0.1     TCP 66 46356 → 54368 [ACK] Seq=1 Ack=71038 Win=34304 Len=0 TSval=1886574571 TSecr=1758596475
  141   1.333649     10.0.0.2 → 10.0.0.1     TCP 66 35722 → 19551 [ACK] Seq=1 Ack=84001 Win=67 Len=0 TSval=1886574594 TSecr=1758596451
  142   1.337562     10.0.0.2 → 10.0.0.1     TCP 66 42968 → 55943 [ACK] Seq=1 Ack=63001 Win=67 Len=0 TSval=1886574598 TSecr=1758596390
  143   1.354395     10.0.0.2 → 10.0.0.1     TCP 66 6776 → 55246 [ACK] Seq=1 Ack=74038 Win=34304 Len=0 TSval=1886574614 TSecr=1758596520
  144   1.366967     10.0.0.2 → 10.0.0.1     TCP 66 42968 → 55943 [ACK] Seq=1 Ack=73001 Win=67 Len=0 TSval=1886574627 TSecr=1758596523
  145   1.368414     10.0.0.2 → 10.0.0.1     TCP 66 47452 → 53241 [ACK] Seq=1 Ack=75038 Win=34304 Len=0 TSval=1886574628 TSecr=1758596531
  146   1.374606     10.0.0.2 → 10.0.0.1     TCP 66 59433 → 48193 [ACK] Seq=1 Ack=82001 Win=67 Len=0 TSval=1886574635 TSecr=1758596483
  147   1.403311     10.0.0.2 → 10.0.0.1     TCP 66 35722 → 19551 [ACK] Seq=1 Ack=89001 Win=67 Len=0 TSval=1886574663 TSecr=1758596510
  148   1.423867     10.0.0.2 → 10.0.0.1     TCP 66 6776 → 55246 [ACK] Seq=1 Ack=75038 Win=34304 Len=0 TSval=1886574684 TSecr=1758596531
  149   1.427984     10.0.0.2 → 10.0.0.1     TCP 66 6776 → 55246 [ACK] Seq=1 Ack=80038 Win=34304 Len=0 TSval=1886574688 TSecr=1758596600
  150   1.428494     10.0.0.2 → 10.0.0.1     TCP 66 47452 → 53241 [ACK] Seq=1 Ack=76038 Win=34304 Len=0 TSval=1886574688 TSecr=1758596545
  151   1.432063     10.0.0.2 → 10.0.0.1     TCP 66 59433 → 48193 [ACK] Seq=1 Ack=87001 Win=67 Len=0 TSval=1886574692 TSecr=1758596550
  152   1.442385     10.0.0.2 → 10.0.0.1     TCP 66 40783 → 32720 [ACK] Seq=1 Ack=73038 Win=34304 Len=0 TSval=1886574702 TSecr=1758596495
  153   1.460068     10.0.0.2 → 10.0.0.1     TCP 66 46356 → 54368 [ACK] Seq=1 Ack=82038 Win=34304 Len=0 TSval=1886574720 TSecr=1758596626
  154   1.511394     10.0.0.2 → 10.0.0.1     TCP 66 47452 → 53241 [ACK] Seq=1 Ack=82038 Win=34304 Len=0 TSval=1886574766 TSecr=1758596614
  155   1.517826     10.0.0.2 → 10.0.0.1     TCP 66 35722 → 19551 [ACK] Seq=1 Ack=98001 Win=67 Len=0 TSval=1886574767 TSecr=1758596630
  156   1.519332     10.0.0.2 → 10.0.0.1     TCP 66 47452 → 53241 [ACK] Seq=1 Ack=87038 Win=34304 Len=0 TSval=1886574779 TSecr=1758596688
  157   1.525649     10.0.0.2 → 10.0.0.1     TCP 66 40783 → 32720 [ACK] Seq=1 Ack=87038 Win=34304 Len=0 TSval=1886574785 TSecr=1758596693
  158   1.527466     10.0.0.2 → 10.0.0.1     TCP 66 59433 → 48193 [ACK] Seq=1 Ack=93001 Win=67 Len=0 TSval=1886574787 TSecr=1758596620
  159   1.536088     10.0.0.2 → 10.0.0.1     TCP 66 42968 → 55943 [ACK] Seq=1 Ack=81001 Win=67 Len=0 TSval=1886574792 TSecr=1758596632
  160   1.541332     10.0.0.2 → 10.0.0.1     TCP 66 35722 → 19551 [ACK] Seq=1 Ack=103001 Win=67 Len=0 TSval=1886574797 TSecr=1758596694
  161   1.549757     10.0.0.2 → 10.0.0.1     TCP 66 6776 → 55246 [ACK] Seq=1 Ack=86038 Win=34304 Len=0 TSval=1886574806 TSecr=1758596686
  162   1.569306     10.0.0.2 → 10.0.0.1     TCP 66 59433 → 48193 [ACK] Seq=1 Ack=99001 Win=67 Len=0 TSval=1886574828 TSecr=1758596704
  163   1.579757     10.0.0.2 → 10.0.0.1     TCP 66 46356 → 54368 [ACK] Seq=1 Ack=90038 Win=34304 Len=0 TSval=1886574840 TSecr=1758596723
  164   1.595652     10.0.0.2 → 10.0.0.1     TCP 66 25904 → 58169 [ACK] Seq=1 Ack=90038 Win=34304 Len=0 TSval=1886574856 TSecr=1758596727
  165   1.604097     10.0.0.2 → 10.0.0.1     TCP 66 47452 → 53241 [ACK] Seq=1 Ack=91038 Win=34304 Len=0 TSval=1886574864 TSecr=1758596743
  166   1.617251     10.0.0.2 → 10.0.0.1     TCP 66 46356 → 54368 [ACK] Seq=1 Ack=92038 Win=34304 Len=0 TSval=1886574876 TSecr=1758596756
  167   1.640831     10.0.0.2 → 10.0.0.1     TCP 66 25904 → 58169 [ACK] Seq=1 Ack=93038 Win=34304 Len=0 TSval=1886574901 TSecr=1758596771
  168   1.657836     10.0.0.2 → 10.0.0.1     TCP 66 42968 → 55943 [ACK] Seq=1 Ack=92001 Win=67 Len=0 TSval=1886574916 TSecr=1758596777
  169   1.682136     10.0.0.2 → 10.0.0.1     TCP 66 6776 → 55246 [ACK] Seq=1 Ack=92038 Win=34304 Len=0 TSval=1886574942 TSecr=1758596770
  170   1.689721     10.0.0.2 → 10.0.0.1     TCP 66 35722 → 19551 [ACK] Seq=1 Ack=110001 Win=67 Len=0 TSval=1886574950 TSecr=1758596792
  171   1.697939     10.0.0.2 → 10.0.0.1     TCP 66 46356 → 54368 [ACK] Seq=1 Ack=95038 Win=34304 Len=0 TSval=1886574958 TSecr=1758596793
  172   1.699565     10.0.0.2 → 10.0.0.1     TCP 66 46356 → 54368 [ACK] Seq=1 Ack=101038 Win=34304 Len=0 TSval=1886574960 TSecr=1758596874
  173   1.721557     10.0.0.2 → 10.0.0.1     TCP 66 25904 → 58169 [ACK] Seq=1 Ack=102038 Win=34304 Len=0 TSval=1886574980 TSecr=1758596890
  174   1.730763     10.0.0.2 → 10.0.0.1     TCP 66 47452 → 53241 [ACK] Seq=1 Ack=98038 Win=34304 Len=0 TSval=1886574991 TSecr=1758596837
  175   1.732351     10.0.0.2 → 10.0.0.1     TCP 66 47452 → 53241 [ACK] Seq=1 Ack=103038 Win=34304 Len=0 TSval=1886574992 TSecr=1758596907
  176   1.742811     10.0.0.2 → 10.0.0.1     TCP 66 59433 → 48193 [ACK] Seq=1 Ack=105001 Win=67 Len=0 TSval=1886575002 TSecr=1758596790
  177   1.747416     10.0.0.2 → 10.0.0.1     TCP 66 6776 → 55246 [ACK] Seq=1 Ack=99038 Win=34304 Len=0 TSval=1886575007 TSecr=1758596858
  178   1.775365     10.0.0.2 → 10.0.0.1     TCP 66 35722 → 19551 [ACK] Seq=1 Ack=116001 Win=67 Len=0 TSval=1886575035 TSecr=1758596866
  179   1.776960     10.0.0.2 → 10.0.0.1     TCP 66 59433 → 48193 [ACK] Seq=1 Ack=116001 Win=67 Len=0 TSval=1886575037 TSecr=1758596927
  180   1.784176     10.0.0.2 → 10.0.0.1     TCP 66 6776 → 55246 [ACK] Seq=1 Ack=105038 Win=34304 Len=0 TSval=1886575044 TSecr=1758596942
  181   1.786242     10.0.0.2 → 10.0.0.1     TCP 66 40783 → 32720 [ACK] Seq=1 Ack=106038 Win=34304 Len=0 TSval=1886575046 TSecr=1758596955
  182   1.804187     10.0.0.2 → 10.0.0.1     TCP 66 25904 → 58169 [ACK] Seq=1 Ack=103038 Win=34304 Len=0 TSval=1886575064 TSecr=1758596898
  183   1.805734     10.0.0.2 → 10.0.0.1     TCP 66 47452 → 53241 [ACK] Seq=1 Ack=105038 Win=34304 Len=0 TSval=1886575066 TSecr=1758596921
  184   1.808123     10.0.0.2 → 10.0.0.1     TCP 78 [TCP Dup ACK 181#1] 40783 → 32720 [ACK] Seq=1 Ack=106038 Win=34304 Len=0 TSval=1886575068 TSecr=1758596955 SLE=94038 SRE=103486
  185   1.890503     10.0.0.2 → 10.0.0.1     TCP 66 35722 → 19551 [ACK] Seq=1 Ack=131001 Win=67 Len=0 TSval=1886575151 TSecr=1758597065
  186   1.912741     10.0.0.2 → 10.0.0.1     TCP 66 59433 → 48193 [ACK] Seq=1 Ack=117001 Win=67 Len=0 TSval=1886575173 TSecr=1758596953
  187   1.914427     10.0.0.2 → 10.0.0.1     TCP 78 [TCP Dup ACK 186#1] 59433 → 48193 [ACK] Seq=1 Ack=117001 Win=67 Len=0 TSval=1886575174 TSecr=1758596953 SLE=126449 SRE=128001
  188   1.916918     10.0.0.2 → 10.0.0.1     TCP 66 6776 → 55246 [ACK] Seq=1 Ack=107038 Win=34304 Len=0 TSval=1886575177 TSecr=1758596960
  189   1.918494     10.0.0.2 → 10.0.0.1     TCP 78 [TCP Dup ACK 188#1] 6776 → 55246 [ACK] Seq=1 Ack=107038 Win=34304 Len=0 TSval=1886575179 TSecr=1758596960 SLE=116486 SRE=117038
  190   1.919983     10.0.0.2 → 10.0.0.1     TCP 78 [TCP Dup ACK 181#2] 40783 → 32720 [ACK] Seq=1 Ack=106038 Win=34304 Len=0 TSval=1886575180 TSecr=1758596955 SLE=108038 SRE=117486
  191   1.933634     10.0.0.2 → 10.0.0.1     TCP 66 46356 → 54368 [ACK] Seq=1 Ack=108038 Win=34304 Len=0 TSval=1886575194 TSecr=1758596976
  192   1.946746     10.0.0.2 → 10.0.0.1     TCP 66 6776 → 55246 [ACK] Seq=1 Ack=117038 Win=34304 Len=0 TSval=1886575206 TSecr=1758597094
  193   1.957802     10.0.0.2 → 10.0.0.1     TCP 66 25904 → 58169 [ACK] Seq=1 Ack=109038 Win=34304 Len=0 TSval=1886575218 TSecr=1758596980
  194   1.979541     10.0.0.2 → 10.0.0.1     TCP 78 40783 → 32720 [ACK] Seq=1 Ack=117486 Win=34304 Len=0 TSval=1886575240 TSecr=1758596962 SLE=106038 SRE=108038
  195   1.982369     10.0.0.2 → 10.0.0.1     TCP 66 47452 → 53241 [ACK] Seq=1 Ack=109038 Win=34304 Len=0 TSval=1886575242 TSecr=1758596982
  196   1.984024     10.0.0.2 → 10.0.0.1     TCP 66 40783 → 32720 [ACK] Seq=1 Ack=118038 Win=34304 Len=0 TSval=1886575244 TSecr=1758597101
  197   2.039644     10.0.0.2 → 10.0.0.1     TCP 66 6776 → 55246 [ACK] Seq=1 Ack=125038 Win=34304 Len=0 TSval=1886575300 TSecr=1758597200
  198   2.072902     10.0.0.2 → 10.0.0.1     TCP 78 59433 → 48193 [ACK] Seq=1 Ack=136001 Win=67 Len=0 TSval=1886575333 TSecr=1758597206 SLE=117001 SRE=126449
  199   2.086973     10.0.0.2 → 10.0.0.1     TCP 66 6776 → 55246 [ACK] Seq=1 Ack=126038 Win=34304 Len=0 TSval=1886575347 TSecr=1758597215
  200   2.093174     10.0.0.2 → 10.0.0.1     TCP 78 35722 → 19551 [ACK] Seq=1 Ack=141449 Win=67 Len=0 TSval=1886575353 TSecr=1758597077 SLE=131001 SRE=132001
  201   2.148954     10.0.0.2 → 10.0.0.1     TCP 66 25904 → 58169 [ACK] Seq=1 Ack=129038 Win=34304 Len=0 TSval=1886575409 TSecr=1758597134
  202   2.173079     10.0.0.2 → 10.0.0.1     TCP 78 40783 → 32720 [ACK] Seq=1 Ack=122038 Win=34304 Len=0 TSval=1886575433 TSecr=1758597160 SLE=126038 SRE=135486
  203   2.200254     10.0.0.2 → 10.0.0.1     TCP 66 40783 → 32720 [ACK] Seq=1 Ack=138038 Win=34304 Len=0 TSval=1886575460 TSecr=1758597368
  204   2.207998     10.0.0.2 → 10.0.0.1     TCP 66 46356 → 54368 [ACK] Seq=1 Ack=125038 Win=34304 Len=0 TSval=1886575468 TSecr=1758597199
  205   2.213582     10.0.0.2 → 10.0.0.1     TCP 66 42968 → 55943 [ACK] Seq=1 Ack=130449 Win=67 Len=0 TSval=1886575474 TSecr=1758597331
  206   2.218720     10.0.0.2 → 10.0.0.1     TCP 78 [TCP Dup ACK 200#1] 35722 → 19551 [ACK] Seq=1 Ack=141449 Win=67 Len=0 TSval=1886575479 TSecr=1758597077 SLE=144001 SRE=153449
  207   2.237761     10.0.0.2 → 10.0.0.1     TCP 66 47452 → 53241 [ACK] Seq=1 Ack=138038 Win=33280 Len=0 TSval=1886575498 TSecr=1758597381
  208   2.275878     10.0.0.2 → 10.0.0.1     TCP 78 [TCP Dup ACK 204#1] 46356 → 54368 [ACK] Seq=1 Ack=125038 Win=34304 Len=0 TSval=1886575536 TSecr=1758597199 SLE=134486 SRE=139038
  209   2.290554     10.0.0.2 → 10.0.0.1     TCP 66 35722 → 19551 [ACK] Seq=1 Ack=153449 Win=65 Len=0 TSval=1886575551 TSecr=1758597247
  210   2.309464     10.0.0.2 → 10.0.0.1     TCP 66 46356 → 54368 [ACK] Seq=1 Ack=139038 Win=34304 Len=0 TSval=1886575569 TSecr=1758597452
  211   2.332194     10.0.0.2 → 10.0.0.1     TCP 78 [TCP Dup ACK 207#1] 47452 → 53241 [ACK] Seq=1 Ack=138038 Win=34304 Len=0 TSval=1886575592 TSecr=1758597381 SLE=122038 SRE=131486
  212   2.347602     10.0.0.2 → 10.0.0.1     TCP 78 [TCP Dup ACK 205#1] 42968 → 55943 [ACK] Seq=1 Ack=130449 Win=67 Len=0 TSval=1886575607 TSecr=1758597331 SLE=133001 SRE=142449
  213   2.370263     10.0.0.2 → 10.0.0.1     TCP 78 [TCP Dup ACK 210#1] 46356 → 54368 [ACK] Seq=1 Ack=139038 Win=34304 Len=0 TSval=1886575630 TSecr=1758597452 SLE=125038 SRE=134486
  214   2.388008     10.0.0.2 → 10.0.0.1     TCP 66 46356 → 54368 [ACK] Seq=1 Ack=147038 Win=34304 Len=0 TSval=1886575648 TSecr=1758597485
  215   2.408358     10.0.0.2 → 10.0.0.1     TCP 66 25904 → 58169 [ACK] Seq=1 Ack=144486 Win=31232 Len=0 TSval=1886575668 TSecr=1758597325
  216   2.443137     10.0.0.2 → 10.0.0.1     TCP 66 40783 → 32720 [ACK] Seq=1 Ack=148486 Win=34304 Len=0 TSval=1886575703 TSecr=1758597376
  217   2.459635     10.0.0.2 → 10.0.0.1     TCP 78 6776 → 55246 [ACK] Seq=1 Ack=138486 Win=34304 Len=0 TSval=1886575719 TSecr=1758597263 SLE=126038 SRE=129038
  218   2.469653     10.0.0.2 → 10.0.0.1     TCP 66 35722 → 19551 [ACK] Seq=1 Ack=167001 Win=67 Len=0 TSval=1886575730 TSecr=1758597549
  219   2.472080     10.0.0.2 → 10.0.0.1     TCP 66 6776 → 55246 [ACK] Seq=1 Ack=145038 Win=34304 Len=0 TSval=1886575732 TSecr=1758597477
  220   2.483205     10.0.0.2 → 10.0.0.1     TCP 66 40783 → 32720 [ACK] Seq=1 Ack=155038 Win=34304 Len=0 TSval=1886575742 TSecr=1758597597
  221   2.497695     10.0.0.2 → 10.0.0.1     TCP 66 47452 → 53241 [ACK] Seq=1 Ack=150486 Win=34304 Len=0 TSval=1886575758 TSecr=1758597534
  222   2.498780     10.0.0.2 → 10.0.0.1     TCP 78 42968 → 55943 [ACK] Seq=1 Ack=142449 Win=67 Len=0 TSval=1886575759 TSecr=1758597331 SLE=130449 SRE=133001
  223   2.514480     10.0.0.2 → 10.0.0.1     TCP 78 [TCP Dup ACK 220#1] 40783 → 32720 [ACK] Seq=1 Ack=155038 Win=34304 Len=0 TSval=1886575774 TSecr=1758597597 SLE=138038 SRE=139038
  224   2.516560     10.0.0.2 → 10.0.0.1     TCP 78 [TCP Dup ACK 222#1] 42968 → 55943 [ACK] Seq=1 Ack=142449 Win=67 Len=0 TSval=1886575776 TSecr=1758597331 SLE=151897 SRE=154001
  225   2.520883     10.0.0.2 → 10.0.0.1     TCP 66 47452 → 53241 [ACK] Seq=1 Ack=157038 Win=34304 Len=0 TSval=1886575781 TSecr=1758597623
  226   2.533401     10.0.0.2 → 10.0.0.1     TCP 66 59433 → 48193 [ACK] Seq=1 Ack=164001 Win=67 Len=0 TSval=1886575793 TSecr=1758597580
  227   2.534948     10.0.0.2 → 10.0.0.1     TCP 66 25904 → 58169 [ACK] Seq=1 Ack=154038 Win=34304 Len=0 TSval=1886575795 TSecr=1758597665
  228   2.554867     10.0.0.2 → 10.0.0.1     TCP 78 [TCP Dup ACK 227#1] 25904 → 58169 [ACK] Seq=1 Ack=154038 Win=34304 Len=0 TSval=1886575814 TSecr=1758597665 SLE=163486 SRE=164038
  229   2.557349     10.0.0.2 → 10.0.0.1     TCP 86 [TCP Dup ACK 227#2] 25904 → 58169 [ACK] Seq=1 Ack=154038 Win=34304 Len=0 TSval=1886575817 TSecr=1758597665 SLE=144486 SRE=153934 SLE=163486 SRE=164038
  230   2.601335     10.0.0.2 → 10.0.0.1     TCP 78 [TCP Dup ACK 218#1] 35722 → 19551 [ACK] Seq=1 Ack=167001 Win=67 Len=0 TSval=1886575861 TSecr=1758597549 SLE=174001 SRE=183449
  231   2.619110     10.0.0.2 → 10.0.0.1     TCP 66 35722 → 19551 [ACK] Seq=1 Ack=183449 Win=61 Len=0 TSval=1886575879 TSecr=1758597777
  232   2.834616     10.0.0.2 → 10.0.0.1     TCP 78 [TCP Dup ACK 220#2] 40783 → 32720 [ACK] Seq=1 Ack=155038 Win=34304 Len=0 TSval=1886575893 TSecr=1758597597 SLE=160038 SRE=169486
  233   2.835655     10.0.0.2 → 10.0.0.1     TCP 78 [TCP Dup ACK 231#1] 35722 → 19551 [ACK] Seq=1 Ack=183449 Win=67 Len=0 TSval=1886575893 TSecr=1758597777 SLE=167001 SRE=174001
  234   2.847814     10.0.0.2 → 10.0.0.1     TCP 78 [TCP Dup ACK 225#1] 47452 → 53241 [ACK] Seq=1 Ack=157038 Win=34304 Len=0 TSval=1886576108 TSecr=1758597623 SLE=163038 SRE=172486
  235   2.855844     10.0.0.2 → 10.0.0.1     TCP 66 46356 → 54368 [ACK] Seq=1 Ack=162038 Win=34304 Len=0 TSval=1886576116 TSecr=1758597685
  236   2.905373     10.0.0.2 → 10.0.0.1     TCP 78 [TCP Dup ACK 226#1] 59433 → 48193 [ACK] Seq=1 Ack=164001 Win=67 Len=0 TSval=1886576165 TSecr=1758597580 SLE=174001 SRE=192897
  237   2.930267     10.0.0.2 → 10.0.0.1     TCP 66 47452 → 53241 [ACK] Seq=1 Ack=181934 Win=23040 Len=0 TSval=1886576190 TSecr=1758597697
  238   2.954528     10.0.0.2 → 10.0.0.1     TCP 86 59433 → 48193 [ACK] Seq=1 Ack=173449 Win=53 Len=0 TSval=1886576215 TSecr=1758598043 SLE=164001 SRE=173449 SLE=174001 SRE=192897
  239   2.962459     10.0.0.2 → 10.0.0.1     TCP 78 40783 → 32720 [ACK] Seq=1 Ack=169486 Win=34304 Len=0 TSval=1886576222 TSecr=1758597659 SLE=180486 SRE=189934
  240   2.981171     10.0.0.2 → 10.0.0.1     TCP 66 59433 → 48193 [ACK] Seq=1 Ack=192897 Win=52 Len=0 TSval=1886576241 TSecr=1758598081
  241   2.994951     10.0.0.2 → 10.0.0.1     TCP 66 25904 → 58169 [ACK] Seq=1 Ack=164038 Win=34304 Len=0 TSval=1886576255 TSecr=1758597711
  242   3.008368     10.0.0.2 → 10.0.0.1     TCP 66 47452 → 53241 [ACK] Seq=1 Ack=193038 Win=34304 Len=0 TSval=1886576267 TSecr=1758598106
  243   3.052789     10.0.0.2 → 10.0.0.1     TCP 66 59433 → 48193 [ACK] Seq=1 Ack=208001 Win=67 Len=0 TSval=1886576308 TSecr=1758598157
  244   3.060444     10.0.0.2 → 10.0.0.1     TCP 66 35722 → 19551 [ACK] Seq=1 Ack=203897 Win=57 Len=0 TSval=1886576319 TSecr=1758598158
  245   3.109030     10.0.0.2 → 10.0.0.1     TCP 86 42968 → 55943 [ACK] Seq=1 Ack=166001 Win=67 Len=0 TSval=1886576369 TSecr=1758597797 SLE=154001 SRE=163449 SLE=184001 SRE=193449
  246   3.126033     10.0.0.2 → 10.0.0.1     TCP 66 47452 → 53241 [ACK] Seq=1 Ack=199038 Win=34304 Len=0 TSval=1886576386 TSecr=1758598185
  247   3.201701     10.0.0.2 → 10.0.0.1     TCP 66 46356 → 54368 [ACK] Seq=1 Ack=171486 Win=34304 Len=0 TSval=1886576462 TSecr=1758597816
  248   3.229999     10.0.0.2 → 10.0.0.1     TCP 78 35722 → 19551 [ACK] Seq=1 Ack=213001 Win=67 Len=0 TSval=1886576490 TSecr=1758598158 SLE=185001 SRE=194449
  249   3.250100     10.0.0.2 → 10.0.0.1     TCP 78 42968 → 55943 [ACK] Seq=1 Ack=193449 Win=67 Len=0 TSval=1886576510 TSecr=1758598333 SLE=212345 SRE=214001
  250   3.314275     10.0.0.2 → 10.0.0.1     TCP 66 46356 → 54368 [ACK] Seq=1 Ack=186038 Win=34304 Len=0 TSval=1886576573 TSecr=1758597936
  251   3.320394     10.0.0.2 → 10.0.0.1     TCP 78 [TCP Dup ACK 250#1] 46356 → 54368 [ACK] Seq=1 Ack=186038 Win=34304 Len=0 TSval=1886576579 TSecr=1758597936 SLE=204934 SRE=214382
  252   3.334857     10.0.0.2 → 10.0.0.1     TCP 66 6776 → 55246 [ACK] Seq=1 Ack=203934 Win=23040 Len=0 TSval=1886576594 TSecr=1758598005
  253   3.372439     10.0.0.2 → 10.0.0.1     TCP 66 47452 → 53241 [ACK] Seq=1 Ack=217486 Win=72192 Len=0 TSval=1886576632 TSecr=1758598512
  254   3.392126     10.0.0.2 → 10.0.0.1     TCP 78 [TCP Dup ACK 253#1] 47452 → 53241 [ACK] Seq=1 Ack=217486 Win=91136 Len=0 TSval=1886576652 TSecr=1758598512 SLE=226934 SRE=227038
  255   3.404417     10.0.0.2 → 10.0.0.1     TCP 78 40783 → 32720 [ACK] Seq=1 Ack=189934 Win=34304 Len=0 TSval=1886576664 TSecr=1758598007 SLE=155038 SRE=160038
  256   3.502883     10.0.0.2 → 10.0.0.1     TCP 86 [TCP Dup ACK 253#2] 47452 → 53241 [ACK] Seq=1 Ack=217486 Win=91136 Len=0 TSval=1886576760 TSecr=1758598512 SLE=157038 SRE=163038 SLE=226934 SRE=227038
  257   3.559103     10.0.0.2 → 10.0.0.1     TCP 78 40783 → 32720 [ACK] Seq=1 Ack=208830 Win=34304 Len=0 TSval=1886576819 TSecr=1758598580 SLE=169486 SRE=171038
  258   3.566698     10.0.0.2 → 10.0.0.1     TCP 86 25904 → 58169 [ACK] Seq=1 Ack=198038 Win=34304 Len=0 TSval=1886576826 TSecr=1758598291 SLE=164038 SRE=173486 SLE=212038 SRE=221486
  259   3.569641     10.0.0.2 → 10.0.0.1     TCP 78 [TCP Dup ACK 257#1] 40783 → 32720 [ACK] Seq=1 Ack=208830 Win=34304 Len=0 TSval=1886576829 TSecr=1758598580 SLE=224238 SRE=227726
  260   3.573608     10.0.0.2 → 10.0.0.1     TCP 78 [TCP Dup ACK 257#2] 40783 → 32720 [ACK] Seq=1 Ack=208830 Win=34304 Len=0 TSval=1886576833 TSecr=1758598580 SLE=224238 SRE=237174
  261   3.641724     10.0.0.2 → 10.0.0.1     TCP 86 [TCP Dup ACK 249#1] 42968 → 55943 [ACK] Seq=1 Ack=193449 Win=67 Len=0 TSval=1886576902 TSecr=1758598333 SLE=166001 SRE=175449 SLE=212345 SRE=214001
  262   3.698845     10.0.0.2 → 10.0.0.1     TCP 66 42968 → 55943 [ACK] Seq=1 Ack=214001 Win=57 Len=0 TSval=1886576959 TSecr=1758598873
  263   3.699714     10.0.0.2 → 10.0.0.1     TCP 78 35722 → 19551 [ACK] Seq=1 Ack=220001 Win=61 Len=0 TSval=1886576960 TSecr=1758598261 SLE=229449 SRE=238897
  264   3.714795     10.0.0.2 → 10.0.0.1     TCP 78 [TCP Dup ACK 262#1] 42968 → 55943 [ACK] Seq=1 Ack=214001 Win=67 Len=0 TSval=1886576975 TSecr=1758598873 SLE=223449 SRE=232897
  265   3.727921     10.0.0.2 → 10.0.0.1     TCP 86 [TCP Dup ACK 253#3] 47452 → 53241 [ACK] Seq=1 Ack=217486 Win=91136 Len=0 TSval=1886576988 TSecr=1758598512 SLE=199038 SRE=208038 SLE=226934 SRE=227038
  266   3.754907     10.0.0.2 → 10.0.0.1     TCP 78 [TCP Dup ACK 262#2] 42968 → 55943 [ACK] Seq=1 Ack=214001 Win=67 Len=0 TSval=1886577014 TSecr=1758598873 SLE=223449 SRE=243185
  267   3.764668     10.0.0.2 → 10.0.0.1     TCP 86 46356 → 54368 [ACK] Seq=1 Ack=195486 Win=34304 Len=0 TSval=1886577025 TSecr=1758598503 SLE=162038 SRE=171486 SLE=204934 SRE=214382
  268   3.769679     10.0.0.2 → 10.0.0.1     TCP 78 [TCP Dup ACK 267#1] 46356 → 54368 [ACK] Seq=1 Ack=195486 Win=34304 Len=0 TSval=1886577030 TSecr=1758598503 SLE=204934 SRE=220342
  269   3.778400     10.0.0.2 → 10.0.0.1     TCP 66 46356 → 54368 [ACK] Seq=1 Ack=220342 Win=29184 Len=0 TSval=1886577038 TSecr=1758598946
  270   3.802265     10.0.0.2 → 10.0.0.1     TCP 78 25904 → 58169 [ACK] Seq=1 Ack=207486 Win=29184 Len=0 TSval=1886577062 TSecr=1758598354 SLE=212038 SRE=221486
  271   3.887713     10.0.0.2 → 10.0.0.1     TCP 66 46356 → 54368 [ACK] Seq=1 Ack=248686 Win=53248 Len=0 TSval=1886577096 TSecr=1758598954
  272   3.891919     10.0.0.2 → 10.0.0.1     TCP 78 [TCP Dup ACK 252#1] 6776 → 55246 [ACK] Seq=1 Ack=203934 Win=34304 Len=0 TSval=1886577149 TSecr=1758598005 SLE=222830 SRE=223038
  273   3.896834     10.0.0.2 → 10.0.0.1     TCP 66 25904 → 58169 [ACK] Seq=1 Ack=221486 Win=31232 Len=0 TSval=1886577151 TSecr=1758598354
  274   3.903224     10.0.0.2 → 10.0.0.1     TCP 78 [TCP Dup ACK 271#1] 46356 → 54368 [ACK] Seq=1 Ack=248686 Win=72192 Len=0 TSval=1886577154 TSecr=1758598954 SLE=249526 SRE=258974
  275   3.905707     10.0.0.2 → 10.0.0.1     TCP 78 59433 → 48193 [ACK] Seq=1 Ack=213001 Win=141 Len=0 TSval=1886577158 TSecr=1758598910 SLE=231897 SRE=241001
