    1   0.000000     10.0.0.1 → 10.0.0.2     TCP 74 42763 → 35722 [SYN] Seq=0 Win=37840 Len=0 MSS=9460 SACK_PERM TSval=1758595171 TSecr=0 WS=512
    2   0.006170     10.0.0.1 → 10.0.0.2     TCP 66 42763 → 35722 [ACK] Seq=1 Ack=1 Win=37888 Len=0 TSval=1758595178 TSecr=1886573260
    3   0.006212     10.0.0.1 → 10.0.0.2     TCP 74 36467 → 59433 [SYN] Seq=0 Win=37840 Len=0 MSS=9460 SACK_PERM TSval=1758595179 TSecr=0 WS=512
    4   0.006257     10.0.0.1 → 10.0.0.2     TCP 103 42763 → 35722 [PSH, ACK] Seq=1 Ack=1 Win=37888 Len=37 TSval=1758595179 TSecr=1886573260
    5   0.009879     10.0.0.1 → 10.0.0.2     TCP 66 36467 → 59433 [ACK] Seq=1 Ack=1 Win=37888 Len=0 TSval=1758595183 TSecr=1886573266
    6   0.009903     10.0.0.1 → 10.0.0.2     TCP 103 36467 → 59433 [PSH, ACK] Seq=1 Ack=1 Win=37888 Len=37 TSval=1758595183 TSecr=1886573266
    7   0.012283     10.0.0.1 → 10.0.0.2     TCP 66 42763 → 35722 [ACK] Seq=38 Ack=2 Win=37888 Len=0 TSval=1758595186 TSecr=1886573267
    8   0.012979     10.0.0.1 → 10.0.0.2     TCP 70 42763 → 35722 [PSH, ACK] Seq=38 Ack=2 Win=37888 Len=4 TSval=1758595186 TSecr=1886573267
    9   0.013579     10.0.0.1 → 10.0.0.2     TCP 66 36467 → 59433 [ACK] Seq=38 Ack=2 Win=37888 Len=0 TSval=1758595186 TSecr=1886573270
   10   0.014330     10.0.0.1 → 10.0.0.2     TCP 70 36467 → 59433 [PSH, ACK] Seq=38 Ack=2 Win=37888 Len=4 TSval=1758595186 TSecr=1886573270
   11   0.021604     10.0.0.1 → 10.0.0.2     TCP 74 39475 → 47452 [SYN] Seq=0 Win=37840 Len=0 MSS=9460 SACK_PERM TSval=1758595195 TSecr=0 WS=512
   12   0.025494     10.0.0.1 → 10.0.0.2     TCP 74 51099 → 25904 [SYN] Seq=0 Win=37840 Len=0 MSS=9460 SACK_PERM TSval=1758595198 TSecr=0 WS=512
   13   0.025690     10.0.0.1 → 10.0.0.2     TCP 74 58271 → 40783 [SYN] Seq=0 Win=37840 Len=0 MSS=9460 SACK_PERM TSval=1758595198 TSecr=0 WS=512
   14   0.025896     10.0.0.1 → 10.0.0.2     TCP 66 39475 → 47452 [ACK] Seq=1 Ack=1 Win=37888 Len=0 TSval=1758595199 TSecr=1886573281
   15   0.033081     10.0.0.1 → 10.0.0.2     TCP 74 55655 → 6776 [SYN] Seq=0 Win=37840 Len=0 MSS=9460 SACK_PERM TSval=1758595202 TSecr=0 WS=512
   16   0.033133     10.0.0.1 → 10.0.0.2     TCP 103 39475 → 47452 [PSH, ACK] Seq=1 Ack=1 Win=37888 Len=37 TSval=1758595203 TSecr=1886573281
   17   0.034905     10.0.0.1 → 10.0.0.2     TCP 66 51099 → 25904 [ACK] Seq=1 Ack=1 Win=37888 Len=0 TSval=1758595207 TSecr=1886573285
   18   0.036476     10.0.0.1 → 10.0.0.2     TCP 74 47085 → 46356 [SYN] Seq=0 Win=37840 Len=0 MSS=9460 SACK_PERM TSval=1758595206 TSecr=0 WS=512
   19   0.037725     10.0.0.1 → 10.0.0.2     TCP 103 58271 → 40783 [PSH, ACK] Seq=1 Ack=1 Win=37888 Len=37 TSval=1758595208 TSecr=1886573285
   20   0.037969     10.0.0.1 → 10.0.0.2     TCP 74 49189 → 42968 [SYN] Seq=0 Win=37840 Len=0 MSS=9460 SACK_PERM TSval=1758595206 TSecr=0 WS=512
   21   0.038134     10.0.0.1 → 10.0.0.2     TCP 66 58271 → 40783 [ACK] Seq=1 Ack=1 Win=37888 Len=0 TSval=1758595207 TSecr=1886573285
   22   0.038720     10.0.0.1 → 10.0.0.2     TCP 103 51099 → 25904 [PSH, ACK] Seq=1 Ack=1 Win=37888 Len=37 TSval=1758595208 TSecr=1886573285
   23   0.039953     10.0.0.1 → 10.0.0.2     TCP 66 55655 → 6776 [ACK] Seq=1 Ack=1 Win=37888 Len=0 TSval=1758595211 TSecr=1886573293
   24   0.042524     10.0.0.1 → 10.0.0.2     TCP 66 39475 → 47452 [ACK] Seq=38 Ack=2 Win=37888 Len=0 TSval=1758595212 TSecr=1886573293
   25   0.043805     10.0.0.1 → 10.0.0.2     TCP 70 39475 → 47452 [PSH, ACK] Seq=38 Ack=2 Win=37888 Len=4 TSval=1758595212 TSecr=1886573293
   26   0.043946     10.0.0.1 → 10.0.0.2     TCP 103 55655 → 6776 [PSH, ACK] Seq=1 Ack=1 Win=37888 Len=37 TSval=1758595212 TSecr=1886573293
   27   0.045875     10.0.0.1 → 10.0.0.2     TCP 66 47085 → 46356 [ACK] Seq=1 Ack=1 Win=37888 Len=0 TSval=1758595216 TSecr=1886573296
   28   0.046029     10.0.0.1 → 10.0.0.2     TCP 66 58271 → 40783 [ACK] Seq=38 Ack=2 Win=37888 Len=0 TSval=1758595217 TSecr=1886573298
   29   0.046882     10.0.0.1 → 10.0.0.2     TCP 70 58271 → 40783 [PSH, ACK] Seq=38 Ack=2 Win=37888 Len=4 TSval=1758595217 TSecr=1886573298
   30   0.047421     10.0.0.1 → 10.0.0.2     TCP 66 49189 → 42968 [ACK] Seq=1 Ack=1 Win=37888 Len=0 TSval=1758595217 TSecr=1886573298
   31   0.047966     10.0.0.1 → 10.0.0.2     TCP 103 49189 → 42968 [PSH, ACK] Seq=1 Ack=1 Win=37888 Len=37 TSval=1758595217 TSecr=1886573298
   32   0.049045     10.0.0.1 → 10.0.0.2     TCP 103 47085 → 46356 [PSH, ACK] Seq=1 Ack=1 Win=37888 Len=37 TSval=1758595217 TSecr=1886573296
   33   0.051227     10.0.0.1 → 10.0.0.2     TCP 66 51099 → 25904 [ACK] Seq=38 Ack=2 Win=37888 Len=0 TSval=1758595223 TSecr=1886573299
   34   0.051366     10.0.0.1 → 10.0.0.2     TCP 70 51099 → 25904 [PSH, ACK] Seq=38 Ack=2 Win=37888 Len=4 TSval=1758595223 TSecr=1886573299
   35   0.052243     10.0.0.1 → 10.0.0.2     TCP 66 55655 → 6776 [ACK] Seq=38 Ack=2 Win=37888 Len=0 TSval=1758595223 TSecr=1886573304
   36   0.052719     10.0.0.1 → 10.0.0.2     TCP 70 55655 → 6776 [PSH, ACK] Seq=38 Ack=2 Win=37888 Len=4 TSval=1758595223 TSecr=1886573304
   37   0.054660     10.0.0.1 → 10.0.0.2     TCP 66 49189 → 42968 [ACK] Seq=38 Ack=2 Win=37888 Len=0 TSval=1758595227 TSecr=1886573308
   38   0.055168     10.0.0.1 → 10.0.0.2     TCP 70 49189 → 42968 [PSH, ACK] Seq=38 Ack=2 Win=37888 Len=4 TSval=1758595227 TSecr=1886573308
   39   0.055617     10.0.0.1 → 10.0.0.2     TCP 66 47085 → 46356 [ACK] Seq=38 Ack=2 Win=37888 Len=0 TSval=1758595228 TSecr=1886573309
   40   0.056117     10.0.0.1 → 10.0.0.2     TCP 70 47085 → 46356 [PSH, ACK] Seq=38 Ack=2 Win=37888 Len=4 TSval=1758595228 TSecr=1886573309
   41   0.056543     10.0.0.1 → 10.0.0.2     TCP 183 42763 → 35722 [PSH, ACK] Seq=42 Ack=2 Win=37888 Len=117 TSval=1758595230 TSecr=1886573314
   42   0.059312     10.0.0.1 → 10.0.0.2     TCP 74 19551 → 35722 [SYN] Seq=0 Win=37840 Len=0 MSS=9460 SACK_PERM TSval=1758595233 TSecr=0 WS=512
   43   0.060086     10.0.0.1 → 10.0.0.2     TCP 183 36467 → 59433 [PSH, ACK] Seq=42 Ack=2 Win=37888 Len=117 TSval=1758595234 TSecr=1886573318
   44   0.067845     10.0.0.1 → 10.0.0.2     TCP 66 19551 → 35722 [ACK] Seq=1 Ack=1 Win=37888 Len=0 TSval=1758595235 TSecr=1886573319
   45   0.068713     10.0.0.1 → 10.0.0.2     TCP 103 19551 → 35722 [PSH, ACK] Seq=1 Ack=1 Win=37888 Len=37 TSval=1758595235 TSecr=1886573319
   46   0.069842     10.0.0.1 → 10.0.0.2     TCP 74 48193 → 59433 [SYN] Seq=0 Win=37840 Len=0 MSS=9460 SACK_PERM TSval=1758595243 TSecr=0 WS=512
   47   0.132744     10.0.0.1 → 10.0.0.2     TCP 103 48193 → 59433 [PSH, ACK] Seq=1 Ack=1 Win=37888 Len=37 TSval=1758595249 TSecr=1886573330
   48   0.134197     10.0.0.1 → 10.0.0.2     TCP 66 42763 → 35722 [ACK] Seq=159 Ack=3 Win=37888 Len=0 TSval=1758595277 TSecr=1886573316
   49   0.135257     10.0.0.1 → 10.0.0.2     TCP 66 48193 → 59433 [ACK] Seq=1 Ack=1 Win=37888 Len=0 TSval=1758595249 TSecr=1886573330
   50   0.139176     10.0.0.1 → 10.0.0.2     TCP 183 39475 → 47452 [PSH, ACK] Seq=42 Ack=2 Win=37888 Len=117 TSval=1758595309 TSecr=1886573358
   51   0.139572     10.0.0.1 → 10.0.0.2     TCP 66 36467 → 59433 [ACK] Seq=159 Ack=3 Win=37888 Len=0 TSval=1758595285 TSecr=1886573320
   52   0.148746     10.0.0.1 → 10.0.0.2     TCP 183 55655 → 6776 [PSH, ACK] Seq=42 Ack=2 Win=37888 Len=117 TSval=1758595312 TSecr=1886573358
   53   0.152795     10.0.0.1 → 10.0.0.2     TCP 183 51099 → 25904 [PSH, ACK] Seq=42 Ack=2 Win=37888 Len=117 TSval=1758595312 TSecr=1886573358
   54   0.155211     10.0.0.1 → 10.0.0.2     TCP 183 47085 → 46356 [PSH, ACK] Seq=42 Ack=2 Win=37888 Len=117 TSval=1758595313 TSecr=1886573358
   55   0.162638     10.0.0.1 → 10.0.0.2     TCP 183 58271 → 40783 [PSH, ACK] Seq=42 Ack=2 Win=37888 Len=117 TSval=1758595314 TSecr=1886573358
   56   0.177499     10.0.0.1 → 10.0.0.2     TCP 183 49189 → 42968 [PSH, ACK] Seq=42 Ack=2 Win=37888 Len=117 TSval=1758595317 TSecr=1886573358
   57   0.195555     10.0.0.1 → 10.0.0.2     TCP 66 42763 → 35722 [ACK] Seq=159 Ack=5 Win=37888 Len=0 TSval=1758595317 TSecr=1886573394
   58   0.204091     10.0.0.1 → 10.0.0.2     TCP 1066 19551 → 35722 [PSH, ACK] Seq=38 Ack=1 Win=37888 Len=1000 TSval=1758595317 TSecr=1886573328
   59   0.208044     10.0.0.1 → 10.0.0.2     TCP 74 53241 → 47452 [SYN] Seq=0 Win=37840 Len=0 MSS=9460 SACK_PERM TSval=1758595379 TSecr=0 WS=512
   60   0.209137     10.0.0.1 → 10.0.0.2     TCP 66 36467 → 59433 [ACK] Seq=159 Ack=5 Win=37888 Len=0 TSval=1758595380 TSecr=1886573399
   61   0.210175     10.0.0.1 → 10.0.0.2     TCP 74 55246 → 6776 [SYN] Seq=0 Win=37840 Len=0 MSS=9460 SACK_PERM TSval=1758595380 TSecr=0 WS=512
   62   0.211501     10.0.0.1 → 10.0.0.2     TCP 1066 48193 → 59433 [PSH, ACK] Seq=38 Ack=1 Win=37888 Len=1000 TSval=1758595380 TSecr=1886573395
   63   0.212462     10.0.0.1 → 10.0.0.2     TCP 74 58169 → 25904 [SYN] Seq=0 Win=37840 Len=0 MSS=9460 SACK_PERM TSval=1758595381 TSecr=0 WS=512
   64   0.213579     10.0.0.1 → 10.0.0.2     TCP 74 54368 → 46356 [SYN] Seq=0 Win=37840 Len=0 MSS=9460 SACK_PERM TSval=1758595381 TSecr=0 WS=512
   65   0.222636     10.0.0.1 → 10.0.0.2     TCP 74 32720 → 40783 [SYN] Seq=0 Win=37840 Len=0 MSS=9460 SACK_PERM TSval=1758595382 TSecr=0 WS=512
   66   0.223582     10.0.0.1 → 10.0.0.2     TCP 74 55943 → 42968 [SYN] Seq=0 Win=37840 Len=0 MSS=9460 SACK_PERM TSval=1758595382 TSecr=0 WS=512
   67   0.231028     10.0.0.1 → 10.0.0.2     TCP 5066 19551 → 35722 [PSH, ACK] Seq=1038 Ack=1 Win=37888 Len=5000 TSval=1758595385 TSecr=1886573464
   68   0.246232     10.0.0.1 → 10.0.0.2     TCP 66 53241 → 47452 [ACK] Seq=1 Ack=1 Win=37888 Len=0 TSval=1758595399 TSecr=1886573468
   69   0.259753     10.0.0.1 → 10.0.0.2     TCP 103 53241 → 47452 [PSH, ACK] Seq=1 Ack=1 Win=37888 Len=37 TSval=1758595399 TSecr=1886573468
   70   0.261222     10.0.0.1 → 10.0.0.2     TCP 66 55246 → 6776 [ACK] Seq=1 Ack=1 Win=37888 Len=0 TSval=1758595400 TSecr=1886573470
   71   0.263177     10.0.0.1 → 10.0.0.2     TCP 103 55246 → 6776 [PSH, ACK] Seq=1 Ack=1 Win=37888 Len=37 TSval=1758595400 TSecr=1886573470
   72   0.278975     10.0.0.1 → 10.0.0.2     TCP 2066 48193 → 59433 [PSH, ACK] Seq=1038 Ack=1 Win=37888 Len=2000 TSval=1758595409 TSecr=1886573471
   73   0.280619     10.0.0.1 → 10.0.0.2     TCP 66 58169 → 25904 [ACK] Seq=1 Ack=1 Win=37888 Len=0 TSval=1758595410 TSecr=1886573472
   74   0.314872     10.0.0.1 → 10.0.0.2     TCP 103 58169 → 25904 [PSH, ACK] Seq=1 Ack=1 Win=37888 Len=37 TSval=1758595410 TSecr=1886573472
   75   0.326673     10.0.0.1 → 10.0.0.2     TCP 66 54368 → 46356 [ACK] Seq=1 Ack=1 Win=37888 Len=0 TSval=1758595410 TSecr=1886573473
   76   0.327414     10.0.0.1 → 10.0.0.2     TCP 103 54368 → 46356 [PSH, ACK] Seq=1 Ack=1 Win=37888 Len=37 TSval=1758595410 TSecr=1886573473
   77   0.328515     10.0.0.1 → 10.0.0.2     TCP 66 32720 → 40783 [ACK] Seq=1 Ack=1 Win=37888 Len=0 TSval=1758595417 TSecr=1886573482
   78   0.332215     10.0.0.1 → 10.0.0.2     TCP 103 32720 → 40783 [PSH, ACK] Seq=1 Ack=1 Win=37888 Len=37 TSval=1758595417 TSecr=1886573482
   79   0.338703     10.0.0.1 → 10.0.0.2     TCP 66 55943 → 42968 [ACK] Seq=1 Ack=1 Win=37888 Len=0 TSval=1758595417 TSecr=1886573483
   80   0.339332     10.0.0.1 → 10.0.0.2     TCP 103 55943 → 42968 [PSH, ACK] Seq=1 Ack=1 Win=37888 Len=37 TSval=1758595417 TSecr=1886573483
   81   0.341178     10.0.0.1 → 10.0.0.2     TCP 66 51099 → 25904 [ACK] Seq=159 Ack=3 Win=37888 Len=0 TSval=1758595421 TSecr=1886573413
   82   0.342162     10.0.0.1 → 10.0.0.2     TCP 66 55655 → 6776 [ACK] Seq=159 Ack=3 Win=37888 Len=0 TSval=1758595421 TSecr=1886573409
   83   0.343204     10.0.0.1 → 10.0.0.2     TCP 66 39475 → 47452 [ACK] Seq=159 Ack=3 Win=37888 Len=0 TSval=1758595421 TSecr=1886573399
   84   0.350345     10.0.0.1 → 10.0.0.2     TCP 66 49189 → 42968 [ACK] Seq=159 Ack=3 Win=37888 Len=0 TSval=1758595425 TSecr=1886573438
   85   0.354305     10.0.0.1 → 10.0.0.2     TCP 66 58271 → 40783 [ACK] Seq=159 Ack=3 Win=37888 Len=0 TSval=1758595425 TSecr=1886573423
   86   0.355436     10.0.0.1 → 10.0.0.2     TCP 66 47085 → 46356 [ACK] Seq=159 Ack=3 Win=37888 Len=0 TSval=1758595425 TSecr=1886573415
   87   0.356615     10.0.0.1 → 10.0.0.2     TCP 3066 19551 → 35722 [PSH, ACK] Seq=6038 Ack=1 Win=37888 Len=3000 TSval=1758595436 TSecr=1886573491
   88   0.359575     10.0.0.1 → 10.0.0.2     TCP 9066 48193 → 59433 [PSH, ACK] Seq=3038 Ack=1 Win=37888 Len=9000 TSval=1758595532 TSecr=1886573539
   89   0.366620     10.0.0.1 → 10.0.0.2     TCP 66 51099 → 25904 [ACK] Seq=159 Ack=5 Win=37888 Len=0 TSval=1758595533 TSecr=1886573601
   90   0.369013     10.0.0.1 → 10.0.0.2     TCP 8066 19551 → 35722 [PSH, ACK] Seq=9038 Ack=1 Win=37888 Len=8000 TSval=1758595534 TSecr=1886573616
   91   0.378197     10.0.0.1 → 10.0.0.2     TCP 66 55655 → 6776 [ACK] Seq=159 Ack=5 Win=37888 Len=0 TSval=1758595533 TSecr=1886573602
   92   0.378754     10.0.0.1 → 10.0.0.2     TCP 66 39475 → 47452 [ACK] Seq=159 Ack=5 Win=37888 Len=0 TSval=1758595533 TSecr=1886573603
   93   0.379148     10.0.0.1 → 10.0.0.2     TCP 66 49189 → 42968 [ACK] Seq=159 Ack=5 Win=37888 Len=0 TSval=1758595533 TSecr=1886573610
   94   0.379467     10.0.0.1 → 10.0.0.2     TCP 66 58271 → 40783 [ACK] Seq=159 Ack=5 Win=37888 Len=0 TSval=1758595533 TSecr=1886573614
   95   0.379767     10.0.0.1 → 10.0.0.2     TCP 66 47085 → 46356 [ACK] Seq=159 Ack=5 Win=37888 Len=0 TSval=1758595533 TSecr=1886573615
   96   0.380380     10.0.0.1 → 10.0.0.2     TCP 1066 53241 → 47452 [PSH, ACK] Seq=38 Ack=1 Win=37888 Len=1000 TSval=1758595534 TSecr=1886573520
   97   0.381388     10.0.0.1 → 10.0.0.2     TCP 1066 55943 → 42968 [PSH, ACK] Seq=38 Ack=1 Win=37888 Len=1000 TSval=1758595536 TSecr=1886573599
   98   0.383325     10.0.0.1 → 10.0.0.2     TCP 1066 55246 → 6776 [PSH, ACK] Seq=38 Ack=1 Win=37888 Len=1000 TSval=1758595543 TSecr=1886573523
   99   0.384761     10.0.0.1 → 10.0.0.2     TCP 1066 48193 → 59433 [PSH, ACK] Seq=12038 Ack=1 Win=37888 Len=1000 TSval=1758595544 TSecr=1886573619
  100   0.386944     10.0.0.1 → 10.0.0.2     TCP 1066 19551 → 35722 [PSH, ACK] Seq=17038 Ack=1 Win=37888 Len=1000 TSval=1758595549 TSecr=1886573629
  101   0.389018     10.0.0.1 → 10.0.0.2     TCP 1066 53241 → 47452 [PSH, ACK] Seq=1038 Ack=1 Win=37888 Len=1000 TSval=1758595556 TSecr=1886573640
  102   0.391138     10.0.0.1 → 10.0.0.2     TCP 1066 55246 → 6776 [PSH, ACK] Seq=1038 Ack=1 Win=37888 Len=1000 TSval=1758595559 TSecr=1886573643
  103   0.394860     10.0.0.1 → 10.0.0.2     TCP 1066 58169 → 25904 [PSH, ACK] Seq=38 Ack=1 Win=37888 Len=1000 TSval=1758595534 TSecr=1886573575
  104   0.396530     10.0.0.1 → 10.0.0.2     TCP 2066 58169 → 25904 [PSH, ACK] Seq=1038 Ack=1 Win=37888 Len=2000 TSval=1758595570 TSecr=1886573655
  105   0.399116     10.0.0.1 → 10.0.0.2     TCP 1066 32720 → 40783 [PSH, ACK] Seq=38 Ack=1 Win=37888 Len=1000 TSval=1758595534 TSecr=1886573592
  106   0.401722     10.0.0.1 → 10.0.0.2     TCP 1066 58169 → 25904 [PSH, ACK] Seq=3038 Ack=1 Win=37888 Len=1000 TSval=1758595574 TSecr=1886573656
  107   0.403365     10.0.0.1 → 10.0.0.2     TCP 1066 54368 → 46356 [PSH, ACK] Seq=38 Ack=1 Win=37888 Len=1000 TSval=1758595536 TSecr=1886573587
  108   0.407705     10.0.0.1 → 10.0.0.2     TCP 1066 55943 → 42968 [PSH, ACK] Seq=1038 Ack=1 Win=37888 Len=1000 TSval=1758595558 TSecr=1886573641
  109   0.411915     10.0.0.1 → 10.0.0.2     TCP 1066 48193 → 59433 [PSH, ACK] Seq=13038 Ack=1 Win=37888 Len=1000 TSval=1758595560 TSecr=1886573645
  110   0.413439     10.0.0.1 → 10.0.0.2     TCP 2066 48193 → 59433 [PSH, ACK] Seq=14038 Ack=1 Win=37888 Len=2000 TSval=1758595587 TSecr=1886573672
  111   0.416187     10.0.0.1 → 10.0.0.2     TCP 1066 19551 → 35722 [PSH, ACK] Seq=18038 Ack=1 Win=37888 Len=1000 TSval=1758595562 TSecr=1886573647
  112   0.420899     10.0.0.1 → 10.0.0.2     TCP 1066 48193 → 59433 [PSH, ACK] Seq=16038 Ack=1 Win=37888 Len=1000 TSval=1758595594 TSecr=1886573673
  113   0.421090     10.0.0.1 → 10.0.0.2     TCP 1066 53241 → 47452 [PSH, ACK] Seq=2038 Ack=1 Win=37888 Len=1000 TSval=1758595564 TSecr=1886573649
  114   0.424080     10.0.0.1 → 10.0.0.2     TCP 2066 53241 → 47452 [PSH, ACK] Seq=3038 Ack=1 Win=37888 Len=2000 TSval=1758595598 TSecr=1886573681
  115   0.425016     10.0.0.1 → 10.0.0.2     TCP 1066 55246 → 6776 [PSH, ACK] Seq=2038 Ack=1 Win=37888 Len=1000 TSval=1758595571 TSecr=1886573651
  116   0.427155     10.0.0.1 → 10.0.0.2     TCP 2066 55246 → 6776 [PSH, ACK] Seq=3038 Ack=1 Win=37888 Len=2000 TSval=1758595601 TSecr=1886573685
  117   0.430005     10.0.0.1 → 10.0.0.2     TCP 3066 32720 → 40783 [PSH, ACK] Seq=1038 Ack=1 Win=37888 Len=3000 TSval=1758595576 TSecr=1886573659
  118   0.436510     10.0.0.1 → 10.0.0.2     TCP 1066 55246 → 6776 [PSH, ACK] Seq=5038 Ack=1 Win=37888 Len=1000 TSval=1758595611 TSecr=1886573687
  119   0.441237     10.0.0.1 → 10.0.0.2     TCP 3066 54368 → 46356 [PSH, ACK] Seq=1038 Ack=1 Win=37888 Len=3000 TSval=1758595579 TSecr=1886573663
  120   0.442821     10.0.0.1 → 10.0.0.2     TCP 3066 54368 → 46356 [PSH, ACK] Seq=4038 Ack=1 Win=37888 Len=3000 TSval=1758595617 TSecr=1886573701
  121   0.453513     10.0.0.1 → 10.0.0.2     TCP 2066 55943 → 42968 [PSH, ACK] Seq=2038 Ack=1 Win=37888 Len=2000 TSval=1758595583 TSecr=1886573667
  122   0.461776     10.0.0.1 → 10.0.0.2     TCP 1066 58169 → 25904 [PSH, ACK] Seq=4038 Ack=1 Win=37888 Len=1000 TSval=1758595588 TSecr=1886573661
  123   0.466036     10.0.0.1 → 10.0.0.2     TCP 2066 19551 → 35722 [PSH, ACK] Seq=19038 Ack=1 Win=37888 Len=2000 TSval=1758595592 TSecr=1886573676
  124   0.467765     10.0.0.1 → 10.0.0.2     TCP 4066 19551 → 35722 [PSH, ACK] Seq=21038 Ack=1 Win=37888 Len=4000 TSval=1758595642 TSecr=1886573726
  125   0.474268     10.0.0.1 → 10.0.0.2     TCP 1066 53241 → 47452 [PSH, ACK] Seq=5038 Ack=1 Win=37888 Len=1000 TSval=1758595601 TSecr=1886573684
  126   0.475745     10.0.0.1 → 10.0.0.2     TCP 3066 53241 → 47452 [PSH, ACK] Seq=6038 Ack=1 Win=37888 Len=3000 TSval=1758595650 TSecr=1886573734
  127   0.478556     10.0.0.1 → 10.0.0.2     TCP 2066 32720 → 40783 [PSH, ACK] Seq=4038 Ack=1 Win=37888 Len=2000 TSval=1758595606 TSecr=1886573690
  128   0.479159     10.0.0.1 → 10.0.0.2     TCP 1066 19551 → 35722 [PSH, ACK] Seq=25038 Ack=1 Win=37888 Len=1000 TSval=1758595651 TSecr=1886573728
  129   0.481077     10.0.0.1 → 10.0.0.2     TCP 1066 53241 → 47452 [PSH, ACK] Seq=9038 Ack=1 Win=37888 Len=1000 TSval=1758595654 TSecr=1886573736
  130   0.486910     10.0.0.1 → 10.0.0.2     TCP 1066 48193 → 59433 [PSH, ACK] Seq=17038 Ack=1 Win=37888 Len=1000 TSval=1758595607 TSecr=1886573681
  131   0.491215     10.0.0.1 → 10.0.0.2     TCP 1066 55246 → 6776 [PSH, ACK] Seq=6038 Ack=1 Win=37888 Len=1000 TSval=1758595624 TSecr=1886573696
  132   0.495340     10.0.0.1 → 10.0.0.2     TCP 3066 55943 → 42968 [PSH, ACK] Seq=4038 Ack=1 Win=37888 Len=3000 TSval=1758595629 TSecr=1886573713
  133   0.496972     10.0.0.1 → 10.0.0.2     TCP 4066 55943 → 42968 [PSH, ACK] Seq=7038 Ack=1 Win=37888 Len=4000 TSval=1758595671 TSecr=1886573755
  134   0.507617     10.0.0.1 → 10.0.0.2     TCP 1066 54368 → 46356 [PSH, ACK] Seq=7038 Ack=1 Win=37888 Len=1000 TSval=1758595630 TSecr=1886573703
  135   0.511874     10.0.0.1 → 10.0.0.2     TCP 3066 58169 → 25904 [PSH, ACK] Seq=5038 Ack=1 Win=37888 Len=3000 TSval=1758595638 TSecr=1886573722
  136   0.524114     10.0.0.1 → 10.0.0.2     TCP 3066 32720 → 40783 [PSH, ACK] Seq=6038 Ack=1 Win=37888 Len=3000 TSval=1758595654 TSecr=1886573738
  137   0.536397     10.0.0.1 → 10.0.0.2     TCP 4066 48193 → 59433 [PSH, ACK] Seq=18038 Ack=1 Win=37888 Len=4000 TSval=1758595663 TSecr=1886573747
  138   0.537816     10.0.0.1 → 10.0.0.2     TCP 3066 48193 → 59433 [PSH, ACK] Seq=22038 Ack=1 Win=37888 Len=3000 TSval=1758595712 TSecr=1886573796
  139   0.552808     10.0.0.1 → 10.0.0.2     TCP 1066 19551 → 35722 [PSH, ACK] Seq=26038 Ack=1 Win=37888 Len=1000 TSval=1758595664 TSecr=1886573739
  140   0.556958     10.0.0.1 → 10.0.0.2     TCP 3066 55246 → 6776 [PSH, ACK] Seq=7038 Ack=1 Win=37888 Len=3000 TSval=1758595667 TSecr=1886573751
  141   0.558590     10.0.0.1 → 10.0.0.2     TCP 5066 55246 → 6776 [PSH, ACK] Seq=10038 Ack=1 Win=37888 Len=5000 TSval=1758595733 TSecr=1886573817
  142   0.572131     10.0.0.1 → 10.0.0.2     TCP 1066 53241 → 47452 [PSH, ACK] Seq=10038 Ack=1 Win=37888 Len=1000 TSval=1758595668 TSecr=1886573741
  143   0.573523     10.0.0.1 → 10.0.0.2     TCP 1066 55943 → 42968 [PSH, ACK] Seq=11038 Ack=1 Win=37888 Len=1000 TSval=1758595683 TSecr=1886573757
  144   0.577772     10.0.0.1 → 10.0.0.2     TCP 4066 54368 → 46356 [PSH, ACK] Seq=8038 Ack=1 Win=37888 Len=4000 TSval=1758595684 TSecr=1886573767
  145   0.579240     10.0.0.1 → 10.0.0.2     TCP 5066 54368 → 46356 [PSH, ACK] Seq=12038 Ack=1 Win=37888 Len=5000 TSval=1758595753 TSecr=1886573838
  146   0.588776     10.0.0.1 → 10.0.0.2     TCP 1066 54368 → 46356 [PSH, ACK] Seq=17038 Ack=1 Win=37888 Len=1000 TSval=1758595763 TSecr=1886573839
  147   0.594000     10.0.0.1 → 10.0.0.2     TCP 4066 58169 → 25904 [PSH, ACK] Seq=8038 Ack=1 Win=37888 Len=4000 TSval=1758595687 TSecr=1886573772
  148   0.595708     10.0.0.1 → 10.0.0.2     TCP 6066 58169 → 25904 [PSH, ACK] Seq=12038 Ack=1 Win=37888 Len=6000 TSval=1758595770 TSecr=1886573854
  149   0.604659     10.0.0.1 → 10.0.0.2     TCP 1066 58169 → 25904 [PSH, ACK] Seq=18038 Ack=1 Win=37888 Len=1000 TSval=1758595774 TSecr=1886573855
  150   0.606761     10.0.0.1 → 10.0.0.2     TCP 1066 54368 → 46356 [PSH, ACK] Seq=18038 Ack=1 Win=37888 Len=1000 TSval=1758595776 TSecr=1886573849
  151   0.610278     10.0.0.1 → 10.0.0.2     TCP 4066 32720 → 40783 [PSH, ACK] Seq=9038 Ack=1 Win=37888 Len=4000 TSval=1758595700 TSecr=1886573784
  152   0.611801     10.0.0.1 → 10.0.0.2     TCP 6066 32720 → 40783 [PSH, ACK] Seq=13038 Ack=1 Win=37888 Len=6000 TSval=1758595786 TSecr=1886573870
  153   0.621041     10.0.0.1 → 10.0.0.2     TCP 1066 32720 → 40783 [PSH, ACK] Seq=19038 Ack=1 Win=37888 Len=1000 TSval=1758595788 TSecr=1886573872
  154   0.626663     10.0.0.1 → 10.0.0.2     TCP 1066 48193 → 59433 [PSH, ACK] Seq=25038 Ack=1 Win=37888 Len=1000 TSval=1758595714 TSecr=1886573798
  155   0.630803     10.0.0.1 → 10.0.0.2     TCP 4066 19551 → 35722 [PSH, ACK] Seq=27038 Ack=1 Win=37888 Len=4000 TSval=1758595729 TSecr=1886573813
  156   0.632416     10.0.0.1 → 10.0.0.2     TCP 6066 19551 → 35722 [PSH, ACK] Seq=31038 Ack=1 Win=37888 Len=6000 TSval=1758595806 TSecr=1886573891
  157   0.641352     10.0.0.1 → 10.0.0.2     TCP 1066 19551 → 35722 [PSH, ACK] Seq=37038 Ack=1 Win=37888 Len=1000 TSval=1758595811 TSecr=1886573892
  158   0.647057     10.0.0.1 → 10.0.0.2     TCP 1066 55246 → 6776 [PSH, ACK] Seq=15038 Ack=1 Win=37888 Len=1000 TSval=1758595744 TSecr=1886573818
  159   0.651349     10.0.0.1 → 10.0.0.2     TCP 6066 53241 → 47452 [PSH, ACK] Seq=11038 Ack=1 Win=37888 Len=6000 TSval=1758595748 TSecr=1886573832
  160   0.651897     10.0.0.1 → 10.0.0.2     TCP 1066 19551 → 35722 [PSH, ACK] Seq=38038 Ack=1 Win=37888 Len=1000 TSval=1758595824 TSecr=1886573901
  161   0.653479     10.0.0.1 → 10.0.0.2     TCP 5066 53241 → 47452 [PSH, ACK] Seq=17038 Ack=1 Win=37888 Len=5000 TSval=1758595827 TSecr=1886573911
  162   0.660719     10.0.0.1 → 10.0.0.2     TCP 1066 53241 → 47452 [PSH, ACK] Seq=22038 Ack=1 Win=37888 Len=1000 TSval=1758595829 TSecr=1886573913
  163   0.663237     10.0.0.1 → 10.0.0.2     TCP 1066 19551 → 35722 [PSH, ACK] Seq=39038 Ack=1 Win=37888 Len=1000 TSval=1758595837 TSecr=1886573912
  164   0.667508     10.0.0.1 → 10.0.0.2     TCP 1066 53241 → 47452 [PSH, ACK] Seq=23038 Ack=1 Win=37888 Len=1000 TSval=1758595841 TSecr=1886573920
  165   0.675602     10.0.0.1 → 10.0.0.2     TCP 4066 55943 → 42968 [PSH, ACK] Seq=12038 Ack=1 Win=37888 Len=4000 TSval=1758595750 TSecr=1886573833
  166   0.679702     10.0.0.1 → 10.0.0.2     TCP 1066 19551 → 35722 [PSH, ACK] Seq=40038 Ack=1 Win=37888 Len=1000 TSval=1758595851 TSecr=1886573923
  167   0.680920     10.0.0.1 → 10.0.0.2     TCP 8066 55943 → 42968 [PSH, ACK] Seq=16038 Ack=1 Win=37888 Len=8000 TSval=1758595851 TSecr=1886573935
  168   0.691863     10.0.0.1 → 10.0.0.2     TCP 1066 58169 → 25904 [PSH, ACK] Seq=19038 Ack=1 Win=37888 Len=1000 TSval=1758595788 TSecr=1886573864
  169   0.693521     10.0.0.1 → 10.0.0.2     TCP 1066 53241 → 47452 [PSH, ACK] Seq=24038 Ack=1 Win=37888 Len=1000 TSval=1758595854 TSecr=1886573927
  170   0.695446     10.0.0.1 → 10.0.0.2     TCP 1066 55943 → 42968 [PSH, ACK] Seq=24038 Ack=1 Win=37888 Len=1000 TSval=1758595858 TSecr=1886573941
  171   0.696472     10.0.0.1 → 10.0.0.2     TCP 1066 54368 → 46356 [PSH, ACK] Seq=19038 Ack=1 Win=37888 Len=1000 TSval=1758595790 TSecr=1886573867
  172   0.698459     10.0.0.1 → 10.0.0.2     TCP 5066 58169 → 25904 [PSH, ACK] Seq=20038 Ack=1 Win=37888 Len=5000 TSval=1758595867 TSecr=1886573952
  173   0.700859     10.0.0.1 → 10.0.0.2     TCP 1066 32720 → 40783 [PSH, ACK] Seq=20038 Ack=1 Win=37888 Len=1000 TSval=1758595801 TSecr=1886573881
  174   0.705023     10.0.0.1 → 10.0.0.2     TCP 6066 48193 → 59433 [PSH, ACK] Seq=26038 Ack=1 Win=37888 Len=6000 TSval=1758595803 TSecr=1886573886
  175   0.707362     10.0.0.1 → 10.0.0.2     TCP 6066 54368 → 46356 [PSH, ACK] Seq=20038 Ack=1 Win=37888 Len=6000 TSval=1758595874 TSecr=1886573956
  176   0.719451     10.0.0.1 → 10.0.0.2     TCP 1066 58169 → 25904 [PSH, ACK] Seq=25038 Ack=1 Win=37888 Len=1000 TSval=1758595875 TSecr=1886573958
  177   0.721501     10.0.0.1 → 10.0.0.2     TCP 5066 32720 → 40783 [PSH, ACK] Seq=21038 Ack=1 Win=37888 Len=5000 TSval=1758595879 TSecr=1886573961
  178   0.728952     10.0.0.1 → 10.0.0.2     TCP 5066 55246 → 6776 [PSH, ACK] Seq=16038 Ack=1 Win=37888 Len=5000 TSval=1758595823 TSecr=1886573907
  179   0.731652     10.0.0.1 → 10.0.0.2     TCP 6066 48193 → 59433 [PSH, ACK] Seq=32038 Ack=1 Win=37888 Len=6000 TSval=1758595881 TSecr=1886573965
  180   0.743787     10.0.0.1 → 10.0.0.2     TCP 1066 54368 → 46356 [PSH, ACK] Seq=26038 Ack=1 Win=37888 Len=1000 TSval=1758595883 TSecr=1886573967
  181   0.745957     10.0.0.1 → 10.0.0.2     TCP 2066 58169 → 25904 [PSH, ACK] Seq=26038 Ack=1 Win=37888 Len=2000 TSval=1758595895 TSecr=1886573979
  182   0.749226     10.0.0.1 → 10.0.0.2     TCP 1066 19551 → 35722 [PSH, ACK] Seq=41038 Ack=1 Win=37888 Len=1000 TSval=1758595864 TSecr=1886573940
  183   0.750509     10.0.0.1 → 10.0.0.2     TCP 7066 55246 → 6776 [PSH, ACK] Seq=21038 Ack=1 Win=37888 Len=7000 TSval=1758595905 TSecr=1886573989
  184   0.753403     10.0.0.1 → 10.0.0.2     TCP 1066 53241 → 47452 [PSH, ACK] Seq=25038 Ack=1 Win=37888 Len=1000 TSval=1758595869 TSecr=1886573953
  185   0.757696     10.0.0.1 → 10.0.0.2     TCP 1066 55943 → 42968 [PSH, ACK] Seq=25038 Ack=1 Win=37888 Len=1000 TSval=1758595871 TSecr=1886573955
  186   0.761973     10.0.0.1 → 10.0.0.2     TCP 2066 32720 → 40783 [PSH, ACK] Seq=26038 Ack=1 Win=37888 Len=2000 TSval=1758595897 TSecr=1886573981
  187   0.764219     10.0.0.1 → 10.0.0.2     TCP 2066 54368 → 46356 [PSH, ACK] Seq=27038 Ack=1 Win=37888 Len=2000 TSval=1758595919 TSecr=1886574004
  188   0.768311     10.0.0.1 → 10.0.0.2     TCP 4066 19551 → 35722 [PSH, ACK] Seq=42038 Ack=1 Win=37888 Len=4000 TSval=1758595925 TSecr=1886574009
  189   0.770245     10.0.0.1 → 10.0.0.2     TCP 2066 48193 → 59433 [PSH, ACK] Seq=38038 Ack=1 Win=37888 Len=2000 TSval=1758595907 TSecr=1886573991
  190   0.776435     10.0.0.1 → 10.0.0.2     TCP 4066 53241 → 47452 [PSH, ACK] Seq=26038 Ack=1 Win=37888 Len=4000 TSval=1758595929 TSecr=1886574013
  191   0.778470     10.0.0.1 → 10.0.0.2     TCP 2066 58169 → 25904 [PSH, ACK] Seq=28038 Ack=1 Win=37888 Len=2000 TSval=1758595921 TSecr=1886574006
  192   0.784599     10.0.0.1 → 10.0.0.2     TCP 1066 19551 → 35722 [PSH, ACK] Seq=46038 Ack=1 Win=37888 Len=1000 TSval=1758595944 TSecr=1886574028
  193   0.786711     10.0.0.1 → 10.0.0.2     TCP 3066 48193 → 59433 [PSH, ACK] Seq=40038 Ack=1 Win=37888 Len=3000 TSval=1758595946 TSecr=1886574030
  194   0.786878     10.0.0.1 → 10.0.0.2     TCP 1066 55246 → 6776 [PSH, ACK] Seq=28038 Ack=1 Win=37888 Len=1000 TSval=1758595926 TSecr=1886574010
  195   0.791000     10.0.0.1 → 10.0.0.2     TCP 4066 55943 → 42968 [PSH, ACK] Seq=26038 Ack=1 Win=37888 Len=4000 TSval=1758595934 TSecr=1886574017
  196   0.792813     10.0.0.1 → 10.0.0.2     TCP 2066 53241 → 47452 [PSH, ACK] Seq=30038 Ack=1 Win=37888 Len=2000 TSval=1758595952 TSecr=1886574036
  197   0.796967     10.0.0.1 → 10.0.0.2     TCP 3066 55943 → 42968 [PSH, ACK] Seq=30038 Ack=1 Win=37888 Len=3000 TSval=1758595967 TSecr=1886574051
  198   0.803112     10.0.0.1 → 10.0.0.2     TCP 1066 53241 → 47452 [PSH, ACK] Seq=32038 Ack=1 Win=37888 Len=1000 TSval=1758595968 TSecr=1886574053
  199   0.805221     10.0.0.1 → 10.0.0.2     TCP 1066 55943 → 42968 [PSH, ACK] Seq=33038 Ack=1 Win=37888 Len=1000 TSval=1758595976 TSecr=1886574057
  200   0.807333     10.0.0.1 → 10.0.0.2     TCP 3066 32720 → 40783 [PSH, ACK] Seq=28038 Ack=1 Win=37888 Len=3000 TSval=1758595937 TSecr=1886574022
  201   0.807513     10.0.0.1 → 10.0.0.2     TCP 1066 53241 → 47452 [PSH, ACK] Seq=33038 Ack=1 Win=37888 Len=1000 TSval=1758595979 TSecr=1886574063
  202   0.809527     10.0.0.1 → 10.0.0.2     TCP 3066 32720 → 40783 [PSH, ACK] Seq=31038 Ack=1 Win=37888 Len=3000 TSval=1758595983 TSecr=1886574067
  203   0.819639     10.0.0.1 → 10.0.0.2     TCP 2066 54368 → 46356 [PSH, ACK] Seq=29038 Ack=1 Win=37888 Len=2000 TSval=1758595940 TSecr=1886574024
  204   0.827859     10.0.0.1 → 10.0.0.2     TCP 2066 58169 → 25904 [PSH, ACK] Seq=30038 Ack=1 Win=37888 Len=2000 TSval=1758595954 TSecr=1886574038
  205   0.829546     10.0.0.1 → 10.0.0.2     TCP 4066 58169 → 25904 [PSH, ACK] Seq=32038 Ack=1 Win=37888 Len=4000 TSval=1758596004 TSecr=1886574088
  206   0.836103     10.0.0.1 → 10.0.0.2     TCP 2066 19551 → 35722 [PSH, ACK] Seq=47038 Ack=1 Win=37888 Len=2000 TSval=1758595960 TSecr=1886574044
  207   0.837637     10.0.0.1 → 10.0.0.2     TCP 4066 19551 → 35722 [PSH, ACK] Seq=49038 Ack=1 Win=37888 Len=4000 TSval=1758596012 TSecr=1886574096
  208   0.844360     10.0.0.1 → 10.0.0.2     TCP 1066 48193 → 59433 [PSH, ACK] Seq=43038 Ack=1 Win=37888 Len=1000 TSval=1758595962 TSecr=1886574046
  209   0.846465     10.0.0.1 → 10.0.0.2     TCP 4066 48193 → 59433 [PSH, ACK] Seq=44038 Ack=1 Win=37888 Len=4000 TSval=1758596020 TSecr=1886574104
  210   0.848627     10.0.0.1 → 10.0.0.2     TCP 3066 55246 → 6776 [PSH, ACK] Seq=29038 Ack=1 Win=37888 Len=3000 TSval=1758595963 TSecr=1886574047
  211   0.850961     10.0.0.1 → 10.0.0.2     TCP 1066 48193 → 59433 [PSH, ACK] Seq=48038 Ack=1 Win=37888 Len=1000 TSval=1758596022 TSecr=1886574106
  212   0.853051     10.0.0.1 → 10.0.0.2     TCP 1066 19551 → 35722 [PSH, ACK] Seq=53038 Ack=1 Win=37888 Len=1000 TSval=1758596024 TSecr=1886574097
  213   0.855202     10.0.0.1 → 10.0.0.2     TCP 5066 55246 → 6776 [PSH, ACK] Seq=32038 Ack=1 Win=37888 Len=5000 TSval=1758596024 TSecr=1886574108
  214   0.860925     10.0.0.1 → 10.0.0.2     TCP 1066 32720 → 40783 [PSH, ACK] Seq=34038 Ack=1 Win=37888 Len=1000 TSval=1758595988 TSecr=1886574069
  215   0.865708     10.0.0.1 → 10.0.0.2     TCP 1066 55943 → 42968 [PSH, ACK] Seq=34038 Ack=1 Win=37888 Len=1000 TSval=1758595990 TSecr=1886574065
  216   0.865889     10.0.0.1 → 10.0.0.2     TCP 3066 53241 → 47452 [PSH, ACK] Seq=34038 Ack=1 Win=37888 Len=3000 TSval=1758596025 TSecr=1886574110
  217   0.869376     10.0.0.1 → 10.0.0.2     TCP 4066 54368 → 46356 [PSH, ACK] Seq=31038 Ack=1 Win=37888 Len=4000 TSval=1758595995 TSecr=1886574079
  218   0.871352     10.0.0.1 → 10.0.0.2     TCP 1066 48193 → 59433 [PSH, ACK] Seq=49038 Ack=1 Win=37888 Len=1000 TSval=1758596034 TSecr=1886574111
  219   0.873565     10.0.0.1 → 10.0.0.2     TCP 3066 55943 → 42968 [PSH, ACK] Seq=35038 Ack=1 Win=37888 Len=3000 TSval=1758596042 TSecr=1886574125
  220   0.879641     10.0.0.1 → 10.0.0.2     TCP 2066 53241 → 47452 [PSH, ACK] Seq=37038 Ack=1 Win=37888 Len=2000 TSval=1758596042 TSecr=1886574126
  221   0.883841     10.0.0.1 → 10.0.0.2     TCP 4066 54368 → 46356 [PSH, ACK] Seq=35038 Ack=1 Win=37888 Len=4000 TSval=1758596045 TSecr=1886574129
  222   0.885668     10.0.0.1 → 10.0.0.2     TCP 1066 58169 → 25904 [PSH, ACK] Seq=36038 Ack=1 Win=37888 Len=1000 TSval=1758596014 TSecr=1886574089
  223   0.889985     10.0.0.1 → 10.0.0.2     TCP 3066 32720 → 40783 [PSH, ACK] Seq=35038 Ack=1 Win=37888 Len=3000 TSval=1758596037 TSecr=1886574121
  224   0.891950     10.0.0.1 → 10.0.0.2     TCP 1066 55943 → 42968 [PSH, ACK] Seq=38038 Ack=1 Win=37888 Len=1000 TSval=1758596049 TSecr=1886574133
  225   0.894121     10.0.0.1 → 10.0.0.2     TCP 1066 54368 → 46356 [PSH, ACK] Seq=39038 Ack=1 Win=37888 Len=1000 TSval=1758596059 TSecr=1886574144
  226   0.896208     10.0.0.1 → 10.0.0.2     TCP 3066 58169 → 25904 [PSH, ACK] Seq=37038 Ack=1 Win=37888 Len=3000 TSval=1758596061 TSecr=1886574145
  227   0.902279     10.0.0.1 → 10.0.0.2     TCP 1066 19551 → 35722 [PSH, ACK] Seq=54038 Ack=1 Win=37888 Len=1000 TSval=1758596037 TSecr=1886574113
  228   0.902442     10.0.0.1 → 10.0.0.2     TCP 1066 55943 → 42968 [PSH, ACK] Seq=39038 Ack=1 Win=37888 Len=1000 TSval=1758596067 TSecr=1886574152
  229   0.904414     10.0.0.1 → 10.0.0.2     TCP 1066 58169 → 25904 [PSH, ACK] Seq=40038 Ack=1 Win=37888 Len=1000 TSval=1758596072 TSecr=1886574156
  230   0.906510     10.0.0.1 → 10.0.0.2     TCP 1066 55246 → 6776 [PSH, ACK] Seq=37038 Ack=1 Win=37888 Len=1000 TSval=1758596038 TSecr=1886574115
  231   0.908396     10.0.0.1 → 10.0.0.2     TCP 3066 55246 → 6776 [PSH, ACK] Seq=38038 Ack=1 Win=37888 Len=3000 TSval=1758596082 TSecr=1886574166
  232   0.910711     10.0.0.1 → 10.0.0.2     TCP 1066 53241 → 47452 [PSH, ACK] Seq=39038 Ack=1 Win=37888 Len=1000 TSval=1758596055 TSecr=1886574139
  233   0.914976     10.0.0.1 → 10.0.0.2     TCP 2066 32720 → 40783 [PSH, ACK] Seq=38038 Ack=1 Win=37888 Len=2000 TSval=1758596066 TSecr=1886574150
  234   0.916847     10.0.0.1 → 10.0.0.2     TCP 1066 55246 → 6776 [PSH, ACK] Seq=41038 Ack=1 Win=37888 Len=1000 TSval=1758596091 TSecr=1886574168
  235   0.923240     10.0.0.1 → 10.0.0.2     TCP 1066 54368 → 46356 [PSH, ACK] Seq=40038 Ack=1 Win=37888 Len=1000 TSval=1758596070 TSecr=1886574154
  236   0.927574     10.0.0.1 → 10.0.0.2     TCP 1066 58169 → 25904 [PSH, ACK] Seq=41038 Ack=1 Win=37888 Len=1000 TSval=1758596081 TSecr=1886574164
  237   0.931788     10.0.0.1 → 10.0.0.2     TCP 2066 53241 → 47452 [PSH, ACK] Seq=40038 Ack=1 Win=37888 Len=2000 TSval=1758596086 TSecr=1886574171
  238   0.933258     10.0.0.1 → 10.0.0.2     TCP 1066 53241 → 47452 [PSH, ACK] Seq=42038 Ack=1 Win=37888 Len=1000 TSval=1758596107 TSecr=1886574192
  239   0.940038     10.0.0.1 → 10.0.0.2     TCP 4066 48193 → 59433 [PSH, ACK] Seq=50038 Ack=1 Win=37888 Len=4000 TSval=1758596089 TSecr=1886574174
  240   0.956437     10.0.0.1 → 10.0.0.2     TCP 2066 32720 → 40783 [PSH, ACK] Seq=40038 Ack=1 Win=37888 Len=2000 TSval=1758596091 TSecr=1886574175
  241   0.964808     10.0.0.1 → 10.0.0.2     TCP 1066 55246 → 6776 [PSH, ACK] Seq=42038 Ack=1 Win=37888 Len=1000 TSval=1758596104 TSecr=1886574177
  242   0.969301     10.0.0.1 → 10.0.0.2     TCP 1066 53241 → 47452 [PSH, ACK] Seq=43038 Ack=1 Win=37888 Len=1000 TSval=1758596109 TSecr=1886574193
  243   0.973561     10.0.0.1 → 10.0.0.2     TCP 2066 48193 → 59433 [PSH, ACK] Seq=54038 Ack=1 Win=37888 Len=2000 TSval=1758596116 TSecr=1886574200
  244   0.990282     10.0.0.1 → 10.0.0.2     TCP 2066 48193 → 59433 [PSH, ACK] Seq=56038 Ack=1 Win=37888 Len=2000 TSval=1758596150 TSecr=1886574233
  245   0.990411     10.0.0.1 → 10.0.0.2     TCP 5066 55943 → 42968 [PSH, ACK] Seq=40038 Ack=1 Win=37888 Len=5000 TSval=1758596126 TSecr=1886574210
  246   0.993667     10.0.0.1 → 10.0.0.2     TCP 6066 54368 → 46356 [PSH, ACK] Seq=41038 Ack=1 Win=37888 Len=6000 TSval=1758596159 TSecr=1886574234
  247   1.001666     10.0.0.1 → 10.0.0.2     TCP 6066 19551 → 35722 [PSH, ACK] Seq=55038 Ack=1 Win=37888 Len=6000 TSval=1758596127 TSecr=1886574210
  248   1.008003     10.0.0.1 → 10.0.0.2     TCP 4066 19551 → 35722 [PSH, ACK] Seq=61038 Ack=1 Win=37888 Len=4000 TSval=1758596180 TSecr=1886574261
  249   1.012632     10.0.0.1 → 10.0.0.2     TCP 5066 55246 → 6776 [PSH, ACK] Seq=43038 Ack=1 Win=37888 Len=5000 TSval=1758596182 TSecr=1886574266
  250   1.026356     10.0.0.1 → 10.0.0.2     TCP 5066 58169 → 25904 [PSH, ACK] Seq=42038 Ack=1 Win=37888 Len=5000 TSval=1758596151 TSecr=1886574234
  251   1.064386     10.0.0.1 → 10.0.0.2     TCP 3066 55943 → 42968 [PSH, ACK] Seq=45038 Ack=1 Win=37888 Len=3000 TSval=1758596169 TSecr=1886574251
  252   1.068032     10.0.0.1 → 10.0.0.2     TCP 1066 54368 → 46356 [PSH, ACK] Seq=47038 Ack=1 Win=37888 Len=1000 TSval=1758596173 TSecr=1886574253
  253   1.079659     10.0.0.1 → 10.0.0.2     TCP 6066 32720 → 40783 [PSH, ACK] Seq=42038 Ack=1 Win=37888 Len=6000 TSval=1758596174 TSecr=1886574258
  254   1.079710     10.0.0.1 → 10.0.0.2     TCP 6066 55943 → 42968 [PSH, ACK] Seq=48038 Ack=1 Win=37888 Len=6000 TSval=1758596250 TSecr=1886574325
  255   1.088349     10.0.0.1 → 10.0.0.2     TCP 6066 54368 → 46356 [PSH, ACK] Seq=48038 Ack=1 Win=37888 Len=6000 TSval=1758596255 TSecr=1886574328
  256   1.093387     10.0.0.1 → 10.0.0.2     TCP 1066 19551 → 35722 [PSH, ACK] Seq=65038 Ack=1 Win=37888 Len=1000 TSval=1758596184 TSecr=1886574268
  257   1.098184     10.0.0.1 → 10.0.0.2     TCP 5066 53241 → 47452 [PSH, ACK] Seq=44038 Ack=1 Win=37888 Len=5000 TSval=1758596185 TSecr=1886574270
  258   1.100458     10.0.0.1 → 10.0.0.2     TCP 6066 19551 → 35722 [PSH, ACK] Seq=66038 Ack=1 Win=37888 Len=6000 TSval=1758596269 TSecr=1886574353
  259   1.119663     10.0.0.1 → 10.0.0.2     TCP 1066 55246 → 6776 [PSH, ACK] Seq=48038 Ack=1 Win=37888 Len=1000 TSval=1758596188 TSecr=1886574272
  260   1.127171     10.0.0.1 → 10.0.0.2     TCP 4066 58169 → 25904 [PSH, ACK] Seq=47038 Ack=1 Win=37888 Len=4000 TSval=1758596203 TSecr=1886574286
  261   1.131343     10.0.0.1 → 10.0.0.2     TCP 7066 58169 → 25904 [PSH, ACK] Seq=51038 Ack=1 Win=37888 Len=7000 TSval=1758596304 TSecr=1886574387
  262   1.138741     10.0.0.1 → 10.0.0.2     TCP 7066 48193 → 59433 [PSH, ACK] Seq=58038 Ack=1 Win=37888 Len=7000 TSval=1758596245 TSecr=1886574322
  263   1.142616     10.0.0.1 → 10.0.0.2     TCP 1066 58169 → 25904 [PSH, ACK] Seq=58038 Ack=1 Win=37888 Len=1000 TSval=1758596308 TSecr=1886574391
  264   1.144413     10.0.0.1 → 10.0.0.2     TCP 6066 48193 → 59433 [PSH, ACK] Seq=65038 Ack=1 Win=37888 Len=6000 TSval=1758596315 TSecr=1886574399
  265   1.156919     10.0.0.1 → 10.0.0.2     TCP 1066 58169 → 25904 [PSH, ACK] Seq=59038 Ack=1 Win=37888 Len=1000 TSval=1758596321 TSecr=1886574402
  266   1.158845     10.0.0.1 → 10.0.0.2     TCP 1066 48193 → 59433 [PSH, ACK] Seq=71038 Ack=1 Win=37888 Len=1000 TSval=1758596327 TSecr=1886574404
  267   1.166314     10.0.0.1 → 10.0.0.2     TCP 1066 48193 → 59433 [PSH, ACK] Seq=72038 Ack=1 Win=37888 Len=1000 TSval=1758596340 TSecr=1886574419
  268   1.166702     10.0.0.1 → 10.0.0.2     TCP 7066 32720 → 40783 [PSH, ACK] Seq=48038 Ack=1 Win=37888 Len=7000 TSval=1758596260 TSecr=1886574340
  269   1.168578     10.0.0.1 → 10.0.0.2     TCP 6066 32720 → 40783 [PSH, ACK] Seq=55038 Ack=1 Win=37888 Len=6000 TSval=1758596342 TSecr=1886574427
  270   1.195140     10.0.0.1 → 10.0.0.2     TCP 1066 55943 → 42968 [PSH, ACK] Seq=54038 Ack=1 Win=37888 Len=1000 TSval=1758596262 TSecr=1886574340
  271   1.197287     10.0.0.1 → 10.0.0.2     TCP 8066 55943 → 42968 [PSH, ACK] Seq=55038 Ack=1 Win=37888 Len=8000 TSval=1758596371 TSecr=1886574455
  272   1.199246     10.0.0.1 → 10.0.0.2     TCP 1066 54368 → 46356 [PSH, ACK] Seq=54038 Ack=1 Win=37888 Len=1000 TSval=1758596265 TSecr=1886574348
  273   1.207191     10.0.0.1 → 10.0.0.2     TCP 7066 53241 → 47452 [PSH, ACK] Seq=49038 Ack=1 Win=37888 Len=7000 TSval=1758596275 TSecr=1886574358
  274   1.210154     10.0.0.1 → 10.0.0.2     TCP 1066 55943 → 42968 [PSH, ACK] Seq=63038 Ack=1 Win=37888 Len=1000 TSval=1758596376 TSecr=1886574457
  275   1.213225     10.0.0.1 → 10.0.0.2     TCP 9066 54368 → 46356 [PSH, ACK] Seq=55038 Ack=1 Win=37888 Len=9000 TSval=1758596381 TSecr=1886574459
  276   1.231210     10.0.0.1 → 10.0.0.2     TCP 8066 53241 → 47452 [PSH, ACK] Seq=56038 Ack=1 Win=37888 Len=8000 TSval=1758596384 TSecr=1886574467
